recevied_date,IP_ID,item_name,quanity,Harvesting_ID,field_id,harvesting_date,mobile_id,location_id,Lot_ID,date_of_cooling,Subsequent_ID,packed_datetime,,is_contaminated
11/18/2021,IP1,cilantro,7336,H1,8,8/16/2021,37,51,LOT1_IP_2021-11-18_51,1/8/2022,SP1,2022-08-22T07:45:21,,TRUE
1/16/2023,IP2,Tomatoes,4160,H2,5,9/14/2021,21,29,LOT2_IP_2023-01-16_29,1/22/2022,SP2,2022-09-26T22:02:49,,FALSE
6/10/2022,IP3,kale,2156,H3,3,11/1/2021,11,15,LOT3_IP_2022-06-10_15,2/14/2022,SP3,2022-11-24T22:39:24,,FALSE
10/28/2022,IP4,melons,3394,H4,4,8/23/2021,17,24,LOT4_IP_2022-10-28_24,1/11/2022,SP4,2022-08-30T06:47:59,,FALSE
8/24/2022,IP5,sweet potato,9681,H5,10,9/18/2021,48,68,LOT5_IP_2022-08-24_68,1/23/2022,SP5,2022-09-30T23:22:17,,FALSE
2/11/2023,IP6,lettuce,161,H6,1,8/25/2021,1,1,LOT6_IP_2023-02-11_1,1/12/2022,SP6,2022-09-01T12:52:08,,TRUE
8/14/2021,IP7,sweet potato,9641,H7,10,10/14/2021,48,67,LOT7_IP_2021-08-14_67,2/5/2022,SP7,2022-11-02T09:57:57,,FALSE
4/13/2022,IP8,sweet potato,9405,H8,9,8/9/2021,47,66,LOT8_IP_2022-04-13_66,1/4/2022,SP8,2022-08-13T14:41:19,,TRUE
2/8/2022,IP9,sweet potato,9477,H9,10,9/18/2021,47,66,LOT9_IP_2022-02-08_66,1/23/2022,SP9,2022-10-01T02:58:33,,FALSE
1/20/2022,IP10,sweet potato,9377,H10,9,8/20/2021,47,66,LOT10_IP_2022-01-20_66,1/9/2022,SP10,2022-08-26T05:28:32,,FALSE
1/6/2022,IP11,Tomatoes,4032,H11,5,11/14/2021,20,28,LOT11_IP_2022-01-06_28,2/20/2022,SP11,2022-12-10T02:43:18,,TRUE
4/16/2022,IP12,melons,3540,H12,4,9/25/2021,18,25,LOT12_IP_2022-04-16_25,1/27/2022,SP12,2022-10-09T20:02:35,,FALSE
3/18/2022,IP13,melons,3011,H13,4,8/16/2021,15,21,LOT13_IP_2022-03-18_21,1/7/2022,SP13,2022-08-21T10:07:41,,FALSE
7/8/2022,IP14,bell peppers,5114,H14,6,10/9/2021,26,36,LOT14_IP_2022-07-08_36,2/3/2022,SP14,2022-10-27T20:35:44,,FALSE
6/1/2022,IP15,spinach,1248,H15,2,8/25/2021,7,9,LOT15_IP_2022-06-01_9,1/12/2022,SP15,2022-09-01T23:40:58,,FALSE
10/26/2021,IP16,cilantro,7728,H16,8,11/14/2021,39,54,LOT16_IP_2021-10-26_54,2/21/2022,SP16,2022-12-10T13:32:08,,TRUE
12/25/2022,IP17,basil,6633,H17,7,11/28/2021,33,47,LOT17_IP_2022-12-25_47,2/27/2022,SP17,2022-12-27T09:15:04,,FALSE
11/20/2021,IP18,kale,1652,H18,2,10/27/2021,9,12,LOT18_IP_2021-11-20_12,2/12/2022,SP18,2022-11-18T08:03:15,,FALSE
8/10/2022,IP19,Tomatoes,3844,H19,4,9/24/2021,20,27,LOT19_IP_2022-08-10_27,1/27/2022,SP19,2022-10-09T09:13:45,,FALSE
12/1/2022,IP20,spinach,1484,H20,2,11/24/2021,8,11,LOT20_IP_2022-12-01_11,2/26/2022,SP20,2022-12-23T07:55:37,,FALSE
5/2/2022,IP21,basil,6980,H21,7,8/17/2021,35,49,LOT21_IP_2022-05-02_49,1/8/2022,SP21,2022-08-23T16:11:50,,FALSE
6/14/2022,IP22,parsley,8072,H22,8,11/11/2021,40,57,LOT22_IP_2022-06-14_57,2/19/2022,SP22,2022-12-07T09:50:20,,TRUE
2/1/2023,IP23,lettuce,150,H23,1,11/26/2021,1,1,LOT23_IP_2023-02-01_1,2/26/2022,SP23,2022-12-24T16:22:06,,TRUE
1/24/2023,IP24,bell peppers,5279,H24,6,9/2/2021,27,37,LOT24_IP_2023-01-24_37,1/16/2022,SP24,2022-09-12T04:47:45,,TRUE
3/16/2022,IP25,cilantro,7465,H25,8,8/20/2021,37,52,LOT25_IP_2022-03-16_52,1/9/2022,SP25,2022-08-26T23:29:55,,FALSE
9/8/2021,IP26,spinach,1506,H26,2,9/16/2021,8,11,LOT26_IP_2021-09-08_11,1/23/2022,SP26,2022-09-28T17:18:08,,FALSE
11/15/2022,IP27,Cucumbers,4869,H27,5,11/8/2021,25,34,LOT27_IP_2022-11-15_34,2/17/2022,SP27,2022-12-02T14:29:29,,FALSE
8/13/2021,IP28,bell peppers,5491,H28,6,8/30/2021,28,39,LOT28_IP_2021-08-13_39,1/14/2022,SP28,2022-09-07T16:39:27,,FALSE
11/1/2022,IP29,chili peppers,5813,H29,6,10/12/2021,29,41,LOT29_IP_2022-11-01_41,2/4/2022,SP29,2022-10-31T00:17:32,,FALSE
3/22/2022,IP30,kale,2129,H30,3,9/23/2021,11,15,LOT30_IP_2022-03-22_15,1/26/2022,SP30,2022-10-08T04:23:33,,FALSE
10/7/2021,IP31,chili peppers,6271,H31,7,11/10/2021,32,44,LOT31_IP_2021-10-07_44,2/19/2022,SP31,2022-12-06T05:00:07,,FALSE
12/14/2021,IP32,kale,1929,H32,3,8/3/2021,10,14,LOT32_IP_2021-12-14_14,1/1/2022,SP32,2022-08-06T02:27:30,,FALSE
8/19/2021,IP33,lettuce,206,H33,1,9/27/2021,2,2,LOT33_IP_2021-08-19_2,1/28/2022,SP33,2022-10-12T09:19:17,,FALSE
6/4/2022,IP34,kale,1694,H34,2,10/20/2021,9,12,LOT34_IP_2022-06-04_12,2/8/2022,SP34,2022-11-09T22:11:46,,TRUE
5/23/2022,IP35,kale,1863,H35,3,9/2/2021,10,13,LOT35_IP_2022-05-23_13,1/16/2022,SP35,2022-09-12T01:11:28,,FALSE
9/23/2021,IP36,bell peppers,5450,H36,6,8/27/2021,27,38,LOT36_IP_2021-09-23_38,1/13/2022,SP36,2022-09-04T05:45:06,,FALSE
10/3/2021,IP37,sweet potato,9741,H37,10,9/14/2021,49,68,LOT37_IP_2021-10-03_68,1/22/2022,SP37,2022-09-26T14:50:16,,FALSE
11/2/2021,IP38,arugula,2530,H38,3,12/1/2021,13,18,LOT38_IP_2021-11-02_18,3/1/2022,SP38,2022-12-30T23:45:42,,FALSE
9/7/2022,IP39,Tomatoes,4006,H39,5,10/5/2021,20,28,LOT39_IP_2022-09-07_28,2/1/2022,SP39,2022-10-22T00:00:58,,FALSE
6/3/2022,IP40,arugula,2254,H40,3,8/17/2021,12,16,LOT40_IP_2022-06-03_16,1/8/2022,SP40,2022-08-23T08:59:17,,FALSE
7/4/2022,IP41,Cucumbers,4377,H41,5,8/4/2021,22,31,LOT41_IP_2022-07-04_31,1/2/2022,SP41,2022-08-07T10:54,,FALSE
11/16/2021,IP42,arugula,2408,H42,3,10/12/2021,12,17,LOT42_IP_2021-11-16_17,2/4/2022,SP42,2022-10-30T20:41:16,,FALSE
1/25/2023,IP43,potato,8910,H43,9,8/7/2021,45,62,LOT43_IP_2023-01-25_62,1/3/2022,SP43,2022-08-10T14:35:48,,TRUE
1/21/2022,IP44,lettuce,479,H44,1,9/20/2021,3,4,LOT44_IP_2022-01-21_4,1/25/2022,SP44,2022-10-03T23:27:48,,FALSE
11/10/2021,IP45,chili peppers,5965,H45,6,8/9/2021,30,42,LOT45_IP_2021-11-10_42,1/4/2022,SP45,2022-08-12T20:39:56,,FALSE
5/28/2022,IP46,basil,6586,H46,7,10/19/2021,33,46,LOT46_IP_2022-05-28_46,2/8/2022,SP46,2022-11-08T13:45:17,,FALSE
5/1/2022,IP47,spinach,1286,H47,2,8/4/2021,7,9,LOT47_IP_2022-05-01_9,1/1/2022,SP47,2022-08-06T20:28:53,,FALSE
9/19/2021,IP48,basil,6560,H48,7,10/4/2021,33,46,LOT48_IP_2021-09-19_46,2/1/2022,SP48,2022-10-21T16:48:24,,FALSE
12/5/2021,IP49,sweet potato,9845,H49,10,9/24/2021,49,69,LOT49_IP_2021-12-05_69,1/27/2022,SP49,2022-10-08T18:48:39,,FALSE
10/27/2022,IP50,kale,2147,H50,3,8/29/2021,11,15,LOT50_IP_2022-10-27_15,1/14/2022,SP50,2022-09-07T02:14:21,,FALSE
1/14/2022,IP51,Tomatoes,3809,H51,4,11/21/2021,19,27,LOT51_IP_2022-01-14_27,2/24/2022,SP51,2022-12-18T16:11:03,,FALSE
11/6/2021,IP52,Cucumbers,4687,H52,5,9/18/2021,24,33,LOT52_IP_2021-11-06_33,1/24/2022,SP52,2022-10-01T20:59:56,,FALSE
8/5/2022,IP53,melons,3403,H53,4,8/11/2021,17,24,LOT53_IP_2022-08-05_24,1/5/2022,SP53,2022-08-15T13:32:55,,FALSE
11/5/2021,IP54,Cucumbers,4488,H54,5,8/21/2021,23,32,LOT54_IP_2021-11-05_32,1/10/2022,SP54,2022-08-27T13:55:01,,FALSE
12/3/2022,IP55,bell peppers,5091,H55,6,9/8/2021,26,36,LOT55_IP_2022-12-03_36,1/19/2022,SP55,2022-09-18T23:00:11,,FALSE
1/5/2022,IP56,sweet potato,9990,H56,10,9/6/2021,50,70,LOT56_IP_2022-01-05_70,1/18/2022,SP56,2022-09-16T06:07:12,,FALSE
8/14/2021,IP57,chili peppers,6341,H57,7,8/23/2021,32,44,LOT57_IP_2021-08-14_44,1/11/2022,SP57,2022-08-30T14:00:32,,FALSE
9/29/2021,IP58,potato,9105,H58,9,11/5/2021,46,64,LOT58_IP_2021-09-29_64,2/16/2022,SP58,2022-11-29T07:11:25,,FALSE
12/7/2022,IP59,bell peppers,5126,H59,6,11/25/2021,26,36,LOT59_IP_2022-12-07_36,2/26/2022,SP59,2022-12-23T18:44:27,,FALSE
3/21/2022,IP60,Cucumbers,4965,H60,5,11/7/2021,25,35,LOT60_IP_2022-03-21_35,2/17/2022,SP60,2022-12-01T20:28:06,,FALSE
3/22/2022,IP61,Cucumbers,4345,H61,5,8/12/2021,22,31,LOT61_IP_2022-03-22_31,1/6/2022,SP61,2022-08-17T08:48:14,,TRUE
11/1/2021,IP62,melons,3150,H62,4,8/26/2021,16,22,LOT62_IP_2021-11-01_22,1/12/2022,SP62,2022-09-02T14:06:04,,FALSE
2/6/2022,IP63,cilantro,7201,H63,7,11/13/2021,36,50,LOT63_IP_2022-02-06_50,2/20/2022,SP63,2022-12-09T05:05:39,,FALSE
12/7/2022,IP64,sweet potato,9628,H64,10,8/19/2021,48,67,LOT64_IP_2022-12-07_67,1/9/2022,SP64,2022-08-25T15:03:25,,FALSE
1/23/2022,IP65,kale,2174,H65,3,10/31/2021,11,15,LOT65_IP_2022-01-23_15,2/14/2022,SP65,2022-11-23T10:36:38,,FALSE
12/14/2022,IP66,kale,1809,H66,3,9/6/2021,9,13,LOT66_IP_2022-12-14_13,1/18/2022,SP66,2022-09-16T13:19:46,,FALSE
2/23/2022,IP67,bell peppers,5535,H67,6,11/1/2021,28,39,LOT67_IP_2022-02-23_39,2/14/2022,SP67,2022-11-25T02:15:40,,FALSE
9/29/2021,IP68,bell peppers,5599,H68,6,8/28/2021,28,39,LOT68_IP_2021-09-29_39,1/13/2022,SP68,2022-09-04T23:46:29,,FALSE
4/8/2022,IP69,chili peppers,5919,H69,6,11/30/2021,30,42,LOT69_IP_2022-04-08_42,3/1/2022,SP69,2022-12-30T05:44:19,,FALSE
9/20/2022,IP70,parsley,7913,H70,8,8/25/2021,40,55,LOT70_IP_2022-09-20_55,1/12/2022,SP70,2022-09-01T09:15:51,,TRUE
1/1/2022,IP71,basil,7020,H71,7,11/6/2021,35,49,LOT71_IP_2022-01-01_49,2/17/2022,SP71,2022-11-30T12:01:37,,FALSE
9/6/2021,IP72,kale,2126,H72,3,9/3/2021,11,15,LOT72_IP_2021-09-06_15,1/16/2022,SP72,2022-09-12T15:36:35,,FALSE
10/29/2021,IP73,arugula,2624,H73,3,9/25/2021,13,19,LOT73_IP_2021-10-29_19,1/27/2022,SP73,2022-10-10T06:51:25,,FALSE
4/18/2022,IP74,cilantro,7801,H74,8,8/28/2021,39,55,LOT74_IP_2022-04-18_55,1/13/2022,SP74,2022-09-05T21:24:09,,FALSE
2/2/2022,IP75,arugula,2328,H75,3,10/10/2021,12,17,LOT75_IP_2022-02-02_17,2/3/2022,SP75,2022-10-28T07:24:34,,TRUE
11/11/2022,IP76,sweet potato,9833,H76,10,8/10/2021,49,69,LOT76_IP_2022-11-11_69,1/4/2022,SP76,2022-08-14T05:06:26,,FALSE
11/21/2022,IP77,parsley,8056,H77,8,11/27/2021,40,56,LOT77_IP_2022-11-21_56,2/27/2022,SP77,2022-12-26T04:24:52,,FALSE
2/9/2023,IP78,parsley,8380,H78,9,8/24/2021,42,59,LOT78_IP_2023-02-09_59,1/11/2022,SP78,2022-08-31T04:25:39,,FALSE
3/31/2022,IP79,kale,1715,H79,2,9/27/2021,9,12,LOT79_IP_2022-03-31_12,1/28/2022,SP79,2022-10-12T05:43,,TRUE
4/18/2022,IP80,chili peppers,6411,H80,7,11/23/2021,32,45,LOT80_IP_2022-04-18_45,2/25/2022,SP80,2022-12-21T19:52:51,,TRUE
9/16/2021,IP81,lettuce,187,H81,1,11/11/2021,1,2,LOT81_IP_2021-09-16_2,2/19/2022,SP81,2022-12-06T19:25:13,,FALSE
7/12/2022,IP82,chili peppers,6349,H82,7,9/19/2021,32,45,LOT82_IP_2022-07-12_45,1/24/2022,SP82,2022-10-02T04:12:29,,FALSE
11/16/2022,IP83,kale,2159,H83,3,8/4/2021,11,15,LOT83_IP_2022-11-16_15,1/2/2022,SP83,2022-08-07T14:30:16,,TRUE
4/3/2022,IP84,potato,8816,H84,9,8/15/2021,44,62,LOT84_IP_2022-04-03_62,1/7/2022,SP84,2022-08-20T19:42:35,,TRUE
5/14/2022,IP85,basil,7100,H85,7,9/18/2021,36,50,LOT85_IP_2022-05-14_50,1/24/2022,SP85,2022-10-01T10:11:07,,FALSE
10/5/2022,IP86,cilantro,7261,H86,8,10/26/2021,36,51,LOT86_IP_2022-10-05_51,2/11/2022,SP86,2022-11-16T20:00:29,,FALSE
12/10/2021,IP87,bell peppers,5144,H87,6,10/29/2021,26,36,LOT87_IP_2021-12-10_36,2/13/2022,SP87,2022-11-20T06:54:50,,FALSE
7/20/2022,IP88,sweet potato,9872,H88,10,8/21/2021,49,69,LOT88_IP_2022-07-20_69,1/10/2022,SP88,2022-08-27T21:07:34,,FALSE
6/2/2022,IP89,kale,1617,H89,2,11/9/2021,9,12,LOT89_IP_2022-06-02_12,2/18/2022,SP89,2022-12-03T19:19:42,,FALSE
8/28/2021,IP90,basil,7135,H90,7,10/23/2021,36,50,LOT90_IP_2021-08-28_50,2/10/2022,SP90,2022-11-13T23:31:14,,FALSE
1/7/2022,IP91,parsley,8257,H91,8,9/29/2021,41,58,LOT91_IP_2022-01-07_58,1/29/2022,SP91,2022-10-15T02:12:15,,TRUE
11/11/2021,IP92,spinach,1324,H92,2,8/11/2021,7,10,LOT92_IP_2021-11-11_10,1/5/2022,SP92,2022-08-15T02:44:05,,TRUE
9/17/2021,IP93,chili peppers,6208,H93,7,10/6/2021,31,44,LOT93_IP_2021-09-17_44,2/1/2022,SP93,2022-10-23T08:27:27,,FALSE
6/12/2022,IP94,Cucumbers,4870,H94,5,11/22/2021,25,34,LOT94_IP_2022-06-12_34,2/25/2022,SP94,2022-12-20T22:15:12,,FALSE
12/3/2021,IP95,spinach,1088,H95,2,9/17/2021,6,8,LOT95_IP_2021-12-03_8,1/23/2022,SP95,2022-09-30T08:57:11,,FALSE
10/28/2021,IP96,chili peppers,6210,H96,7,9/6/2021,31,44,LOT96_IP_2021-10-28_44,1/18/2022,SP96,2022-09-16T20:32:19,,FALSE
9/13/2021,IP97,lettuce,378,H97,1,8/8/2021,2,3,LOT97_IP_2021-09-13_3,1/4/2022,SP97,2022-08-12T13:27:23,,FALSE
10/20/2021,IP98,chili peppers,5955,H98,6,8/2/2021,30,42,LOT98_IP_2021-10-20_42,12/31/2021,SP98,2022-08-04T14:24:45,,TRUE
1/3/2022,IP99,spinach,823,H99,2,8/4/2021,5,6,LOT99_IP_2022-01-03_6,1/1/2022,SP99,2022-08-06T16:52:37,,FALSE
5/22/2022,IP100,spinach,833,H100,2,10/19/2021,5,6,LOT100_IP_2022-05-22_6,2/8/2022,SP100,2022-11-08T17:21:34,,FALSE
1/19/2022,IP101,basil,6831,H101,7,9/17/2021,34,48,LOT101_IP_2022-01-19_48,1/23/2022,SP101,2022-09-30T16:09:44,,FALSE
12/23/2022,IP102,arugula,2872,H102,4,11/9/2021,15,20,LOT102_IP_2022-12-23_20,2/18/2022,SP102,2022-12-04T13:21:05,,FALSE
11/13/2021,IP103,chili peppers,6079,H103,6,9/15/2021,31,43,LOT103_IP_2021-11-13_43,1/22/2022,SP103,2022-09-27T05:15:22,,FALSE
8/13/2022,IP104,parsley,8511,H104,9,9/12/2021,43,60,LOT104_IP_2022-08-13_60,1/20/2022,SP104,2022-09-23T14:44:45,,FALSE
11/30/2022,IP105,melons,3603,H105,4,9/11/2021,18,25,LOT105_IP_2022-11-30_25,1/20/2022,SP105,2022-09-22T13:30:49,,FALSE
7/28/2022,IP106,chili peppers,6026,H106,6,10/2/2021,30,42,LOT106_IP_2022-07-28_42,1/30/2022,SP106,2022-10-18T02:17:47,,FALSE
9/29/2022,IP107,melons,2992,H107,4,9/10/2021,15,21,LOT107_IP_2022-09-29_21,1/20/2022,SP107,2022-09-22T02:41:59,,FALSE
10/20/2022,IP108,potato,8777,H108,9,10/4/2021,44,61,LOT108_IP_2022-10-20_61,2/1/2022,SP108,2022-10-21T05:59:35,,TRUE
3/24/2022,IP109,cilantro,7468,H109,8,10/15/2021,37,52,LOT109_IP_2022-03-24_52,2/6/2022,SP109,2022-11-03T03:59:20,,FALSE
10/4/2022,IP110,Tomatoes,4290,H110,5,11/26/2021,22,30,LOT110_IP_2022-10-04_30,2/27/2022,SP110,2022-12-25T06:47:12,,FALSE
11/14/2021,IP111,Tomatoes,3821,H111,4,11/24/2021,19,27,LOT111_IP_2021-11-14_27,2/26/2022,SP111,2022-12-23T00:43:04,,FALSE
12/5/2022,IP112,arugula,2786,H112,3,8/15/2021,14,20,LOT112_IP_2022-12-05_20,1/7/2022,SP112,2022-08-21T02:55:08,,FALSE
5/13/2022,IP113,cilantro,7325,H113,8,9/3/2021,37,51,LOT113_IP_2022-05-13_51,1/16/2022,SP113,2022-09-12T12:00:18,,FALSE
8/4/2022,IP114,potato,8879,H114,9,11/17/2021,44,62,LOT114_IP_2022-08-04_62,2/22/2022,SP114,2022-12-14T11:15:19,,FALSE
7/29/2022,IP115,lettuce,533,H115,1,10/25/2021,3,4,LOT115_IP_2022-07-29_4,2/11/2022,SP115,2022-11-16T01:59:06,,FALSE
2/14/2022,IP116,Cucumbers,4631,H116,5,9/17/2021,23,33,LOT116_IP_2022-02-14_33,1/23/2022,SP116,2022-09-30T05:20:54,,FALSE
12/23/2021,IP117,potato,8638,H117,9,8/4/2021,43,61,LOT117_IP_2021-12-23_61,1/1/2022,SP117,2022-08-07T00:05:10,,TRUE
3/10/2022,IP118,potato,9029,H118,9,10/11/2021,45,63,LOT118_IP_2022-03-10_63,2/4/2022,SP118,2022-10-29T15:51:03,,FALSE
8/3/2021,IP119,lettuce,719,H119,2,11/25/2021,4,5,LOT119_IP_2021-08-03_5,2/26/2022,SP119,2022-12-23T11:31:53,,FALSE
8/13/2021,IP120,cilantro,7662,H120,8,9/25/2021,38,54,LOT120_IP_2021-08-13_54,1/27/2022,SP120,2022-10-09T12:50:02,,FALSE
1/16/2022,IP121,Tomatoes,4334,H121,5,10/16/2021,22,31,LOT121_IP_2022-01-16_31,2/6/2022,SP121,2022-11-04T08:49:33,,FALSE
1/9/2022,IP122,sweet potato,9992,H122,10,9/28/2021,50,70,LOT122_IP_2022-01-09_70,1/29/2022,SP122,2022-10-14T04:34:36,,TRUE
11/3/2022,IP123,lettuce,713,H123,2,8/7/2021,4,5,LOT123_IP_2022-11-03_5,1/3/2022,SP123,2022-08-11T05:00:54,,FALSE
10/18/2021,IP124,chili peppers,5905,H124,6,10/23/2021,30,41,LOT124_IP_2021-10-18_41,2/10/2022,SP124,2022-11-13T01:53:34,,TRUE
9/27/2021,IP125,bell peppers,5716,H125,6,11/6/2021,29,40,LOT125_IP_2021-09-27_40,2/17/2022,SP125,2022-11-30T19:14:10,,TRUE
2/2/2022,IP126,basil,6654,H126,7,10/9/2021,33,47,LOT126_IP_2022-02-02_47,2/3/2022,SP126,2022-10-26T22:58:05,,FALSE
6/25/2022,IP127,potato,9082,H127,9,9/27/2021,45,64,LOT127_IP_2022-06-25_64,1/28/2022,SP127,2022-10-12T20:08:06,,FALSE
11/24/2021,IP128,arugula,2540,H128,3,9/17/2021,13,18,LOT128_IP_2021-11-24_18,1/23/2022,SP128,2022-09-30T01:44:37,,FALSE
1/16/2023,IP129,arugula,2560,H129,3,10/12/2021,13,18,LOT129_IP_2023-01-16_18,2/4/2022,SP129,2022-10-30T17:04:59,,FALSE
7/15/2022,IP130,basil,7098,H130,7,10/6/2021,36,50,LOT130_IP_2022-07-15_50,2/1/2022,SP130,2022-10-23T15:40,,TRUE
12/24/2021,IP131,melons,3443,H131,4,9/20/2021,18,24,LOT131_IP_2021-12-24_24,1/25/2022,SP131,2022-10-03T19:51:32,,FALSE
12/8/2021,IP132,chili peppers,6113,H132,6,10/29/2021,31,43,LOT132_IP_2021-12-08_43,2/13/2022,SP132,2022-11-20T17:43:40,,FALSE
6/26/2022,IP133,melons,3223,H133,4,8/5/2021,16,23,LOT133_IP_2022-06-26_23,1/2/2022,SP133,2022-08-08T08:31:39,,FALSE
9/20/2021,IP134,lettuce,342,H134,1,11/14/2021,2,3,LOT134_IP_2021-09-20_3,2/21/2022,SP134,2022-12-10T06:19:35,,FALSE
2/13/2023,IP135,Cucumbers,4565,H135,5,8/31/2021,23,32,LOT135_IP_2023-02-13_32,1/15/2022,SP135,2022-09-08T21:29:40,,FALSE
1/14/2022,IP136,Tomatoes,3754,H136,4,9/1/2021,19,26,LOT136_IP_2022-01-14_26,1/15/2022,SP136,2022-09-10T05:56:09,,FALSE
4/28/2022,IP137,Cucumbers,4692,H137,5,10/30/2021,24,33,LOT137_IP_2022-04-28_33,2/13/2022,SP137,2022-11-22T09:22:42,,FALSE
10/19/2022,IP138,kale,1855,H138,3,9/26/2021,10,13,LOT138_IP_2022-10-19_13,1/28/2022,SP138,2022-10-11T18:54:10,,FALSE
2/5/2022,IP139,basil,6794,H139,7,11/7/2021,34,48,LOT139_IP_2022-02-05_48,2/17/2022,SP139,2022-12-02T10:53:13,,FALSE
10/10/2021,IP140,cilantro,7184,H140,7,10/16/2021,36,50,LOT140_IP_2021-10-10_50,2/6/2022,SP140,2022-11-04T16:02:06,,FALSE
5/3/2022,IP141,cilantro,7459,H141,8,11/8/2021,37,52,LOT141_IP_2022-05-03_52,2/18/2022,SP141,2022-12-03T15:43:25,,FALSE
12/30/2022,IP142,sweet potato,9298,H142,9,8/12/2021,47,65,LOT142_IP_2022-12-30_65,1/5/2022,SP142,2022-08-16T18:23:07,,FALSE
5/31/2022,IP143,chili peppers,5940,H143,6,9/5/2021,30,42,LOT143_IP_2022-05-31_42,1/17/2022,SP143,2022-09-15T01:17,,FALSE
8/5/2021,IP144,basil,6476,H144,7,11/20/2021,33,45,LOT144_IP_2021-08-05_45,2/24/2022,SP144,2022-12-18T05:22:13,,TRUE
7/24/2022,IP145,spinach,1194,H145,2,10/8/2021,6,9,LOT145_IP_2022-07-24_9,2/2/2022,SP145,2022-10-25T21:44:09,,TRUE
3/3/2022,IP146,cilantro,7769,H146,8,10/3/2021,39,54,LOT146_IP_2022-03-03_54,1/31/2022,SP146,2022-10-19T21:33:06,,FALSE
2/8/2022,IP147,melons,3134,H147,4,11/22/2021,16,22,LOT147_IP_2022-02-08_22,2/24/2022,SP147,2022-12-20T00:37:32,,FALSE
9/3/2022,IP148,potato,8818,H148,9,10/23/2021,44,62,LOT148_IP_2022-09-03_62,2/10/2022,SP148,2022-11-13T09:06:07,,TRUE
8/19/2021,IP149,chili peppers,6341,H149,7,8/31/2021,32,44,LOT149_IP_2021-08-19_44,1/15/2022,SP149,2022-09-09T15:31:03,,FALSE
12/18/2021,IP150,sweet potato,9296,H150,9,11/16/2021,47,65,LOT150_IP_2021-12-18_65,2/22/2022,SP150,2022-12-13T02:48:50,,FALSE
1/27/2023,IP151,kale,2047,H151,3,12/1/2021,11,15,LOT151_IP_2023-01-27_15,3/1/2022,SP151,2022-12-31T10:34:32,,FALSE
1/28/2022,IP152,cilantro,7571,H152,8,9/26/2021,38,53,LOT152_IP_2022-01-28_53,1/27/2022,SP152,2022-10-11T00:52:47,,FALSE
11/18/2022,IP153,kale,1661,H153,2,10/15/2021,9,12,LOT153_IP_2022-11-18_12,2/6/2022,SP153,2022-11-04T01:37,,TRUE
10/12/2021,IP154,lettuce,518,H154,1,9/3/2021,3,4,LOT154_IP_2021-10-12_4,1/16/2022,SP154,2022-09-13T02:25:24,,FALSE
9/15/2021,IP155,Tomatoes,3848,H155,4,11/22/2021,20,27,LOT155_IP_2021-09-15_27,2/24/2022,SP155,2022-12-19T21:01:16,,FALSE
11/11/2022,IP156,parsley,7887,H156,8,10/6/2021,40,55,LOT156_IP_2022-11-11_55,2/2/2022,SP156,2022-10-23T19:16:17,,FALSE
1/6/2023,IP157,basil,7156,H157,7,8/19/2021,36,50,LOT157_IP_2023-01-06_50,1/9/2022,SP157,2022-08-25T11:27:09,,FALSE
2/28/2023,IP158,spinach,1192,H158,2,11/22/2021,6,9,LOT158_IP_2023-02-28_9,2/25/2022,SP158,2022-12-20T11:26:22,,FALSE
2/12/2023,IP159,cilantro,7645,H159,8,10/11/2021,38,54,LOT159_IP_2023-02-12_54,2/4/2022,SP159,2022-10-29T12:14:46,,FALSE
5/15/2022,IP160,lettuce,398,H160,1,10/27/2021,2,3,LOT160_IP_2022-05-15_3,2/12/2022,SP160,2022-11-18T00:50:41,,FALSE
7/19/2022,IP161,melons,3235,H161,4,11/14/2021,17,23,LOT161_IP_2022-07-19_23,2/21/2022,SP161,2022-12-11T00:20:58,,FALSE
12/23/2022,IP162,basil,6704,H162,7,11/29/2021,34,47,LOT162_IP_2022-12-23_47,2/28/2022,SP162,2022-12-28T21:17:50,,TRUE
4/23/2022,IP163,Tomatoes,4322,H163,5,10/4/2021,22,30,LOT163_IP_2022-04-23_30,2/1/2022,SP163,2022-10-21T09:35:51,,FALSE
4/14/2022,IP164,Tomatoes,4066,H164,5,11/21/2021,21,29,LOT164_IP_2022-04-14_29,2/24/2022,SP164,2022-12-19T02:59:53,,FALSE
6/20/2022,IP165,cilantro,7463,H165,8,11/28/2021,37,52,LOT165_IP_2022-06-20_52,2/28/2022,SP165,2022-12-28T03:16:27,,TRUE
9/25/2022,IP166,Tomatoes,3717,H166,4,10/19/2021,19,26,LOT166_IP_2022-09-25_26,2/8/2022,SP166,2022-11-09T00:34:07,,FALSE
12/6/2022,IP167,cilantro,7661,H167,8,10/14/2021,38,54,LOT167_IP_2022-12-06_54,2/5/2022,SP167,2022-11-02T13:34:14,,FALSE
2/9/2022,IP168,melons,3294,H168,4,10/25/2021,17,23,LOT168_IP_2022-02-09_23,2/11/2022,SP168,2022-11-16T05:35:22,,FALSE
10/5/2021,IP169,bell peppers,5176,H169,6,11/23/2021,26,36,LOT169_IP_2021-10-05_36,2/25/2022,SP169,2022-12-21T12:40:18,,FALSE
9/1/2021,IP170,Cucumbers,4839,H170,5,11/17/2021,24,34,LOT170_IP_2021-09-01_34,2/22/2022,SP170,2022-12-14T04:02:46,,FALSE
9/3/2021,IP171,spinach,1399,H171,2,11/27/2021,7,10,LOT171_IP_2021-09-03_10,2/27/2022,SP171,2022-12-26T08:01:08,,TRUE
4/9/2022,IP172,lettuce,415,H172,1,10/20/2021,3,3,LOT172_IP_2022-04-09_3,2/8/2022,SP172,2022-11-09T11:22:57,,TRUE
10/23/2021,IP173,Cucumbers,4500,H173,5,8/7/2021,23,32,LOT173_IP_2021-10-23_32,1/3/2022,SP173,2022-08-10T10:59:31,,FALSE
12/16/2022,IP174,basil,6946,H174,7,10/29/2021,35,49,LOT174_IP_2022-12-16_49,2/13/2022,SP174,2022-11-21T04:32:29,,FALSE
6/12/2022,IP175,cilantro,7219,H175,7,9/4/2021,36,51,LOT175_IP_2022-06-12_51,1/17/2022,SP175,2022-09-14T07:15:37,,FALSE
10/26/2022,IP176,cilantro,7802,H176,8,8/12/2021,39,55,LOT176_IP_2022-10-26_55,1/6/2022,SP176,2022-08-17T12:24:30,,FALSE
9/19/2022,IP177,melons,2952,H177,4,8/15/2021,15,21,LOT177_IP_2022-09-19_21,1/7/2022,SP177,2022-08-20T05:17:29,,FALSE
6/15/2022,IP178,cilantro,7835,H178,8,10/13/2021,39,55,LOT178_IP_2022-06-15_55,2/5/2022,SP178,2022-10-31T18:18:55,,FALSE
7/1/2022,IP179,sweet potato,9666,H179,10,9/27/2021,48,68,LOT179_IP_2022-07-01_68,1/28/2022,SP179,2022-10-12T02:06:44,,FALSE
2/24/2023,IP180,sweet potato,9966,H180,10,9/5/2021,50,70,LOT180_IP_2023-02-24_70,1/17/2022,SP180,2022-09-15T15:42:06,,FALSE
9/4/2021,IP181,arugula,2467,H181,3,8/17/2021,13,17,LOT181_IP_2021-09-04_17,1/8/2022,SP181,2022-08-23T12:35:33,,TRUE
10/31/2022,IP182,Cucumbers,4507,H182,5,11/19/2021,23,32,LOT182_IP_2022-10-31_32,2/23/2022,SP182,2022-12-16T20:55:44,,FALSE
2/8/2023,IP183,spinach,1389,H183,2,11/15/2021,7,10,LOT183_IP_2023-02-08_10,2/21/2022,SP183,2022-12-11T21:58:37,,FALSE
4/1/2022,IP184,arugula,2421,H184,3,8/22/2021,12,17,LOT184_IP_2022-04-01_17,1/10/2022,SP184,2022-08-29T09:10:20,,FALSE
4/25/2022,IP185,basil,6595,H185,7,11/21/2021,33,46,LOT185_IP_2022-04-25_46,2/24/2022,SP185,2022-12-19T06:36:09,,FALSE
8/15/2022,IP186,chili peppers,5765,H186,6,10/25/2021,29,40,LOT186_IP_2022-08-15_40,2/11/2022,SP186,2022-11-15T18:46:33,,TRUE
11/14/2021,IP187,bell peppers,5604,H187,6,9/27/2021,28,39,LOT187_IP_2021-11-14_39,1/28/2022,SP187,2022-10-12T16:31:50,,TRUE
8/9/2022,IP188,arugula,2578,H188,3,10/28/2021,13,18,LOT188_IP_2022-08-09_18,2/12/2022,SP188,2022-11-19T23:42:17,,FALSE
8/1/2022,IP189,potato,9211,H189,9,10/18/2021,46,64,LOT189_IP_2022-08-01_64,2/8/2022,SP189,2022-11-07T19:43:54,,TRUE
4/26/2022,IP190,cilantro,7265,H190,8,8/12/2021,36,51,LOT190_IP_2022-04-26_51,1/5/2022,SP190,2022-08-17T01:35:40,,FALSE
2/10/2022,IP191,cilantro,7792,H191,8,11/30/2021,39,55,LOT191_IP_2022-02-10_55,3/1/2022,SP191,2022-12-30T09:20:36,,FALSE
8/16/2021,IP192,arugula,2499,H192,3,10/22/2021,13,18,LOT192_IP_2021-08-16_18,2/9/2022,SP192,2022-11-12T11:28:28,,FALSE
10/19/2021,IP193,kale,1839,H193,3,9/28/2021,10,13,LOT193_IP_2021-10-19_13,1/29/2022,SP193,2022-10-13T17:45:46,,FALSE
3/11/2022,IP194,Cucumbers,4503,H194,5,9/23/2021,23,32,LOT194_IP_2022-03-11_32,1/26/2022,SP194,2022-10-07T21:10:59,,FALSE
9/11/2021,IP195,parsley,8314,H195,8,9/4/2021,42,58,LOT195_IP_2021-09-11_58,1/17/2022,SP195,2022-09-14T00:03:04,,FALSE
2/20/2022,IP196,chili peppers,6059,H196,6,9/8/2021,30,43,LOT196_IP_2022-02-20_43,1/18/2022,SP196,2022-09-18T15:47:38,,FALSE
10/10/2022,IP197,chili peppers,6416,H197,7,8/24/2021,32,45,LOT197_IP_2022-10-10_45,1/11/2022,SP197,2022-09-01T02:03:18,,FALSE
10/8/2021,IP198,melons,3103,H198,4,11/12/2021,16,22,LOT198_IP_2021-10-08_22,2/20/2022,SP198,2022-12-07T17:02:53,,FALSE
12/20/2021,IP199,lettuce,747,H199,2,9/21/2021,4,6,LOT199_IP_2021-12-20_6,1/25/2022,SP199,2022-10-05T00:41:44,,FALSE
11/22/2021,IP200,sweet potato,9387,H200,9,10/26/2021,47,66,LOT200_IP_2021-11-22_66,2/11/2022,SP200,2022-11-17T03:13:02,,FALSE
2/26/2023,IP201,arugula,2738,H201,3,9/29/2021,14,19,LOT201_IP_2023-02-26_19,1/29/2022,SP201,2022-10-15T13:01:05,,FALSE
12/15/2021,IP202,arugula,2369,H202,3,9/25/2021,12,17,LOT202_IP_2021-12-15_17,1/27/2022,SP202,2022-10-10T03:15:08,,FALSE
2/15/2022,IP203,melons,3109,H203,4,8/30/2021,16,22,LOT203_IP_2022-02-15_22,1/14/2022,SP203,2022-09-08T10:40:50,,FALSE
9/25/2021,IP204,Tomatoes,3782,H204,4,8/6/2021,19,27,LOT204_IP_2021-09-25_27,1/2/2022,SP204,2022-08-09T06:09:18,,FALSE
11/27/2022,IP205,parsley,8586,H205,9,9/22/2021,43,60,LOT205_IP_2022-11-27_60,1/26/2022,SP205,2022-10-06T12:44:30,,FALSE
9/23/2022,IP206,parsley,8090,H206,8,10/27/2021,41,57,LOT206_IP_2022-09-23_57,2/12/2022,SP206,2022-11-18T18:52:04,,FALSE
6/23/2022,IP207,Tomatoes,3948,H207,4,11/19/2021,20,28,LOT207_IP_2022-06-23_28,2/23/2022,SP207,2022-12-17T00:32:01,,FALSE
8/2/2021,IP208,arugula,2726,H208,3,9/6/2021,14,19,LOT208_IP_2021-08-02_19,1/18/2022,SP208,2022-09-16T09:43:29,,FALSE
9/9/2022,IP209,lettuce,420,H209,1,10/20/2021,3,3,LOT209_IP_2022-09-09_3,2/8/2022,SP209,2022-11-09T14:59:13,,FALSE
12/2/2022,IP210,basil,6731,H210,7,9/11/2021,34,47,LOT210_IP_2022-12-02_47,1/20/2022,SP210,2022-09-22T17:07:05,,FALSE
3/26/2022,IP211,spinach,836,H211,2,10/30/2021,5,6,LOT211_IP_2022-03-26_6,2/13/2022,SP211,2022-11-21T22:33:52,,FALSE
9/4/2022,IP212,chili peppers,6130,H212,6,10/10/2021,31,43,LOT212_IP_2022-09-04_43,2/3/2022,SP212,2022-10-28T00:12:01,,FALSE
10/30/2021,IP213,kale,1869,H213,3,11/6/2021,10,13,LOT213_IP_2021-10-30_13,2/17/2022,SP213,2022-11-30T22:50:27,,FALSE
2/17/2022,IP214,lettuce,393,H214,1,10/11/2021,2,3,LOT214_IP_2022-02-17_3,2/4/2022,SP214,2022-10-29T05:02:13,,FALSE
5/27/2022,IP215,basil,7111,H215,7,10/12/2021,36,50,LOT215_IP_2022-05-27_50,2/5/2022,SP215,2022-10-31T11:06:22,,FALSE
2/15/2023,IP216,arugula,2850,H216,4,10/4/2021,15,20,LOT216_IP_2023-02-15_20,1/31/2022,SP216,2022-10-20T22:47:02,,FALSE
3/2/2022,IP217,spinach,1246,H217,2,11/10/2021,7,9,LOT217_IP_2022-03-02_9,2/18/2022,SP217,2022-12-05T03:46:11,,FALSE
7/11/2022,IP218,basil,6943,H218,7,9/22/2021,35,49,LOT218_IP_2022-07-11_49,1/25/2022,SP218,2022-10-05T22:19:24,,FALSE
12/29/2021,IP219,melons,3555,H219,4,11/10/2021,18,25,LOT219_IP_2021-12-29_25,2/19/2022,SP219,2022-12-05T10:58:44,,FALSE
3/23/2022,IP220,arugula,2359,H220,3,8/29/2021,12,17,LOT220_IP_2022-03-23_17,1/14/2022,SP220,2022-09-06T15:25:31,,FALSE
5/16/2022,IP221,kale,1759,H221,3,10/14/2021,9,13,LOT221_IP_2022-05-16_13,2/5/2022,SP221,2022-11-01T19:32:51,,FALSE
10/6/2021,IP222,chili peppers,5987,H222,6,8/1/2021,30,42,LOT222_IP_2021-10-06_42,12/31/2021,SP222,2022-08-03T23:59:38,,FALSE
10/26/2022,IP223,parsley,8118,H223,8,11/29/2021,41,57,LOT223_IP_2022-10-26_57,2/28/2022,SP223,2022-12-29T08:06:40,,FALSE
8/19/2022,IP224,bell peppers,5198,H224,6,10/16/2021,26,37,LOT224_IP_2022-08-19_37,2/6/2022,SP224,2022-11-05T02:50:56,,TRUE
2/28/2022,IP225,melons,3555,H225,4,11/10/2021,18,25,LOT225_IP_2022-02-28_25,2/19/2022,SP225,2022-12-05T21:47:34,,TRUE
12/15/2022,IP226,lettuce,626,H226,1,8/7/2021,4,5,LOT226_IP_2022-12-15_5,1/3/2022,SP226,2022-08-11T08:37:11,,FALSE
10/7/2022,IP227,chili peppers,6101,H227,6,8/7/2021,31,43,LOT227_IP_2022-10-07_43,1/3/2022,SP227,2022-08-10T07:23:15,,FALSE
5/20/2022,IP228,basil,6847,H228,7,10/3/2021,34,48,LOT228_IP_2022-05-20_48,1/31/2022,SP228,2022-10-19T14:20:32,,FALSE
12/25/2021,IP229,chili peppers,5879,H229,6,11/20/2021,30,41,LOT229_IP_2021-12-25_41,2/24/2022,SP229,2022-12-18T12:34:46,,FALSE
1/29/2022,IP230,Tomatoes,3761,H230,4,10/23/2021,19,27,LOT230_IP_2022-01-29_27,2/10/2022,SP230,2022-11-13T19:54:57,,FALSE
11/8/2021,IP231,sweet potato,9465,H231,10,11/18/2021,47,66,LOT231_IP_2021-11-08_66,2/23/2022,SP231,2022-12-15T23:18:05,,FALSE
1/3/2022,IP232,basil,6896,H232,7,8/21/2021,35,48,LOT232_IP_2022-01-03_48,1/10/2022,SP232,2022-08-28T07:56:24,,FALSE
9/20/2022,IP233,arugula,2323,H233,3,11/28/2021,12,16,LOT233_IP_2022-09-20_16,2/27/2022,SP233,2022-12-27T16:27:38,,FALSE
1/15/2022,IP234,Cucumbers,4502,H234,5,8/6/2021,23,32,LOT234_IP_2022-01-15_32,1/2/2022,SP234,2022-08-09T13:21:52,,FALSE
9/16/2022,IP235,basil,7105,H235,7,10/5/2021,36,50,LOT235_IP_2022-09-16_50,2/1/2022,SP235,2022-10-22T10:49:47,,TRUE
6/30/2022,IP236,lettuce,395,H236,1,8/13/2021,2,3,LOT236_IP_2022-06-30_3,1/6/2022,SP236,2022-08-17T23:13:20,,FALSE
8/25/2022,IP237,basil,6623,H237,7,11/7/2021,33,46,LOT237_IP_2022-08-25_46,2/17/2022,SP237,2022-12-02T07:16:56,,FALSE
7/27/2022,IP238,melons,3228,H238,4,10/22/2021,16,23,LOT238_IP_2022-07-27_23,2/9/2022,SP238,2022-11-11T21:03:22,,FALSE
12/29/2022,IP239,parsley,8176,H239,8,8/3/2021,41,57,LOT239_IP_2022-12-29_57,1/1/2022,SP239,2022-08-05T08:26:07,,TRUE
3/15/2022,IP240,kale,1640,H240,2,11/16/2021,9,12,LOT240_IP_2022-03-15_12,2/22/2022,SP240,2022-12-12T19:36:17,,TRUE
12/29/2021,IP241,Cucumbers,4589,H241,5,10/28/2021,23,32,LOT241_IP_2021-12-29_32,2/12/2022,SP241,2022-11-19T12:53:27,,FALSE
1/20/2023,IP242,melons,3265,H242,4,9/26/2021,17,23,LOT242_IP_2023-01-20_23,1/28/2022,SP242,2022-10-11T15:17:54,,FALSE
6/17/2022,IP243,bell peppers,5542,H243,6,8/8/2021,28,39,LOT243_IP_2022-06-17_39,1/3/2022,SP243,2022-08-11T15:49:44,,FALSE
2/11/2023,IP244,bell peppers,5270,H244,6,9/5/2021,27,37,LOT244_IP_2023-02-11_37,1/17/2022,SP244,2022-09-15T12:05:49,,FALSE
3/13/2022,IP245,melons,3222,H245,4,10/4/2021,16,23,LOT245_IP_2022-03-13_23,1/31/2022,SP245,2022-10-21T02:23:18,,FALSE
11/5/2022,IP246,basil,6992,H246,7,10/7/2021,35,49,LOT246_IP_2022-11-05_49,2/2/2022,SP246,2022-10-25T00:06:29,,FALSE
8/9/2021,IP247,spinach,1039,H247,2,10/18/2021,6,8,LOT247_IP_2021-08-09_8,2/7/2022,SP247,2022-11-07T12:31:21,,FALSE
10/13/2022,IP248,sweet potato,9592,H248,10,8/5/2021,48,67,LOT248_IP_2022-10-13_67,1/2/2022,SP248,2022-08-07T21:42:49,,FALSE
12/12/2021,IP249,spinach,1384,H249,2,9/16/2021,7,10,LOT249_IP_2021-12-12_10,1/23/2022,SP249,2022-09-29T00:30:41,,FALSE
8/20/2021,IP250,lettuce,334,H250,1,10/5/2021,2,3,LOT250_IP_2021-08-20_3,2/1/2022,SP250,2022-10-22T21:38:37,,FALSE
9/5/2021,IP251,spinach,939,H251,2,10/11/2021,5,7,LOT251_IP_2021-09-05_7,2/4/2022,SP251,2022-10-29T19:27:20,,FALSE
10/15/2022,IP252,lettuce,618,H252,1,10/18/2021,4,5,LOT252_IP_2022-10-15_5,2/7/2022,SP252,2022-11-06T22:06:15,,FALSE
2/10/2023,IP253,Cucumbers,4753,H253,5,8/24/2021,24,33,LOT253_IP_2023-02-10_33,1/12/2022,SP253,2022-09-01T05:39:35,,FALSE
8/17/2022,IP254,parsley,8215,H254,8,8/12/2021,41,58,LOT254_IP_2022-08-17_58,1/5/2022,SP254,2022-08-16T07:34:18,,FALSE
2/22/2022,IP255,sweet potato,9694,H255,10,9/25/2021,48,68,LOT255_IP_2022-02-22_68,1/27/2022,SP255,2022-10-10T10:27:41,,FALSE
2/7/2023,IP256,melons,3565,H256,4,8/5/2021,18,25,LOT256_IP_2023-02-07_25,1/2/2022,SP256,2022-08-07T18:06:33,,FALSE
11/21/2022,IP257,arugula,2802,H257,3,11/24/2021,14,20,LOT257_IP_2022-11-21_20,2/25/2022,SP257,2022-12-22T10:17:57,,FALSE
1/29/2022,IP258,lettuce,211,H258,1,10/30/2021,2,2,LOT258_IP_2022-01-29_2,2/14/2022,SP258,2022-11-22T16:35:15,,FALSE
8/24/2021,IP259,parsley,7961,H259,8,10/2/2021,40,56,LOT259_IP_2021-08-24_56,1/30/2022,SP259,2022-10-18T09:30:20,,FALSE
6/5/2022,IP260,spinach,1094,H260,2,9/14/2021,6,8,LOT260_IP_2022-06-05_8,1/22/2022,SP260,2022-09-26T11:14,,FALSE
8/4/2021,IP261,parsley,8208,H261,8,10/21/2021,41,58,LOT261_IP_2021-08-04_58,2/9/2022,SP261,2022-11-10T16:13:09,,FALSE
9/24/2021,IP262,cilantro,7504,H262,8,9/5/2021,38,53,LOT262_IP_2021-09-24_53,1/17/2022,SP262,2022-09-15T19:18:23,,FALSE
2/20/2022,IP263,Tomatoes,3861,H263,4,11/9/2021,20,27,LOT263_IP_2022-02-20_27,2/18/2022,SP263,2022-12-04T06:08:32,,FALSE
6/15/2022,IP264,spinach,1166,H264,2,10/18/2021,6,8,LOT264_IP_2022-06-15_8,2/7/2022,SP264,2022-11-06T18:29:58,,FALSE
1/3/2023,IP265,cilantro,7684,H265,8,8/10/2021,39,54,LOT265_IP_2023-01-03_54,1/5/2022,SP265,2022-08-14T23:07:48,,FALSE
5/30/2022,IP266,kale,2167,H266,3,8/26/2021,11,15,LOT266_IP_2022-05-30_15,1/12/2022,SP266,2022-09-02T17:42:20,,FALSE
2/22/2023,IP267,sweet potato,9457,H267,10,10/18/2021,47,66,LOT267_IP_2023-02-22_66,2/7/2022,SP267,2022-11-07T05:18:48,,FALSE
3/10/2022,IP268,lettuce,373,H268,1,8/18/2021,2,3,LOT268_IP_2022-03-10_3,1/9/2022,SP268,2022-08-24T21:02:02,,FALSE
12/19/2022,IP269,cilantro,7495,H269,8,12/1/2021,38,53,LOT269_IP_2022-12-19_53,3/1/2022,SP269,2022-12-31T03:21:59,,FALSE
2/7/2022,IP270,chili peppers,6400,H270,7,9/26/2021,32,45,LOT270_IP_2022-02-07_45,1/27/2022,SP270,2022-10-10T17:40:14,,FALSE
9/30/2022,IP271,sweet potato,9392,H271,9,10/17/2021,47,66,LOT271_IP_2022-09-30_66,2/7/2022,SP271,2022-11-05T20:52:19,,FALSE
8/2/2022,IP272,spinach,1029,H272,2,11/11/2021,6,7,LOT272_IP_2022-08-02_7,2/19/2022,SP272,2022-12-07T06:14:03,,FALSE
9/1/2022,IP273,sweet potato,9601,H273,10,9/28/2021,48,67,LOT273_IP_2022-09-01_67,1/28/2022,SP273,2022-10-13T03:20:40,,FALSE
1/17/2022,IP274,parsley,8206,H274,8,11/15/2021,41,57,LOT274_IP_2022-01-17_57,2/21/2022,SP274,2022-12-12T05:11:10,,FALSE
11/29/2021,IP275,arugula,2227,H275,3,8/28/2021,12,16,LOT275_IP_2021-11-29_16,1/13/2022,SP275,2022-09-05T06:59:02,,FALSE
11/30/2022,IP276,parsley,8354,H276,9,9/1/2021,42,59,LOT276_IP_2022-11-30_59,1/15/2022,SP276,2022-09-10T23:57:32,,FALSE
11/7/2022,IP277,arugula,2632,H277,3,8/27/2021,14,19,LOT277_IP_2022-11-07_19,1/13/2022,SP277,2022-09-03T18:56:17,,FALSE
7/23/2022,IP278,chili peppers,6442,H278,7,11/4/2021,32,45,LOT278_IP_2022-07-23_45,2/16/2022,SP278,2022-11-28T05:57:29,,FALSE
11/9/2022,IP279,cilantro,7193,H279,7,8/18/2021,36,50,LOT279_IP_2022-11-09_50,1/9/2022,SP279,2022-08-24T17:25:46,,TRUE
10/24/2022,IP280,parsley,8038,H280,8,11/15/2021,40,56,LOT280_IP_2022-10-24_56,2/21/2022,SP280,2022-12-11T11:09:47,,FALSE
9/4/2022,IP281,Cucumbers,4668,H281,5,11/16/2021,24,33,LOT281_IP_2022-09-04_33,2/21/2022,SP281,2022-12-12T16:00,,TRUE
9/24/2022,IP282,spinach,1284,H282,2,9/14/2021,7,9,LOT282_IP_2022-09-24_9,1/22/2022,SP282,2022-09-26T04:01:26,,TRUE
9/27/2021,IP283,bell peppers,5155,H283,6,9/13/2021,26,36,LOT283_IP_2021-09-27_36,1/21/2022,SP283,2022-09-25T17:12:37,,FALSE
5/23/2022,IP284,cilantro,7455,H284,8,11/30/2021,37,52,LOT284_IP_2022-05-23_52,2/28/2022,SP284,2022-12-29T15:19:13,,FALSE
1/21/2023,IP285,lettuce,663,H285,2,8/22/2021,4,5,LOT285_IP_2023-01-21_5,1/11/2022,SP285,2022-08-29T19:59:09,,TRUE
10/21/2021,IP286,bell peppers,5642,H286,6,10/17/2021,28,40,LOT286_IP_2021-10-21_40,2/7/2022,SP286,2022-11-06T00:28:35,,FALSE
11/2/2022,IP287,Tomatoes,3743,H287,4,10/16/2021,19,26,LOT287_IP_2022-11-02_26,2/6/2022,SP287,2022-11-04T19:38:23,,FALSE
9/14/2021,IP288,potato,8834,H288,9,10/11/2021,44,62,LOT288_IP_2021-09-14_62,2/4/2022,SP288,2022-10-30T06:16:09,,FALSE
7/30/2022,IP289,potato,8812,H289,9,10/13/2021,44,62,LOT289_IP_2022-07-30_62,2/5/2022,SP289,2022-11-01T12:20:18,,FALSE
2/3/2022,IP290,lettuce,699,H290,2,9/4/2021,4,5,LOT290_IP_2022-02-03_5,1/17/2022,SP290,2022-09-14T18:04:27,,FALSE
8/28/2021,IP291,spinach,810,H291,2,9/8/2021,5,6,LOT291_IP_2021-08-28_6,1/19/2022,SP291,2022-09-19T09:49,,FALSE
7/7/2022,IP292,arugula,2370,H292,3,8/27/2021,12,17,LOT292_IP_2022-07-07_17,1/13/2022,SP292,2022-09-03T22:32:33,,FALSE
1/20/2022,IP293,arugula,2304,H293,3,9/2/2021,12,16,LOT293_IP_2022-01-20_16,1/16/2022,SP293,2022-09-11T10:46:22,,FALSE
9/26/2022,IP294,basil,6490,H294,7,11/17/2021,33,46,LOT294_IP_2022-09-26_46,2/22/2022,SP294,2022-12-13T17:13:56,,FALSE
3/5/2022,IP295,melons,3001,H295,4,8/2/2021,15,21,LOT295_IP_2022-03-05_21,1/1/2022,SP295,2022-08-04T21:37:18,,FALSE
9/7/2021,IP296,potato,8866,H296,9,10/1/2021,44,62,LOT296_IP_2021-09-07_62,1/30/2022,SP296,2022-10-17T04:40:07,,FALSE
12/8/2021,IP297,bell peppers,5489,H297,6,10/12/2021,28,39,LOT297_IP_2021-12-08_39,2/4/2022,SP297,2022-10-30T09:52:26,,TRUE
11/7/2022,IP298,basil,7048,H298,7,10/5/2021,35,49,LOT298_IP_2022-11-07_49,2/1/2022,SP298,2022-10-22T07:13:31,,FALSE
8/7/2021,IP299,kale,1912,H299,3,10/28/2021,10,14,LOT299_IP_2021-08-07_14,2/12/2022,SP299,2022-11-19T20:06,,FALSE
2/16/2023,IP300,melons,3539,H300,4,9/2/2021,18,25,LOT300_IP_2023-02-16_25,1/16/2022,SP300,2022-09-11T14:22:38,,FALSE
10/9/2022,IP301,lettuce,494,H301,1,11/25/2021,3,4,LOT301_IP_2022-10-09_4,2/26/2022,SP301,2022-12-24T12:45:49,,FALSE
12/3/2021,IP302,arugula,2568,H302,3,9/1/2021,13,18,LOT302_IP_2021-12-03_18,1/15/2022,SP302,2022-09-10T09:32:26,,FALSE
10/1/2021,IP303,parsley,7987,H303,8,11/29/2021,40,56,LOT303_IP_2021-10-01_56,2/28/2022,SP303,2022-12-29T00:54:07,,FALSE
11/23/2022,IP304,basil,7108,H304,7,10/9/2021,36,50,LOT304_IP_2022-11-23_50,2/3/2022,SP304,2022-10-26T19:21:48,,FALSE
3/2/2022,IP305,Cucumbers,4714,H305,5,9/23/2021,24,33,LOT305_IP_2022-03-02_33,1/26/2022,SP305,2022-10-07T17:34:43,,TRUE
7/21/2022,IP306,parsley,8053,H306,8,10/3/2021,40,56,LOT306_IP_2022-07-21_56,1/31/2022,SP306,2022-10-19T10:44:16,,FALSE
1/31/2022,IP307,spinach,913,H307,2,11/21/2021,5,7,LOT307_IP_2022-01-31_7,2/24/2022,SP307,2022-12-18T23:23:36,,TRUE
6/27/2022,IP308,Cucumbers,4848,H308,5,8/30/2021,25,34,LOT308_IP_2022-06-27_34,1/14/2022,SP308,2022-09-07T20:15:44,,FALSE
8/29/2021,IP309,sweet potato,9616,H309,10,10/30/2021,48,67,LOT309_IP_2021-08-29_67,2/13/2022,SP309,2022-11-21T11:45:03,,FALSE
9/22/2021,IP310,arugula,2457,H310,3,9/16/2021,13,17,LOT310_IP_2021-09-22_17,1/23/2022,SP310,2022-09-28T20:54:25,,FALSE
2/1/2022,IP311,Cucumbers,4587,H311,5,9/21/2021,23,32,LOT311_IP_2022-02-01_32,1/25/2022,SP311,2022-10-05T04:18:01,,FALSE
12/8/2022,IP312,Cucumbers,4863,H312,5,9/9/2021,25,34,LOT312_IP_2022-12-08_34,1/19/2022,SP312,2022-09-20T00:14:07,,FALSE
4/9/2022,IP313,lettuce,751,H313,2,10/28/2021,4,6,LOT313_IP_2022-04-09_6,2/12/2022,SP313,2022-11-19T09:17:11,,FALSE
12/16/2022,IP314,spinach,1177,H314,2,8/26/2021,6,9,LOT314_IP_2022-12-16_9,1/12/2022,SP314,2022-09-03T00:54:54,,FALSE
12/6/2021,IP315,potato,8943,H315,9,11/5/2021,45,63,LOT315_IP_2021-12-06_63,2/16/2022,SP315,2022-11-28T23:58:51,,FALSE
3/28/2022,IP316,potato,8657,H316,9,9/30/2021,43,61,LOT316_IP_2022-03-28_61,1/29/2022,SP316,2022-10-15T23:49:55,,FALSE
11/29/2021,IP317,parsley,8009,H317,8,8/29/2021,40,56,LOT317_IP_2021-11-29_56,1/14/2022,SP317,2022-09-06T19:01:48,,FALSE
10/6/2022,IP318,melons,3563,H318,4,10/28/2021,18,25,LOT318_IP_2022-10-06_25,2/12/2022,SP318,2022-11-19T16:29:44,,FALSE
2/12/2022,IP319,spinach,1387,H319,2,8/9/2021,7,10,LOT319_IP_2022-02-12_10,1/4/2022,SP319,2022-08-13T00:16:13,,FALSE
8/10/2021,IP320,potato,8931,H320,9,8/2/2021,45,63,LOT320_IP_2021-08-10_63,12/31/2021,SP320,2022-08-04T10:48:28,,FALSE
2/10/2022,IP321,Cucumbers,4376,H321,5,10/21/2021,22,31,LOT321_IP_2022-02-10_31,2/9/2022,SP321,2022-11-10T23:25:42,,FALSE
11/3/2021,IP322,spinach,1386,H322,2,10/2/2021,7,10,LOT322_IP_2021-11-03_10,1/30/2022,SP322,2022-10-18T13:06:36,,FALSE
12/11/2022,IP323,basil,6729,H323,7,10/13/2021,34,47,LOT323_IP_2022-12-11_47,2/5/2022,SP323,2022-11-01T08:44:01,,FALSE
6/22/2022,IP324,bell peppers,5225,H324,6,9/10/2021,26,37,LOT324_IP_2022-06-22_37,1/20/2022,SP324,2022-09-21T15:53:09,,TRUE
8/13/2022,IP325,bell peppers,5589,H325,6,8/29/2021,28,39,LOT325_IP_2022-08-13_39,1/14/2022,SP325,2022-09-07T09:26:54,,FALSE
2/26/2022,IP326,potato,9176,H326,9,10/18/2021,46,64,LOT326_IP_2022-02-26_64,2/7/2022,SP326,2022-11-07T01:42:31,,FALSE
2/13/2023,IP327,Tomatoes,3865,H327,4,11/10/2021,20,27,LOT327_IP_2023-02-13_27,2/18/2022,SP327,2022-12-05T00:09:55,,FALSE
11/4/2022,IP328,kale,1808,H328,3,9/13/2021,9,13,LOT328_IP_2022-11-04_13,1/21/2022,SP328,2022-09-24T23:11:14,,FALSE
5/29/2022,IP329,spinach,1419,H329,2,10/5/2021,8,10,LOT329_IP_2022-05-29_10,2/1/2022,SP329,2022-10-21T20:24:41,,FALSE
1/6/2023,IP330,Cucumbers,4836,H330,5,8/29/2021,24,34,LOT330_IP_2023-01-06_34,1/14/2022,SP330,2022-09-06T22:38:05,,FALSE
10/30/2021,IP331,potato,8765,H331,9,11/12/2021,44,61,LOT331_IP_2021-10-30_61,2/19/2022,SP331,2022-12-07T13:26:36,,FALSE
3/30/2022,IP332,Tomatoes,4183,H332,5,9/7/2021,21,29,LOT332_IP_2022-03-30_29,1/18/2022,SP332,2022-09-17T21:46:15,,FALSE
8/26/2022,IP333,bell peppers,5340,H333,6,9/29/2021,27,38,LOT333_IP_2022-08-26_38,1/29/2022,SP333,2022-10-14T22:35:58,,FALSE
3/1/2023,IP334,chili peppers,6367,H334,7,10/17/2021,32,45,LOT334_IP_2023-03-01_45,2/7/2022,SP334,2022-11-06T07:41:08,,TRUE
4/6/2022,IP335,kale,1694,H335,2,11/6/2021,9,12,LOT335_IP_2022-04-06_12,2/17/2022,SP335,2022-11-30T08:25:21,,FALSE
10/16/2022,IP336,arugula,2538,H336,3,11/27/2021,13,18,LOT336_IP_2022-10-16_18,2/27/2022,SP336,2022-12-26T15:13:42,,FALSE
3/3/2022,IP337,parsley,8534,H337,9,10/22/2021,43,60,LOT337_IP_2022-03-03_60,2/9/2022,SP337,2022-11-11T17:27:05,,FALSE
9/9/2021,IP338,lettuce,586,H338,1,8/20/2021,3,4,LOT338_IP_2021-09-09_4,1/10/2022,SP338,2022-08-27T06:42:28,,TRUE
2/18/2023,IP339,potato,8909,H339,9,10/23/2021,45,62,LOT339_IP_2023-02-18_62,2/10/2022,SP339,2022-11-13T05:29:51,,FALSE
9/2/2021,IP340,lettuce,374,H340,1,8/14/2021,2,3,LOT340_IP_2021-09-02_3,1/6/2022,SP340,2022-08-18T20:50:59,,FALSE
11/19/2022,IP341,chili peppers,6158,H341,7,8/27/2021,31,43,LOT341_IP_2022-11-19_43,1/13/2022,SP341,2022-09-04T20:10:13,,FALSE
1/25/2022,IP342,melons,2972,H342,4,8/28/2021,15,21,LOT342_IP_2022-01-25_21,1/14/2022,SP342,2022-09-06T04:36:42,,FALSE
12/4/2021,IP343,spinach,908,H343,2,10/7/2021,5,7,LOT343_IP_2021-12-04_7,2/2/2022,SP343,2022-10-24T09:41:23,,TRUE
2/21/2022,IP344,cilantro,7738,H344,8,11/27/2021,39,54,LOT344_IP_2022-02-21_54,2/27/2022,SP344,2022-12-26T00:48:35,,FALSE
4/15/2022,IP345,Tomatoes,3657,H345,4,9/14/2021,19,26,LOT345_IP_2022-04-15_26,1/22/2022,SP345,2022-09-27T01:39:06,,FALSE
9/1/2021,IP346,chili peppers,6071,H346,6,11/1/2021,31,43,LOT346_IP_2021-09-01_43,2/14/2022,SP346,2022-11-24T19:03:07,,FALSE
9/26/2021,IP347,Tomatoes,3734,H347,4,11/3/2021,19,26,LOT347_IP_2021-09-26_26,2/15/2022,SP347,2022-11-27T08:19:49,,TRUE
2/28/2022,IP348,chili peppers,6355,H348,7,11/11/2021,32,45,LOT348_IP_2022-02-28_45,2/19/2022,SP348,2022-12-07T02:37:47,,FALSE
11/14/2022,IP349,potato,8856,H349,9,8/15/2021,44,62,LOT349_IP_2022-11-14_62,1/7/2022,SP349,2022-08-20T23:18:51,,TRUE
10/5/2021,IP350,basil,6609,H350,7,11/3/2021,33,46,LOT350_IP_2021-10-05_46,2/15/2022,SP350,2022-11-26T14:18:26,,FALSE
8/20/2022,IP351,basil,6468,H351,7,11/8/2021,33,45,LOT351_IP_2022-08-20_45,2/18/2022,SP351,2022-12-03T12:07:09,,FALSE
4/19/2022,IP352,lettuce,771,H352,2,8/22/2021,4,6,LOT352_IP_2022-04-19_6,1/10/2022,SP352,2022-08-28T18:45:13,,TRUE
10/2/2022,IP353,chili peppers,6067,H353,6,11/4/2021,31,43,LOT353_IP_2022-10-02_43,2/16/2022,SP353,2022-11-28T16:46:18,,FALSE
9/5/2022,IP354,bell peppers,5567,H354,6,8/28/2021,28,39,LOT354_IP_2022-09-05_39,1/13/2022,SP354,2022-09-05T03:22:46,,FALSE
6/23/2022,IP355,bell peppers,5352,H355,6,8/1/2021,27,38,LOT355_IP_2022-06-23_38,12/31/2021,SP355,2022-08-03T20:23:22,,FALSE
9/23/2021,IP356,potato,9139,H356,9,11/15/2021,46,64,LOT356_IP_2021-09-23_64,2/21/2022,SP356,2022-12-11T18:22:20,,FALSE
2/6/2023,IP357,sweet potato,9443,H357,9,11/29/2021,47,66,LOT357_IP_2023-02-06_66,2/28/2022,SP357,2022-12-29T04:30:23,,FALSE
1/5/2022,IP358,sweet potato,9352,H358,9,11/3/2021,47,65,LOT358_IP_2022-01-05_65,2/15/2022,SP358,2022-11-26T21:30:59,,FALSE
10/9/2021,IP359,kale,1817,H359,3,11/14/2021,9,13,LOT359_IP_2021-10-09_13,2/21/2022,SP359,2022-12-10T09:55:51,,FALSE
9/14/2022,IP360,kale,1739,H360,2,8/13/2021,9,12,LOT360_IP_2022-09-14_12,1/6/2022,SP360,2022-08-17T16:00:47,,FALSE
7/18/2022,IP361,potato,9231,H361,9,11/20/2021,46,65,LOT361_IP_2022-07-18_65,2/24/2022,SP361,2022-12-17T18:33:24,,FALSE
10/1/2022,IP362,sweet potato,9961,H362,10,10/27/2021,50,70,LOT362_IP_2022-10-01_70,2/12/2022,SP362,2022-11-18T11:39:31,,FALSE
10/2/2021,IP363,cilantro,7391,H363,8,8/15/2021,37,52,LOT363_IP_2021-10-02_52,1/7/2022,SP363,2022-08-20T01:41:12,,FALSE
5/4/2022,IP364,parsley,8208,H364,8,11/14/2021,41,58,LOT364_IP_2022-05-04_58,2/20/2022,SP364,2022-12-09T23:07:02,,FALSE
11/20/2021,IP365,chili peppers,5862,H365,6,8/28/2021,30,41,LOT365_IP_2021-11-20_41,1/13/2022,SP365,2022-09-06T01:00:25,,FALSE
11/6/2022,IP366,Cucumbers,4532,H366,5,9/19/2021,23,32,LOT366_IP_2022-11-06_32,1/24/2022,SP366,2022-10-03T01:50:09,,FALSE
12/27/2022,IP367,Tomatoes,4194,H367,5,8/24/2021,21,30,LOT367_IP_2022-12-27_30,1/11/2022,SP367,2022-08-31T18:50:45,,FALSE
10/12/2022,IP368,Cucumbers,4710,H368,5,8/5/2021,24,33,LOT368_IP_2022-10-12_33,1/2/2022,SP368,2022-08-08T04:55:22,,FALSE
4/27/2022,IP369,basil,6722,H369,7,8/23/2021,34,47,LOT369_IP_2022-04-27_47,1/11/2022,SP369,2022-08-30T17:36:49,,FALSE
2/5/2023,IP370,melons,3192,H370,4,11/23/2021,16,23,LOT370_IP_2023-02-05_23,2/25/2022,SP370,2022-12-21T05:27:45,,FALSE
1/20/2023,IP371,potato,8895,H371,9,9/17/2021,45,62,LOT371_IP_2023-01-20_62,1/23/2022,SP371,2022-09-29T14:55:48,,FALSE
11/5/2022,IP372,cilantro,7246,H372,7,9/9/2021,36,51,LOT372_IP_2022-11-05_51,1/19/2022,SP372,2022-09-19T20:37:50,,FALSE
12/4/2022,IP373,cilantro,7242,H373,7,9/1/2021,36,51,LOT373_IP_2022-12-04_51,1/15/2022,SP373,2022-09-10T20:21:16,,FALSE
11/15/2022,IP374,bell peppers,5259,H374,6,8/16/2021,27,37,LOT374_IP_2022-11-15_37,1/7/2022,SP374,2022-08-21T20:56:31,,TRUE
10/11/2022,IP375,sweet potato,9677,H375,10,8/5/2021,48,68,LOT375_IP_2022-10-11_68,1/2/2022,SP375,2022-08-08T15:44:12,,TRUE
12/15/2022,IP376,cilantro,7507,H376,8,11/27/2021,38,53,LOT376_IP_2022-12-15_53,2/27/2022,SP376,2022-12-26T22:26:15,,FALSE
11/9/2021,IP377,cilantro,7435,H377,8,11/24/2021,37,52,LOT377_IP_2021-11-09_52,2/26/2022,SP377,2022-12-22T17:30:31,,FALSE
7/3/2022,IP378,parsley,8518,H378,9,8/13/2021,43,60,LOT378_IP_2022-07-03_60,1/6/2022,SP378,2022-08-18T17:14:43,,FALSE
8/27/2021,IP379,bell peppers,5377,H379,6,11/26/2021,27,38,LOT379_IP_2021-08-27_38,2/26/2022,SP379,2022-12-24T19:58:23,,FALSE
7/30/2022,IP380,arugula,2751,H380,3,11/13/2021,14,19,LOT380_IP_2022-07-30_19,2/20/2022,SP380,2022-12-08T21:53:06,,FALSE
11/27/2022,IP381,cilantro,7490,H381,8,10/3/2021,38,53,LOT381_IP_2022-11-27_53,1/31/2022,SP381,2022-10-20T04:45:39,,FALSE
6/11/2022,IP382,basil,6969,H382,7,11/30/2021,35,49,LOT382_IP_2022-06-11_49,2/28/2022,SP382,2022-12-29T18:55:30,,TRUE
10/25/2021,IP383,lettuce,753,H383,2,10/7/2021,4,6,LOT383_IP_2021-10-25_6,2/2/2022,SP383,2022-10-24T20:30:13,,TRUE
1/7/2023,IP384,bell peppers,5239,H384,6,11/6/2021,26,37,LOT384_IP_2023-01-07_37,2/17/2022,SP384,2022-11-30T04:49:04,,FALSE
11/12/2022,IP385,parsley,8132,H385,8,9/14/2021,41,57,LOT385_IP_2022-11-12_57,1/21/2022,SP385,2022-09-26T00:25:10,,FALSE
8/18/2022,IP386,bell peppers,5343,H386,6,9/10/2021,27,38,LOT386_IP_2022-08-18_38,1/20/2022,SP386,2022-09-21T08:40:36,,FALSE
10/27/2021,IP387,cilantro,7241,H387,7,10/6/2021,36,51,LOT387_IP_2021-10-27_51,2/1/2022,SP387,2022-10-23T01:14:54,,FALSE
3/26/2022,IP388,bell peppers,5337,H388,6,10/28/2021,27,37,LOT388_IP_2022-03-26_37,2/12/2022,SP388,2022-11-20T03:18:33,,FALSE
11/15/2021,IP389,chili peppers,6327,H389,7,9/3/2021,32,44,LOT389_IP_2021-11-15_44,1/16/2022,SP389,2022-09-12T19:12:51,,FALSE
5/31/2022,IP390,basil,7148,H390,7,10/27/2021,36,50,LOT390_IP_2022-05-31_50,2/12/2022,SP390,2022-11-18T04:26:58,,FALSE
8/4/2021,IP391,Tomatoes,3637,H391,4,10/9/2021,19,26,LOT391_IP_2021-08-04_26,2/3/2022,SP391,2022-10-27T02:34:21,,TRUE
5/26/2022,IP392,sweet potato,9317,H392,9,10/1/2021,47,65,LOT392_IP_2022-05-26_65,1/30/2022,SP392,2022-10-17T22:41:30,,FALSE
2/25/2023,IP393,arugula,2695,H393,3,8/6/2021,14,19,LOT393_IP_2023-02-25_19,1/3/2022,SP393,2022-08-10T03:46:58,,FALSE
9/21/2021,IP394,Tomatoes,3998,H394,5,10/8/2021,20,28,LOT394_IP_2021-09-21_28,2/2/2022,SP394,2022-10-26T01:20:25,,FALSE
12/4/2022,IP395,sweet potato,9662,H395,10,9/22/2021,48,68,LOT395_IP_2022-12-04_68,1/26/2022,SP395,2022-10-06T05:31:57,,FALSE
4/23/2022,IP396,melons,3242,H396,4,8/25/2021,17,23,LOT396_IP_2022-04-23_23,1/12/2022,SP396,2022-09-02T10:29:47,,FALSE
3/17/2022,IP397,Cucumbers,4964,H397,5,11/13/2021,25,35,LOT397_IP_2022-03-17_35,2/20/2022,SP397,2022-12-09T19:30:45,,FALSE
12/2/2021,IP398,sweet potato,9701,H398,10,10/10/2021,49,68,LOT398_IP_2021-12-02_68,2/3/2022,SP398,2022-10-28T03:48:17,,FALSE
11/26/2021,IP399,basil,6802,H399,7,11/10/2021,34,48,LOT399_IP_2021-11-26_48,2/19/2022,SP399,2022-12-05T07:22:28,,FALSE
8/11/2022,IP400,cilantro,7711,H400,8,11/8/2021,39,54,LOT400_IP_2022-08-11_54,2/18/2022,SP400,2022-12-03T04:54:36,,FALSE
12/10/2022,IP401,spinach,1081,H401,2,9/28/2021,6,8,LOT401_IP_2022-12-10_8,1/28/2022,SP401,2022-10-13T06:56:56,,FALSE
12/17/2022,IP402,Tomatoes,4259,H402,5,8/12/2021,22,30,LOT402_IP_2022-12-17_30,1/5/2022,SP402,2022-08-16T11:10:34,,FALSE
2/26/2022,IP403,potato,8777,H403,9,9/13/2021,44,61,LOT403_IP_2022-02-26_61,1/21/2022,SP403,2022-09-25T10:00:04,,FALSE
8/6/2022,IP404,cilantro,7779,H404,8,8/14/2021,39,55,LOT404_IP_2022-08-06_55,1/7/2022,SP404,2022-08-19T18:28:39,,FALSE
1/7/2023,IP405,bell peppers,5055,H405,6,11/26/2021,26,36,LOT405_IP_2023-01-07_36,2/27/2022,SP405,2022-12-25T17:36:02,,FALSE
9/12/2021,IP406,melons,3329,H406,4,10/14/2021,17,24,LOT406_IP_2021-09-12_24,2/5/2022,SP406,2022-11-02T02:45:24,,FALSE
7/17/2022,IP407,lettuce,170,H407,1,8/27/2021,1,1,LOT407_IP_2022-07-17_1,1/13/2022,SP407,2022-09-04T09:21:23,,FALSE
11/15/2021,IP408,arugula,2450,H408,3,11/1/2021,13,17,LOT408_IP_2021-11-15_17,2/14/2022,SP408,2022-11-24T08:14:18,,TRUE
4/11/2022,IP409,Tomatoes,3685,H409,4,11/1/2021,19,26,LOT409_IP_2022-04-11_26,2/14/2022,SP409,2022-11-24T15:26:51,,FALSE
1/13/2023,IP410,spinach,1460,H410,2,9/11/2021,8,10,LOT410_IP_2023-01-13_10,1/20/2022,SP410,2022-09-23T00:19:38,,TRUE
8/22/2021,IP411,melons,3139,H411,4,9/23/2021,16,22,LOT411_IP_2021-08-22_22,1/26/2022,SP411,2022-10-07T06:45:53,,FALSE
8/21/2022,IP412,chili peppers,6120,H412,6,9/29/2021,31,43,LOT412_IP_2022-08-21_43,1/29/2022,SP412,2022-10-14T15:23:25,,FALSE
2/23/2023,IP413,arugula,2467,H413,3,9/7/2021,13,17,LOT413_IP_2023-02-23_17,1/18/2022,SP413,2022-09-18T01:22:31,,FALSE
1/26/2022,IP414,Cucumbers,4773,H414,5,10/9/2021,24,34,LOT414_IP_2022-01-26_34,2/3/2022,SP414,2022-10-27T06:10:38,,FALSE
4/14/2022,IP415,spinach,898,H415,2,11/4/2021,5,7,LOT415_IP_2022-04-14_7,2/16/2022,SP415,2022-11-27T22:44:55,,FALSE
6/11/2022,IP416,bell peppers,5436,H416,6,8/14/2021,27,38,LOT416_IP_2022-06-11_38,1/6/2022,SP416,2022-08-19T14:52:22,,TRUE
1/22/2023,IP417,parsley,8068,H417,8,9/13/2021,40,57,LOT417_IP_2023-01-22_57,1/21/2022,SP417,2022-09-25T13:36:20,,FALSE
6/18/2022,IP418,parsley,8511,H418,9,8/17/2021,43,60,LOT418_IP_2022-06-18_60,1/8/2022,SP418,2022-08-22T18:34:10,,FALSE
1/21/2023,IP419,spinach,1030,H419,2,10/1/2021,6,7,LOT419_IP_2023-01-21_7,1/30/2022,SP419,2022-10-16T21:27:34,,FALSE
9/10/2022,IP420,bell peppers,5695,H420,6,9/22/2021,29,40,LOT420_IP_2022-09-10_40,1/26/2022,SP420,2022-10-06T16:20:47,,FALSE
7/10/2022,IP421,sweet potato,9476,H421,10,10/27/2021,47,66,LOT421_IP_2022-07-10_66,2/12/2022,SP421,2022-11-18T22:28:21,,FALSE
11/8/2021,IP422,arugula,2824,H422,3,10/14/2021,14,20,LOT422_IP_2021-11-08_20,2/6/2022,SP422,2022-11-02T17:10:31,,FALSE
11/17/2021,IP423,melons,3451,H423,4,9/16/2021,18,24,LOT423_IP_2021-11-17_24,1/22/2022,SP423,2022-09-28T10:05:35,,FALSE
5/1/2022,IP424,Cucumbers,4848,H424,5,9/25/2021,25,34,LOT424_IP_2022-05-01_34,1/27/2022,SP424,2022-10-09T23:38:51,,FALSE
12/15/2021,IP425,potato,8617,H425,9,9/5/2021,43,60,LOT425_IP_2021-12-15_60,1/17/2022,SP425,2022-09-14T21:40:43,,FALSE
11/22/2022,IP426,bell peppers,5245,H426,6,9/12/2021,26,37,LOT426_IP_2022-11-22_37,1/21/2022,SP426,2022-09-24T01:33:34,,TRUE
11/18/2022,IP427,cilantro,7234,H427,7,10/8/2021,36,51,LOT427_IP_2022-11-18_51,2/2/2022,SP427,2022-10-25T10:55:19,,FALSE
8/28/2022,IP428,lettuce,530,H428,1,9/2/2021,3,4,LOT428_IP_2022-08-28_4,1/16/2022,SP428,2022-09-12T08:24:01,,FALSE
10/18/2022,IP429,arugula,2863,H429,4,9/3/2021,15,20,LOT429_IP_2022-10-18_20,1/16/2022,SP429,2022-09-12T22:49:08,,FALSE
3/12/2022,IP430,cilantro,7790,H430,8,8/30/2021,39,55,LOT430_IP_2022-03-12_55,1/14/2022,SP430,2022-09-08T14:17:07,,FALSE
5/13/2022,IP431,kale,2032,H431,3,9/7/2021,11,14,LOT431_IP_2022-05-13_14,1/18/2022,SP431,2022-09-17T10:57:25,,FALSE
8/29/2022,IP432,chili peppers,5964,H432,6,9/4/2021,30,42,LOT432_IP_2022-08-29_42,1/17/2022,SP432,2022-09-14T10:51:53,,FALSE
5/9/2022,IP433,kale,1714,H433,2,8/4/2021,9,12,LOT433_IP_2022-05-09_12,1/2/2022,SP433,2022-08-07T07:17:43,,FALSE
7/22/2022,IP434,chili peppers,6156,H434,7,10/31/2021,31,43,LOT434_IP_2022-07-22_43,2/14/2022,SP434,2022-11-22T20:11:32,,FALSE
12/13/2022,IP435,Cucumbers,4920,H435,5,11/20/2021,25,35,LOT435_IP_2022-12-13_35,2/23/2022,SP435,2022-12-17T07:44:34,,FALSE
9/18/2022,IP436,potato,9175,H436,9,8/13/2021,46,64,LOT436_IP_2022-09-18_64,1/6/2022,SP436,2022-08-17T19:37:03,,FALSE
2/6/2022,IP437,Cucumbers,4770,H437,5,10/9/2021,24,34,LOT437_IP_2022-02-06_34,2/3/2022,SP437,2022-10-27T13:23:11,,TRUE
12/28/2022,IP438,cilantro,7701,H438,8,10/23/2021,39,54,LOT438_IP_2022-12-28_54,2/10/2022,SP438,2022-11-13T16:18:41,,FALSE
2/15/2022,IP439,parsley,8230,H439,8,8/24/2021,41,58,LOT439_IP_2022-02-15_58,1/11/2022,SP439,2022-08-31T15:14:28,,TRUE
8/22/2022,IP440,bell peppers,5209,H440,6,9/20/2021,26,37,LOT440_IP_2022-08-22_37,1/25/2022,SP440,2022-10-04T10:16:38,,FALSE
1/9/2022,IP441,kale,1561,H441,2,10/29/2021,8,11,LOT441_IP_2022-01-09_11,2/13/2022,SP441,2022-11-20T10:31:07,,FALSE
1/29/2023,IP442,Cucumbers,4493,H442,5,9/10/2021,23,32,LOT442_IP_2023-01-29_32,1/19/2022,SP442,2022-09-21T01:28:03,,FALSE
10/6/2022,IP443,lettuce,282,H443,1,11/7/2021,2,2,LOT443_IP_2022-10-06_2,2/17/2022,SP443,2022-12-01T16:51:50,,FALSE
5/20/2022,IP444,sweet potato,9596,H444,10,10/25/2021,48,67,LOT444_IP_2022-05-20_67,2/11/2022,SP444,2022-11-15T22:22:49,,FALSE
9/2/2022,IP445,lettuce,740,H445,2,10/15/2021,4,5,LOT445_IP_2022-09-02_5,2/6/2022,SP445,2022-11-03T22:00:43,,FALSE
1/14/2023,IP446,spinach,1264,H446,2,9/15/2021,7,9,LOT446_IP_2023-01-14_9,1/22/2022,SP446,2022-09-28T02:53:02,,FALSE
9/30/2022,IP447,potato,9006,H447,9,9/9/2021,45,63,LOT447_IP_2022-09-30_63,1/19/2022,SP447,2022-09-20T11:02:57,,FALSE
9/21/2021,IP448,chili peppers,6207,H448,7,8/2/2021,31,44,LOT448_IP_2021-09-21_44,12/31/2021,SP448,2022-08-04T07:12:11,,FALSE
12/22/2022,IP449,Cucumbers,4969,H449,5,10/4/2021,25,35,LOT449_IP_2022-12-22_35,1/31/2022,SP449,2022-10-20T11:58:12,,TRUE
7/23/2022,IP450,parsley,8523,H450,9,8/12/2021,43,60,LOT450_IP_2022-07-23_60,1/5/2022,SP450,2022-08-16T21:59:24,,TRUE
10/28/2021,IP451,kale,2044,H451,3,10/26/2021,11,15,LOT451_IP_2021-10-28_15,2/11/2022,SP451,2022-11-16T16:24:12,,FALSE
10/31/2021,IP452,Cucumbers,4808,H452,5,10/5/2021,24,34,LOT452_IP_2021-10-31_34,2/1/2022,SP452,2022-10-22T18:02:20,,FALSE
7/12/2022,IP453,chili peppers,5766,H453,6,9/20/2021,29,40,LOT453_IP_2022-07-12_40,1/24/2022,SP453,2022-10-03T09:02:42,,FALSE
12/11/2021,IP454,arugula,2918,H454,4,8/6/2021,15,21,LOT454_IP_2021-12-11_21,1/2/2022,SP454,2022-08-09T02:33:02,,FALSE
4/29/2022,IP455,lettuce,713,H455,2,8/31/2021,4,5,LOT455_IP_2022-04-29_5,1/15/2022,SP455,2022-09-09T01:05:57,,FALSE
9/8/2022,IP456,spinach,1012,H456,2,11/18/2021,6,7,LOT456_IP_2022-09-08_7,2/23/2022,SP456,2022-12-15T16:05:31,,FALSE
9/10/2022,IP457,Tomatoes,4322,H457,5,8/19/2021,22,30,LOT457_IP_2022-09-10_30,1/9/2022,SP457,2022-08-25T00:38:19,,FALSE
2/27/2022,IP458,kale,2182,H458,3,8/1/2021,11,16,LOT458_IP_2022-02-27_16,12/31/2021,SP458,2022-08-03T09:34:32,,TRUE
1/10/2023,IP459,parsley,8415,H459,9,11/25/2021,42,59,LOT459_IP_2023-01-10_59,2/26/2022,SP459,2022-12-24T09:09:33,,FALSE
1/13/2023,IP460,lettuce,103,H460,1,11/2/2021,1,1,LOT460_IP_2023-01-13_1,2/15/2022,SP460,2022-11-26T07:05:53,,FALSE
2/6/2023,IP461,cilantro,7499,H461,8,10/5/2021,38,53,LOT461_IP_2023-02-06_53,2/1/2022,SP461,2022-10-22T03:37:14,,TRUE
2/19/2023,IP462,basil,6850,H462,7,9/9/2021,34,48,LOT462_IP_2023-02-19_48,1/19/2022,SP462,2022-09-20T21:51:46,,FALSE
9/6/2022,IP463,sweet potato,9627,H463,10,10/2/2021,48,67,LOT463_IP_2022-09-06_67,1/31/2022,SP463,2022-10-18T23:55:26,,FALSE
12/27/2021,IP464,lettuce,537,H464,1,8/14/2021,3,4,LOT464_IP_2021-12-27_4,1/6/2022,SP464,2022-08-19T04:03:33,,TRUE
1/2/2022,IP465,kale,1861,H465,3,8/18/2021,10,13,LOT465_IP_2022-01-02_13,1/8/2022,SP465,2022-08-24T03:00:40,,FALSE
2/17/2023,IP466,spinach,1378,H466,2,11/29/2021,7,10,LOT466_IP_2023-02-17_10,2/28/2022,SP466,2022-12-28T17:41:34,,TRUE
12/18/2022,IP467,cilantro,7258,H467,8,10/19/2021,36,51,LOT467_IP_2022-12-18_51,2/8/2022,SP467,2022-11-08T10:09,,FALSE
2/4/2022,IP468,kale,1885,H468,3,11/10/2021,10,13,LOT468_IP_2022-02-04_13,2/19/2022,SP468,2022-12-05T18:11:17,,FALSE
2/4/2023,IP469,melons,3401,H469,4,11/4/2021,17,24,LOT469_IP_2023-02-04_24,2/15/2022,SP469,2022-11-27T15:32:22,,FALSE
12/8/2022,IP470,parsley,8245,H470,8,11/23/2021,41,58,LOT470_IP_2022-12-08_58,2/25/2022,SP470,2022-12-22T03:05:24,,FALSE
5/6/2022,IP471,kale,2041,H471,3,9/19/2021,11,15,LOT471_IP_2022-05-06_15,1/24/2022,SP471,2022-10-02T18:37:36,,FALSE
10/15/2022,IP472,arugula,2696,H472,3,10/11/2021,14,19,LOT472_IP_2022-10-15_19,2/4/2022,SP472,2022-10-29T08:38:30,,TRUE
7/14/2022,IP473,lettuce,752,H473,2,8/31/2021,4,6,LOT473_IP_2022-07-14_6,1/15/2022,SP473,2022-09-09T11:54:46,,FALSE
8/2/2021,IP474,melons,3511,H474,4,11/18/2021,18,25,LOT474_IP_2021-08-02_25,2/23/2022,SP474,2022-12-15T05:16:42,,FALSE
5/25/2022,IP475,cilantro,7617,H475,8,10/6/2021,38,53,LOT475_IP_2022-05-25_53,2/1/2022,SP475,2022-10-23T04:51:10,,TRUE
7/8/2022,IP476,kale,2117,H476,3,10/22/2021,11,15,LOT476_IP_2022-07-08_15,2/9/2022,SP476,2022-11-12T00:39:38,,FALSE
1/28/2023,IP477,Cucumbers,4559,H477,5,11/25/2021,23,32,LOT477_IP_2023-01-28_32,2/26/2022,SP477,2022-12-24T01:57,,FALSE
8/31/2022,IP478,Tomatoes,4330,H478,5,9/11/2021,22,30,LOT478_IP_2022-08-31_30,1/20/2022,SP478,2022-09-23T03:55:55,,FALSE
12/3/2022,IP479,bell peppers,5242,H479,6,11/28/2021,26,37,LOT479_IP_2022-12-03_37,2/27/2022,SP479,2022-12-27T05:38:48,,FALSE
11/23/2021,IP480,basil,7040,H480,7,9/19/2021,35,49,LOT480_IP_2021-11-23_49,1/24/2022,SP480,2022-10-03T05:26:26,,TRUE
8/30/2021,IP481,lettuce,346,H481,1,10/27/2021,2,3,LOT481_IP_2021-08-30_3,2/12/2022,SP481,2022-11-17T21:14:25,,FALSE
11/11/2021,IP482,chili peppers,6423,H482,7,8/18/2021,32,45,LOT482_IP_2021-11-11_45,1/8/2022,SP482,2022-08-24T13:49:29,,FALSE
10/22/2021,IP483,Cucumbers,4396,H483,5,11/12/2021,22,31,LOT483_IP_2021-10-22_31,2/20/2022,SP483,2022-12-08T07:27:59,,TRUE
7/20/2022,IP484,Tomatoes,3938,H484,4,10/2/2021,20,28,LOT484_IP_2022-07-20_28,1/30/2022,SP484,2022-10-18T05:54:03,,FALSE
7/9/2022,IP485,lettuce,159,H485,1,10/1/2021,1,1,LOT485_IP_2022-07-09_1,1/30/2022,SP485,2022-10-17T08:16:24,,FALSE
4/17/2022,IP486,potato,9090,H486,9,11/9/2021,45,64,LOT486_IP_2022-04-17_64,2/18/2022,SP486,2022-12-04T02:32:15,,FALSE
10/21/2021,IP487,spinach,877,H487,2,9/21/2021,5,6,LOT487_IP_2021-10-21_6,1/25/2022,SP487,2022-10-04T17:29:11,,FALSE
9/10/2021,IP488,potato,8953,H488,9,11/7/2021,45,63,LOT488_IP_2021-09-10_63,2/17/2022,SP488,2022-12-01T13:15:33,,FALSE
3/18/2022,IP489,bell peppers,5724,H489,6,10/8/2021,29,40,LOT489_IP_2022-03-18_40,2/3/2022,SP489,2022-10-26T04:56:42,,FALSE
2/12/2023,IP490,parsley,8197,H490,8,9/21/2021,41,57,LOT490_IP_2023-02-12_57,1/25/2022,SP490,2022-10-04T21:05:28,,TRUE
11/28/2022,IP491,parsley,8198,H491,8,8/22/2021,41,57,LOT491_IP_2022-11-28_57,1/10/2022,SP491,2022-08-28T22:21:30,,FALSE
12/1/2022,IP492,parsley,7915,H492,8,9/2/2021,40,55,LOT492_IP_2022-12-01_55,1/15/2022,SP492,2022-09-11T03:33:49,,TRUE
10/16/2022,IP493,cilantro,7822,H493,8,10/14/2021,39,55,LOT493_IP_2022-10-16_55,2/6/2022,SP493,2022-11-02T20:46:47,,TRUE
6/14/2022,IP494,potato,9187,H494,9,11/17/2021,46,64,LOT494_IP_2022-06-14_64,2/22/2022,SP494,2022-12-14T14:51:35,,FALSE
10/4/2022,IP495,chili peppers,6077,H495,6,9/11/2021,31,43,LOT495_IP_2022-10-04_43,1/20/2022,SP495,2022-09-22T20:43:22,,FALSE
7/31/2022,IP496,parsley,7934,H496,8,11/26/2021,40,56,LOT496_IP_2022-07-31_56,2/27/2022,SP496,2022-12-25T13:59:46,,FALSE
7/10/2022,IP497,Cucumbers,4702,H497,5,10/15/2021,24,33,LOT497_IP_2022-07-10_33,2/6/2022,SP497,2022-11-03T14:48:10,,FALSE
4/10/2022,IP498,lettuce,672,H498,2,11/29/2021,4,5,LOT498_IP_2022-04-10_5,2/28/2022,SP498,2022-12-29T11:42:57,,FALSE
9/16/2022,IP499,cilantro,7476,H499,8,9/20/2021,38,52,LOT499_IP_2022-09-16_52,1/25/2022,SP499,2022-10-04T03:04:05,,FALSE
11/4/2021,IP500,sweet potato,9539,H500,10,8/21/2021,48,67,LOT500_IP_2021-11-04_67,1/10/2022,SP500,2022-08-27T10:18:44,,FALSE
2/16/2022,IP501,spinach,839,H501,2,8/10/2021,5,6,LOT501_IP_2022-02-16_6,1/4/2022,SP501,2022-08-14T12:18:59,,FALSE
9/19/2021,IP502,potato,8809,H502,9,8/27/2021,44,62,LOT502_IP_2021-09-19_62,1/13/2022,SP502,2022-09-04T12:57:39,,FALSE
3/29/2022,IP503,cilantro,7787,H503,8,8/21/2021,39,55,LOT503_IP_2022-03-29_55,1/10/2022,SP503,2022-08-28T11:32:40,,FALSE
4/17/2022,IP504,cilantro,7579,H504,8,8/5/2021,38,53,LOT504_IP_2022-04-17_53,1/2/2022,SP504,2022-08-08T01:19:06,,FALSE
2/5/2022,IP505,basil,6533,H505,7,10/22/2021,33,46,LOT505_IP_2022-02-05_46,2/9/2022,SP505,2022-11-12T04:15:55,,FALSE
12/20/2022,IP506,kale,1724,H506,2,9/14/2021,9,12,LOT506_IP_2022-12-20_12,1/22/2022,SP506,2022-09-26T18:26:33,,FALSE
2/14/2023,IP507,sweet potato,9826,H507,10,11/19/2021,49,69,LOT507_IP_2023-02-14_69,2/23/2022,SP507,2022-12-16T17:19:27,,FALSE
1/10/2022,IP508,kale,1658,H508,2,8/27/2021,9,12,LOT508_IP_2022-01-10_12,1/13/2022,SP508,2022-09-04T02:08:50,,FALSE
12/14/2021,IP509,spinach,842,H509,2,9/29/2021,5,6,LOT509_IP_2021-12-14_6,1/29/2022,SP509,2022-10-14T11:47:09,,TRUE
10/25/2021,IP510,basil,6824,H510,7,9/17/2021,34,48,LOT510_IP_2021-10-25_48,1/23/2022,SP510,2022-09-29T18:32:04,,FALSE
9/21/2022,IP511,arugula,2337,H511,3,8/10/2021,12,17,LOT511_IP_2022-09-21_17,1/4/2022,SP511,2022-08-14T01:30:09,,FALSE
12/14/2022,IP512,basil,7144,H512,7,10/2/2021,36,50,LOT512_IP_2022-12-14_50,1/31/2022,SP512,2022-10-19T03:31:43,,FALSE
12/6/2022,IP513,spinach,1422,H513,2,10/25/2021,8,10,LOT513_IP_2022-12-06_10,2/11/2022,SP513,2022-11-15T11:34,,TRUE
3/6/2022,IP514,bell peppers,5560,H514,6,9/29/2021,28,39,LOT514_IP_2022-03-06_39,1/29/2022,SP514,2022-10-14T18:59:42,,FALSE
12/16/2021,IP515,Cucumbers,4855,H515,5,12/1/2021,25,34,LOT515_IP_2021-12-16_34,3/1/2022,SP515,2022-12-31T06:58:15,,FALSE
8/18/2022,IP516,cilantro,7737,H516,8,11/25/2021,39,54,LOT516_IP_2022-08-18_54,2/26/2022,SP516,2022-12-23T22:20:43,,FALSE
12/18/2022,IP517,melons,3220,H517,4,8/30/2021,16,23,LOT517_IP_2022-12-18_23,1/14/2022,SP517,2022-09-07T13:03:11,,FALSE
5/10/2022,IP518,sweet potato,9423,H518,9,11/5/2021,47,66,LOT518_IP_2022-05-10_66,2/16/2022,SP518,2022-11-29T10:47:41,,FALSE
9/11/2022,IP519,potato,8639,H519,9,8/3/2021,43,61,LOT519_IP_2022-09-11_61,1/1/2022,SP519,2022-08-05T15:38:41,,FALSE
11/24/2022,IP520,basil,6849,H520,7,8/11/2021,34,48,LOT520_IP_2022-11-24_48,1/5/2022,SP520,2022-08-15T17:09:11,,FALSE
2/17/2022,IP521,sweet potato,9365,H521,9,10/21/2021,47,66,LOT521_IP_2022-02-17_66,2/9/2022,SP521,2022-11-11T03:01:59,,FALSE
10/17/2022,IP522,sweet potato,9897,H522,10,10/9/2021,49,69,LOT522_IP_2022-10-17_69,2/3/2022,SP522,2022-10-27T09:46:54,,FALSE
9/21/2022,IP523,lettuce,381,H523,1,8/20/2021,2,3,LOT523_IP_2022-09-21_3,1/9/2022,SP523,2022-08-27T03:06:11,,FALSE
2/5/2023,IP524,chili peppers,5965,H524,6,9/20/2021,30,42,LOT524_IP_2023-02-05_42,1/25/2022,SP524,2022-10-04T06:40:22,,FALSE
7/22/2022,IP525,potato,8957,H525,9,10/1/2021,45,63,LOT525_IP_2022-07-22_63,1/30/2022,SP525,2022-10-17T11:52:40,,FALSE
11/22/2021,IP526,chili peppers,5772,H526,6,10/29/2021,29,41,LOT526_IP_2021-11-22_41,2/13/2022,SP526,2022-11-21T08:08:46,,FALSE
9/3/2021,IP527,bell peppers,5098,H527,6,9/27/2021,26,36,LOT527_IP_2021-09-03_36,1/28/2022,SP527,2022-10-12T12:55:33,,TRUE
10/19/2022,IP528,kale,2055,H528,3,8/5/2021,11,15,LOT528_IP_2022-10-19_15,1/2/2022,SP528,2022-08-08T12:07:56,,FALSE
4/29/2022,IP529,melons,3149,H529,4,9/7/2021,16,22,LOT529_IP_2022-04-29_22,1/18/2022,SP529,2022-09-18T08:35:04,,FALSE
1/9/2023,IP530,Tomatoes,4234,H530,5,11/1/2021,21,30,LOT530_IP_2023-01-09_30,2/14/2022,SP530,2022-11-24T01:01:44,,FALSE
1/15/2022,IP531,potato,9065,H531,9,10/3/2021,45,63,LOT531_IP_2022-01-15_63,1/31/2022,SP531,2022-10-20T01:09:22,,FALSE
9/27/2022,IP532,arugula,2759,H532,3,8/2/2021,14,20,LOT532_IP_2022-09-27_20,12/31/2021,SP532,2022-08-04T03:35:55,,TRUE
6/1/2022,IP533,melons,3449,H533,4,9/7/2021,18,24,LOT533_IP_2022-06-01_24,1/18/2022,SP533,2022-09-17T14:33:42,,TRUE
9/15/2022,IP534,Cucumbers,4910,H534,5,11/26/2021,25,35,LOT534_IP_2022-09-15_35,2/26/2022,SP534,2022-12-24T23:34:39,,TRUE
2/18/2022,IP535,lettuce,180,H535,1,11/24/2021,1,2,LOT535_IP_2022-02-18_2,2/25/2022,SP535,2022-12-22T06:41:41,,FALSE
6/26/2022,IP536,melons,3335,H536,4,10/3/2021,17,24,LOT536_IP_2022-06-26_24,1/31/2022,SP536,2022-10-20T08:21:55,,TRUE
1/17/2022,IP537,cilantro,7691,H537,8,9/8/2021,39,54,LOT537_IP_2022-01-17_54,1/19/2022,SP537,2022-09-19T06:12:44,,FALSE
4/6/2022,IP538,Tomatoes,3852,H538,4,10/9/2021,20,27,LOT538_IP_2022-04-06_27,2/3/2022,SP538,2022-10-27T16:59:27,,FALSE
3/28/2022,IP539,melons,3569,H539,4,11/22/2021,18,25,LOT539_IP_2022-03-28_25,2/25/2022,SP539,2022-12-20T07:50:05,,FALSE
7/4/2022,IP540,kale,1837,H540,3,11/25/2021,10,13,LOT540_IP_2022-07-04_13,2/26/2022,SP540,2022-12-24T05:33:16,,FALSE
9/9/2021,IP541,arugula,2529,H541,3,11/15/2021,13,18,LOT541_IP_2021-09-09_18,2/21/2022,SP541,2022-12-11T14:46:04,,TRUE
10/20/2022,IP542,basil,6952,H542,7,8/13/2021,35,49,LOT542_IP_2022-10-20_49,1/6/2022,SP542,2022-08-18T13:38:26,,FALSE
7/16/2022,IP543,melons,3559,H543,4,11/1/2021,18,25,LOT543_IP_2022-07-16_25,2/14/2022,SP543,2022-11-24T11:50:34,,FALSE
8/2/2022,IP544,melons,3100,H544,4,11/16/2021,16,22,LOT544_IP_2022-08-02_22,2/22/2022,SP544,2022-12-12T23:12:33,,FALSE
4/2/2022,IP545,basil,7110,H545,7,8/18/2021,36,50,LOT545_IP_2022-04-02_50,1/8/2022,SP545,2022-08-23T23:24:23,,FALSE
6/13/2022,IP546,potato,8773,H546,9,9/12/2021,44,61,LOT546_IP_2022-06-13_61,1/21/2022,SP546,2022-09-24T15:58:41,,FALSE
3/13/2022,IP547,sweet potato,9394,H547,9,8/9/2021,47,66,LOT547_IP_2022-03-13_66,1/4/2022,SP547,2022-08-13T03:52:29,,TRUE
7/25/2022,IP548,Tomatoes,3645,H548,4,10/31/2021,19,26,LOT548_IP_2022-07-25_26,2/14/2022,SP548,2022-11-23T17:49:11,,FALSE
7/5/2022,IP549,spinach,1315,H549,2,9/10/2021,7,9,LOT549_IP_2022-07-05_9,1/20/2022,SP549,2022-09-21T05:04:19,,FALSE
1/19/2023,IP550,kale,1910,H550,3,10/4/2021,10,14,LOT550_IP_2023-01-19_14,1/31/2022,SP550,2022-10-20T19:10:45,,FALSE
11/27/2021,IP551,Tomatoes,3849,H551,4,9/16/2021,20,27,LOT551_IP_2021-11-27_27,1/23/2022,SP551,2022-09-29T04:06:58,,FALSE
1/27/2022,IP552,sweet potato,9958,H552,10,8/6/2021,50,70,LOT552_IP_2022-01-27_70,1/2/2022,SP552,2022-08-09T09:45:35,,FALSE
10/13/2022,IP553,chili peppers,6231,H553,7,11/21/2021,31,44,LOT553_IP_2022-10-13_44,2/24/2022,SP553,2022-12-18T19:47:20,,FALSE
10/30/2022,IP554,basil,6980,H554,7,11/20/2021,35,49,LOT554_IP_2022-10-30_49,2/23/2022,SP554,2022-12-17T14:57:07,,FALSE
1/17/2023,IP555,kale,2053,H555,3,10/30/2021,11,15,LOT555_IP_2023-01-17_15,2/13/2022,SP555,2022-11-22T12:58:59,,FALSE
10/17/2021,IP556,Tomatoes,4082,H556,5,8/10/2021,21,29,LOT556_IP_2021-10-17_29,1/5/2022,SP556,2022-08-14T15:55:15,,FALSE
5/8/2022,IP557,lettuce,542,H557,1,8/19/2021,3,4,LOT557_IP_2022-05-08_4,1/9/2022,SP557,2022-08-25T07:50:52,,FALSE
12/7/2021,IP558,arugula,2815,H558,3,11/9/2021,14,20,LOT558_IP_2021-12-07_20,2/18/2022,SP558,2022-12-04T16:57:21,,TRUE
4/7/2022,IP559,kale,1995,H559,3,8/28/2021,10,14,LOT559_IP_2022-04-07_14,1/13/2022,SP559,2022-09-05T14:11:35,,FALSE
11/3/2021,IP560,basil,7140,H560,7,10/21/2021,36,50,LOT560_IP_2021-11-03_50,2/9/2022,SP560,2022-11-11T10:14:32,,FALSE
6/18/2022,IP561,kale,1699,H561,2,10/28/2021,9,12,LOT561_IP_2022-06-18_12,2/12/2022,SP561,2022-11-19T05:40:54,,FALSE
5/2/2022,IP562,bell peppers,5088,H562,6,8/10/2021,26,36,LOT562_IP_2022-05-02_36,1/5/2022,SP562,2022-08-14T19:31:32,,FALSE
9/13/2021,IP563,lettuce,458,H563,1,9/11/2021,3,3,LOT563_IP_2021-09-13_3,1/20/2022,SP563,2022-09-23T07:32:11,,FALSE
9/6/2022,IP564,melons,3546,H564,4,10/13/2021,18,25,LOT564_IP_2022-09-06_25,2/5/2022,SP564,2022-10-31T21:55:12,,FALSE
11/10/2022,IP565,lettuce,460,H565,1,9/7/2021,3,4,LOT565_IP_2022-11-10_4,1/18/2022,SP565,2022-09-18T04:58:48,,FALSE
9/27/2022,IP566,melons,3506,H566,4,9/15/2021,18,25,LOT566_IP_2022-09-27_25,1/22/2022,SP566,2022-09-27T16:04:12,,FALSE
3/29/2022,IP567,melons,3361,H567,4,10/7/2021,17,24,LOT567_IP_2022-03-29_24,2/2/2022,SP567,2022-10-24T06:05:06,,FALSE
6/29/2022,IP568,lettuce,683,H568,2,10/26/2021,4,5,LOT568_IP_2022-06-29_5,2/11/2022,SP568,2022-11-17T06:49:18,,FALSE
11/19/2022,IP569,chili peppers,6434,H569,7,10/26/2021,32,45,LOT569_IP_2022-11-19_45,2/11/2022,SP569,2022-11-16T23:36:45,,FALSE
8/29/2021,IP570,arugula,2792,H570,3,9/5/2021,14,20,LOT570_IP_2021-08-29_20,1/17/2022,SP570,2022-09-15T08:29:33,,FALSE
2/15/2023,IP571,parsley,8353,H571,9,10/15/2021,42,59,LOT571_IP_2023-02-15_59,2/6/2022,SP571,2022-11-03T11:11:53,,FALSE
1/18/2022,IP572,lettuce,188,H572,1,8/22/2021,1,2,LOT572_IP_2022-01-18_2,1/10/2022,SP572,2022-08-29T01:57:47,,FALSE
1/8/2022,IP573,melons,3307,H573,4,9/26/2021,17,23,LOT573_IP_2022-01-08_23,1/27/2022,SP573,2022-10-10T21:16:31,,FALSE
12/22/2021,IP574,spinach,1439,H574,2,9/15/2021,8,10,LOT574_IP_2021-12-22_10,1/22/2022,SP574,2022-09-27T12:27:56,,FALSE
12/22/2021,IP575,arugula,2761,H575,3,10/6/2021,14,20,LOT575_IP_2021-12-22_20,2/2/2022,SP575,2022-10-23T22:52:33,,FALSE
7/16/2022,IP576,potato,8781,H576,9,9/28/2021,44,62,LOT576_IP_2022-07-16_62,1/29/2022,SP576,2022-10-14T00:58:19,,TRUE
9/19/2022,IP577,chili peppers,6352,H577,7,8/9/2021,32,45,LOT577_IP_2022-09-19_45,1/4/2022,SP577,2022-08-13T18:17:36,,FALSE
3/30/2022,IP578,parsley,8155,H578,8,9/3/2021,41,57,LOT578_IP_2022-03-30_57,1/16/2022,SP578,2022-09-13T13:14:14,,TRUE
12/10/2022,IP579,arugula,2609,H579,3,11/19/2021,13,18,LOT579_IP_2022-12-10_18,2/23/2022,SP579,2022-12-16T10:06:54,,FALSE
6/24/2022,IP580,melons,3162,H580,4,10/8/2021,16,22,LOT580_IP_2022-06-24_22,2/2/2022,SP580,2022-10-25T14:31:35,,FALSE
12/19/2021,IP581,parsley,8473,H581,9,8/12/2021,42,59,LOT581_IP_2021-12-19_59,1/6/2022,SP581,2022-08-17T05:11:57,,FALSE
8/6/2021,IP582,lettuce,612,H582,1,9/30/2021,4,5,LOT582_IP_2021-08-06_5,1/30/2022,SP582,2022-10-16T10:38:44,,TRUE
5/16/2022,IP583,potato,9013,H583,9,8/25/2021,45,63,LOT583_IP_2022-05-16_63,1/12/2022,SP583,2022-09-01T16:28:24,,FALSE
9/14/2021,IP584,Cucumbers,4539,H584,5,9/9/2021,23,32,LOT584_IP_2021-09-14_32,1/19/2022,SP584,2022-09-20T07:26:40,,FALSE
6/6/2022,IP585,parsley,7943,H585,8,11/22/2021,40,56,LOT585_IP_2022-06-06_56,2/25/2022,SP585,2022-12-20T18:38:55,,TRUE
12/17/2021,IP586,bell peppers,5101,H586,6,9/9/2021,26,36,LOT586_IP_2021-12-17_36,1/19/2022,SP586,2022-09-20T18:15:30,,TRUE
1/25/2023,IP587,spinach,1356,H587,2,10/24/2021,7,10,LOT587_IP_2023-01-25_10,2/10/2022,SP587,2022-11-14T03:07:30,,TRUE
2/12/2022,IP588,bell peppers,5096,H588,6,9/24/2021,26,36,LOT588_IP_2022-02-12_36,1/26/2022,SP588,2022-10-08T15:12:22,,FALSE
1/13/2022,IP589,basil,6735,H589,7,9/7/2021,34,47,LOT589_IP_2022-01-13_47,1/18/2022,SP589,2022-09-17T18:09:58,,FALSE
12/12/2022,IP590,spinach,1313,H590,2,10/26/2021,7,9,LOT590_IP_2022-12-12_9,2/11/2022,SP590,2022-11-17T14:01:52,,FALSE
8/21/2022,IP591,sweet potato,9601,H591,10,9/9/2021,48,67,LOT591_IP_2022-08-21_67,1/19/2022,SP591,2022-09-20T03:50:23,,FALSE
8/11/2022,IP592,bell peppers,5076,H592,6,8/2/2021,26,36,LOT592_IP_2022-08-11_36,1/1/2022,SP592,2022-08-04T18:01:01,,FALSE
10/14/2021,IP593,spinach,1173,H593,2,8/11/2021,6,8,LOT593_IP_2021-10-14_8,1/5/2022,SP593,2022-08-15T20:45:28,,TRUE
12/4/2021,IP594,Cucumbers,4828,H594,5,9/4/2021,24,34,LOT594_IP_2021-12-04_34,1/17/2022,SP594,2022-09-14T14:28:10,,FALSE
12/31/2021,IP595,sweet potato,9837,H595,10,8/7/2021,49,69,LOT595_IP_2021-12-31_69,1/3/2022,SP595,2022-08-10T18:12:04,,TRUE
7/6/2022,IP596,Tomatoes,4037,H596,5,9/24/2021,20,28,LOT596_IP_2022-07-06_28,1/27/2022,SP596,2022-10-08T22:24:55,,FALSE
3/1/2022,IP597,kale,2216,H597,3,10/13/2021,11,16,LOT597_IP_2022-03-01_16,2/5/2022,SP597,2022-10-31T14:42:38,,FALSE
6/21/2022,IP598,bell peppers,5643,H598,6,8/25/2021,28,40,LOT598_IP_2022-06-21_40,1/12/2022,SP598,2022-09-02T06:53:31,,FALSE
7/11/2022,IP599,chili peppers,6185,H599,7,8/26/2021,31,43,LOT599_IP_2022-07-11_43,1/12/2022,SP599,2022-09-02T21:18:37,,FALSE
7/7/2022,IP600,cilantro,7392,H600,8,8/6/2021,37,52,LOT600_IP_2022-07-07_52,1/3/2022,SP600,2022-08-10T00:10:41,,FALSE
9/5/2021,IP601,spinach,1263,H601,2,10/10/2021,7,9,LOT601_IP_2021-09-05_9,2/3/2022,SP601,2022-10-28T14:37:07,,FALSE
3/14/2022,IP602,parsley,8359,H602,9,11/11/2021,42,59,LOT602_IP_2022-03-14_59,2/19/2022,SP602,2022-12-06T15:48:57,,FALSE
7/13/2022,IP603,lettuce,693,H603,2,11/13/2021,4,5,LOT603_IP_2022-07-13_5,2/20/2022,SP603,2022-12-09T01:29:22,,FALSE
6/19/2022,IP604,potato,9122,H604,9,11/7/2021,46,64,LOT604_IP_2022-06-19_64,2/17/2022,SP604,2022-12-01T09:39:17,,FALSE
10/20/2021,IP605,Tomatoes,4106,H605,5,11/4/2021,21,29,LOT605_IP_2021-10-20_29,2/16/2022,SP605,2022-11-28T02:21:12,,FALSE
12/21/2021,IP606,spinach,966,H606,2,11/28/2021,5,7,LOT606_IP_2021-12-21_7,2/28/2022,SP606,2022-12-27T20:03:54,,FALSE
9/17/2022,IP607,basil,6706,H607,7,8/24/2021,34,47,LOT607_IP_2022-09-17_47,1/11/2022,SP607,2022-08-31T22:27:02,,FALSE
1/9/2023,IP608,parsley,8462,H608,9,8/8/2021,42,59,LOT608_IP_2023-01-09_59,1/3/2022,SP608,2022-08-12T02:38:33,,TRUE
12/25/2022,IP609,potato,8648,H609,9,11/6/2021,43,61,LOT609_IP_2022-12-25_61,2/17/2022,SP609,2022-12-01T06:03,,FALSE
3/19/2022,IP610,basil,6986,H610,7,9/26/2021,35,49,LOT610_IP_2022-03-19_49,1/28/2022,SP610,2022-10-11T08:05:21,,FALSE
1/2/2023,IP611,potato,8713,H611,9,9/22/2021,44,61,LOT611_IP_2023-01-02_61,1/25/2022,SP611,2022-10-06T01:55:40,,FALSE
1/28/2022,IP612,chili peppers,6395,H612,7,11/23/2021,32,45,LOT612_IP_2022-01-28_45,2/25/2022,SP612,2022-12-21T01:51:28,,FALSE
12/21/2022,IP613,kale,1936,H613,3,11/21/2021,10,14,LOT613_IP_2022-12-21_14,2/24/2022,SP613,2022-12-19T17:24:59,,FALSE
4/21/2022,IP614,Cucumbers,4691,H614,5,9/28/2021,24,33,LOT614_IP_2022-04-21_33,1/29/2022,SP614,2022-10-13T21:22:02,,FALSE
1/12/2022,IP615,spinach,851,H615,2,11/19/2021,5,6,LOT615_IP_2022-01-12_6,2/23/2022,SP615,2022-12-16T02:54:21,,FALSE
8/15/2022,IP616,melons,3039,H616,4,9/18/2021,16,21,LOT616_IP_2022-08-15_21,1/24/2022,SP616,2022-10-01T17:23:40,,FALSE
4/20/2022,IP617,chili peppers,6120,H617,6,8/7/2021,31,43,LOT617_IP_2022-04-20_43,1/3/2022,SP617,2022-08-11T01:24:37,,FALSE
1/15/2023,IP618,spinach,1293,H618,2,8/29/2021,7,9,LOT618_IP_2023-01-15_9,1/14/2022,SP618,2022-09-07T05:50:38,,FALSE
10/2/2022,IP619,basil,6729,H619,7,11/16/2021,34,47,LOT619_IP_2022-10-02_47,2/21/2022,SP619,2022-12-12T12:23:43,,FALSE
2/27/2023,IP620,kale,2178,H620,3,11/9/2021,11,15,LOT620_IP_2023-02-27_15,2/18/2022,SP620,2022-12-04T20:33:38,,FALSE
5/29/2022,IP621,lettuce,108,H621,1,11/9/2021,1,1,LOT621_IP_2022-05-29_1,2/18/2022,SP621,2022-12-03T22:55:58,,FALSE
6/7/2022,IP622,potato,8786,H622,9,9/2/2021,44,62,LOT622_IP_2022-06-07_62,1/16/2022,SP622,2022-09-11T17:58:55,,FALSE
2/1/2022,IP623,cilantro,7583,H623,8,11/2/2021,38,53,LOT623_IP_2022-02-01_53,2/15/2022,SP623,2022-11-25T13:04:30,,TRUE
5/28/2022,IP624,melons,3589,H624,4,9/15/2021,18,25,LOT624_IP_2022-05-28_25,1/22/2022,SP624,2022-09-28T06:29:18,,FALSE
7/29/2022,IP625,bell peppers,5720,H625,6,10/17/2021,29,40,LOT625_IP_2022-07-29_40,2/7/2022,SP625,2022-11-06T04:04:52,,FALSE
6/16/2022,IP626,kale,2150,H626,3,10/31/2021,11,15,LOT626_IP_2022-06-16_15,2/14/2022,SP626,2022-11-23T07:00:22,,FALSE
1/22/2022,IP627,Tomatoes,4015,H627,5,9/18/2021,20,28,LOT627_IP_2022-01-22_28,1/24/2022,SP627,2022-10-01T06:34:50,,FALSE
4/21/2022,IP628,basil,6540,H628,7,9/12/2021,33,46,LOT628_IP_2022-04-21_46,1/21/2022,SP628,2022-09-24T05:09:51,,FALSE
2/27/2023,IP629,kale,1710,H629,2,9/12/2021,9,12,LOT629_IP_2023-02-27_12,1/21/2022,SP629,2022-09-24T08:46:07,,FALSE
1/31/2023,IP630,spinach,1477,H630,2,10/18/2021,8,11,LOT630_IP_2023-01-31_11,2/7/2022,SP630,2022-11-07T08:55:04,,FALSE
2/9/2022,IP631,potato,8675,H631,9,8/17/2021,43,61,LOT631_IP_2022-02-09_61,1/8/2022,SP631,2022-08-23T01:46:44,,FALSE
11/4/2022,IP632,lettuce,559,H632,1,10/7/2021,3,4,LOT632_IP_2022-11-04_4,2/2/2022,SP632,2022-10-25T07:19:02,,FALSE
10/31/2021,IP633,kale,2026,H633,3,8/6/2021,11,14,LOT633_IP_2021-10-31_14,1/2/2022,SP633,2022-08-08T22:56:45,,FALSE
1/10/2022,IP634,potato,9207,H634,9,11/12/2021,46,64,LOT634_IP_2022-01-10_64,2/20/2022,SP634,2022-12-07T20:39:09,,FALSE
4/24/2022,IP635,potato,9128,H635,9,10/19/2021,46,64,LOT635_IP_2022-04-24_64,2/8/2022,SP635,2022-11-07T23:20:11,,FALSE
9/9/2022,IP636,sweet potato,9948,H636,10,8/9/2021,50,70,LOT636_IP_2022-09-09_70,1/4/2022,SP636,2022-08-13T11:05:03,,TRUE
8/17/2021,IP637,arugula,2477,H637,3,8/26/2021,13,18,LOT637_IP_2021-08-17_18,1/12/2022,SP637,2022-09-03T11:43:43,,TRUE
10/27/2022,IP638,parsley,8488,H638,9,10/15/2021,43,59,LOT638_IP_2022-10-27_59,2/6/2022,SP638,2022-11-03T18:24:27,,FALSE
6/24/2022,IP639,lettuce,465,H639,1,11/23/2021,3,4,LOT639_IP_2022-06-24_4,2/25/2022,SP639,2022-12-21T09:04:01,,TRUE
7/2/2022,IP640,spinach,1485,H640,2,10/13/2021,8,11,LOT640_IP_2022-07-02_11,2/5/2022,SP640,2022-11-01T15:56:35,,FALSE
5/5/2022,IP641,cilantro,7746,H641,8,10/24/2021,39,54,LOT641_IP_2022-05-05_54,2/11/2022,SP641,2022-11-15T04:21:26,,TRUE
12/5/2021,IP642,Cucumbers,4548,H642,5,10/30/2021,23,32,LOT642_IP_2021-12-05_32,2/13/2022,SP642,2022-11-22T02:10:09,,FALSE
8/26/2022,IP643,basil,6507,H643,7,11/27/2021,33,46,LOT643_IP_2022-08-26_46,2/27/2022,SP643,2022-12-26T18:49:58,,FALSE
11/25/2022,IP644,potato,8683,H644,9,11/3/2021,43,61,LOT644_IP_2022-11-25_61,2/15/2022,SP644,2022-11-27T11:56:06,,FALSE
10/9/2022,IP645,potato,8674,H645,9,8/20/2021,43,61,LOT645_IP_2022-10-09_61,1/9/2022,SP645,2022-08-26T16:17:21,,TRUE
6/8/2022,IP646,sweet potato,9519,H646,10,8/19/2021,48,67,LOT646_IP_2022-06-08_67,1/9/2022,SP646,2022-08-25T04:14:36,,FALSE
11/25/2021,IP647,arugula,2541,H647,3,11/6/2021,13,18,LOT647_IP_2021-11-25_18,2/17/2022,SP647,2022-11-30T15:37:54,,FALSE
4/10/2022,IP648,arugula,2773,H648,3,8/31/2021,14,20,LOT648_IP_2022-04-10_20,1/15/2022,SP648,2022-09-09T08:18:30,,FALSE
9/25/2021,IP649,melons,3524,H649,4,11/18/2021,18,25,LOT649_IP_2021-09-25_25,2/23/2022,SP649,2022-12-15T12:29:15,,FALSE
12/31/2022,IP650,kale,1578,H650,2,9/24/2021,8,11,LOT650_IP_2022-12-31_11,1/27/2022,SP650,2022-10-09T05:37:29,,FALSE
8/15/2021,IP651,sweet potato,9517,H651,10,11/27/2021,48,67,LOT651_IP_2021-08-15_67,2/27/2022,SP651,2022-12-26T11:37:25,,FALSE
2/21/2023,IP652,parsley,8355,H652,9,9/22/2021,42,59,LOT652_IP_2023-02-21_59,1/26/2022,SP652,2022-10-06T09:08:14,,FALSE
1/2/2023,IP653,chili peppers,6104,H653,6,10/4/2021,31,43,LOT653_IP_2023-01-02_43,1/31/2022,SP653,2022-10-20T15:34:28,,FALSE
11/7/2021,IP654,Tomatoes,3971,H654,5,8/23/2021,20,28,LOT654_IP_2021-11-07_28,1/11/2022,SP654,2022-08-30T21:13:06,,FALSE
1/26/2022,IP655,melons,3132,H655,4,8/1/2021,16,22,LOT655_IP_2022-01-26_22,12/31/2021,SP655,2022-08-03T16:47:05,,TRUE
11/19/2021,IP656,parsley,7905,H656,8,11/20/2021,40,55,LOT656_IP_2021-11-19_55,2/23/2022,SP656,2022-12-17T11:20:50,,TRUE
10/17/2022,IP657,arugula,2608,H657,3,8/18/2021,13,18,LOT657_IP_2022-10-17_18,1/8/2022,SP657,2022-08-23T19:48:06,,FALSE
11/4/2021,IP658,Tomatoes,3644,H658,4,10/19/2021,19,26,LOT658_IP_2021-11-04_26,2/8/2022,SP658,2022-11-08T20:57:50,,FALSE
8/14/2022,IP659,cilantro,7593,H659,8,8/3/2021,38,53,LOT659_IP_2022-08-14_53,1/1/2022,SP659,2022-08-06T06:03:47,,FALSE
10/10/2021,IP660,basil,6647,H660,7,8/16/2021,33,47,LOT660_IP_2021-10-10_47,1/7/2022,SP660,2022-08-21T17:20:14,,FALSE
10/24/2021,IP661,parsley,7887,H661,8,8/17/2021,40,55,LOT661_IP_2021-10-24_55,1/8/2022,SP661,2022-08-23T05:23,,FALSE
8/31/2021,IP662,cilantro,7367,H662,8,10/30/2021,37,52,LOT662_IP_2021-08-31_52,2/13/2022,SP662,2022-11-21T15:21:19,,FALSE
9/17/2022,IP663,kale,1647,H663,2,11/14/2021,9,12,LOT663_IP_2022-09-17_12,2/21/2022,SP663,2022-12-10T17:08:24,,FALSE
3/7/2022,IP664,lettuce,373,H664,1,11/12/2021,2,3,LOT664_IP_2022-03-07_3,2/20/2022,SP664,2022-12-08T14:40:32,,FALSE
10/31/2022,IP665,cilantro,7850,H665,8,11/12/2021,39,55,LOT665_IP_2022-10-31_55,2/20/2022,SP665,2022-12-08T03:51:43,,FALSE
5/7/2022,IP666,basil,6520,H666,7,9/12/2021,33,46,LOT666_IP_2022-05-07_46,1/21/2022,SP666,2022-09-23T18:21:01,,FALSE
2/19/2023,IP667,Tomatoes,3831,H667,4,8/13/2021,19,27,LOT667_IP_2023-02-19_27,1/6/2022,SP667,2022-08-18T02:49:37,,FALSE
10/15/2021,IP668,parsley,8384,H668,9,10/10/2021,42,59,LOT668_IP_2021-10-15_59,2/4/2022,SP668,2022-10-28T21:49:40,,FALSE
9/5/2022,IP669,Tomatoes,4242,H669,5,11/16/2021,22,30,LOT669_IP_2022-09-05_30,2/22/2022,SP669,2022-12-13T10:01:23,,FALSE
6/8/2022,IP670,sweet potato,9920,H670,10,10/8/2021,50,69,LOT670_IP_2022-06-08_69,2/3/2022,SP670,2022-10-26T08:32:58,,TRUE
5/5/2022,IP671,Cucumbers,4387,H671,5,9/18/2021,22,31,LOT671_IP_2022-05-05_31,1/24/2022,SP671,2022-10-02T00:36:13,,FALSE
10/4/2021,IP672,sweet potato,9820,H672,10,10/26/2021,49,69,LOT672_IP_2021-10-04_69,2/11/2022,SP672,2022-11-17T10:25:35,,TRUE
3/6/2022,IP673,cilantro,7220,H673,7,8/14/2021,36,51,LOT673_IP_2022-03-06_51,1/7/2022,SP673,2022-08-19T22:04:55,,FALSE
8/22/2022,IP674,melons,3210,H674,4,11/22/2021,16,23,LOT674_IP_2022-08-22_23,2/25/2022,SP674,2022-12-20T15:02:38,,FALSE
9/13/2022,IP675,bell peppers,5227,H675,6,11/28/2021,26,37,LOT675_IP_2022-09-13_37,2/28/2022,SP675,2022-12-28T06:52:44,,FALSE
1/27/2023,IP676,sweet potato,9692,H676,10,8/3/2021,48,68,LOT676_IP_2023-01-27_68,1/1/2022,SP676,2022-08-06T09:40:04,,FALSE
11/12/2021,IP677,chili peppers,6278,H677,7,9/5/2021,32,44,LOT677_IP_2021-11-12_44,1/17/2022,SP677,2022-09-15T04:53:16,,FALSE
8/15/2021,IP678,lettuce,460,H678,1,8/18/2021,3,4,LOT678_IP_2021-08-15_4,1/8/2022,SP678,2022-08-24T10:13:13,,FALSE
5/17/2022,IP679,lettuce,240,H679,1,11/2/2021,2,2,LOT679_IP_2022-05-17_2,2/15/2022,SP679,2022-11-25T23:53:20,,FALSE
12/1/2021,IP680,chili peppers,6459,H680,7,9/24/2021,32,45,LOT680_IP_2021-12-01_45,1/26/2022,SP680,2022-10-08T07:59:49,,FALSE
10/24/2021,IP681,parsley,8070,H681,8,11/30/2021,40,57,LOT681_IP_2021-10-24_57,2/28/2022,SP681,2022-12-30T02:08:03,,FALSE
3/14/2022,IP682,spinach,1445,H682,2,9/4/2021,8,10,LOT682_IP_2022-03-14_10,1/17/2022,SP682,2022-09-13T16:50:31,,FALSE
1/6/2022,IP683,parsley,8463,H683,9,10/14/2021,42,59,LOT683_IP_2022-01-06_59,2/5/2022,SP683,2022-11-02T06:21:41,,FALSE
11/20/2022,IP684,sweet potato,9302,H684,9,10/21/2021,47,65,LOT684_IP_2022-11-20_65,2/9/2022,SP684,2022-11-10T12:36:53,,FALSE
4/1/2022,IP685,kale,2079,H685,3,8/8/2021,11,15,LOT685_IP_2022-04-01_15,1/3/2022,SP685,2022-08-11T23:02:17,,TRUE
8/17/2022,IP686,melons,3004,H686,4,9/3/2021,15,21,LOT686_IP_2022-08-17_21,1/16/2022,SP686,2022-09-13T06:01:41,,FALSE
2/19/2022,IP687,Cucumbers,5022,H687,5,10/25/2021,25,35,LOT687_IP_2022-02-19_35,2/11/2022,SP687,2022-11-16T12:47:56,,FALSE
10/19/2021,IP688,Cucumbers,4792,H688,5,10/23/2021,24,34,LOT688_IP_2021-10-19_34,2/10/2022,SP688,2022-11-12T22:17:18,,FALSE
8/14/2022,IP689,Tomatoes,3878,H689,4,8/1/2021,20,27,LOT689_IP_2022-08-14_27,12/31/2021,SP689,2022-08-03T13:10:49,,TRUE
8/28/2022,IP690,cilantro,7372,H690,8,10/29/2021,37,52,LOT690_IP_2022-08-28_52,2/13/2022,SP690,2022-11-20T14:07:23,,FALSE
8/25/2021,IP691,basil,6796,H691,7,8/20/2021,34,48,LOT691_IP_2021-08-25_48,1/9/2022,SP691,2022-08-26T09:04:48,,FALSE
10/29/2022,IP692,parsley,8516,H692,9,8/31/2021,43,60,LOT692_IP_2022-10-29_60,1/15/2022,SP692,2022-09-08T17:53:24,,FALSE
1/11/2023,IP693,arugula,2228,H693,3,11/2/2021,12,16,LOT693_IP_2023-01-11_16,2/15/2022,SP693,2022-11-25T09:28:14,,FALSE
12/26/2022,IP694,chili peppers,6448,H694,7,11/2/2021,32,45,LOT694_IP_2022-12-26_45,2/15/2022,SP694,2022-11-25T16:40:47,,FALSE
6/9/2022,IP695,parsley,8219,H695,8,8/21/2021,41,58,LOT695_IP_2022-06-09_58,1/10/2022,SP695,2022-08-28T04:20:07,,FALSE
8/30/2022,IP696,cilantro,7740,H696,8,11/18/2021,39,54,LOT696_IP_2022-08-30_54,2/22/2022,SP696,2022-12-15T01:40:25,,FALSE
9/12/2022,IP697,cilantro,7339,H697,8,11/3/2021,37,51,LOT697_IP_2022-09-12_51,2/15/2022,SP697,2022-11-26T17:54:43,,TRUE
10/11/2021,IP698,lettuce,681,H698,2,10/16/2021,4,5,LOT698_IP_2021-10-11_5,2/6/2022,SP698,2022-11-04T12:25:49,,FALSE
4/3/2022,IP699,basil,6482,H699,7,9/13/2021,33,45,LOT699_IP_2022-04-03_45,1/21/2022,SP699,2022-09-25T06:23:47,,FALSE
10/8/2022,IP700,melons,3430,H700,4,9/2/2021,17,24,LOT700_IP_2022-10-08_24,1/16/2022,SP700,2022-09-11T07:10:05,,FALSE
1/18/2022,IP701,parsley,7917,H701,8,11/9/2021,40,55,LOT701_IP_2022-01-18_55,2/18/2022,SP701,2022-12-04T09:44:48,,FALSE
12/30/2022,IP702,basil,6908,H702,7,10/14/2021,35,48,LOT702_IP_2022-12-30_48,2/6/2022,SP702,2022-11-03T00:23:04,,FALSE
8/7/2022,IP703,Cucumbers,4852,H703,5,11/11/2021,25,34,LOT703_IP_2022-08-07_34,2/19/2022,SP703,2022-12-06T23:01:30,,FALSE
1/26/2023,IP704,potato,8884,H704,9,9/11/2021,44,62,LOT704_IP_2023-01-26_62,1/20/2022,SP704,2022-09-22T06:18:15,,FALSE
9/2/2022,IP705,potato,8912,H705,9,10/24/2021,45,62,LOT705_IP_2022-09-02_62,2/10/2022,SP705,2022-11-15T00:45:10,,FALSE
7/1/2022,IP706,parsley,8090,H706,8,11/23/2021,41,57,LOT706_IP_2022-07-01_57,2/25/2022,SP706,2022-12-21T23:29:08,,FALSE
8/9/2022,IP707,Tomatoes,4061,H707,5,9/27/2021,21,29,LOT707_IP_2022-08-09_29,1/28/2022,SP707,2022-10-12T23:44:23,,FALSE
9/16/2021,IP708,bell peppers,5186,H708,6,9/2/2021,26,36,LOT708_IP_2021-09-16_36,1/16/2022,SP708,2022-09-11T21:35:12,,FALSE
10/23/2022,IP709,Cucumbers,4533,H709,5,8/19/2021,23,32,LOT709_IP_2022-10-23_32,1/9/2022,SP709,2022-08-25T22:15:58,,TRUE
10/8/2022,IP710,parsley,8532,H710,9,8/14/2021,43,60,LOT710_IP_2022-10-08_60,1/6/2022,SP710,2022-08-19T07:39:49,,FALSE
8/16/2022,IP711,lettuce,672,H711,2,8/5/2021,4,5,LOT711_IP_2022-08-16_5,1/2/2022,SP711,2022-08-08T19:20:29,,FALSE
5/21/2022,IP712,bell peppers,5644,H712,6,10/8/2021,28,40,LOT712_IP_2022-05-21_40,2/3/2022,SP712,2022-10-26T12:09:15,,FALSE
2/16/2023,IP713,sweet potato,9523,H713,10,11/26/2021,48,67,LOT713_IP_2023-02-16_67,2/27/2022,SP713,2022-12-25T10:23:29,,FALSE
2/13/2022,IP714,parsley,8405,H714,9,9/15/2021,42,59,LOT714_IP_2022-02-13_59,1/22/2022,SP714,2022-09-27T19:40:29,,FALSE
11/9/2021,IP715,basil,6970,H715,7,11/19/2021,35,49,LOT715_IP_2021-11-09_49,2/23/2022,SP715,2022-12-16T13:43:11,,FALSE
11/19/2021,IP716,cilantro,7710,H716,8,9/10/2021,39,54,LOT716_IP_2021-11-19_54,1/20/2022,SP716,2022-09-21T23:05:42,,TRUE
8/21/2021,IP717,basil,6911,H717,7,11/3/2021,35,48,LOT717_IP_2021-08-21_48,2/15/2022,SP717,2022-11-26T10:42:10,,FALSE
1/23/2023,IP718,potato,9271,H718,9,9/7/2021,46,65,LOT718_IP_2023-01-23_65,1/18/2022,SP718,2022-09-17T07:21:08,,TRUE
1/29/2023,IP719,lettuce,143,H719,1,11/2/2021,1,1,LOT719_IP_2023-01-29_1,2/15/2022,SP719,2022-11-26T03:29:37,,FALSE
9/22/2022,IP720,parsley,8466,H720,9,11/17/2021,42,59,LOT720_IP_2022-09-22_59,2/22/2022,SP720,2022-12-14T07:39:02,,FALSE
9/24/2022,IP721,spinach,1379,H721,2,8/8/2021,7,10,LOT721_IP_2022-09-24_10,1/3/2022,SP721,2022-08-11T19:26,,FALSE
8/1/2021,IP722,potato,8718,H722,9,8/15/2021,44,61,LOT722_IP_2021-08-01_61,1/7/2022,SP722,2022-08-20T08:53:45,,FALSE
1/5/2023,IP723,Tomatoes,4274,H723,5,9/19/2021,22,30,LOT723_IP_2023-01-05_30,1/24/2022,SP723,2022-10-02T07:48:46,,FALSE
3/11/2022,IP724,melons,3034,H724,4,8/21/2021,16,21,LOT724_IP_2022-03-11_21,1/10/2022,SP724,2022-08-28T00:43:51,,FALSE
8/3/2021,IP725,basil,6706,H725,7,8/17/2021,34,47,LOT725_IP_2021-08-03_47,1/8/2022,SP725,2022-08-22T14:57:54,,FALSE
5/21/2022,IP726,lettuce,577,H726,1,9/23/2021,3,4,LOT726_IP_2022-05-21_4,1/26/2022,SP726,2022-10-06T23:33:20,,FALSE
2/24/2022,IP727,potato,8988,H727,9,10/24/2021,45,63,LOT727_IP_2022-02-24_63,2/10/2022,SP727,2022-11-14T13:56:20,,FALSE
8/25/2022,IP728,Tomatoes,3795,H728,4,9/16/2021,19,27,LOT728_IP_2022-08-25_27,1/23/2022,SP728,2022-09-29T07:43:15,,FALSE
2/1/2023,IP729,spinach,1056,H729,2,9/21/2021,6,8,LOT729_IP_2023-02-01_8,1/25/2022,SP729,2022-10-04T13:52:55,,FALSE
8/25/2021,IP730,lettuce,214,H730,1,8/20/2021,2,2,LOT730_IP_2021-08-25_2,1/9/2022,SP730,2022-08-26T12:41:05,,FALSE
12/13/2021,IP731,Cucumbers,4619,H731,5,8/29/2021,23,32,LOT731_IP_2021-12-13_32,1/14/2022,SP731,2022-09-06T08:12:58,,FALSE
8/8/2021,IP732,parsley,8226,H732,8,11/5/2021,41,58,LOT732_IP_2021-08-08_58,2/16/2022,SP732,2022-11-29T03:35:08,,TRUE
6/5/2022,IP733,kale,1515,H733,2,8/28/2021,8,11,LOT733_IP_2022-06-05_11,1/13/2022,SP733,2022-09-05T17:47:52,,FALSE
8/24/2022,IP734,arugula,2560,H734,3,8/22/2021,13,18,LOT734_IP_2022-08-24_18,1/10/2022,SP734,2022-08-29T12:46:36,,TRUE
11/26/2022,IP735,chili peppers,6294,H735,7,10/31/2021,32,44,LOT735_IP_2022-11-26_44,2/14/2022,SP735,2022-11-23T03:24:05,,FALSE
2/11/2022,IP736,sweet potato,9343,H736,9,11/29/2021,47,65,LOT736_IP_2022-02-11_65,2/28/2022,SP736,2022-12-28T10:29,,TRUE
3/8/2022,IP737,Tomatoes,3857,H737,4,11/30/2021,20,27,LOT737_IP_2022-03-08_27,2/28/2022,SP737,2022-12-29T22:31:46,,FALSE
3/25/2022,IP738,sweet potato,9392,H738,9,11/21/2021,47,66,LOT738_IP_2022-03-25_66,2/24/2022,SP738,2022-12-19T13:48:42,,TRUE
3/15/2022,IP739,Tomatoes,3646,H739,4,9/12/2021,19,26,LOT739_IP_2022-03-15_26,1/21/2022,SP739,2022-09-24T12:22:24,,FALSE
12/24/2022,IP740,spinach,1082,H740,2,9/26/2021,6,8,LOT740_IP_2022-12-24_8,1/28/2022,SP740,2022-10-11T11:41:37,,FALSE
8/7/2021,IP741,lettuce,757,H741,2,8/16/2021,4,6,LOT741_IP_2021-08-07_6,1/8/2022,SP741,2022-08-22T04:09:04,,TRUE
12/27/2022,IP742,lettuce,236,H742,1,10/3/2021,2,2,LOT742_IP_2022-12-27_2,1/31/2022,SP742,2022-10-19T17:56:49,,FALSE
12/27/2021,IP743,kale,2097,H743,3,11/28/2021,11,15,LOT743_IP_2021-12-27_15,2/28/2022,SP743,2022-12-27T23:40:11,,FALSE
3/7/2022,IP744,chili peppers,6195,H744,7,11/6/2021,31,43,LOT744_IP_2022-03-07_43,2/17/2022,SP744,2022-12-01T02:26:44,,FALSE
1/11/2023,IP745,parsley,8156,H745,8,11/15/2021,41,57,LOT745_IP_2023-01-11_57,2/21/2022,SP745,2022-12-12T01:34:54,,FALSE
11/30/2021,IP746,cilantro,7623,H746,8,11/20/2021,38,53,LOT746_IP_2021-11-30_53,2/24/2022,SP746,2022-12-18T01:45:57,,FALSE
2/23/2023,IP747,melons,2944,H747,4,9/6/2021,15,21,LOT747_IP_2023-02-23_21,1/18/2022,SP747,2022-09-16T16:56:02,,FALSE
2/4/2022,IP748,spinach,824,H748,2,9/9/2021,5,6,LOT748_IP_2022-02-04_6,1/19/2022,SP748,2022-09-20T14:39:13,,FALSE
2/20/2023,IP749,Cucumbers,4789,H749,5,8/27/2021,24,34,LOT749_IP_2023-02-20_34,1/13/2022,SP749,2022-09-04T16:33:56,,FALSE
11/7/2021,IP750,bell peppers,5336,H750,6,9/16/2021,27,37,LOT750_IP_2021-11-07_37,1/23/2022,SP750,2022-09-29T11:19:31,,FALSE
12/9/2022,IP751,kale,1819,H751,3,8/6/2021,10,13,LOT751_IP_2022-12-09_13,1/3/2022,SP751,2022-08-09T16:58:08,,FALSE
11/12/2022,IP752,sweet potato,9986,H752,10,10/16/2021,50,70,LOT752_IP_2022-11-12_70,2/7/2022,SP752,2022-11-05T10:03:29,,TRUE
10/16/2021,IP753,melons,3480,H753,4,10/20/2021,18,25,LOT753_IP_2021-10-16_25,2/8/2022,SP753,2022-11-09T07:46:40,,FALSE
3/8/2022,IP754,potato,8708,H754,9,9/1/2021,44,61,LOT754_IP_2022-03-08_61,1/15/2022,SP754,2022-09-10T16:44:59,,FALSE
5/18/2022,IP755,basil,7095,H755,7,8/14/2021,36,50,LOT755_IP_2022-05-18_50,1/6/2022,SP755,2022-08-19T00:27:16,,FALSE
4/5/2022,IP756,cilantro,7847,H756,8,10/22/2021,39,55,LOT756_IP_2022-04-05_55,2/9/2022,SP756,2022-11-12T15:04:45,,FALSE
2/23/2022,IP757,bell peppers,5715,H757,6,9/18/2021,29,40,LOT757_IP_2022-02-23_40,1/23/2022,SP757,2022-09-30T19:46,,FALSE
1/31/2022,IP758,bell peppers,5353,H758,6,11/5/2021,27,38,LOT758_IP_2022-01-31_38,2/16/2022,SP758,2022-11-29T21:36:31,,FALSE
1/7/2022,IP759,parsley,8288,H759,8,10/20/2021,42,58,LOT759_IP_2022-01-07_58,2/9/2022,SP759,2022-11-10T05:24:19,,FALSE
9/17/2021,IP760,spinach,1378,H760,2,10/1/2021,7,10,LOT760_IP_2021-09-17_10,1/30/2022,SP760,2022-10-17T01:03:51,,FALSE
10/16/2021,IP761,basil,6673,H761,7,9/22/2021,34,47,LOT761_IP_2021-10-16_47,1/26/2022,SP761,2022-10-06T19:57:03,,TRUE
1/10/2023,IP762,melons,3501,H762,4,9/20/2021,18,25,LOT762_IP_2023-01-10_25,1/24/2022,SP762,2022-10-03T12:38:59,,FALSE
11/16/2021,IP763,basil,7065,H763,7,9/22/2021,35,50,LOT763_IP_2021-11-16_50,1/25/2022,SP763,2022-10-05T18:43:07,,TRUE
8/10/2021,IP764,Tomatoes,4079,H764,5,11/24/2021,21,29,LOT764_IP_2021-08-10_29,2/26/2022,SP764,2022-12-22T21:06:47,,FALSE
11/22/2022,IP765,spinach,1417,H765,2,9/16/2021,8,10,LOT765_IP_2022-11-22_10,1/22/2022,SP765,2022-09-28T13:41:52,,TRUE
8/12/2022,IP766,sweet potato,9469,H766,10,11/18/2021,47,66,LOT766_IP_2022-08-12_66,2/22/2022,SP766,2022-12-14T22:04:09,,FALSE
3/21/2022,IP767,basil,6494,H767,7,8/8/2021,33,46,LOT767_IP_2022-03-21_46,1/4/2022,SP767,2022-08-12T06:14:50,,FALSE
6/30/2022,IP768,arugula,2789,H768,3,8/4/2021,14,20,LOT768_IP_2022-06-30_20,1/1/2022,SP768,2022-08-06T13:16:20,,FALSE
11/17/2022,IP769,bell peppers,5277,H769,6,9/21/2021,27,37,LOT769_IP_2022-11-17_37,1/25/2022,SP769,2022-10-05T11:30:34,,FALSE
2/19/2022,IP770,basil,6816,H770,7,10/11/2021,34,48,LOT770_IP_2022-02-19_48,2/4/2022,SP770,2022-10-29T23:03:36,,FALSE
11/21/2021,IP771,lettuce,240,H771,1,10/22/2021,2,2,LOT771_IP_2021-11-21_2,2/10/2022,SP771,2022-11-12T18:41:01,,FALSE
1/1/2023,IP772,lettuce,262,H772,1,8/10/2021,2,2,LOT772_IP_2023-01-01_2,1/4/2022,SP772,2022-08-13T21:53:52,,FALSE
5/12/2022,IP773,basil,6922,H773,7,9/18/2021,35,49,LOT773_IP_2022-05-12_49,1/24/2022,SP773,2022-10-01T13:47:23,,FALSE
12/21/2021,IP774,cilantro,7469,H774,8,9/11/2021,37,52,LOT774_IP_2021-12-21_52,1/20/2022,SP774,2022-09-22T09:54:32,,FALSE
10/13/2021,IP775,cilantro,7354,H775,8,8/14/2021,37,52,LOT775_IP_2021-10-13_52,1/6/2022,SP775,2022-08-19T11:16:06,,FALSE
1/5/2023,IP776,basil,6768,H776,7,10/8/2021,34,47,LOT776_IP_2023-01-05_47,2/2/2022,SP776,2022-10-25T18:07:52,,FALSE
11/28/2021,IP777,chili peppers,6298,H777,7,11/8/2021,32,44,LOT777_IP_2021-11-28_44,2/18/2022,SP777,2022-12-03T08:30:52,,FALSE
9/13/2022,IP778,potato,9224,H778,9,11/30/2021,46,65,LOT778_IP_2022-09-13_65,3/1/2022,SP778,2022-12-30T16:33:09,,FALSE
10/6/2021,IP779,spinach,901,H779,2,10/20/2021,5,7,LOT779_IP_2021-10-06_7,2/8/2022,SP779,2022-11-09T04:10:23,,FALSE
2/21/2023,IP780,sweet potato,9964,H780,10,10/7/2021,50,70,LOT780_IP_2023-02-21_70,2/2/2022,SP780,2022-10-24T13:17:39,,FALSE
9/24/2021,IP781,lettuce,175,H781,1,9/24/2021,1,2,LOT781_IP_2021-09-24_2,1/27/2022,SP781,2022-10-09T02:01:12,,FALSE
8/6/2021,IP782,basil,6741,H782,7,10/12/2021,34,47,LOT782_IP_2021-08-06_47,2/4/2022,SP782,2022-10-31T03:53:49,,FALSE
12/30/2021,IP783,kale,1587,H783,2,11/29/2021,8,11,LOT783_IP_2021-12-30_11,2/28/2022,SP783,2022-12-28T14:05:17,,FALSE
6/4/2022,IP784,parsley,8317,H784,8,9/17/2021,42,58,LOT784_IP_2022-06-04_58,1/23/2022,SP784,2022-09-30T12:33:27,,FALSE
11/26/2022,IP785,Cucumbers,4951,H785,5,11/26/2021,25,35,LOT785_IP_2022-11-26_35,2/27/2022,SP785,2022-12-25T21:12:19,,FALSE
8/18/2021,IP786,Cucumbers,5013,H786,5,10/25/2021,25,35,LOT786_IP_2021-08-18_35,2/11/2022,SP786,2022-11-16T09:11:39,,FALSE
1/24/2022,IP787,cilantro,7291,H787,8,9/1/2021,37,51,LOT787_IP_2022-01-24_51,1/15/2022,SP787,2022-09-09T22:43:36,,TRUE
8/9/2021,IP788,spinach,976,H788,2,11/27/2021,5,7,LOT788_IP_2021-08-09_7,2/27/2022,SP788,2022-12-27T02:02:31,,FALSE
1/30/2022,IP789,potato,9077,H789,9,9/13/2021,45,64,LOT789_IP_2022-01-30_64,1/21/2022,SP789,2022-09-25T20:48:53,,FALSE
8/23/2021,IP790,parsley,8014,H790,8,9/12/2021,40,56,LOT790_IP_2021-08-23_56,1/21/2022,SP790,2022-09-23T21:57:18,,FALSE
5/19/2022,IP791,Tomatoes,3916,H791,4,9/8/2021,20,28,LOT791_IP_2022-05-19_28,1/19/2022,SP791,2022-09-19T13:25:17,,FALSE
10/24/2022,IP792,sweet potato,9899,H792,10,9/29/2021,49,69,LOT792_IP_2022-10-24_69,1/29/2022,SP792,2022-10-15T09:24:48,,FALSE
8/10/2022,IP793,cilantro,7203,H793,7,10/12/2021,36,51,LOT793_IP_2022-08-10_51,2/5/2022,SP793,2022-10-31T07:30:05,,FALSE
12/26/2021,IP794,arugula,2777,H794,3,10/29/2021,14,20,LOT794_IP_2021-12-26_20,2/13/2022,SP794,2022-11-20T21:19:56,,FALSE
10/28/2022,IP795,arugula,2830,H795,3,11/14/2021,15,20,LOT795_IP_2022-10-28_20,2/21/2022,SP795,2022-12-10T20:44:41,,FALSE
7/5/2022,IP796,chili peppers,5867,H796,6,10/14/2021,30,41,LOT796_IP_2022-07-05_41,2/5/2022,SP796,2022-11-01T23:09:08,,FALSE
8/3/2022,IP797,Cucumbers,4624,H797,5,9/10/2021,23,33,LOT797_IP_2022-08-03_33,1/20/2022,SP797,2022-09-21T12:16:53,,FALSE
9/28/2021,IP798,lettuce,796,H798,2,8/26/2021,4,6,LOT798_IP_2021-09-28_6,1/12/2022,SP798,2022-09-03T04:31:10,,FALSE
10/10/2022,IP799,Tomatoes,4059,H799,5,10/22/2021,21,29,LOT799_IP_2022-10-10_29,2/9/2022,SP799,2022-11-12T07:52:11,,FALSE
4/30/2022,IP800,potato,8891,H800,9,12/1/2021,45,62,LOT800_IP_2022-04-30_62,3/1/2022,SP800,2022-12-30T20:09:26,,FALSE
8/11/2021,IP801,Cucumbers,4856,H801,5,11/20/2021,25,34,LOT801_IP_2021-08-11_34,2/24/2022,SP801,2022-12-17T22:09:40,,FALSE
11/1/2021,IP802,basil,6747,H802,7,10/4/2021,34,47,LOT802_IP_2021-11-01_47,2/1/2022,SP802,2022-10-21T13:12:08,,TRUE
8/26/2021,IP803,kale,2164,H803,3,10/30/2021,11,15,LOT803_IP_2021-08-26_15,2/13/2022,SP803,2022-11-21T18:57:36,,FALSE
5/24/2022,IP804,kale,1780,H804,3,9/8/2021,9,13,LOT804_IP_2022-05-24_13,1/19/2022,SP804,2022-09-18T19:23:54,,FALSE
11/1/2022,IP805,sweet potato,9947,H805,10,10/17/2021,50,70,LOT805_IP_2022-11-01_70,2/7/2022,SP805,2022-11-06T11:17:25,,FALSE
4/13/2022,IP806,arugula,2503,H806,3,9/30/2021,13,18,LOT806_IP_2022-04-13_18,1/30/2022,SP806,2022-10-16T14:15:01,,TRUE
1/28/2023,IP807,sweet potato,9675,H807,10,8/30/2021,48,68,LOT807_IP_2023-01-28_68,1/14/2022,SP807,2022-09-07T23:52:01,,FALSE
5/14/2022,IP808,sweet potato,9455,H808,10,10/13/2021,47,66,LOT808_IP_2022-05-14_66,2/5/2022,SP808,2022-11-01T05:07:45,,FALSE
4/8/2022,IP809,arugula,2344,H809,3,9/26/2021,12,17,LOT809_IP_2022-04-08_17,1/28/2022,SP809,2022-10-11T04:29:04,,FALSE
3/19/2022,IP810,potato,8969,H810,9,11/15/2021,45,63,LOT810_IP_2022-03-19_63,2/21/2022,SP810,2022-12-11T03:57:14,,FALSE
12/31/2021,IP811,basil,6763,H811,7,10/10/2021,34,47,LOT811_IP_2021-12-31_47,2/3/2022,SP811,2022-10-28T11:00:50,,FALSE
4/25/2022,IP812,melons,3611,H812,4,8/30/2021,18,25,LOT812_IP_2022-04-25_25,1/14/2022,SP812,2022-09-08T03:28:17,,FALSE
4/24/2022,IP813,chili peppers,5942,H813,6,11/13/2021,30,42,LOT813_IP_2022-04-24_42,2/20/2022,SP813,2022-12-09T08:41:55,,FALSE
1/8/2023,IP814,sweet potato,9384,H814,9,10/11/2021,47,66,LOT814_IP_2023-01-08_66,2/4/2022,SP814,2022-10-30T02:39:53,,TRUE
7/14/2022,IP815,arugula,2659,H815,3,11/8/2021,14,19,LOT815_IP_2022-07-14_19,2/18/2022,SP815,2022-12-02T21:42:02,,FALSE
12/10/2021,IP816,Tomatoes,4261,H816,5,9/17/2021,22,30,LOT816_IP_2021-12-10_30,1/23/2022,SP816,2022-09-29T22:08:21,,FALSE
9/6/2021,IP817,potato,8824,H817,9,11/2/2021,44,62,LOT817_IP_2021-09-06_62,2/15/2022,SP817,2022-11-25T20:17:03,,FALSE
4/12/2022,IP818,bell peppers,5221,H818,6,10/2/2021,26,37,LOT818_IP_2022-04-12_37,1/31/2022,SP818,2022-10-18T16:42:53,,FALSE
11/29/2022,IP819,Cucumbers,4501,H819,5,11/5/2021,23,32,LOT819_IP_2022-11-29_32,2/16/2022,SP819,2022-11-29T14:23:58,,FALSE
6/28/2022,IP820,bell peppers,5400,H820,6,11/4/2021,27,38,LOT820_IP_2022-06-28_38,2/16/2022,SP820,2022-11-28T09:33:45,,FALSE
1/12/2023,IP821,potato,8626,H821,9,11/17/2021,43,60,LOT821_IP_2023-01-12_60,2/22/2022,SP821,2022-12-13T20:50:13,,FALSE
10/21/2022,IP822,basil,7008,H822,7,8/13/2021,35,49,LOT822_IP_2022-10-21_49,1/6/2022,SP822,2022-08-18T10:02:10,,TRUE
8/26/2021,IP823,potato,8838,H823,9,10/10/2021,44,62,LOT823_IP_2021-08-26_62,2/4/2022,SP823,2022-10-28T18:13:24,,FALSE
8/3/2022,IP824,arugula,2663,H824,3,11/23/2021,14,19,LOT824_IP_2022-08-03_19,2/25/2022,SP824,2022-12-21T16:16:35,,TRUE
12/19/2022,IP825,lettuce,697,H825,2,9/7/2021,4,5,LOT825_IP_2022-12-19_5,1/18/2022,SP825,2022-09-18T12:11:21,,FALSE
4/5/2022,IP826,lettuce,497,H826,1,8/10/2021,3,4,LOT826_IP_2022-04-05_4,1/4/2022,SP826,2022-08-14T08:42:42,,FALSE
5/27/2022,IP827,kale,1686,H827,2,10/2/2021,9,12,LOT827_IP_2022-05-27_12,1/31/2022,SP827,2022-10-18T20:19:09,,FALSE
10/15/2021,IP828,spinach,1217,H828,2,11/8/2021,7,9,LOT828_IP_2021-10-15_9,2/18/2022,SP828,2022-12-03T01:18:19,,FALSE
12/12/2022,IP829,arugula,2882,H829,4,9/8/2021,15,20,LOT829_IP_2022-12-12_20,1/19/2022,SP829,2022-09-19T02:36:27,,FALSE
8/8/2022,IP830,arugula,2442,H830,3,11/26/2021,13,17,LOT830_IP_2022-08-08_17,2/26/2022,SP830,2022-12-25T03:10:56,,FALSE
2/26/2023,IP831,parsley,8370,H831,9,10/7/2021,42,59,LOT831_IP_2023-02-26_59,2/2/2022,SP831,2022-10-25T03:42:46,,TRUE
10/4/2021,IP832,chili peppers,6217,H832,7,8/11/2021,31,44,LOT832_IP_2021-10-04_44,1/5/2022,SP832,2022-08-16T00:21:44,,TRUE
11/8/2022,IP833,lettuce,784,H833,2,8/26/2021,4,6,LOT833_IP_2022-11-08_6,1/12/2022,SP833,2022-09-03T08:07:27,,TRUE
8/6/2022,IP834,kale,2113,H834,3,10/31/2021,11,15,LOT834_IP_2022-08-06_15,2/14/2022,SP834,2022-11-22T23:47:48,,FALSE
10/13/2021,IP835,potato,9123,H835,9,8/8/2021,46,64,LOT835_IP_2021-10-13_64,1/3/2022,SP835,2022-08-11T12:13:27,,FALSE
11/18/2021,IP836,arugula,2528,H836,3,10/24/2021,13,18,LOT836_IP_2021-11-18_18,2/10/2022,SP836,2022-11-14T06:43:47,,FALSE
7/25/2022,IP837,Tomatoes,3767,H837,4,8/2/2021,19,27,LOT837_IP_2022-07-25_27,1/1/2022,SP837,2022-08-05T01:13:34,,FALSE
7/18/2022,IP838,melons,3147,H838,4,10/17/2021,16,22,LOT838_IP_2022-07-18_22,2/7/2022,SP838,2022-11-05T17:16:02,,FALSE
4/27/2022,IP839,lettuce,778,H839,2,9/30/2021,4,6,LOT839_IP_2022-04-27_6,1/29/2022,SP839,2022-10-15T20:13:38,,FALSE
10/14/2022,IP840,melons,3203,H840,4,8/4/2021,16,23,LOT840_IP_2022-10-14_23,1/2/2022,SP840,2022-08-07T03:41:26,,FALSE
1/11/2022,IP841,basil,7049,H841,7,8/15/2021,35,49,LOT841_IP_2022-01-11_49,1/7/2022,SP841,2022-08-20T12:30:02,,FALSE
12/23/2021,IP842,spinach,917,H842,2,11/25/2021,5,7,LOT842_IP_2021-12-23_7,2/26/2022,SP842,2022-12-23T15:08:10,,FALSE
11/25/2021,IP843,bell peppers,5317,H843,6,9/20/2021,27,37,LOT843_IP_2021-11-25_37,1/25/2022,SP843,2022-10-03T16:15:15,,FALSE
12/1/2021,IP844,spinach,1176,H844,2,10/19/2021,6,9,LOT844_IP_2021-12-01_9,2/8/2022,SP844,2022-11-08T06:32:44,,FALSE
7/31/2022,IP845,Tomatoes,4283,H845,5,11/17/2021,22,30,LOT845_IP_2022-07-31_30,2/22/2022,SP845,2022-12-14T00:26:29,,FALSE
12/22/2022,IP846,potato,8675,H846,9,11/15/2021,43,61,LOT846_IP_2022-12-22_61,2/21/2022,SP846,2022-12-11T07:33:31,,FALSE
9/20/2021,IP847,chili peppers,6363,H847,7,9/23/2021,32,45,LOT847_IP_2021-09-20_45,1/26/2022,SP847,2022-10-07T03:09:37,,FALSE
11/16/2022,IP848,basil,6779,H848,7,11/21/2021,34,48,LOT848_IP_2022-11-16_48,2/24/2022,SP848,2022-12-19T10:12:26,,FALSE
1/22/2022,IP849,spinach,1229,H849,2,11/12/2021,7,9,LOT849_IP_2022-01-22_9,2/20/2022,SP849,2022-12-08T11:04:16,,FALSE
6/7/2022,IP850,melons,2988,H850,4,8/31/2021,15,21,LOT850_IP_2022-06-07_21,1/15/2022,SP850,2022-09-09T04:42:13,,TRUE
1/2/2022,IP851,spinach,1372,H851,2,8/22/2021,7,10,LOT851_IP_2022-01-02_10,1/11/2022,SP851,2022-08-29T16:22:53,,FALSE
1/22/2023,IP852,cilantro,7813,H852,8,8/9/2021,39,55,LOT852_IP_2023-01-22_55,1/4/2022,SP852,2022-08-13T07:28:46,,FALSE
9/8/2021,IP853,basil,6559,H853,7,11/1/2021,33,46,LOT853_IP_2021-09-08_46,2/14/2022,SP853,2022-11-24T04:38:01,,FALSE
7/26/2022,IP854,Cucumbers,4538,H854,5,9/15/2021,23,32,LOT854_IP_2022-07-26_32,1/22/2022,SP854,2022-09-27T23:16:45,,FALSE
1/24/2022,IP855,chili peppers,6067,H855,6,10/17/2021,31,43,LOT855_IP_2022-01-24_43,2/7/2022,SP855,2022-11-05T13:39:46,,TRUE
1/11/2022,IP856,bell peppers,5480,H856,6,11/24/2021,28,38,LOT856_IP_2022-01-11_38,2/26/2022,SP856,2022-12-23T04:19:20,,FALSE
2/13/2022,IP857,arugula,2927,H857,4,11/7/2021,15,21,LOT857_IP_2022-02-13_21,2/17/2022,SP857,2022-12-02T00:04:23,,FALSE
3/9/2022,IP858,parsley,8378,H858,9,10/6/2021,42,59,LOT858_IP_2022-03-09_59,2/2/2022,SP858,2022-10-24T02:28:50,,TRUE
11/25/2022,IP859,parsley,7922,H859,8,9/30/2021,40,56,LOT859_IP_2022-11-25_56,1/29/2022,SP859,2022-10-15T16:37:21,,FALSE
1/18/2023,IP860,spinach,1061,H860,2,10/24/2021,6,8,LOT860_IP_2023-01-18_8,2/10/2022,SP860,2022-11-14T17:32:37,,FALSE
9/30/2021,IP861,potato,9183,H861,9,10/18/2021,46,64,LOT861_IP_2021-09-30_64,2/7/2022,SP861,2022-11-07T16:07:38,,TRUE
2/2/2023,IP862,sweet potato,9480,H862,10,10/17/2021,47,66,LOT862_IP_2023-02-02_66,2/7/2022,SP862,2022-11-06T14:53:42,,FALSE
10/22/2022,IP863,arugula,2501,H863,3,8/28/2021,13,18,LOT863_IP_2022-10-22_18,1/13/2022,SP863,2022-09-05T10:35:19,,FALSE
2/20/2023,IP864,Tomatoes,4139,H864,5,8/3/2021,21,29,LOT864_IP_2023-02-20_29,1/1/2022,SP864,2022-08-05T12:02:24,,FALSE
10/23/2021,IP865,parsley,8480,H865,9,11/5/2021,42,59,LOT865_IP_2021-10-23_59,2/16/2022,SP865,2022-11-30T01:12:47,,FALSE
4/16/2022,IP866,Tomatoes,4228,H866,5,8/25/2021,21,30,LOT866_IP_2022-04-16_30,1/12/2022,SP866,2022-09-01T20:04:41,,FALSE
2/3/2023,IP867,Tomatoes,3901,H867,4,9/6/2021,20,27,LOT867_IP_2023-02-03_27,1/17/2022,SP867,2022-09-16T02:30:56,,FALSE
10/25/2022,IP868,spinach,1388,H868,2,11/10/2021,7,10,LOT868_IP_2022-10-25_10,2/19/2022,SP868,2022-12-06T01:23:51,,TRUE
8/12/2021,IP869,Tomatoes,4077,H869,5,8/7/2021,21,29,LOT869_IP_2021-08-12_29,1/3/2022,SP869,2022-08-10T21:48:21,,FALSE
8/21/2021,IP870,kale,2178,H870,3,11/24/2021,11,15,LOT870_IP_2021-08-21_15,2/25/2022,SP870,2022-12-22T13:54:14,,FALSE
5/17/2022,IP871,spinach,1238,H871,2,10/27/2021,7,9,LOT871_IP_2022-05-17_9,2/12/2022,SP871,2022-11-18T15:15:48,,FALSE
12/30/2021,IP872,potato,9106,H872,9,11/11/2021,46,64,LOT872_IP_2021-12-30_64,2/19/2022,SP872,2022-12-06T08:36:24,,FALSE
5/4/2022,IP873,arugula,2889,H873,4,11/13/2021,15,20,LOT873_IP_2022-05-04_20,2/20/2022,SP873,2022-12-09T12:18:12,,FALSE
1/31/2023,IP874,arugula,2450,H874,3,9/19/2021,13,17,LOT874_IP_2023-01-31_17,1/24/2022,SP874,2022-10-02T15:01:19,,FALSE
1/14/2023,IP875,sweet potato,9456,H875,10,8/11/2021,47,66,LOT875_IP_2023-01-14_66,1/5/2022,SP875,2022-08-16T03:58:01,,TRUE
2/24/2023,IP876,spinach,1044,H876,2,8/6/2021,6,8,LOT876_IP_2023-02-24_8,1/3/2022,SP876,2022-08-09T20:34:25,,FALSE
6/19/2022,IP877,potato,9105,H877,9,10/21/2021,46,64,LOT877_IP_2022-06-19_64,2/9/2022,SP877,2022-11-11T13:50:49,,FALSE
5/25/2022,IP878,spinach,1357,H878,2,10/25/2021,7,10,LOT878_IP_2022-05-25_10,2/11/2022,SP878,2022-11-15T15:10:16,,TRUE
6/27/2022,IP879,spinach,1047,H879,2,9/21/2021,6,8,LOT879_IP_2022-06-27_8,1/25/2022,SP879,2022-10-05T15:06:51,,FALSE
12/11/2022,IP880,kale,2174,H880,3,10/21/2021,11,15,LOT880_IP_2022-12-11_15,2/9/2022,SP880,2022-11-11T06:38:15,,FALSE
6/3/2022,IP881,parsley,7898,H881,8,9/29/2021,40,55,LOT881_IP_2022-06-03_55,1/29/2022,SP881,2022-10-15T05:48:32,,FALSE
8/29/2022,IP882,chili peppers,6160,H882,7,11/2/2021,31,43,LOT882_IP_2022-08-29_43,2/15/2022,SP882,2022-11-25T05:51:57,,FALSE
11/12/2021,IP883,spinach,1444,H883,2,11/18/2021,8,10,LOT883_IP_2021-11-12_10,2/23/2022,SP883,2022-12-15T19:41:48,,TRUE
9/25/2022,IP884,parsley,8564,H884,9,11/19/2021,43,60,LOT884_IP_2022-09-25_60,2/23/2022,SP884,2022-12-16T06:30:38,,FALSE
8/27/2022,IP885,basil,6672,H885,7,9/28/2021,34,47,LOT885_IP_2022-08-27_47,1/28/2022,SP885,2022-10-13T14:09:29,,FALSE
9/28/2021,IP886,kale,1583,H886,2,8/23/2021,8,11,LOT886_IP_2021-09-28_11,1/11/2022,SP886,2022-08-29T23:35:26,,FALSE
12/12/2021,IP887,Cucumbers,5022,H887,5,11/4/2021,25,35,LOT887_IP_2021-12-12_35,2/16/2022,SP887,2022-11-28T20:22:35,,FALSE
1/18/2023,IP888,sweet potato,9546,H888,10,8/24/2021,48,67,LOT888_IP_2023-01-18_67,1/11/2022,SP888,2022-08-31T11:38:12,,FALSE
8/20/2022,IP889,melons,3039,H889,4,10/16/2021,16,21,LOT889_IP_2022-08-20_21,2/6/2022,SP889,2022-11-04T23:14:39,,FALSE
11/23/2021,IP890,sweet potato,9318,H890,9,8/22/2021,47,65,LOT890_IP_2021-11-23_65,1/10/2022,SP890,2022-08-28T15:08:57,,FALSE
2/27/2022,IP891,basil,6465,H891,7,9/27/2021,33,45,LOT891_IP_2022-02-27_45,1/28/2022,SP891,2022-10-11T22:30:27,,TRUE
2/21/2022,IP892,melons,3562,H892,4,9/1/2021,18,25,LOT892_IP_2022-02-21_25,1/15/2022,SP892,2022-09-10T02:19:53,,FALSE
10/12/2022,IP893,cilantro,7537,H893,8,10/19/2021,38,53,LOT893_IP_2022-10-12_53,2/8/2022,SP893,2022-11-08T02:56:27,,TRUE
5/9/2022,IP894,Tomatoes,4074,H894,5,8/8/2021,21,29,LOT894_IP_2022-05-09_29,1/4/2022,SP894,2022-08-12T09:51:07,,FALSE
4/20/2022,IP895,cilantro,7622,H895,8,8/11/2021,38,53,LOT895_IP_2022-04-20_53,1/5/2022,SP895,2022-08-15T06:20:22,,FALSE
8/11/2021,IP896,parsley,8308,H896,8,11/19/2021,42,58,LOT896_IP_2021-08-11_58,2/23/2022,SP896,2022-12-17T04:08:17,,FALSE
1/30/2023,IP897,Cucumbers,4488,H897,5,9/24/2021,23,32,LOT897_IP_2023-01-30_32,1/26/2022,SP897,2022-10-08T11:36:06,,FALSE
10/17/2021,IP898,cilantro,7796,H898,8,10/20/2021,39,55,LOT898_IP_2021-10-17_55,2/8/2022,SP898,2022-11-10T01:48:03,,FALSE
12/29/2022,IP899,chili peppers,5935,H899,6,8/11/2021,30,42,LOT899_IP_2022-12-29_42,1/5/2022,SP899,2022-08-15T09:56:38,,FALSE
6/20/2022,IP900,chili peppers,5853,H900,6,9/25/2021,29,41,LOT900_IP_2022-06-20_41,1/27/2022,SP900,2022-10-09T16:26:18,,FALSE
5/19/2022,IP901,chili peppers,6148,H901,6,8/26/2021,31,43,LOT901_IP_2022-05-19_43,1/12/2022,SP901,2022-09-03T15:20,,FALSE
12/11/2021,IP902,parsley,8152,H902,8,10/9/2021,41,57,LOT902_IP_2021-12-11_57,2/3/2022,SP902,2022-10-26T15:45:31,,TRUE
2/17/2023,IP903,Tomatoes,4223,H903,5,10/15/2021,21,30,LOT903_IP_2023-02-17_30,2/6/2022,SP903,2022-11-03T07:35:37,,FALSE
9/18/2021,IP904,sweet potato,9377,H904,9,11/15/2021,47,66,LOT904_IP_2021-09-18_66,2/21/2022,SP904,2022-12-12T08:47:27,,TRUE
1/4/2022,IP905,Cucumbers,4910,H905,5,11/20/2021,25,35,LOT905_IP_2022-01-04_35,2/24/2022,SP905,2022-12-18T08:58:30,,TRUE
10/1/2021,IP906,arugula,2578,H906,3,8/16/2021,13,18,LOT906_IP_2021-10-01_18,1/7/2022,SP906,2022-08-22T00:32:47,,FALSE
4/2/2022,IP907,melons,2996,H907,4,8/9/2021,15,21,LOT907_IP_2022-04-02_21,1/4/2022,SP907,2022-08-12T17:03:40,,FALSE
12/9/2021,IP908,lettuce,183,H908,1,9/5/2021,1,2,LOT908_IP_2021-12-09_2,1/17/2022,SP908,2022-09-15T22:54:39,,FALSE
9/12/2021,IP909,kale,2185,H909,3,8/22/2021,11,16,LOT909_IP_2021-09-12_16,1/10/2022,SP909,2022-08-29T05:34:03,,FALSE
2/8/2023,IP910,sweet potato,9614,H910,10,9/10/2021,48,67,LOT910_IP_2023-02-08_67,1/20/2022,SP910,2022-09-21T19:29:26,,FALSE
9/15/2022,IP911,melons,2969,H911,4,8/24/2021,15,21,LOT911_IP_2022-09-15_21,1/11/2022,SP911,2022-08-31T08:01:55,,FALSE
9/1/2022,IP912,Cucumbers,4955,H912,5,8/3/2021,25,35,LOT912_IP_2022-09-01_35,1/1/2022,SP912,2022-08-05T19:14:57,,FALSE
2/16/2022,IP913,Cucumbers,4655,H913,5,9/6/2021,24,33,LOT913_IP_2022-02-16_33,1/18/2022,SP913,2022-09-17T00:08:35,,FALSE
1/17/2023,IP914,parsley,7973,H914,8,10/6/2021,40,56,LOT914_IP_2023-01-17_56,2/1/2022,SP914,2022-10-23T12:03:43,,FALSE
2/25/2022,IP915,sweet potato,9510,H915,10,8/16/2021,48,67,LOT915_IP_2022-02-25_67,1/7/2022,SP915,2022-08-21T13:43:58,,FALSE
10/21/2022,IP916,Cucumbers,4763,H916,5,8/19/2021,24,34,LOT916_IP_2022-10-21_34,1/9/2022,SP916,2022-08-25T18:39:42,,TRUE
12/25/2021,IP917,parsley,8063,H917,8,10/24/2021,40,56,LOT917_IP_2021-12-25_56,2/10/2022,SP917,2022-11-14T21:08:53,,FALSE
2/28/2023,IP918,bell peppers,5296,H918,6,8/29/2021,27,37,LOT918_IP_2023-02-28_37,1/14/2022,SP918,2022-09-06T11:49:15,,FALSE
11/14/2022,IP919,spinach,1354,H919,2,11/12/2021,7,10,LOT919_IP_2022-11-14_10,2/20/2022,SP919,2022-12-08T00:15:26,,FALSE
8/23/2022,IP920,bell peppers,5602,H920,6,9/23/2021,28,39,LOT920_IP_2022-08-23_39,1/26/2022,SP920,2022-10-07T13:58:26,,TRUE
10/9/2021,IP921,spinach,876,H921,2,9/3/2021,5,6,LOT921_IP_2021-10-09_6,1/16/2022,SP921,2022-09-13T09:37:57,,FALSE
8/18/2021,IP922,spinach,988,H922,2,9/30/2021,5,7,LOT922_IP_2021-08-18_7,1/30/2022,SP922,2022-10-16T07:02:28,,FALSE
4/28/2022,IP923,spinach,986,H923,2,10/21/2021,5,7,LOT923_IP_2022-04-28_7,2/9/2022,SP923,2022-11-10T19:49:26,,FALSE
7/15/2022,IP924,lettuce,120,H924,1,11/7/2021,1,1,LOT924_IP_2022-07-15_1,2/17/2022,SP924,2022-12-02T03:40:40,,FALSE
6/16/2022,IP925,Tomatoes,4223,H925,5,10/1/2021,21,30,LOT925_IP_2022-06-16_30,1/30/2022,SP925,2022-10-17T19:05:13,,FALSE
2/9/2023,IP926,bell peppers,5571,H926,6,10/23/2021,28,39,LOT926_IP_2023-02-09_39,2/10/2022,SP926,2022-11-13T12:42:24,,FALSE
11/26/2021,IP927,spinach,1369,H927,2,9/6/2021,7,10,LOT927_IP_2021-11-26_10,1/18/2022,SP927,2022-09-17T03:44:52,,TRUE
10/27/2021,IP928,parsley,8402,H928,9,8/21/2021,42,59,LOT928_IP_2021-10-27_59,1/10/2022,SP928,2022-08-27T17:31:17,,TRUE
3/25/2022,IP929,kale,1551,H929,2,11/10/2021,8,11,LOT929_IP_2022-03-25_11,2/19/2022,SP929,2022-12-05T14:35:01,,TRUE
11/27/2021,IP930,parsley,7904,H930,8,9/19/2021,40,55,LOT930_IP_2021-11-27_55,1/24/2022,SP930,2022-10-02T11:25:03,,FALSE
8/17/2021,IP931,parsley,8554,H931,9,10/28/2021,43,60,LOT931_IP_2021-08-17_60,2/12/2022,SP931,2022-11-19T02:04:37,,TRUE
6/9/2022,IP932,kale,1522,H932,2,8/18/2021,8,11,LOT932_IP_2022-06-09_11,1/8/2022,SP932,2022-08-24T06:36:56,,FALSE
1/13/2022,IP933,Cucumbers,4525,H933,5,9/21/2021,23,32,LOT933_IP_2022-01-13_32,1/25/2022,SP933,2022-10-05T07:54:18,,FALSE
10/5/2022,IP934,sweet potato,9487,H934,10,10/29/2021,47,66,LOT934_IP_2022-10-05_66,2/13/2022,SP934,2022-11-21T00:56:13,,FALSE
9/8/2022,IP935,spinach,916,H935,2,10/1/2021,5,7,LOT935_IP_2022-09-08_7,1/30/2022,SP935,2022-10-17T15:28:57,,FALSE
6/29/2022,IP936,cilantro,7491,H936,8,9/23/2021,38,53,LOT936_IP_2022-06-29_53,1/26/2022,SP936,2022-10-08T00:47:16,,FALSE
7/19/2022,IP937,bell peppers,5232,H937,6,11/8/2021,26,37,LOT937_IP_2022-07-19_37,2/18/2022,SP937,2022-12-02T18:05:46,,FALSE
11/8/2022,IP938,kale,1826,H938,3,8/30/2021,10,13,LOT938_IP_2022-11-08_13,1/14/2022,SP938,2022-09-08T07:04:34,,FALSE
9/2/2021,IP939,Cucumbers,4757,H939,5,10/5/2021,24,33,LOT939_IP_2021-09-02_33,2/1/2022,SP939,2022-10-22T14:26:04,,FALSE
4/22/2022,IP940,chili peppers,6343,H940,7,10/26/2021,32,45,LOT940_IP_2022-04-22_45,2/12/2022,SP940,2022-11-17T17:38:08,,FALSE
5/10/2022,IP941,lettuce,511,H941,1,9/13/2021,3,4,LOT941_IP_2022-05-10_4,1/21/2022,SP941,2022-09-24T19:34:57,,FALSE
2/24/2022,IP942,potato,8644,H942,9,11/13/2021,43,61,LOT942_IP_2022-02-24_61,2/20/2022,SP942,2022-12-08T18:16:49,,FALSE
10/30/2022,IP943,lettuce,657,H943,2,11/3/2021,4,5,LOT943_IP_2022-10-30_5,2/15/2022,SP943,2022-11-27T04:43:33,,TRUE
10/1/2022,IP944,arugula,2277,H944,3,11/3/2021,12,16,LOT944_IP_2022-10-01_16,2/15/2022,SP944,2022-11-27T01:07:16,,FALSE
12/26/2021,IP945,parsley,8573,H945,9,10/31/2021,43,60,LOT945_IP_2021-12-26_60,2/14/2022,SP945,2022-11-23T14:12:55,,FALSE
9/10/2021,IP946,lettuce,327,H946,1,9/30/2021,2,3,LOT946_IP_2021-09-10_3,1/29/2022,SP946,2022-10-16T03:26:11,,FALSE
7/3/2022,IP947,Cucumbers,4742,H947,5,9/13/2021,24,33,LOT947_IP_2022-07-03_33,1/21/2022,SP947,2022-09-25T02:47:30,,FALSE
9/23/2022,IP948,bell peppers,5569,H948,6,10/10/2021,28,39,LOT948_IP_2022-09-23_39,2/4/2022,SP948,2022-10-29T01:25:57,,FALSE
1/21/2022,IP949,spinach,1314,H949,2,10/24/2021,7,9,LOT949_IP_2022-01-21_9,2/10/2022,SP949,2022-11-14T10:20:04,,TRUE
11/23/2022,IP950,potato,9173,H950,9,8/23/2021,46,64,LOT950_IP_2022-11-23_64,1/11/2022,SP950,2022-08-30T10:24:16,,FALSE
1/3/2023,IP951,parsley,8548,H951,9,11/30/2021,43,60,LOT951_IP_2023-01-03_60,3/1/2022,SP951,2022-12-30T12:56:53,,FALSE
11/30/2021,IP952,lettuce,763,H952,2,9/4/2021,4,6,LOT952_IP_2021-11-30_6,1/17/2022,SP952,2022-09-13T20:26:47,,FALSE
9/28/2022,IP953,cilantro,7189,H953,7,11/11/2021,36,50,LOT953_IP_2022-09-28_50,2/19/2022,SP953,2022-12-06T12:12:40,,FALSE
4/4/2022,IP954,arugula,2302,H954,3,8/23/2021,12,16,LOT954_IP_2022-04-04_16,1/11/2022,SP954,2022-08-30T03:11:43,,FALSE
11/3/2022,IP955,Cucumbers,4976,H955,5,10/16/2021,25,35,LOT955_IP_2022-11-03_35,2/7/2022,SP955,2022-11-05T06:27:12,,FALSE
8/7/2022,IP956,Tomatoes,3649,H956,4,10/20/2021,19,26,LOT956_IP_2022-08-07_26,2/9/2022,SP956,2022-11-10T09:00:36,,TRUE
8/4/2022,IP957,arugula,2316,H957,3,9/25/2021,12,16,LOT957_IP_2022-08-04_16,1/27/2022,SP957,2022-10-10T14:03:58,,FALSE
11/10/2022,IP958,Tomatoes,4261,H958,5,9/23/2021,22,30,LOT958_IP_2022-11-10_30,1/26/2022,SP958,2022-10-07T10:22:10,,TRUE
1/4/2023,IP959,basil,6994,H959,7,8/31/2021,35,49,LOT959_IP_2023-01-04_49,1/15/2022,SP959,2022-09-09T19:07:20,,FALSE
3/17/2022,IP960,parsley,7954,H960,8,10/25/2021,40,56,LOT960_IP_2022-03-17_56,2/11/2022,SP960,2022-11-15T07:57:43,,TRUE
10/12/2021,IP961,cilantro,7355,H961,8,10/20/2021,37,52,LOT961_IP_2021-10-12_52,2/8/2022,SP961,2022-11-09T18:35:30,,FALSE
8/30/2021,IP962,sweet potato,9578,H962,10,8/3/2021,48,67,LOT962_IP_2021-08-30_67,1/1/2022,SP962,2022-08-05T22:51:14,,FALSE
7/27/2022,IP963,cilantro,7805,H963,8,10/30/2021,39,55,LOT963_IP_2022-07-27_55,2/13/2022,SP963,2022-11-22T05:46:26,,FALSE
5/11/2022,IP964,melons,3277,H964,4,9/30/2021,17,23,LOT964_IP_2022-05-11_23,1/30/2022,SP964,2022-10-16T17:51:17,,FALSE
3/23/2022,IP965,bell peppers,5293,H965,6,8/17/2021,27,37,LOT965_IP_2022-03-23_37,1/8/2022,SP965,2022-08-22T11:21:37,,FALSE
10/23/2022,IP966,lettuce,418,H966,1,9/1/2021,3,3,LOT966_IP_2022-10-23_3,1/15/2022,SP966,2022-09-10T13:08:42,,FALSE
2/2/2023,IP967,parsley,8405,H967,9,11/17/2021,42,59,LOT967_IP_2023-02-02_59,2/22/2022,SP967,2022-12-14T18:27:52,,FALSE
1/24/2023,IP968,kale,1705,H968,2,8/17/2021,9,12,LOT968_IP_2023-01-24_12,1/8/2022,SP968,2022-08-22T22:10:27,,FALSE
8/24/2021,IP969,potato,9151,H969,9,10/31/2021,46,64,LOT969_IP_2021-08-24_64,2/14/2022,SP969,2022-11-23T21:25:28,,FALSE
5/12/2022,IP970,bell peppers,5081,H970,6,9/28/2021,26,36,LOT970_IP_2022-05-12_36,1/29/2022,SP970,2022-10-14T08:10:52,,FALSE
12/7/2021,IP971,chili peppers,6435,H971,7,8/16/2021,32,45,LOT971_IP_2021-12-07_45,1/7/2022,SP971,2022-08-21T06:31:25,,TRUE
10/3/2022,IP972,melons,3219,H972,4,8/15/2021,16,23,LOT972_IP_2022-10-03_23,1/7/2022,SP972,2022-08-20T16:06:18,,FALSE
12/26/2022,IP973,cilantro,7295,H973,8,8/19/2021,37,51,LOT973_IP_2022-12-26_51,1/9/2022,SP973,2022-08-26T01:52:15,,FALSE
7/26/2022,IP974,bell peppers,5212,H974,6,10/15/2021,26,37,LOT974_IP_2022-07-26_37,2/6/2022,SP974,2022-11-04T05:13:16,,FALSE
12/18/2021,IP975,lettuce,743,H975,2,9/4/2021,4,5,LOT975_IP_2021-12-18_5,1/17/2022,SP975,2022-09-14T03:39:20,,FALSE
10/8/2021,IP976,sweet potato,9751,H976,10,8/2/2021,49,68,LOT976_IP_2021-10-08_68,1/1/2022,SP976,2022-08-05T04:49:51,,TRUE
3/4/2022,IP977,melons,3307,H977,4,10/12/2021,17,23,LOT977_IP_2022-03-04_23,2/4/2022,SP977,2022-10-30T13:28:42,,FALSE
4/12/2022,IP978,sweet potato,9338,H978,9,11/16/2021,47,65,LOT978_IP_2022-04-12_65,2/22/2022,SP978,2022-12-13T06:25:06,,FALSE
11/13/2022,IP979,bell peppers,5407,H979,6,11/22/2021,27,38,LOT979_IP_2022-11-13_38,2/24/2022,SP979,2022-12-20T04:13:49,,FALSE
12/16/2021,IP980,lettuce,446,H980,1,8/12/2021,3,3,LOT980_IP_2021-12-16_3,1/5/2022,SP980,2022-08-16T14:46:51,,TRUE
3/20/2022,IP981,basil,6748,H981,7,11/13/2021,34,47,LOT981_IP_2022-03-20_47,2/20/2022,SP981,2022-12-09T15:54:28,,TRUE
12/19/2021,IP982,bell peppers,5400,H982,6,11/4/2021,27,38,LOT982_IP_2021-12-19_38,2/16/2022,SP982,2022-11-27T19:08:39,,FALSE
3/27/2022,IP983,arugula,2911,H983,4,9/12/2021,15,21,LOT983_IP_2022-03-27_21,1/20/2022,SP983,2022-09-23T11:08:28,,FALSE
5/6/2022,IP984,parsley,8127,H984,8,9/19/2021,41,57,LOT984_IP_2022-05-06_57,1/24/2022,SP984,2022-10-02T22:13:52,,FALSE
5/8/2022,IP985,basil,6706,H985,7,10/13/2021,34,47,LOT985_IP_2022-05-08_47,2/5/2022,SP985,2022-11-01T01:31:28,,TRUE
11/29/2022,IP986,melons,2956,H986,4,8/23/2021,15,21,LOT986_IP_2022-11-29_21,1/11/2022,SP986,2022-08-31T00:49:22,,TRUE
1/1/2023,IP987,bell peppers,5594,H987,6,10/7/2021,28,39,LOT987_IP_2023-01-01_39,2/2/2022,SP987,2022-10-24T16:53:56,,FALSE
8/30/2022,IP988,lettuce,135,H988,1,11/5/2021,1,1,LOT988_IP_2022-08-30_1,2/16/2022,SP988,2022-11-29T18:00:14,,FALSE
2/4/2023,IP989,parsley,8385,H989,9,11/16/2021,42,59,LOT989_IP_2023-02-04_59,2/22/2022,SP989,2022-12-13T13:37:39,,FALSE
5/24/2022,IP990,basil,6516,H990,7,9/8/2021,33,46,LOT990_IP_2022-05-24_46,1/19/2022,SP990,2022-09-19T17:01:34,,FALSE
1/25/2022,IP991,basil,6791,H991,7,9/14/2021,34,48,LOT991_IP_2022-01-25_48,1/22/2022,SP991,2022-09-26T07:37:43,,FALSE
10/2/2021,IP992,basil,7153,H992,7,8/20/2021,36,50,LOT992_IP_2021-10-02_50,1/9/2022,SP992,2022-08-26T19:53:38,,TRUE
3/4/2022,IP993,bell peppers,5551,H993,6,11/18/2021,28,39,LOT993_IP_2022-03-04_39,2/23/2022,SP993,2022-12-15T08:52:58,,FALSE
12/21/2022,IP994,lettuce,224,H994,1,8/13/2021,2,2,LOT994_IP_2022-12-21_2,1/6/2022,SP994,2022-08-18T06:25:53,,FALSE
8/22/2021,IP995,Tomatoes,4043,H995,5,8/25/2021,21,28,LOT995_IP_2021-08-22_28,1/12/2022,SP995,2022-09-02T03:17:14,,FALSE
9/12/2022,IP996,sweet potato,9926,H996,10,10/3/2021,50,69,LOT996_IP_2022-09-12_69,1/31/2022,SP996,2022-10-19T07:07:59,,FALSE
12/28/2021,IP997,spinach,1220,H997,2,9/15/2021,7,9,LOT997_IP_2021-12-28_9,1/22/2022,SP997,2022-09-27T08:51:39,,FALSE
6/22/2022,IP998,sweet potato,9435,H998,9,11/28/2021,47,66,LOT998_IP_2022-06-22_66,2/27/2022,SP998,2022-12-27T12:51:21,,FALSE
9/28/2022,IP999,spinach,1049,H999,2,9/28/2021,6,8,LOT999_IP_2022-09-28_8,1/28/2022,SP999,2022-10-13T10:33:13,,FALSE
11/5/2021,IP1000,lettuce,652,H1000,2,11/4/2021,4,5,LOT1000_IP_2021-11-05_5,2/16/2022,SP1000,2022-11-28T13:10:02,,FALSE
12/3/2021,IP1001,Cucumbers,4395,H1001,5,9/17/2021,22,31,LOT1001_IP_2021-12-03_31,1/23/2022,SP1001,2022-09-30T05:20:54,,FALSE
4/26/2022,IP1002,basil,7028,H1002,7,11/27/2021,35,49,LOT1002_IP_2022-04-26_49,2/27/2022,SP1002,2022-12-26T11:37:25,,FALSE
2/1/2022,IP1003,kale,2037,H1003,3,11/10/2021,11,15,LOT1003_IP_2022-02-01_15,2/19/2022,SP1003,2022-12-06T05:00:07,,FALSE
11/27/2022,IP1004,cilantro,7191,H1004,7,11/1/2021,36,50,LOT1004_IP_2022-11-27_50,2/14/2022,SP1004,2022-11-25T02:15:40,,FALSE
2/2/2022,IP1005,bell peppers,5056,H1005,6,9/12/2021,26,36,LOT1005_IP_2022-02-02_36,1/21/2022,SP1005,2022-09-24T08:46:07,,TRUE
9/12/2021,IP1006,sweet potato,9782,H1006,10,8/21/2021,49,68,LOT1006_IP_2021-09-12_68,1/10/2022,SP1006,2022-08-28T11:32:40,,FALSE
5/23/2022,IP1007,basil,6979,H1007,7,11/8/2021,35,49,LOT1007_IP_2022-05-23_49,2/18/2022,SP1007,2022-12-02T21:42:02,,TRUE
8/10/2021,IP1008,spinach,1035,H1008,2,10/6/2021,6,8,LOT1008_IP_2021-08-10_8,2/1/2022,SP1008,2022-10-23T12:03:43,,FALSE
11/10/2021,IP1009,bell peppers,5504,H1009,6,9/26/2021,28,39,LOT1009_IP_2021-11-10_39,1/28/2022,SP1009,2022-10-11T18:54:10,,FALSE
7/9/2022,IP1010,Cucumbers,4655,H1010,5,10/27/2021,24,33,LOT1010_IP_2022-07-09_33,2/12/2022,SP1010,2022-11-18T15:15:48,,FALSE
1/4/2022,IP1011,cilantro,7344,H1011,8,8/2/2021,37,51,LOT1011_IP_2022-01-04_51,1/1/2022,SP1011,2022-08-04T21:37:18,,FALSE
12/8/2021,IP1012,potato,9105,H1012,9,9/12/2021,46,64,LOT1012_IP_2021-12-08_64,1/21/2022,SP1012,2022-09-23T18:21:01,,FALSE
12/27/2022,IP1013,chili peppers,6261,H1013,7,11/9/2021,31,44,LOT1013_IP_2022-12-27_44,2/18/2022,SP1013,2022-12-04T06:08:32,,FALSE
4/18/2022,IP1014,sweet potato,9571,H1014,10,11/23/2021,48,67,LOT1014_IP_2022-04-18_67,2/25/2022,SP1014,2022-12-21T16:16:35,,FALSE
11/4/2022,IP1015,sweet potato,9618,H1015,10,11/8/2021,48,67,LOT1015_IP_2022-11-04_67,2/18/2022,SP1015,2022-12-03T12:07:09,,FALSE
6/10/2022,IP1016,potato,9154,H1016,9,10/15/2021,46,64,LOT1016_IP_2022-06-10_64,2/6/2022,SP1016,2022-11-03T07:35:37,,FALSE
10/14/2021,IP1017,arugula,2894,H1017,4,10/31/2021,15,20,LOT1017_IP_2021-10-14_20,2/14/2022,SP1017,2022-11-23T21:25:28,,FALSE
1/22/2023,IP1018,Cucumbers,4548,H1018,5,8/12/2021,23,32,LOT1018_IP_2023-01-22_32,1/6/2022,SP1018,2022-08-17T12:24:30,,FALSE
5/14/2022,IP1019,potato,9197,H1019,9,9/3/2021,46,64,LOT1019_IP_2022-05-14_64,1/16/2022,SP1019,2022-09-13T09:37:57,,FALSE
5/23/2022,IP1020,kale,1657,H1020,2,10/22/2021,9,12,LOT1020_IP_2022-05-23_12,2/9/2022,SP1020,2022-11-12T04:15:55,,FALSE
9/3/2022,IP1021,kale,2067,H1021,3,11/5/2021,11,15,LOT1021_IP_2022-09-03_15,2/16/2022,SP1021,2022-11-30T01:12:47,,FALSE
1/19/2022,IP1022,melons,3213,H1022,4,10/16/2021,16,23,LOT1022_IP_2022-01-19_23,2/6/2022,SP1022,2022-11-04T12:25:49,,FALSE
8/18/2022,IP1023,basil,6486,H1023,7,9/19/2021,33,46,LOT1023_IP_2022-08-18_46,1/24/2022,SP1023,2022-10-02T11:25:03,,FALSE
12/8/2021,IP1024,parsley,7916,H1024,8,9/19/2021,40,55,LOT1024_IP_2021-12-08_55,1/24/2022,SP1024,2022-10-02T18:37:36,,FALSE
2/20/2022,IP1025,parsley,8555,H1025,9,9/17/2021,43,60,LOT1025_IP_2022-02-20_60,1/23/2022,SP1025,2022-09-30T12:33:27,,FALSE
10/21/2022,IP1026,Tomatoes,3740,H1026,4,10/15/2021,19,26,LOT1026_IP_2022-10-21_26,2/6/2022,SP1026,2022-11-04T01:37,,FALSE
2/27/2023,IP1027,chili peppers,6006,H1027,6,11/19/2021,30,42,LOT1027_IP_2023-02-27_42,2/23/2022,SP1027,2022-12-16T20:55:44,,FALSE
4/25/2022,IP1028,spinach,932,H1028,2,9/30/2021,5,7,LOT1028_IP_2022-04-25_7,1/30/2022,SP1028,2022-10-16T10:38:44,,FALSE
9/12/2022,IP1029,potato,8779,H1029,9,9/22/2021,44,61,LOT1029_IP_2022-09-12_61,1/26/2022,SP1029,2022-10-06T12:44:30,,FALSE
4/10/2022,IP1030,spinach,1490,H1030,2,8/15/2021,8,11,LOT1030_IP_2022-04-10_11,1/7/2022,SP1030,2022-08-20T16:06:18,,FALSE
2/18/2023,IP1031,arugula,2724,H1031,3,9/4/2021,14,19,LOT1031_IP_2023-02-18_19,1/17/2022,SP1031,2022-09-14T18:04:27,,FALSE
10/1/2022,IP1032,kale,1812,H1032,3,8/27/2021,9,13,LOT1032_IP_2022-10-01_13,1/13/2022,SP1032,2022-09-04T16:33:56,,TRUE
8/20/2022,IP1033,kale,2173,H1033,3,9/26/2021,11,15,LOT1033_IP_2022-08-20_15,1/28/2022,SP1033,2022-10-11T08:05:21,,FALSE
7/9/2022,IP1034,sweet potato,9754,H1034,10,10/18/2021,49,68,LOT1034_IP_2022-07-09_68,2/8/2022,SP1034,2022-11-07T19:43:54,,FALSE
3/3/2022,IP1035,sweet potato,9895,H1035,10,9/11/2021,49,69,LOT1035_IP_2022-03-03_69,1/20/2022,SP1035,2022-09-23T00:19:38,,FALSE
11/22/2022,IP1036,cilantro,7742,H1036,8,9/24/2021,39,54,LOT1036_IP_2022-11-22_54,1/27/2022,SP1036,2022-10-09T02:01:12,,TRUE
9/5/2021,IP1037,lettuce,686,H1037,2,11/23/2021,4,5,LOT1037_IP_2021-09-05_5,2/25/2022,SP1037,2022-12-21T09:04:01,,FALSE
8/9/2022,IP1038,spinach,1211,H1038,2,11/30/2021,6,9,LOT1038_IP_2022-08-09_9,2/28/2022,SP1038,2022-12-30T02:08:03,,FALSE
8/4/2021,IP1039,kale,1714,H1039,2,10/4/2021,9,12,LOT1039_IP_2021-08-04_12,2/1/2022,SP1039,2022-10-21T05:59:35,,FALSE
8/13/2022,IP1040,parsley,8197,H1040,8,8/12/2021,41,57,LOT1040_IP_2022-08-13_57,1/6/2022,SP1040,2022-08-17T05:11:57,,FALSE
12/19/2021,IP1041,Cucumbers,4990,H1041,5,8/16/2021,25,35,LOT1041_IP_2021-12-19_35,1/7/2022,SP1041,2022-08-21T06:31:25,,FALSE
1/15/2023,IP1042,potato,9266,H1042,9,8/24/2021,46,65,LOT1042_IP_2023-01-15_65,1/11/2022,SP1042,2022-08-31T11:38:12,,FALSE
8/24/2022,IP1043,Tomatoes,4125,H1043,5,8/30/2021,21,29,LOT1043_IP_2022-08-24_29,1/14/2022,SP1043,2022-09-08T07:04:34,,FALSE
8/18/2022,IP1044,bell peppers,5207,H1044,6,9/14/2021,26,37,LOT1044_IP_2022-08-18_37,1/22/2022,SP1044,2022-09-27T01:39:06,,FALSE
5/13/2022,IP1045,chili peppers,6322,H1045,7,9/20/2021,32,44,LOT1045_IP_2022-05-13_44,1/25/2022,SP1045,2022-10-04T03:04:05,,FALSE
6/27/2022,IP1046,potato,8690,H1046,9,11/19/2021,44,61,LOT1046_IP_2022-06-27_61,2/23/2022,SP1046,2022-12-16T06:30:38,,FALSE
1/9/2022,IP1047,melons,3146,H1047,4,11/15/2021,16,22,LOT1047_IP_2022-01-09_22,2/21/2022,SP1047,2022-12-12T01:34:54,,FALSE
6/22/2022,IP1048,cilantro,7628,H1048,8,9/17/2021,38,53,LOT1048_IP_2022-06-22_53,1/23/2022,SP1048,2022-09-30T12:33:27,,FALSE
11/13/2021,IP1049,chili peppers,5778,H1049,6,8/19/2021,29,41,LOT1049_IP_2021-11-13_41,1/9/2022,SP1049,2022-08-25T07:50:52,,FALSE
5/2/2022,IP1050,Cucumbers,4774,H1050,5,10/20/2021,24,34,LOT1050_IP_2022-05-02_34,2/8/2022,SP1050,2022-11-09T11:22:57,,FALSE
10/26/2022,IP1051,lettuce,241,H1051,1,10/6/2021,2,2,LOT1051_IP_2022-10-26_2,2/2/2022,SP1051,2022-10-24T02:28:50,,FALSE
1/3/2022,IP1052,arugula,2900,H1052,4,8/9/2021,15,21,LOT1052_IP_2022-01-03_21,1/4/2022,SP1052,2022-08-12T20:39:56,,FALSE
3/11/2022,IP1053,basil,7118,H1053,7,11/12/2021,36,50,LOT1053_IP_2022-03-11_50,2/20/2022,SP1053,2022-12-08T11:04:16,,FALSE
12/4/2021,IP1054,sweet potato,9913,H1054,10,9/2/2021,50,69,LOT1054_IP_2021-12-04_69,1/16/2022,SP1054,2022-09-11T14:22:38,,FALSE
8/28/2022,IP1055,melons,3122,H1055,4,12/1/2021,16,22,LOT1055_IP_2022-08-28_22,3/1/2022,SP1055,2022-12-30T20:09:26,,FALSE
1/21/2022,IP1056,kale,1645,H1056,2,8/7/2021,9,12,LOT1056_IP_2022-01-21_12,1/3/2022,SP1056,2022-08-10T07:23:15,,TRUE
1/29/2023,IP1057,Tomatoes,3916,H1057,4,9/1/2021,20,28,LOT1057_IP_2023-01-29_28,1/15/2022,SP1057,2022-09-10T09:32:26,,FALSE
12/8/2022,IP1058,parsley,8398,H1058,9,9/16/2021,42,59,LOT1058_IP_2022-12-08_59,1/22/2022,SP1058,2022-09-28T10:05:35,,TRUE
12/19/2021,IP1059,cilantro,7657,H1059,8,9/24/2021,38,54,LOT1059_IP_2021-12-19_54,1/27/2022,SP1059,2022-10-09T02:01:12,,FALSE
1/14/2023,IP1060,Cucumbers,4903,H1060,5,10/4/2021,25,34,LOT1060_IP_2023-01-14_34,1/31/2022,SP1060,2022-10-20T19:10:45,,TRUE
10/15/2022,IP1061,potato,8636,H1061,9,10/30/2021,43,60,LOT1061_IP_2022-10-15_60,2/13/2022,SP1061,2022-11-22T02:10:09,,FALSE
3/22/2022,IP1062,lettuce,479,H1062,1,8/9/2021,3,4,LOT1062_IP_2022-03-22_4,1/4/2022,SP1062,2022-08-13T11:05:03,,FALSE
12/23/2022,IP1063,melons,3334,H1063,4,10/21/2021,17,24,LOT1063_IP_2022-12-23_24,2/9/2022,SP1063,2022-11-11T06:38:15,,FALSE
6/16/2022,IP1064,kale,2155,H1064,3,11/21/2021,11,15,LOT1064_IP_2022-06-16_15,2/24/2022,SP1064,2022-12-19T13:48:42,,FALSE
10/2/2022,IP1065,spinach,1482,H1065,2,9/18/2021,8,11,LOT1065_IP_2022-10-02_11,1/24/2022,SP1065,2022-10-01T10:11:07,,FALSE
7/12/2022,IP1066,melons,3227,H1066,4,10/8/2021,16,23,LOT1066_IP_2022-07-12_23,2/3/2022,SP1066,2022-10-26T04:56:42,,FALSE
12/18/2022,IP1067,parsley,8057,H1067,8,10/1/2021,40,56,LOT1067_IP_2022-12-18_56,1/30/2022,SP1067,2022-10-17T11:52:40,,FALSE
12/12/2022,IP1068,sweet potato,9349,H1068,9,10/25/2021,47,65,LOT1068_IP_2022-12-12_65,2/11/2022,SP1068,2022-11-16T09:11:39,,FALSE
12/29/2022,IP1069,Tomatoes,3688,H1069,4,8/9/2021,19,26,LOT1069_IP_2022-12-29_26,1/4/2022,SP1069,2022-08-13T07:28:46,,FALSE
6/5/2022,IP1070,arugula,2833,H1070,3,9/4/2021,15,20,LOT1070_IP_2022-06-05_20,1/17/2022,SP1070,2022-09-14T18:04:27,,FALSE
2/4/2022,IP1071,potato,9066,H1071,9,8/16/2021,45,63,LOT1071_IP_2022-02-04_63,1/7/2022,SP1071,2022-08-21T06:31:25,,FALSE
1/5/2023,IP1072,basil,6752,H1072,7,9/24/2021,34,47,LOT1072_IP_2023-01-05_47,1/27/2022,SP1072,2022-10-09T05:37:29,,FALSE
9/24/2022,IP1073,chili peppers,6425,H1073,7,11/13/2021,32,45,LOT1073_IP_2022-09-24_45,2/20/2022,SP1073,2022-12-09T15:54:28,,TRUE
10/21/2021,IP1074,Tomatoes,3871,H1074,4,9/11/2021,20,27,LOT1074_IP_2021-10-21_27,1/20/2022,SP1074,2022-09-23T07:32:11,,FALSE
10/9/2022,IP1075,sweet potato,9684,H1075,10,9/6/2021,48,68,LOT1075_IP_2022-10-09_68,1/18/2022,SP1075,2022-09-16T13:19:46,,TRUE
1/16/2022,IP1076,spinach,952,H1076,2,11/27/2021,5,7,LOT1076_IP_2022-01-16_7,2/27/2022,SP1076,2022-12-26T18:49:58,,FALSE
11/15/2022,IP1077,Cucumbers,4464,H1077,5,11/22/2021,23,31,LOT1077_IP_2022-11-15_31,2/25/2022,SP1077,2022-12-20T22:15:12,,TRUE
12/29/2021,IP1078,lettuce,738,H1078,2,8/29/2021,4,5,LOT1078_IP_2021-12-29_5,1/14/2022,SP1078,2022-09-06T15:25:31,,FALSE
12/1/2021,IP1079,parsley,8177,H1079,8,11/29/2021,41,57,LOT1079_IP_2021-12-01_57,2/28/2022,SP1079,2022-12-29T04:30:23,,FALSE
4/6/2022,IP1080,basil,6885,H1080,7,11/18/2021,35,48,LOT1080_IP_2022-04-06_48,2/22/2022,SP1080,2022-12-15T01:40:25,,FALSE
8/6/2022,IP1081,arugula,2453,H1081,3,8/19/2021,13,17,LOT1081_IP_2022-08-06_17,1/9/2022,SP1081,2022-08-25T04:14:36,,FALSE
8/10/2021,IP1082,Tomatoes,3889,H1082,4,11/3/2021,20,27,LOT1082_IP_2021-08-10_27,2/15/2022,SP1082,2022-11-26T21:30:59,,FALSE
6/2/2022,IP1083,kale,1656,H1083,2,11/2/2021,9,12,LOT1083_IP_2022-06-02_12,2/15/2022,SP1083,2022-11-25T20:17:03,,FALSE
10/7/2021,IP1084,sweet potato,9426,H1084,9,8/29/2021,47,66,LOT1084_IP_2021-10-07_66,1/14/2022,SP1084,2022-09-06T19:01:48,,FALSE
2/21/2023,IP1085,basil,6539,H1085,7,9/1/2021,33,46,LOT1085_IP_2023-02-21_46,1/15/2022,SP1085,2022-09-09T22:43:36,,FALSE
9/10/2022,IP1086,lettuce,634,H1086,1,11/12/2021,4,5,LOT1086_IP_2022-09-10_5,2/20/2022,SP1086,2022-12-08T07:27:59,,FALSE
9/15/2021,IP1087,Cucumbers,4895,H1087,5,11/4/2021,25,34,LOT1087_IP_2021-09-15_34,2/15/2022,SP1087,2022-11-27T15:32:22,,FALSE
1/1/2022,IP1088,potato,8946,H1088,9,11/18/2021,45,63,LOT1088_IP_2022-01-01_63,2/22/2022,SP1088,2022-12-14T22:04:09,,FALSE
2/18/2022,IP1089,kale,2163,H1089,3,8/1/2021,11,15,LOT1089_IP_2022-02-18_15,12/31/2021,SP1089,2022-08-03T23:59:38,,FALSE
4/18/2022,IP1090,chili peppers,6109,H1090,6,8/24/2021,31,43,LOT1090_IP_2022-04-18_43,1/11/2022,SP1090,2022-08-31T08:01:55,,TRUE
11/17/2021,IP1091,basil,7105,H1091,7,10/14/2021,36,50,LOT1091_IP_2021-11-17_50,2/5/2022,SP1091,2022-11-01T23:09:08,,FALSE
12/16/2022,IP1092,arugula,2268,H1092,3,10/1/2021,12,16,LOT1092_IP_2022-12-16_16,1/30/2022,SP1092,2022-10-17T19:05:13,,FALSE
7/11/2022,IP1093,cilantro,7426,H1093,8,10/21/2021,37,52,LOT1093_IP_2022-07-11_52,2/9/2022,SP1093,2022-11-11T10:14:32,,FALSE
3/29/2022,IP1094,chili peppers,6302,H1094,7,10/18/2021,32,44,LOT1094_IP_2022-03-29_44,2/7/2022,SP1094,2022-11-07T12:31:21,,FALSE
8/8/2021,IP1095,basil,6509,H1095,7,11/16/2021,33,46,LOT1095_IP_2021-08-08_46,2/22/2022,SP1095,2022-12-12T23:12:33,,TRUE
7/31/2022,IP1096,spinach,1358,H1096,2,8/26/2021,7,10,LOT1096_IP_2022-07-31_10,1/12/2022,SP1096,2022-09-03T04:31:10,,FALSE
11/15/2021,IP1097,bell peppers,5404,H1097,6,11/26/2021,27,38,LOT1097_IP_2021-11-15_38,2/27/2022,SP1097,2022-12-25T17:36:02,,FALSE
9/16/2021,IP1098,cilantro,7652,H1098,8,10/1/2021,38,54,LOT1098_IP_2021-09-16_54,1/30/2022,SP1098,2022-10-17T01:03:51,,FALSE
11/25/2022,IP1099,spinach,847,H1099,2,11/29/2021,5,6,LOT1099_IP_2022-11-25_6,2/28/2022,SP1099,2022-12-28T21:17:50,,FALSE
8/27/2021,IP1100,basil,6550,H1100,7,10/2/2021,33,46,LOT1100_IP_2021-08-27_46,1/31/2022,SP1100,2022-10-18T20:19:09,,FALSE
1/25/2022,IP1101,basil,6885,H1101,7,8/7/2021,35,48,LOT1101_IP_2022-01-25_48,1/3/2022,SP1101,2022-08-11T01:24:37,,FALSE
3/22/2022,IP1102,arugula,2609,H1102,3,8/2/2021,13,18,LOT1102_IP_2022-03-22_18,1/1/2022,SP1102,2022-08-05T01:13:34,,FALSE
12/22/2021,IP1103,kale,2146,H1103,3,10/6/2021,11,15,LOT1103_IP_2021-12-22_15,2/2/2022,SP1103,2022-10-24T02:28:50,,FALSE
9/10/2021,IP1104,spinach,1175,H1104,2,10/21/2021,6,8,LOT1104_IP_2021-09-10_8,2/9/2022,SP1104,2022-11-11T10:14:32,,FALSE
8/13/2022,IP1105,Tomatoes,4139,H1105,5,9/17/2021,21,29,LOT1105_IP_2022-08-13_29,1/23/2022,SP1105,2022-09-30T05:20:54,,FALSE
3/1/2022,IP1106,kale,2027,H1106,3,9/22/2021,11,14,LOT1106_IP_2022-03-01_14,1/25/2022,SP1106,2022-10-05T22:19:24,,FALSE
7/22/2022,IP1107,Tomatoes,4229,H1107,5,8/6/2021,21,30,LOT1107_IP_2022-07-22_30,1/2/2022,SP1107,2022-08-09T02:33:02,,FALSE
11/13/2022,IP1108,bell peppers,5436,H1108,6,11/27/2021,27,38,LOT1108_IP_2022-11-13_38,2/27/2022,SP1108,2022-12-26T22:26:15,,FALSE
2/6/2022,IP1109,cilantro,7733,H1109,8,9/10/2021,39,54,LOT1109_IP_2022-02-06_54,1/20/2022,SP1109,2022-09-21T12:16:53,,FALSE
2/24/2023,IP1110,basil,7016,H1110,7,8/9/2021,35,49,LOT1110_IP_2023-02-24_49,1/4/2022,SP1110,2022-08-12T17:03:40,,TRUE
7/9/2022,IP1111,Cucumbers,4980,H1111,5,9/24/2021,25,35,LOT1111_IP_2022-07-09_35,1/27/2022,SP1111,2022-10-09T02:01:12,,FALSE
1/18/2023,IP1112,sweet potato,9320,H1112,9,9/12/2021,47,65,LOT1112_IP_2023-01-18_65,1/20/2022,SP1112,2022-09-23T14:44:45,,FALSE
12/24/2022,IP1113,potato,9255,H1113,9,11/13/2021,46,65,LOT1113_IP_2022-12-24_65,2/20/2022,SP1113,2022-12-09T08:41:55,,FALSE
4/2/2022,IP1114,Tomatoes,3755,H1114,4,10/1/2021,19,26,LOT1114_IP_2022-04-02_26,1/30/2022,SP1114,2022-10-17T04:40:07,,FALSE
1/5/2022,IP1115,potato,8997,H1115,9,11/7/2021,45,63,LOT1115_IP_2022-01-05_63,2/17/2022,SP1115,2022-12-01T13:15:33,,FALSE
4/12/2022,IP1116,potato,9032,H1116,9,10/26/2021,45,63,LOT1116_IP_2022-04-12_63,2/11/2022,SP1116,2022-11-16T20:00:29,,FALSE
10/18/2022,IP1117,potato,8675,H1117,9,11/8/2021,43,61,LOT1117_IP_2022-10-18_61,2/18/2022,SP1117,2022-12-02T21:42:02,,FALSE
11/23/2022,IP1118,arugula,2487,H1118,3,9/19/2021,13,18,LOT1118_IP_2022-11-23_18,1/24/2022,SP1118,2022-10-02T11:25:03,,FALSE
8/6/2021,IP1119,Tomatoes,3989,H1119,5,11/30/2021,20,28,LOT1119_IP_2021-08-06_28,3/1/2022,SP1119,2022-12-30T16:33:09,,FALSE
8/25/2021,IP1120,melons,3035,H1120,4,11/6/2021,16,21,LOT1120_IP_2021-08-25_21,2/17/2022,SP1120,2022-11-30T22:50:27,,TRUE
8/19/2021,IP1121,parsley,7931,H1121,8,8/4/2021,40,56,LOT1121_IP_2021-08-19_56,1/1/2022,SP1121,2022-08-06T13:16:20,,FALSE
11/18/2022,IP1122,Cucumbers,4460,H1122,5,8/25/2021,23,31,LOT1122_IP_2022-11-18_31,1/12/2022,SP1122,2022-09-01T09:15:51,,FALSE
3/25/2022,IP1123,parsley,8201,H1123,8,11/27/2021,41,57,LOT1123_IP_2022-03-25_57,2/27/2022,SP1123,2022-12-26T22:26:15,,FALSE
8/2/2022,IP1124,potato,8627,H1124,9,9/21/2021,43,60,LOT1124_IP_2022-08-02_60,1/25/2022,SP1124,2022-10-04T13:52:55,,FALSE
9/6/2022,IP1125,melons,2988,H1125,4,10/3/2021,15,21,LOT1125_IP_2022-09-06_21,1/31/2022,SP1125,2022-10-19T21:33:06,,TRUE
8/13/2021,IP1126,melons,3498,H1126,4,11/4/2021,18,25,LOT1126_IP_2021-08-13_25,2/16/2022,SP1126,2022-11-28T02:21:12,,FALSE
1/11/2023,IP1127,lettuce,569,H1127,1,9/30/2021,3,4,LOT1127_IP_2023-01-11_4,1/29/2022,SP1127,2022-10-15T16:37:21,,FALSE
3/2/2022,IP1128,cilantro,7505,H1128,8,8/21/2021,38,53,LOT1128_IP_2022-03-02_53,1/10/2022,SP1128,2022-08-28T07:56:24,,FALSE
1/10/2022,IP1129,lettuce,270,H1129,1,8/11/2021,2,2,LOT1129_IP_2022-01-10_2,1/5/2022,SP1129,2022-08-15T06:20:22,,FALSE
1/11/2023,IP1130,sweet potato,9404,H1130,9,11/24/2021,47,66,LOT1130_IP_2023-01-11_66,2/25/2022,SP1130,2022-12-22T10:17:57,,FALSE
10/10/2022,IP1131,potato,8711,H1131,9,10/23/2021,44,61,LOT1131_IP_2022-10-10_61,2/10/2022,SP1131,2022-11-13T16:18:41,,TRUE
9/9/2022,IP1132,spinach,1084,H1132,2,8/9/2021,6,8,LOT1132_IP_2022-09-09_8,1/4/2022,SP1132,2022-08-12T17:03:40,,FALSE
10/19/2022,IP1133,potato,9212,H1133,9,10/2/2021,46,65,LOT1133_IP_2022-10-19_65,1/31/2022,SP1133,2022-10-18T16:42:53,,FALSE
9/22/2021,IP1134,Cucumbers,4453,H1134,5,11/22/2021,23,31,LOT1134_IP_2021-09-22_31,2/25/2022,SP1134,2022-12-20T11:26:22,,FALSE
12/3/2021,IP1135,spinach,880,H1135,2,10/3/2021,5,6,LOT1135_IP_2021-12-03_6,1/31/2022,SP1135,2022-10-19T07:07:59,,FALSE
10/1/2022,IP1136,Tomatoes,3989,H1136,5,10/26/2021,20,28,LOT1136_IP_2022-10-01_28,2/11/2022,SP1136,2022-11-16T23:36:45,,FALSE
12/1/2022,IP1137,potato,8943,H1137,9,8/23/2021,45,63,LOT1137_IP_2022-12-01_63,1/11/2022,SP1137,2022-08-30T06:47:59,,FALSE
2/21/2022,IP1138,potato,8976,H1138,9,10/8/2021,45,63,LOT1138_IP_2022-02-21_63,2/2/2022,SP1138,2022-10-25T14:31:35,,TRUE
8/2/2021,IP1139,spinach,1422,H1139,2,8/25/2021,8,10,LOT1139_IP_2021-08-02_10,1/12/2022,SP1139,2022-09-01T09:15:51,,FALSE
12/6/2022,IP1140,bell peppers,5291,H1140,6,10/25/2021,27,37,LOT1140_IP_2022-12-06_37,2/11/2022,SP1140,2022-11-16T12:47:56,,FALSE
4/11/2022,IP1141,Tomatoes,4120,H1141,5,8/17/2021,21,29,LOT1141_IP_2022-04-11_29,1/8/2022,SP1141,2022-08-23T16:11:50,,FALSE
3/6/2022,IP1142,cilantro,7775,H1142,8,8/11/2021,39,54,LOT1142_IP_2022-03-06_54,1/5/2022,SP1142,2022-08-15T06:20:22,,FALSE
2/13/2022,IP1143,bell peppers,5562,H1143,6,8/30/2021,28,39,LOT1143_IP_2022-02-13_39,1/14/2022,SP1143,2022-09-08T14:17:07,,FALSE
2/15/2022,IP1144,parsley,8471,H1144,9,10/9/2021,42,59,LOT1144_IP_2022-02-15_59,2/3/2022,SP1144,2022-10-27T06:10:38,,FALSE
8/14/2022,IP1145,cilantro,7617,H1145,8,11/19/2021,38,53,LOT1145_IP_2022-08-14_53,2/23/2022,SP1145,2022-12-17T00:32:01,,TRUE
2/7/2023,IP1146,sweet potato,9360,H1146,9,9/13/2021,47,66,LOT1146_IP_2023-02-07_66,1/21/2022,SP1146,2022-09-25T17:12:37,,FALSE
6/3/2022,IP1147,chili peppers,6275,H1147,7,10/25/2021,32,44,LOT1147_IP_2022-06-03_44,2/11/2022,SP1147,2022-11-15T18:46:33,,FALSE
12/26/2022,IP1148,Cucumbers,4979,H1148,5,8/6/2021,25,35,LOT1148_IP_2022-12-26_35,1/3/2022,SP1148,2022-08-10T00:10:41,,FALSE
12/24/2022,IP1149,basil,6889,H1149,7,9/10/2021,35,48,LOT1149_IP_2022-12-24_48,1/20/2022,SP1149,2022-09-21T05:04:19,,FALSE
6/5/2022,IP1150,Cucumbers,4691,H1150,5,8/8/2021,24,33,LOT1150_IP_2022-06-05_33,1/4/2022,SP1150,2022-08-12T06:14:50,,TRUE
7/7/2022,IP1151,spinach,1365,H1151,2,10/21/2021,7,10,LOT1151_IP_2022-07-07_10,2/9/2022,SP1151,2022-11-11T13:50:49,,FALSE
6/22/2022,IP1152,Tomatoes,3911,H1152,4,11/16/2021,20,28,LOT1152_IP_2022-06-22_28,2/22/2022,SP1152,2022-12-12T23:12:33,,FALSE
2/2/2023,IP1153,melons,3453,H1153,4,8/5/2021,18,24,LOT1153_IP_2023-02-02_24,1/2/2022,SP1153,2022-08-07T21:42:49,,FALSE
1/9/2022,IP1154,kale,1623,H1154,2,9/10/2021,9,12,LOT1154_IP_2022-01-09_12,1/20/2022,SP1154,2022-09-21T08:40:36,,FALSE
8/16/2022,IP1155,Cucumbers,4807,H1155,5,9/8/2021,24,34,LOT1155_IP_2022-08-16_34,1/19/2022,SP1155,2022-09-19T02:36:27,,FALSE
8/14/2022,IP1156,kale,2170,H1156,3,9/25/2021,11,15,LOT1156_IP_2022-08-14_15,1/27/2022,SP1156,2022-10-09T23:38:51,,TRUE
5/28/2022,IP1157,kale,1593,H1157,2,11/11/2021,8,11,LOT1157_IP_2022-05-28_11,2/19/2022,SP1157,2022-12-06T12:12:40,,FALSE
8/22/2021,IP1158,kale,2048,H1158,3,11/18/2021,11,15,LOT1158_IP_2021-08-22_15,2/22/2022,SP1158,2022-12-15T01:40:25,,FALSE
10/8/2022,IP1159,spinach,1267,H1159,2,11/28/2021,7,9,LOT1159_IP_2022-10-08_9,2/28/2022,SP1159,2022-12-28T03:16:27,,FALSE
1/12/2023,IP1160,bell peppers,5653,H1160,6,8/9/2021,28,40,LOT1160_IP_2023-01-12_40,1/4/2022,SP1160,2022-08-13T03:52:29,,FALSE
3/3/2022,IP1161,basil,6597,H1161,7,8/21/2021,33,46,LOT1161_IP_2022-03-03_46,1/10/2022,SP1161,2022-08-27T21:07:34,,FALSE
9/21/2022,IP1162,parsley,8328,H1162,8,9/2/2021,42,58,LOT1162_IP_2022-09-21_58,1/16/2022,SP1162,2022-09-12T08:24:01,,FALSE
6/4/2022,IP1163,spinach,1122,H1163,2,10/11/2021,6,8,LOT1163_IP_2022-06-04_8,2/4/2022,SP1163,2022-10-29T19:27:20,,FALSE
12/6/2022,IP1164,kale,1709,H1164,2,11/22/2021,9,12,LOT1164_IP_2022-12-06_12,2/24/2022,SP1164,2022-12-20T00:37:32,,TRUE
3/4/2022,IP1165,spinach,1374,H1165,2,8/25/2021,7,10,LOT1165_IP_2022-03-04_10,1/12/2022,SP1165,2022-09-01T09:15:51,,FALSE
11/7/2022,IP1166,arugula,2837,H1166,3,11/12/2021,15,20,LOT1166_IP_2022-11-07_20,2/20/2022,SP1166,2022-12-07T20:39:09,,FALSE
11/15/2021,IP1167,Tomatoes,3986,H1167,5,10/5/2021,20,28,LOT1167_IP_2021-11-15_28,2/1/2022,SP1167,2022-10-22T21:38:37,,FALSE
1/20/2022,IP1168,cilantro,7431,H1168,8,8/15/2021,37,52,LOT1168_IP_2022-01-20_52,1/7/2022,SP1168,2022-08-20T05:17:29,,FALSE
11/26/2022,IP1169,parsley,8111,H1169,8,10/3/2021,41,57,LOT1169_IP_2022-11-26_57,1/31/2022,SP1169,2022-10-20T08:21:55,,FALSE
1/8/2023,IP1170,arugula,2745,H1170,3,8/26/2021,14,19,LOT1170_IP_2023-01-08_19,1/12/2022,SP1170,2022-09-03T15:20,,FALSE
3/27/2022,IP1171,potato,9137,H1171,9,11/27/2021,46,64,LOT1171_IP_2022-03-27_64,2/27/2022,SP1171,2022-12-26T08:01:08,,FALSE
12/21/2021,IP1172,cilantro,7190,H1172,7,11/2/2021,36,50,LOT1172_IP_2021-12-21_50,2/15/2022,SP1172,2022-11-25T05:51:57,,FALSE
2/6/2023,IP1173,chili peppers,5769,H1173,6,10/20/2021,29,41,LOT1173_IP_2023-02-06_41,2/8/2022,SP1173,2022-11-09T18:35:30,,FALSE
1/21/2022,IP1174,potato,9003,H1174,9,9/24/2021,45,63,LOT1174_IP_2022-01-21_63,1/27/2022,SP1174,2022-10-09T09:13:45,,FALSE
10/15/2022,IP1175,melons,3601,H1175,4,10/13/2021,18,25,LOT1175_IP_2022-10-15_25,2/5/2022,SP1175,2022-11-01T05:07:45,,FALSE
9/24/2021,IP1176,melons,3375,H1176,4,10/3/2021,17,24,LOT1176_IP_2021-09-24_24,1/31/2022,SP1176,2022-10-20T08:21:55,,FALSE
2/24/2023,IP1177,spinach,1198,H1177,2,9/8/2021,6,9,LOT1177_IP_2023-02-24_9,1/18/2022,SP1177,2022-09-18T15:47:38,,FALSE
3/20/2022,IP1178,melons,3104,H1178,4,9/11/2021,16,22,LOT1178_IP_2022-03-20_22,1/20/2022,SP1178,2022-09-22T17:07:05,,FALSE
8/22/2022,IP1179,Tomatoes,4052,H1179,5,10/25/2021,21,29,LOT1179_IP_2022-08-22_29,2/11/2022,SP1179,2022-11-16T05:35:22,,FALSE
10/8/2022,IP1180,kale,2193,H1180,3,8/10/2021,11,16,LOT1180_IP_2022-10-08_16,1/4/2022,SP1180,2022-08-14T12:18:59,,FALSE
9/10/2022,IP1181,spinach,1113,H1181,2,11/26/2021,6,8,LOT1181_IP_2022-09-10_8,2/27/2022,SP1181,2022-12-25T13:59:46,,FALSE
1/8/2023,IP1182,potato,8663,H1182,9,8/4/2021,43,61,LOT1182_IP_2023-01-08_61,1/2/2022,SP1182,2022-08-07T07:17:43,,TRUE
6/20/2022,IP1183,Tomatoes,4340,H1183,5,8/21/2021,22,31,LOT1183_IP_2022-06-20_31,1/10/2022,SP1183,2022-08-27T10:18:44,,FALSE
2/22/2023,IP1184,basil,6707,H1184,7,8/25/2021,34,47,LOT1184_IP_2023-02-22_47,1/12/2022,SP1184,2022-09-01T16:28:24,,FALSE
3/23/2022,IP1185,Tomatoes,3834,H1185,4,8/6/2021,19,27,LOT1185_IP_2022-03-23_27,1/3/2022,SP1185,2022-08-09T16:58:08,,FALSE
3/17/2022,IP1186,melons,3344,H1186,4,10/17/2021,17,24,LOT1186_IP_2022-03-17_24,2/7/2022,SP1186,2022-11-06T11:17:25,,FALSE
2/5/2022,IP1187,basil,7143,H1187,7,11/5/2021,36,50,LOT1187_IP_2022-02-05_50,2/16/2022,SP1187,2022-11-29T18:00:14,,FALSE
6/23/2022,IP1188,kale,2076,H1188,3,10/4/2021,11,15,LOT1188_IP_2022-06-23_15,2/1/2022,SP1188,2022-10-21T16:48:24,,FALSE
7/14/2022,IP1189,parsley,7931,H1189,8,10/18/2021,40,56,LOT1189_IP_2022-07-14_56,2/7/2022,SP1189,2022-11-06T18:29:58,,FALSE
1/5/2023,IP1190,spinach,1465,H1190,2,11/21/2021,8,11,LOT1190_IP_2023-01-05_11,2/24/2022,SP1190,2022-12-19T02:59:53,,FALSE
5/3/2022,IP1191,parsley,7906,H1191,8,11/26/2021,40,55,LOT1191_IP_2022-05-03_55,2/26/2022,SP1191,2022-12-24T19:58:23,,FALSE
2/5/2023,IP1192,parsley,8077,H1192,8,10/14/2021,40,57,LOT1192_IP_2023-02-05_57,2/6/2022,SP1192,2022-11-02T20:46:47,,FALSE
4/16/2022,IP1193,Tomatoes,3811,H1193,4,10/28/2021,19,27,LOT1193_IP_2022-04-16_27,2/12/2022,SP1193,2022-11-19T23:42:17,,FALSE
11/19/2022,IP1194,parsley,8125,H1194,8,11/28/2021,41,57,LOT1194_IP_2022-11-19_57,2/27/2022,SP1194,2022-12-27T09:15:04,,FALSE
1/25/2022,IP1195,lettuce,276,H1195,1,11/20/2021,2,2,LOT1195_IP_2022-01-25_2,2/24/2022,SP1195,2022-12-17T22:09:40,,FALSE
12/27/2022,IP1196,basil,6690,H1196,7,10/13/2021,34,47,LOT1196_IP_2022-12-27_47,2/5/2022,SP1196,2022-10-31T18:18:55,,FALSE
10/22/2021,IP1197,melons,3486,H1197,4,9/28/2021,18,25,LOT1197_IP_2021-10-22_25,1/29/2022,SP1197,2022-10-14T08:10:52,,FALSE
11/21/2022,IP1198,sweet potato,9365,H1198,9,8/17/2021,47,66,LOT1198_IP_2022-11-21_66,1/8/2022,SP1198,2022-08-23T05:23,,FALSE
1/23/2022,IP1199,arugula,2640,H1199,3,11/28/2021,14,19,LOT1199_IP_2022-01-23_19,2/27/2022,SP1199,2022-12-27T12:51:21,,FALSE
9/28/2021,IP1200,basil,7087,H1200,7,10/16/2021,36,50,LOT1200_IP_2021-09-28_50,2/6/2022,SP1200,2022-11-04T16:02:06,,FALSE
1/6/2022,IP1201,basil,7041,H1201,7,10/28/2021,35,49,LOT1201_IP_2022-01-06_49,2/12/2022,SP1201,2022-11-19T09:17:11,,TRUE
10/20/2022,IP1202,basil,6814,H1202,7,9/13/2021,34,48,LOT1202_IP_2022-10-20_48,1/21/2022,SP1202,2022-09-25T06:23:47,,TRUE
11/8/2021,IP1203,arugula,2593,H1203,3,8/10/2021,13,18,LOT1203_IP_2021-11-08_18,1/4/2022,SP1203,2022-08-13T21:53:52,,TRUE
10/5/2021,IP1204,Tomatoes,3636,H1204,4,9/24/2021,19,26,LOT1204_IP_2021-10-05_26,1/27/2022,SP1204,2022-10-09T02:01:12,,FALSE
11/30/2021,IP1205,bell peppers,5558,H1205,6,10/22/2021,28,39,LOT1205_IP_2021-11-30_39,2/9/2022,SP1205,2022-11-12T07:52:11,,TRUE
2/22/2022,IP1206,arugula,2800,H1206,3,11/24/2021,14,20,LOT1206_IP_2022-02-22_20,2/26/2022,SP1206,2022-12-22T21:06:47,,FALSE
9/16/2021,IP1207,chili peppers,6047,H1207,6,9/13/2021,30,42,LOT1207_IP_2021-09-16_42,1/21/2022,SP1207,2022-09-24T23:11:14,,FALSE
12/8/2022,IP1208,bell peppers,5499,H1208,6,10/21/2021,28,39,LOT1208_IP_2022-12-08_39,2/9/2022,SP1208,2022-11-10T16:13:09,,FALSE
9/24/2021,IP1209,chili peppers,6183,H1209,7,9/20/2021,31,43,LOT1209_IP_2021-09-24_43,1/25/2022,SP1209,2022-10-04T06:40:22,,FALSE
11/24/2022,IP1210,lettuce,776,H1210,2,10/4/2021,4,6,LOT1210_IP_2022-11-24_6,2/1/2022,SP1210,2022-10-21T16:48:24,,TRUE
3/30/2022,IP1211,spinach,822,H1211,2,9/12/2021,5,6,LOT1211_IP_2022-03-30_6,1/21/2022,SP1211,2022-09-24T12:22:24,,FALSE
1/2/2022,IP1212,chili peppers,5848,H1212,6,8/8/2021,29,41,LOT1212_IP_2022-01-02_41,1/3/2022,SP1212,2022-08-11T12:13:27,,FALSE
9/19/2021,IP1213,kale,2072,H1213,3,9/29/2021,11,15,LOT1213_IP_2021-09-19_15,1/29/2022,SP1213,2022-10-14T18:59:42,,FALSE
12/10/2021,IP1214,spinach,1383,H1214,2,9/24/2021,7,10,LOT1214_IP_2021-12-10_10,1/27/2022,SP1214,2022-10-08T18:48:39,,FALSE
11/23/2022,IP1215,basil,6832,H1215,7,9/3/2021,34,48,LOT1215_IP_2022-11-23_48,1/16/2022,SP1215,2022-09-12T22:49:08,,FALSE
2/23/2023,IP1216,kale,1614,H1216,2,9/18/2021,8,12,LOT1216_IP_2023-02-23_12,1/24/2022,SP1216,2022-10-01T20:59:56,,FALSE
5/29/2022,IP1217,chili peppers,5896,H1217,6,9/29/2021,30,41,LOT1217_IP_2022-05-29_41,1/29/2022,SP1217,2022-10-15T09:24:48,,TRUE
8/23/2022,IP1218,arugula,2805,H1218,3,10/10/2021,14,20,LOT1218_IP_2022-08-23_20,2/3/2022,SP1218,2022-10-28T00:12:01,,FALSE
11/5/2021,IP1219,spinach,1306,H1219,2,9/9/2021,7,9,LOT1219_IP_2021-11-05_9,1/19/2022,SP1219,2022-09-20T21:51:46,,FALSE
11/3/2021,IP1220,spinach,883,H1220,2,10/25/2021,5,6,LOT1220_IP_2021-11-03_6,2/11/2022,SP1220,2022-11-15T07:57:43,,FALSE
10/7/2022,IP1221,cilantro,7679,H1221,8,10/11/2021,39,54,LOT1221_IP_2022-10-07_54,2/4/2022,SP1221,2022-10-29T19:27:20,,FALSE
4/24/2022,IP1222,basil,6849,H1222,7,8/22/2021,34,48,LOT1222_IP_2022-04-24_48,1/11/2022,SP1222,2022-08-29T19:59:09,,TRUE
3/25/2022,IP1223,kale,1530,H1223,2,10/30/2021,8,11,LOT1223_IP_2022-03-25_11,2/13/2022,SP1223,2022-11-21T15:21:19,,FALSE
4/2/2022,IP1224,parsley,7987,H1224,8,9/30/2021,40,56,LOT1224_IP_2022-04-02_56,1/30/2022,SP1224,2022-10-16T14:15:01,,FALSE
12/31/2022,IP1225,chili peppers,5928,H1225,6,8/12/2021,30,42,LOT1225_IP_2022-12-31_42,1/6/2022,SP1225,2022-08-17T08:48:14,,FALSE
11/12/2022,IP1226,potato,9204,H1226,9,11/15/2021,46,64,LOT1226_IP_2022-11-12_64,2/21/2022,SP1226,2022-12-11T07:33:31,,FALSE
9/13/2022,IP1227,potato,9054,H1227,9,11/14/2021,45,63,LOT1227_IP_2022-09-13_63,2/21/2022,SP1227,2022-12-10T20:44:41,,FALSE
5/21/2022,IP1228,parsley,8569,H1228,9,9/26/2021,43,60,LOT1228_IP_2022-05-21_60,1/27/2022,SP1228,2022-10-11T00:52:47,,FALSE
2/8/2023,IP1229,chili peppers,6182,H1229,7,9/10/2021,31,43,LOT1229_IP_2023-02-08_43,1/20/2022,SP1229,2022-09-21T08:40:36,,FALSE
1/25/2022,IP1230,arugula,2628,H1230,3,9/16/2021,14,19,LOT1230_IP_2022-01-25_19,1/23/2022,SP1230,2022-09-29T11:19:31,,TRUE
8/11/2021,IP1231,basil,6510,H1231,7,9/1/2021,33,46,LOT1231_IP_2021-08-11_46,1/15/2022,SP1231,2022-09-10T13:08:42,,FALSE
11/4/2022,IP1232,parsley,8207,H1232,8,10/7/2021,41,58,LOT1232_IP_2022-11-04_58,2/2/2022,SP1232,2022-10-24T06:05:06,,FALSE
7/5/2022,IP1233,Tomatoes,4087,H1233,5,10/22/2021,21,29,LOT1233_IP_2022-07-05_29,2/9/2022,SP1233,2022-11-11T21:03:22,,FALSE
3/28/2022,IP1234,basil,6874,H1234,7,9/7/2021,35,48,LOT1234_IP_2022-03-28_48,1/18/2022,SP1234,2022-09-17T07:21:08,,FALSE
10/7/2022,IP1235,potato,8864,H1235,9,11/27/2021,44,62,LOT1235_IP_2022-10-07_62,2/27/2022,SP1235,2022-12-26T08:01:08,,FALSE
9/25/2021,IP1236,lettuce,618,H1236,1,11/29/2021,4,5,LOT1236_IP_2021-09-25_5,2/28/2022,SP1236,2022-12-29T00:54:07,,FALSE
12/29/2021,IP1237,bell peppers,5455,H1237,6,11/5/2021,28,38,LOT1237_IP_2021-12-29_38,2/16/2022,SP1237,2022-11-29T18:00:14,,FALSE
12/12/2022,IP1238,sweet potato,9424,H1238,9,12/1/2021,47,66,LOT1238_IP_2022-12-12_66,3/1/2022,SP1238,2022-12-31T06:58:15,,FALSE
11/10/2021,IP1239,cilantro,7805,H1239,8,10/16/2021,39,55,LOT1239_IP_2021-11-10_55,2/6/2022,SP1239,2022-11-04T12:25:49,,FALSE
12/16/2021,IP1240,parsley,8548,H1240,9,10/3/2021,43,60,LOT1240_IP_2021-12-16_60,1/31/2022,SP1240,2022-10-19T10:44:16,,FALSE
7/26/2022,IP1241,Cucumbers,4465,H1241,5,10/13/2021,23,31,LOT1241_IP_2022-07-26_31,2/5/2022,SP1241,2022-10-31T18:18:55,,FALSE
5/6/2022,IP1242,spinach,1088,H1242,2,10/20/2021,6,8,LOT1242_IP_2022-05-06_8,2/8/2022,SP1242,2022-11-09T14:59:13,,FALSE
5/25/2022,IP1243,chili peppers,6261,H1243,7,10/31/2021,31,44,LOT1243_IP_2022-05-25_44,2/14/2022,SP1243,2022-11-23T10:36:38,,FALSE
7/22/2022,IP1244,arugula,2614,H1244,3,10/18/2021,13,19,LOT1244_IP_2022-07-22_19,2/7/2022,SP1244,2022-11-07T16:07:38,,FALSE
3/13/2022,IP1245,parsley,8286,H1245,8,10/23/2021,42,58,LOT1245_IP_2022-03-13_58,2/10/2022,SP1245,2022-11-13T19:54:57,,FALSE
8/9/2021,IP1246,lettuce,535,H1246,1,9/20/2021,3,4,LOT1246_IP_2021-08-09_4,1/24/2022,SP1246,2022-10-03T09:02:42,,TRUE
12/7/2022,IP1247,kale,1787,H1247,3,8/19/2021,9,13,LOT1247_IP_2022-12-07_13,1/9/2022,SP1247,2022-08-25T07:50:52,,FALSE
4/12/2022,IP1248,chili peppers,6187,H1248,7,10/4/2021,31,43,LOT1248_IP_2022-04-12_43,2/1/2022,SP1248,2022-10-21T05:59:35,,FALSE
10/5/2021,IP1249,potato,8804,H1249,9,11/7/2021,44,62,LOT1249_IP_2021-10-05_62,2/17/2022,SP1249,2022-12-01T20:28:06,,FALSE
11/18/2021,IP1250,arugula,2559,H1250,3,10/6/2021,13,18,LOT1250_IP_2021-11-18_18,2/1/2022,SP1250,2022-10-23T01:14:54,,FALSE
11/17/2022,IP1251,lettuce,363,H1251,1,11/1/2021,2,3,LOT1251_IP_2022-11-17_3,2/14/2022,SP1251,2022-11-24T01:01:44,,FALSE
2/9/2022,IP1252,parsley,8243,H1252,8,8/10/2021,41,58,LOT1252_IP_2022-02-09_58,1/4/2022,SP1252,2022-08-14T01:30:09,,FALSE
4/19/2022,IP1253,kale,2053,H1253,3,9/28/2021,11,15,LOT1253_IP_2022-04-19_15,1/29/2022,SP1253,2022-10-14T08:10:52,,FALSE
7/22/2022,IP1254,cilantro,7822,H1254,8,8/17/2021,39,55,LOT1254_IP_2022-07-22_55,1/8/2022,SP1254,2022-08-23T05:23,,TRUE
11/29/2022,IP1255,Cucumbers,4993,H1255,5,9/10/2021,25,35,LOT1255_IP_2022-11-29_35,1/20/2022,SP1255,2022-09-22T02:41:59,,FALSE
10/13/2021,IP1256,Cucumbers,5028,H1256,5,10/28/2021,25,35,LOT1256_IP_2021-10-13_35,2/12/2022,SP1256,2022-11-19T09:17:11,,FALSE
9/11/2021,IP1257,spinach,1127,H1257,2,10/13/2021,6,8,LOT1257_IP_2021-09-11_8,2/5/2022,SP1257,2022-11-01T01:31:28,,FALSE
2/9/2023,IP1258,Tomatoes,4012,H1258,5,10/24/2021,20,28,LOT1258_IP_2023-02-09_28,2/10/2022,SP1258,2022-11-14T21:08:53,,TRUE
7/30/2022,IP1259,spinach,858,H1259,2,10/22/2021,5,6,LOT1259_IP_2022-07-30_6,2/9/2022,SP1259,2022-11-12T15:04:45,,FALSE
2/18/2023,IP1260,spinach,1406,H1260,2,11/4/2021,7,10,LOT1260_IP_2023-02-18_10,2/16/2022,SP1260,2022-11-28T02:21:12,,FALSE
2/20/2022,IP1261,melons,3311,H1261,4,10/31/2021,17,23,LOT1261_IP_2022-02-20_23,2/14/2022,SP1261,2022-11-23T21:25:28,,TRUE
1/14/2022,IP1262,potato,9229,H1262,9,9/14/2021,46,65,LOT1262_IP_2022-01-14_65,1/22/2022,SP1262,2022-09-26T07:37:43,,TRUE
8/17/2022,IP1263,melons,2968,H1263,4,10/31/2021,15,21,LOT1263_IP_2022-08-17_21,2/14/2022,SP1263,2022-11-23T17:49:11,,FALSE
6/3/2022,IP1264,Cucumbers,4791,H1264,5,11/12/2021,24,34,LOT1264_IP_2022-06-03_34,2/19/2022,SP1264,2022-12-07T13:26:36,,FALSE
6/14/2022,IP1265,cilantro,7470,H1265,8,11/22/2021,37,52,LOT1265_IP_2022-06-14_52,2/25/2022,SP1265,2022-12-20T22:15:12,,FALSE
10/15/2022,IP1266,potato,8642,H1266,9,11/20/2021,43,61,LOT1266_IP_2022-10-15_61,2/24/2022,SP1266,2022-12-17T22:09:40,,FALSE
11/16/2022,IP1267,bell peppers,5756,H1267,6,11/11/2021,29,40,LOT1267_IP_2022-11-16_40,2/19/2022,SP1267,2022-12-07T02:37:47,,FALSE
12/10/2021,IP1268,parsley,8150,H1268,8,11/16/2021,41,57,LOT1268_IP_2021-12-10_57,2/22/2022,SP1268,2022-12-13T10:01:23,,FALSE
6/14/2022,IP1269,cilantro,7748,H1269,8,11/22/2021,39,54,LOT1269_IP_2022-06-14_54,2/25/2022,SP1269,2022-12-20T15:02:38,,TRUE
6/4/2022,IP1270,melons,3011,H1270,4,11/17/2021,15,21,LOT1270_IP_2022-06-04_21,2/22/2022,SP1270,2022-12-14T00:26:29,,FALSE
2/2/2022,IP1271,parsley,8489,H1271,9,10/3/2021,43,59,LOT1271_IP_2022-02-02_59,1/31/2022,SP1271,2022-10-20T04:45:39,,FALSE
12/25/2022,IP1272,lettuce,347,H1272,1,9/9/2021,2,3,LOT1272_IP_2022-12-25_3,1/19/2022,SP1272,2022-09-20T21:51:46,,FALSE
1/28/2023,IP1273,parsley,8193,H1273,8,8/31/2021,41,57,LOT1273_IP_2023-01-28_57,1/15/2022,SP1273,2022-09-09T19:07:20,,FALSE
3/30/2022,IP1274,basil,6999,H1274,7,10/25/2021,35,49,LOT1274_IP_2022-03-30_49,2/11/2022,SP1274,2022-11-15T15:10:16,,TRUE
5/9/2022,IP1275,cilantro,7553,H1275,8,8/29/2021,38,53,LOT1275_IP_2022-05-09_53,1/14/2022,SP1275,2022-09-07T09:26:54,,FALSE
11/12/2022,IP1276,Tomatoes,3791,H1276,4,9/2/2021,19,27,LOT1276_IP_2022-11-12_27,1/16/2022,SP1276,2022-09-11T17:58:55,,FALSE
5/30/2022,IP1277,bell peppers,5342,H1277,6,11/17/2021,27,38,LOT1277_IP_2022-05-30_38,2/22/2022,SP1277,2022-12-14T18:27:52,,FALSE
9/30/2022,IP1278,melons,3117,H1278,4,8/6/2021,16,22,LOT1278_IP_2022-09-30_22,1/2/2022,SP1278,2022-08-09T09:45:35,,FALSE
1/23/2023,IP1279,chili peppers,5974,H1279,6,11/4/2021,30,42,LOT1279_IP_2023-01-23_42,2/16/2022,SP1279,2022-11-28T05:57:29,,FALSE
11/1/2021,IP1280,spinach,1115,H1280,2,8/2/2021,6,8,LOT1280_IP_2021-11-01_8,12/31/2021,SP1280,2022-08-04T03:35:55,,FALSE
1/5/2023,IP1281,cilantro,7458,H1281,8,10/20/2021,37,52,LOT1281_IP_2023-01-05_52,2/8/2022,SP1281,2022-11-09T14:59:13,,FALSE
12/23/2021,IP1282,potato,9239,H1282,9,10/10/2021,46,65,LOT1282_IP_2021-12-23_65,2/3/2022,SP1282,2022-10-28T03:48:17,,FALSE
5/9/2022,IP1283,potato,8827,H1283,9,10/18/2021,44,62,LOT1283_IP_2022-05-09_62,2/7/2022,SP1283,2022-11-07T16:07:38,,FALSE
1/18/2023,IP1284,parsley,8033,H1284,8,8/28/2021,40,56,LOT1284_IP_2023-01-18_56,1/13/2022,SP1284,2022-09-05T10:35:19,,FALSE
5/10/2022,IP1285,bell peppers,5216,H1285,6,11/15/2021,26,37,LOT1285_IP_2022-05-10_37,2/21/2022,SP1285,2022-12-11T18:22:20,,TRUE
11/22/2021,IP1286,sweet potato,9433,H1286,9,8/28/2021,47,66,LOT1286_IP_2021-11-22_66,1/14/2022,SP1286,2022-09-06T04:36:42,,TRUE
11/23/2022,IP1287,basil,6899,H1287,7,9/22/2021,35,48,LOT1287_IP_2022-11-23_48,1/26/2022,SP1287,2022-10-06T12:44:30,,TRUE
8/15/2022,IP1288,melons,3545,H1288,4,11/8/2021,18,25,LOT1288_IP_2022-08-15_25,2/18/2022,SP1288,2022-12-03T08:30:52,,FALSE
6/18/2022,IP1289,arugula,2688,H1289,3,11/24/2021,14,19,LOT1289_IP_2022-06-18_19,2/25/2022,SP1289,2022-12-22T06:41:41,,TRUE
9/8/2021,IP1290,Cucumbers,4543,H1290,5,8/21/2021,23,32,LOT1290_IP_2021-09-08_32,1/10/2022,SP1290,2022-08-28T00:43:51,,FALSE
7/4/2022,IP1291,spinach,1030,H1291,2,10/5/2021,6,7,LOT1291_IP_2022-07-04_7,2/1/2022,SP1291,2022-10-21T20:24:41,,FALSE
9/15/2022,IP1292,lettuce,392,H1292,1,8/23/2021,2,3,LOT1292_IP_2022-09-15_3,1/11/2022,SP1292,2022-08-30T06:47:59,,FALSE
9/1/2021,IP1293,cilantro,7287,H1293,8,11/7/2021,37,51,LOT1293_IP_2021-09-01_51,2/17/2022,SP1293,2022-12-01T16:51:50,,FALSE
9/12/2022,IP1294,potato,9087,H1294,9,10/1/2021,45,64,LOT1294_IP_2022-09-12_64,1/30/2022,SP1294,2022-10-17T22:41:30,,FALSE
12/23/2021,IP1295,cilantro,7873,H1295,8,10/13/2021,39,55,LOT1295_IP_2021-12-23_55,2/5/2022,SP1295,2022-10-31T14:42:38,,TRUE
4/9/2022,IP1296,lettuce,754,H1296,2,11/23/2021,4,6,LOT1296_IP_2022-04-09_6,2/25/2022,SP1296,2022-12-21T05:27:45,,FALSE
10/26/2022,IP1297,bell peppers,5163,H1297,6,10/19/2021,26,36,LOT1297_IP_2022-10-26_36,2/8/2022,SP1297,2022-11-08T13:45:17,,FALSE
7/20/2022,IP1298,potato,9068,H1298,9,10/11/2021,45,64,LOT1298_IP_2022-07-20_64,2/4/2022,SP1298,2022-10-29T15:51:03,,FALSE
2/23/2023,IP1299,spinach,1370,H1299,2,10/6/2021,7,10,LOT1299_IP_2023-02-23_10,2/1/2022,SP1299,2022-10-23T08:27:27,,FALSE
7/12/2022,IP1300,melons,3577,H1300,4,9/15/2021,18,25,LOT1300_IP_2022-07-12_25,1/22/2022,SP1300,2022-09-28T02:53:02,,FALSE
9/16/2021,IP1301,potato,8751,H1301,9,8/26/2021,44,61,LOT1301_IP_2021-09-16_61,1/12/2022,SP1301,2022-09-03T00:54:54,,FALSE
4/5/2022,IP1302,parsley,8073,H1302,8,9/14/2021,40,57,LOT1302_IP_2022-04-05_57,1/22/2022,SP1302,2022-09-26T22:02:49,,TRUE
7/30/2022,IP1303,kale,1948,H1303,3,11/24/2021,10,14,LOT1303_IP_2022-07-30_14,2/25/2022,SP1303,2022-12-22T13:54:14,,FALSE
10/10/2021,IP1304,basil,6897,H1304,7,10/20/2021,35,48,LOT1304_IP_2021-10-10_48,2/8/2022,SP1304,2022-11-09T07:46:40,,FALSE
9/9/2022,IP1305,parsley,8006,H1305,8,8/10/2021,40,56,LOT1305_IP_2022-09-09_56,1/4/2022,SP1305,2022-08-13T21:53:52,,FALSE
8/19/2021,IP1306,sweet potato,9906,H1306,10,8/4/2021,50,69,LOT1306_IP_2021-08-19_69,1/2/2022,SP1306,2022-08-07T10:54,,FALSE
10/21/2021,IP1307,cilantro,7494,H1307,8,9/27/2021,38,53,LOT1307_IP_2021-10-21_53,1/28/2022,SP1307,2022-10-12T05:43,,FALSE
6/11/2022,IP1308,kale,1812,H1308,3,9/11/2021,9,13,LOT1308_IP_2022-06-11_13,1/20/2022,SP1308,2022-09-23T03:55:55,,TRUE
8/25/2022,IP1309,cilantro,7244,H1309,7,8/20/2021,36,51,LOT1309_IP_2022-08-25_51,1/9/2022,SP1309,2022-08-26T19:53:38,,FALSE
11/12/2021,IP1310,chili peppers,5839,H1310,6,8/25/2021,29,41,LOT1310_IP_2021-11-12_41,1/12/2022,SP1310,2022-09-01T16:28:24,,FALSE
8/15/2022,IP1311,parsley,8059,H1311,8,10/27/2021,40,56,LOT1311_IP_2022-08-15_56,2/12/2022,SP1311,2022-11-17T21:14:25,,FALSE
8/13/2022,IP1312,basil,7074,H1312,7,11/25/2021,36,50,LOT1312_IP_2022-08-13_50,2/26/2022,SP1312,2022-12-23T18:44:27,,FALSE
6/20/2022,IP1313,parsley,8167,H1313,8,9/19/2021,41,57,LOT1313_IP_2022-06-20_57,1/24/2022,SP1313,2022-10-03T05:26:26,,FALSE
7/3/2022,IP1314,spinach,1053,H1314,2,8/2/2021,6,8,LOT1314_IP_2022-07-03_8,12/31/2021,SP1314,2022-08-04T10:48:28,,TRUE
1/1/2023,IP1315,sweet potato,9396,H1315,9,10/20/2021,47,66,LOT1315_IP_2023-01-01_66,2/8/2022,SP1315,2022-11-09T22:11:46,,FALSE
3/29/2022,IP1316,basil,7065,H1316,7,8/6/2021,35,50,LOT1316_IP_2022-03-29_50,1/3/2022,SP1316,2022-08-10T00:10:41,,FALSE
9/14/2022,IP1317,Cucumbers,4578,H1317,5,11/6/2021,23,32,LOT1317_IP_2022-09-14_32,2/17/2022,SP1317,2022-11-30T08:25:21,,FALSE
2/5/2023,IP1318,chili peppers,6148,H1318,6,9/30/2021,31,43,LOT1318_IP_2023-02-05_43,1/29/2022,SP1318,2022-10-15T16:37:21,,FALSE
2/22/2023,IP1319,basil,6821,H1319,7,10/22/2021,34,48,LOT1319_IP_2023-02-22_48,2/9/2022,SP1319,2022-11-12T04:15:55,,FALSE
9/15/2022,IP1320,melons,3429,H1320,4,10/23/2021,17,24,LOT1320_IP_2022-09-15_24,2/10/2022,SP1320,2022-11-13T16:18:41,,FALSE
6/4/2022,IP1321,melons,3407,H1321,4,11/21/2021,17,24,LOT1321_IP_2022-06-04_24,2/24/2022,SP1321,2022-12-18T19:47:20,,FALSE
1/26/2022,IP1322,melons,3014,H1322,4,8/24/2021,15,21,LOT1322_IP_2022-01-26_21,1/11/2022,SP1322,2022-08-31T04:25:39,,FALSE
5/23/2022,IP1323,arugula,2437,H1323,3,8/15/2021,13,17,LOT1323_IP_2022-05-23_17,1/7/2022,SP1323,2022-08-20T01:41:12,,TRUE
8/30/2021,IP1324,Cucumbers,4543,H1324,5,11/8/2021,23,32,LOT1324_IP_2021-08-30_32,2/18/2022,SP1324,2022-12-02T18:05:46,,FALSE
3/16/2022,IP1325,cilantro,7536,H1325,8,10/21/2021,38,53,LOT1325_IP_2022-03-16_53,2/9/2022,SP1325,2022-11-11T03:01:59,,TRUE
5/10/2022,IP1326,kale,1615,H1326,2,9/25/2021,8,12,LOT1326_IP_2022-05-10_12,1/27/2022,SP1326,2022-10-10T03:15:08,,TRUE
9/30/2022,IP1327,sweet potato,9936,H1327,10,10/8/2021,50,70,LOT1327_IP_2022-09-30_70,2/3/2022,SP1327,2022-10-26T04:56:42,,FALSE
6/18/2022,IP1328,Tomatoes,3867,H1328,4,10/27/2021,20,27,LOT1328_IP_2022-06-18_27,2/12/2022,SP1328,2022-11-18T15:15:48,,FALSE
12/21/2022,IP1329,basil,6548,H1329,7,12/1/2021,33,46,LOT1329_IP_2022-12-21_46,3/1/2022,SP1329,2022-12-31T06:58:15,,FALSE
8/30/2021,IP1330,sweet potato,9605,H1330,10,9/27/2021,48,67,LOT1330_IP_2021-08-30_67,1/28/2022,SP1330,2022-10-12T16:31:50,,FALSE
6/14/2022,IP1331,cilantro,7234,H1331,7,8/6/2021,36,51,LOT1331_IP_2022-06-14_51,1/2/2022,SP1331,2022-08-09T09:45:35,,TRUE
10/28/2021,IP1332,chili peppers,6267,H1332,7,9/10/2021,32,44,LOT1332_IP_2021-10-28_44,1/19/2022,SP1332,2022-09-21T01:28:03,,FALSE
5/26/2022,IP1333,Cucumbers,4888,H1333,5,10/27/2021,25,34,LOT1333_IP_2022-05-26_34,2/12/2022,SP1333,2022-11-18T00:50:41,,TRUE
3/16/2022,IP1334,lettuce,466,H1334,1,11/24/2021,3,4,LOT1334_IP_2022-03-16_4,2/25/2022,SP1334,2022-12-22T06:41:41,,FALSE
8/13/2022,IP1335,cilantro,7876,H1335,8,8/20/2021,39,55,LOT1335_IP_2022-08-13_55,1/9/2022,SP1335,2022-08-26T09:04:48,,FALSE
8/10/2021,IP1336,lettuce,308,H1336,1,8/30/2021,2,2,LOT1336_IP_2021-08-10_2,1/14/2022,SP1336,2022-09-07T16:39:27,,TRUE
6/15/2022,IP1337,melons,2930,H1337,4,9/27/2021,15,21,LOT1337_IP_2022-06-15_21,1/28/2022,SP1337,2022-10-12T23:44:23,,FALSE
1/7/2022,IP1338,chili peppers,6012,H1338,6,9/24/2021,30,42,LOT1338_IP_2022-01-07_42,1/27/2022,SP1338,2022-10-09T05:37:29,,FALSE
7/3/2022,IP1339,bell peppers,5664,H1339,6,8/4/2021,29,40,LOT1339_IP_2022-07-03_40,1/2/2022,SP1339,2022-08-07T03:41:26,,TRUE
8/17/2021,IP1340,parsley,8419,H1340,9,8/16/2021,42,59,LOT1340_IP_2021-08-17_59,1/7/2022,SP1340,2022-08-21T10:07:41,,FALSE
12/7/2021,IP1341,spinach,1243,H1341,2,9/13/2021,7,9,LOT1341_IP_2021-12-07_9,1/21/2022,SP1341,2022-09-24T23:11:14,,FALSE
3/17/2022,IP1342,parsley,8178,H1342,8,9/3/2021,41,57,LOT1342_IP_2022-03-17_57,1/16/2022,SP1342,2022-09-13T06:01:41,,FALSE
8/24/2022,IP1343,parsley,8254,H1343,8,11/16/2021,41,58,LOT1343_IP_2022-08-24_58,2/22/2022,SP1343,2022-12-12T23:12:33,,FALSE
11/12/2022,IP1344,bell peppers,5653,H1344,6,11/21/2021,28,40,LOT1344_IP_2022-11-12_40,2/24/2022,SP1344,2022-12-18T19:47:20,,TRUE
1/29/2023,IP1345,cilantro,7194,H1345,7,8/23/2021,36,50,LOT1345_IP_2023-01-29_50,1/11/2022,SP1345,2022-08-30T10:24:16,,FALSE
1/28/2023,IP1346,basil,6636,H1346,7,8/29/2021,33,47,LOT1346_IP_2023-01-28_47,1/14/2022,SP1346,2022-09-06T15:25:31,,FALSE
9/23/2022,IP1347,kale,1677,H1347,2,11/7/2021,9,12,LOT1347_IP_2022-09-23_12,2/17/2022,SP1347,2022-12-01T16:51:50,,FALSE
8/9/2021,IP1348,basil,7049,H1348,7,8/1/2021,35,49,LOT1348_IP_2021-08-09_49,12/31/2021,SP1348,2022-08-03T13:10:49,,TRUE
12/4/2022,IP1349,arugula,2765,H1349,3,10/14/2021,14,20,LOT1349_IP_2022-12-04_20,2/5/2022,SP1349,2022-11-01T23:09:08,,FALSE
11/1/2021,IP1350,cilantro,7801,H1350,8,10/11/2021,39,55,LOT1350_IP_2021-11-01_55,2/4/2022,SP1350,2022-10-30T06:16:09,,TRUE
12/28/2021,IP1351,melons,3592,H1351,4,10/25/2021,18,25,LOT1351_IP_2021-12-28_25,2/11/2022,SP1351,2022-11-15T15:10:16,,FALSE
3/11/2022,IP1352,melons,3335,H1352,4,10/24/2021,17,24,LOT1352_IP_2022-03-11_24,2/10/2022,SP1352,2022-11-14T21:08:53,,FALSE
3/29/2022,IP1353,kale,1786,H1353,3,8/3/2021,9,13,LOT1353_IP_2022-03-29_13,1/1/2022,SP1353,2022-08-05T15:38:41,,FALSE
6/8/2022,IP1354,Tomatoes,4323,H1354,5,8/24/2021,22,30,LOT1354_IP_2022-06-08_30,1/11/2022,SP1354,2022-09-01T02:03:18,,FALSE
11/20/2021,IP1355,arugula,2336,H1355,3,8/4/2021,12,17,LOT1355_IP_2021-11-20_17,1/1/2022,SP1355,2022-08-06T20:28:53,,FALSE
4/3/2022,IP1356,spinach,1467,H1356,2,11/12/2021,8,11,LOT1356_IP_2022-04-03_11,2/20/2022,SP1356,2022-12-07T17:02:53,,FALSE
1/17/2022,IP1357,lettuce,706,H1357,2,11/11/2021,4,5,LOT1357_IP_2022-01-17_5,2/19/2022,SP1357,2022-12-06T19:25:13,,FALSE
1/28/2022,IP1358,bell peppers,5069,H1358,6,10/20/2021,26,36,LOT1358_IP_2022-01-28_36,2/8/2022,SP1358,2022-11-09T11:22:57,,FALSE
11/3/2021,IP1359,basil,6651,H1359,7,10/29/2021,33,47,LOT1359_IP_2021-11-03_47,2/13/2022,SP1359,2022-11-21T04:32:29,,FALSE
1/12/2023,IP1360,arugula,2363,H1360,3,8/21/2021,12,17,LOT1360_IP_2023-01-12_17,1/10/2022,SP1360,2022-08-28T00:43:51,,FALSE
11/7/2021,IP1361,cilantro,7352,H1361,8,8/5/2021,37,52,LOT1361_IP_2021-11-07_52,1/2/2022,SP1361,2022-08-08T04:55:22,,FALSE
8/4/2021,IP1362,arugula,2256,H1362,3,9/4/2021,12,16,LOT1362_IP_2021-08-04_16,1/17/2022,SP1362,2022-09-14T03:39:20,,FALSE
6/6/2022,IP1363,Tomatoes,4009,H1363,5,10/20/2021,20,28,LOT1363_IP_2022-06-06_28,2/8/2022,SP1363,2022-11-09T18:35:30,,FALSE
8/24/2021,IP1364,chili peppers,6261,H1364,7,10/7/2021,31,44,LOT1364_IP_2021-08-24_44,2/2/2022,SP1364,2022-10-24T13:17:39,,FALSE
3/1/2023,IP1365,spinach,1245,H1365,2,10/14/2021,7,9,LOT1365_IP_2023-03-01_9,2/5/2022,SP1365,2022-11-01T23:09:08,,FALSE
12/6/2022,IP1366,potato,8838,H1366,9,10/11/2021,44,62,LOT1366_IP_2022-12-06_62,2/4/2022,SP1366,2022-10-29T08:38:30,,FALSE
11/27/2021,IP1367,basil,6888,H1367,7,10/14/2021,35,48,LOT1367_IP_2021-11-27_48,2/5/2022,SP1367,2022-11-02T09:57:57,,FALSE
11/1/2021,IP1368,cilantro,7205,H1368,7,9/14/2021,36,51,LOT1368_IP_2021-11-01_51,1/22/2022,SP1368,2022-09-26T18:26:33,,FALSE
10/12/2022,IP1369,melons,3061,H1369,4,11/8/2021,16,22,LOT1369_IP_2022-10-12_22,2/18/2022,SP1369,2022-12-02T18:05:46,,FALSE
2/25/2022,IP1370,bell peppers,5267,H1370,6,9/23/2021,27,37,LOT1370_IP_2022-02-25_37,1/26/2022,SP1370,2022-10-07T10:22:10,,FALSE
11/15/2022,IP1371,kale,1881,H1371,3,11/29/2021,10,13,LOT1371_IP_2022-11-15_13,2/28/2022,SP1371,2022-12-28T17:41:34,,FALSE
10/19/2021,IP1372,chili peppers,6218,H1372,7,11/18/2021,31,44,LOT1372_IP_2021-10-19_44,2/23/2022,SP1372,2022-12-15T08:52:58,,FALSE
9/18/2021,IP1373,Tomatoes,4030,H1373,5,10/6/2021,20,28,LOT1373_IP_2021-09-18_28,2/2/2022,SP1373,2022-10-24T02:28:50,,FALSE
9/4/2021,IP1374,parsley,8025,H1374,8,8/25/2021,40,56,LOT1374_IP_2021-09-04_56,1/12/2022,SP1374,2022-09-01T12:52:08,,FALSE
11/27/2022,IP1375,spinach,1042,H1375,2,10/26/2021,6,8,LOT1375_IP_2022-11-27_8,2/11/2022,SP1375,2022-11-16T20:00:29,,FALSE
8/6/2021,IP1376,spinach,1356,H1376,2,11/24/2021,7,10,LOT1376_IP_2021-08-06_10,2/25/2022,SP1376,2022-12-22T13:54:14,,FALSE
9/14/2021,IP1377,spinach,1482,H1377,2,11/2/2021,8,11,LOT1377_IP_2021-09-14_11,2/15/2022,SP1377,2022-11-25T13:04:30,,FALSE
12/6/2022,IP1378,parsley,8193,H1378,8,9/30/2021,41,57,LOT1378_IP_2022-12-06_57,1/29/2022,SP1378,2022-10-15T16:37:21,,FALSE
8/23/2021,IP1379,Tomatoes,3781,H1379,4,8/3/2021,19,27,LOT1379_IP_2021-08-23_27,1/1/2022,SP1379,2022-08-05T15:38:41,,FALSE
1/3/2022,IP1380,potato,8744,H1380,9,9/20/2021,44,61,LOT1380_IP_2022-01-03_61,1/25/2022,SP1380,2022-10-04T03:04:05,,FALSE
2/9/2022,IP1381,arugula,2658,H1381,3,9/15/2021,14,19,LOT1381_IP_2022-02-09_19,1/22/2022,SP1381,2022-09-28T02:53:02,,FALSE
9/14/2022,IP1382,potato,8634,H1382,9,10/17/2021,43,60,LOT1382_IP_2022-09-14_60,2/7/2022,SP1382,2022-11-06T04:04:52,,FALSE
8/2/2022,IP1383,chili peppers,5873,H1383,6,10/15/2021,30,41,LOT1383_IP_2022-08-02_41,2/6/2022,SP1383,2022-11-03T11:11:53,,FALSE
1/14/2022,IP1384,chili peppers,6378,H1384,7,8/31/2021,32,45,LOT1384_IP_2022-01-14_45,1/15/2022,SP1384,2022-09-09T04:42:13,,FALSE
10/30/2022,IP1385,spinach,1002,H1385,2,10/20/2021,5,7,LOT1385_IP_2022-10-30_7,2/8/2022,SP1385,2022-11-10T01:48:03,,FALSE
5/12/2022,IP1386,kale,1579,H1386,2,10/7/2021,8,11,LOT1386_IP_2022-05-12_11,2/2/2022,SP1386,2022-10-24T13:17:39,,FALSE
1/11/2023,IP1387,kale,2115,H1387,3,8/13/2021,11,15,LOT1387_IP_2023-01-11_15,1/6/2022,SP1387,2022-08-18T10:02:10,,FALSE
11/8/2022,IP1388,Tomatoes,4303,H1388,5,11/25/2021,22,30,LOT1388_IP_2022-11-08_30,2/26/2022,SP1388,2022-12-24T05:33:16,,FALSE
2/19/2023,IP1389,melons,3552,H1389,4,11/6/2021,18,25,LOT1389_IP_2023-02-19_25,2/17/2022,SP1389,2022-11-30T15:37:54,,FALSE
6/12/2022,IP1390,potato,8877,H1390,9,11/29/2021,44,62,LOT1390_IP_2022-06-12_62,2/28/2022,SP1390,2022-12-29T08:06:40,,TRUE
2/13/2023,IP1391,melons,3112,H1391,4,10/5/2021,16,22,LOT1391_IP_2023-02-13_22,2/1/2022,SP1391,2022-10-22T10:49:47,,FALSE
10/24/2022,IP1392,melons,3431,H1392,4,10/23/2021,17,24,LOT1392_IP_2022-10-24_24,2/10/2022,SP1392,2022-11-12T22:17:18,,FALSE
4/22/2022,IP1393,basil,6556,H1393,7,11/29/2021,33,46,LOT1393_IP_2022-04-22_46,2/28/2022,SP1393,2022-12-29T11:42:57,,FALSE
2/6/2023,IP1394,cilantro,7604,H1394,8,9/13/2021,38,53,LOT1394_IP_2023-02-06_53,1/21/2022,SP1394,2022-09-25T06:23:47,,TRUE
4/8/2022,IP1395,potato,8672,H1395,9,9/2/2021,43,61,LOT1395_IP_2022-04-08_61,1/16/2022,SP1395,2022-09-12T01:11:28,,TRUE
9/6/2021,IP1396,Tomatoes,4317,H1396,5,8/24/2021,22,30,LOT1396_IP_2021-09-06_30,1/11/2022,SP1396,2022-08-31T15:14:28,,FALSE
6/16/2022,IP1397,arugula,2805,H1397,3,9/19/2021,14,20,LOT1397_IP_2022-06-16_20,1/24/2022,SP1397,2022-10-02T18:37:36,,FALSE
12/30/2021,IP1398,lettuce,750,H1398,2,10/11/2021,4,6,LOT1398_IP_2021-12-30_6,2/4/2022,SP1398,2022-10-29T05:02:13,,FALSE
7/23/2022,IP1399,basil,6775,H1399,7,9/17/2021,34,48,LOT1399_IP_2022-07-23_48,1/23/2022,SP1399,2022-09-30T12:33:27,,FALSE
11/26/2021,IP1400,kale,1810,H1400,3,10/27/2021,9,13,LOT1400_IP_2021-11-26_13,2/12/2022,SP1400,2022-11-17T21:14:25,,TRUE
5/21/2022,IP1401,Cucumbers,5015,H1401,5,8/20/2021,25,35,LOT1401_IP_2022-05-21_35,1/9/2022,SP1401,2022-08-26T16:17:21,,FALSE
2/13/2023,IP1402,melons,3189,H1402,4,9/25/2021,16,23,LOT1402_IP_2023-02-13_23,1/27/2022,SP1402,2022-10-09T16:26:18,,FALSE
5/30/2022,IP1403,kale,2131,H1403,3,11/28/2021,11,15,LOT1403_IP_2022-05-30_15,2/28/2022,SP1403,2022-12-28T03:16:27,,FALSE
2/5/2022,IP1404,kale,1711,H1404,2,8/2/2021,9,12,LOT1404_IP_2022-02-05_12,1/1/2022,SP1404,2022-08-04T21:37:18,,TRUE
11/27/2022,IP1405,kale,1615,H1405,2,9/14/2021,8,12,LOT1405_IP_2022-11-27_12,1/22/2022,SP1405,2022-09-26T07:37:43,,FALSE
9/25/2022,IP1406,sweet potato,9699,H1406,10,8/29/2021,49,68,LOT1406_IP_2022-09-25_68,1/14/2022,SP1406,2022-09-06T22:38:05,,FALSE
2/8/2022,IP1407,sweet potato,9871,H1407,10,9/26/2021,49,69,LOT1407_IP_2022-02-08_69,1/28/2022,SP1407,2022-10-11T18:54:10,,FALSE
3/17/2022,IP1408,basil,6871,H1408,7,9/19/2021,35,48,LOT1408_IP_2022-03-17_48,1/24/2022,SP1408,2022-10-02T18:37:36,,FALSE
11/19/2022,IP1409,kale,1847,H1409,3,10/8/2021,10,13,LOT1409_IP_2022-11-19_13,2/2/2022,SP1409,2022-10-26T01:20:25,,FALSE
1/21/2023,IP1410,bell peppers,5508,H1410,6,9/18/2021,28,39,LOT1410_IP_2023-01-21_39,1/24/2022,SP1410,2022-10-01T06:34:50,,FALSE
2/17/2023,IP1411,basil,6891,H1411,7,9/13/2021,35,48,LOT1411_IP_2023-02-17_48,1/21/2022,SP1411,2022-09-25T20:48:53,,TRUE
10/6/2022,IP1412,potato,8683,H1412,9,8/29/2021,43,61,LOT1412_IP_2022-10-06_61,1/14/2022,SP1412,2022-09-07T02:14:21,,TRUE
4/27/2022,IP1413,Cucumbers,4817,H1413,5,10/9/2021,24,34,LOT1413_IP_2022-04-27_34,2/3/2022,SP1413,2022-10-27T16:59:27,,FALSE
3/22/2022,IP1414,parsley,8300,H1414,8,8/14/2021,42,58,LOT1414_IP_2022-03-22_58,1/6/2022,SP1414,2022-08-18T20:50:59,,FALSE
5/23/2022,IP1415,bell peppers,5595,H1415,6,8/23/2021,28,39,LOT1415_IP_2022-05-23_39,1/11/2022,SP1415,2022-08-30T06:47:59,,FALSE
1/11/2023,IP1416,parsley,8502,H1416,9,9/27/2021,43,60,LOT1416_IP_2023-01-11_60,1/28/2022,SP1416,2022-10-12T09:19:17,,TRUE
1/28/2023,IP1417,lettuce,443,H1417,1,8/1/2021,3,3,LOT1417_IP_2023-01-28_3,12/31/2021,SP1417,2022-08-03T20:23:22,,FALSE
2/5/2022,IP1418,melons,3607,H1418,4,8/19/2021,18,25,LOT1418_IP_2022-02-05_25,1/9/2022,SP1418,2022-08-25T15:03:25,,FALSE
10/26/2022,IP1419,sweet potato,9504,H1419,10,10/4/2021,48,67,LOT1419_IP_2022-10-26_67,1/31/2022,SP1419,2022-10-20T19:10:45,,FALSE
8/16/2022,IP1420,kale,2039,H1420,3,10/27/2021,11,15,LOT1420_IP_2022-08-16_15,2/12/2022,SP1420,2022-11-18T15:15:48,,FALSE
10/19/2021,IP1421,potato,8901,H1421,9,10/2/2021,45,62,LOT1421_IP_2021-10-19_62,1/30/2022,SP1421,2022-10-18T13:06:36,,FALSE
2/19/2023,IP1422,cilantro,7643,H1422,8,10/19/2021,38,54,LOT1422_IP_2023-02-19_54,2/8/2022,SP1422,2022-11-07T23:20:11,,FALSE
12/26/2022,IP1423,melons,3393,H1423,4,9/22/2021,17,24,LOT1423_IP_2022-12-26_24,1/25/2022,SP1423,2022-10-05T22:19:24,,FALSE
1/12/2022,IP1424,Cucumbers,4877,H1424,5,9/24/2021,25,34,LOT1424_IP_2022-01-12_34,1/26/2022,SP1424,2022-10-08T11:36:06,,FALSE
11/26/2022,IP1425,chili peppers,5978,H1425,6,10/26/2021,30,42,LOT1425_IP_2022-11-26_42,2/11/2022,SP1425,2022-11-17T06:49:18,,FALSE
12/22/2021,IP1426,chili peppers,6407,H1426,7,10/28/2021,32,45,LOT1426_IP_2021-12-22_45,2/12/2022,SP1426,2022-11-19T16:29:44,,FALSE
2/16/2022,IP1427,bell peppers,5573,H1427,6,11/23/2021,28,39,LOT1427_IP_2022-02-16_39,2/25/2022,SP1427,2022-12-21T09:04:01,,FALSE
3/16/2022,IP1428,Cucumbers,4916,H1428,5,8/26/2021,25,35,LOT1428_IP_2022-03-16_35,1/12/2022,SP1428,2022-09-03T11:43:43,,FALSE
8/24/2022,IP1429,parsley,8152,H1429,8,9/18/2021,41,57,LOT1429_IP_2022-08-24_57,1/24/2022,SP1429,2022-10-02T00:36:13,,TRUE
1/15/2022,IP1430,potato,8871,H1430,9,10/27/2021,44,62,LOT1430_IP_2022-01-15_62,2/12/2022,SP1430,2022-11-18T18:52:04,,FALSE
10/10/2021,IP1431,arugula,2336,H1431,3,8/7/2021,12,17,LOT1431_IP_2021-10-10_17,1/3/2022,SP1431,2022-08-10T18:12:04,,FALSE
2/13/2023,IP1432,sweet potato,9402,H1432,9,10/11/2021,47,66,LOT1432_IP_2023-02-13_66,2/4/2022,SP1432,2022-10-29T12:14:46,,FALSE
1/3/2023,IP1433,sweet potato,9457,H1433,10,11/5/2021,47,66,LOT1433_IP_2023-01-03_66,2/16/2022,SP1433,2022-11-29T18:00:14,,FALSE
2/28/2022,IP1434,Cucumbers,4656,H1434,5,11/1/2021,24,33,LOT1434_IP_2022-02-28_33,2/14/2022,SP1434,2022-11-24T19:03:07,,FALSE
11/21/2021,IP1435,basil,7161,H1435,7,9/5/2021,36,50,LOT1435_IP_2021-11-21_50,1/17/2022,SP1435,2022-09-14T21:40:43,,FALSE
8/5/2022,IP1436,kale,1595,H1436,2,10/7/2021,8,11,LOT1436_IP_2022-08-05_11,2/2/2022,SP1436,2022-10-25T07:19:02,,FALSE
10/25/2022,IP1437,lettuce,575,H1437,1,10/14/2021,3,4,LOT1437_IP_2022-10-25_4,2/5/2022,SP1437,2022-11-02T09:57:57,,TRUE
1/1/2023,IP1438,Cucumbers,4731,H1438,5,8/28/2021,24,33,LOT1438_IP_2023-01-01_33,1/13/2022,SP1438,2022-09-05T03:22:46,,FALSE
12/25/2021,IP1439,bell peppers,5530,H1439,6,9/20/2021,28,39,LOT1439_IP_2021-12-25_39,1/24/2022,SP1439,2022-10-03T12:38:59,,FALSE
10/2/2021,IP1440,spinach,1132,H1440,2,10/9/2021,6,8,LOT1440_IP_2021-10-02_8,2/3/2022,SP1440,2022-10-27T16:59:27,,FALSE
8/1/2022,IP1441,potato,9050,H1441,9,9/23/2021,45,63,LOT1441_IP_2022-08-01_63,1/26/2022,SP1441,2022-10-07T03:09:37,,FALSE
7/4/2022,IP1442,melons,3232,H1442,4,11/26/2021,17,23,LOT1442_IP_2022-07-04_23,2/26/2022,SP1442,2022-12-24T19:58:23,,FALSE
10/21/2021,IP1443,kale,1609,H1443,2,10/18/2021,8,12,LOT1443_IP_2021-10-21_12,2/7/2022,SP1443,2022-11-06T18:29:58,,FALSE
12/11/2022,IP1444,parsley,8266,H1444,8,10/8/2021,41,58,LOT1444_IP_2022-12-11_58,2/2/2022,SP1444,2022-10-26T01:20:25,,FALSE
12/29/2021,IP1445,cilantro,7372,H1445,8,10/10/2021,37,52,LOT1445_IP_2021-12-29_52,2/4/2022,SP1445,2022-10-29T01:25:57,,FALSE
6/18/2022,IP1446,bell peppers,5652,H1446,6,9/1/2021,28,40,LOT1446_IP_2022-06-18_40,1/15/2022,SP1446,2022-09-10T09:32:26,,FALSE
11/10/2022,IP1447,melons,3372,H1447,4,11/15/2021,17,24,LOT1447_IP_2022-11-10_24,2/21/2022,SP1447,2022-12-11T11:09:47,,FALSE
9/10/2022,IP1448,potato,9126,H1448,9,10/22/2021,46,64,LOT1448_IP_2022-09-10_64,2/9/2022,SP1448,2022-11-12T15:04:45,,FALSE
8/24/2022,IP1449,sweet potato,9525,H1449,10,9/4/2021,48,67,LOT1449_IP_2022-08-24_67,1/17/2022,SP1449,2022-09-14T07:15:37,,FALSE
2/6/2022,IP1450,bell peppers,5527,H1450,6,11/24/2021,28,39,LOT1450_IP_2022-02-06_39,2/25/2022,SP1450,2022-12-22T06:41:41,,FALSE
11/23/2021,IP1451,Tomatoes,3665,H1451,4,10/18/2021,19,26,LOT1451_IP_2021-11-23_26,2/7/2022,SP1451,2022-11-07T01:42:31,,FALSE
3/18/2022,IP1452,spinach,1401,H1452,2,9/17/2021,7,10,LOT1452_IP_2022-03-18_10,1/23/2022,SP1452,2022-09-30T16:09:44,,FALSE
8/25/2022,IP1453,melons,3487,H1453,4,8/24/2021,18,25,LOT1453_IP_2022-08-25_25,1/11/2022,SP1453,2022-08-31T11:38:12,,FALSE
8/12/2022,IP1454,parsley,7922,H1454,8,8/6/2021,40,56,LOT1454_IP_2022-08-12_56,1/3/2022,SP1454,2022-08-09T20:34:25,,FALSE
8/12/2022,IP1455,Cucumbers,4411,H1455,5,10/18/2021,22,31,LOT1455_IP_2022-08-12_31,2/7/2022,SP1455,2022-11-07T12:31:21,,FALSE
9/10/2021,IP1456,potato,8863,H1456,9,11/18/2021,44,62,LOT1456_IP_2021-09-10_62,2/23/2022,SP1456,2022-12-15T16:05:31,,FALSE
6/11/2022,IP1457,arugula,2434,H1457,3,9/28/2021,13,17,LOT1457_IP_2022-06-11_17,1/28/2022,SP1457,2022-10-13T03:20:40,,FALSE
3/22/2022,IP1458,arugula,2374,H1458,3,8/3/2021,12,17,LOT1458_IP_2022-03-22_17,1/1/2022,SP1458,2022-08-05T15:38:41,,TRUE
11/27/2022,IP1459,potato,8671,H1459,9,11/12/2021,43,61,LOT1459_IP_2022-11-27_61,2/20/2022,SP1459,2022-12-08T11:04:16,,TRUE
5/12/2022,IP1460,kale,1846,H1460,3,8/19/2021,10,13,LOT1460_IP_2022-05-12_13,1/9/2022,SP1460,2022-08-26T01:52:15,,FALSE
10/31/2022,IP1461,bell peppers,5654,H1461,6,11/18/2021,28,40,LOT1461_IP_2022-10-31_40,2/22/2022,SP1461,2022-12-14T22:04:09,,FALSE
2/13/2022,IP1462,arugula,2248,H1462,3,10/18/2021,12,16,LOT1462_IP_2022-02-13_16,2/7/2022,SP1462,2022-11-07T08:55:04,,FALSE
10/29/2021,IP1463,basil,6979,H1463,7,9/1/2021,35,49,LOT1463_IP_2021-10-29_49,1/15/2022,SP1463,2022-09-10T09:32:26,,FALSE
12/25/2022,IP1464,Tomatoes,4342,H1464,5,10/18/2021,22,31,LOT1464_IP_2022-12-25_31,2/8/2022,SP1464,2022-11-07T19:43:54,,FALSE
7/25/2022,IP1465,spinach,1503,H1465,2,9/1/2021,8,11,LOT1465_IP_2022-07-25_11,1/15/2022,SP1465,2022-09-10T09:32:26,,FALSE
2/6/2023,IP1466,lettuce,672,H1466,2,11/19/2021,4,5,LOT1466_IP_2023-02-06_5,2/23/2022,SP1466,2022-12-16T02:54:21,,FALSE
2/21/2022,IP1467,melons,3563,H1467,4,10/2/2021,18,25,LOT1467_IP_2022-02-21_25,1/30/2022,SP1467,2022-10-18T13:06:36,,FALSE
12/28/2021,IP1468,spinach,1443,H1468,2,10/22/2021,8,10,LOT1468_IP_2021-12-28_10,2/9/2022,SP1468,2022-11-12T15:04:45,,FALSE
5/12/2022,IP1469,arugula,2581,H1469,3,11/26/2021,13,18,LOT1469_IP_2022-05-12_18,2/26/2022,SP1469,2022-12-24T23:34:39,,FALSE
10/28/2022,IP1470,Cucumbers,4637,H1470,5,8/18/2021,23,33,LOT1470_IP_2022-10-28_33,1/8/2022,SP1470,2022-08-24T13:49:29,,FALSE
10/12/2022,IP1471,bell peppers,5201,H1471,6,8/11/2021,26,37,LOT1471_IP_2022-10-12_37,1/5/2022,SP1471,2022-08-15T20:45:28,,FALSE
2/11/2022,IP1472,potato,8633,H1472,9,10/20/2021,43,60,LOT1472_IP_2022-02-11_60,2/8/2022,SP1472,2022-11-09T07:46:40,,FALSE
3/1/2023,IP1473,arugula,2245,H1473,3,10/5/2021,12,16,LOT1473_IP_2023-03-01_16,2/1/2022,SP1473,2022-10-22T18:02:20,,FALSE
11/25/2022,IP1474,lettuce,642,H1474,1,11/22/2021,4,5,LOT1474_IP_2022-11-25_5,2/24/2022,SP1474,2022-12-19T21:01:16,,FALSE
4/24/2022,IP1475,basil,6776,H1475,7,8/25/2021,34,48,LOT1475_IP_2022-04-24_48,1/12/2022,SP1475,2022-09-01T16:28:24,,FALSE
10/23/2021,IP1476,bell peppers,5536,H1476,6,8/17/2021,28,39,LOT1476_IP_2021-10-23_39,1/8/2022,SP1476,2022-08-23T05:23,,FALSE
1/27/2023,IP1477,parsley,8390,H1477,9,11/29/2021,42,59,LOT1477_IP_2023-01-27_59,2/28/2022,SP1477,2022-12-29T11:42:57,,TRUE
11/26/2022,IP1478,Cucumbers,4896,H1478,5,9/2/2021,25,34,LOT1478_IP_2022-11-26_34,1/16/2022,SP1478,2022-09-11T07:10:05,,FALSE
9/24/2021,IP1479,basil,6701,H1479,7,10/31/2021,34,47,LOT1479_IP_2021-09-24_47,2/14/2022,SP1479,2022-11-23T03:24:05,,FALSE
1/10/2023,IP1480,Cucumbers,4459,H1480,5,10/15/2021,23,31,LOT1480_IP_2023-01-10_31,2/6/2022,SP1480,2022-11-03T03:59:20,,FALSE
4/25/2022,IP1481,Cucumbers,4587,H1481,5,10/10/2021,23,32,LOT1481_IP_2022-04-25_32,2/4/2022,SP1481,2022-10-28T18:13:24,,FALSE
2/24/2022,IP1482,spinach,1414,H1482,2,11/29/2021,8,10,LOT1482_IP_2022-02-24_10,2/28/2022,SP1482,2022-12-29T11:42:57,,FALSE
8/26/2021,IP1483,kale,1756,H1483,3,9/2/2021,9,13,LOT1483_IP_2021-08-26_13,1/16/2022,SP1483,2022-09-12T01:11:28,,FALSE
1/26/2022,IP1484,kale,1923,H1484,3,8/18/2021,10,14,LOT1484_IP_2022-01-26_14,1/8/2022,SP1484,2022-08-24T03:00:40,,FALSE
10/16/2021,IP1485,parsley,8067,H1485,8,11/2/2021,40,57,LOT1485_IP_2021-10-16_57,2/15/2022,SP1485,2022-11-25T09:28:14,,TRUE
5/24/2022,IP1486,cilantro,7771,H1486,8,9/22/2021,39,54,LOT1486_IP_2022-05-24_54,1/25/2022,SP1486,2022-10-05T22:19:24,,FALSE
9/20/2021,IP1487,kale,2163,H1487,3,10/17/2021,11,15,LOT1487_IP_2021-09-20_15,2/7/2022,SP1487,2022-11-06T04:04:52,,FALSE
1/5/2022,IP1488,parsley,8421,H1488,9,8/16/2021,42,59,LOT1488_IP_2022-01-05_59,1/7/2022,SP1488,2022-08-21T20:56:31,,FALSE
6/15/2022,IP1489,kale,2173,H1489,3,11/20/2021,11,15,LOT1489_IP_2022-06-15_15,2/24/2022,SP1489,2022-12-18T01:45:57,,TRUE
11/26/2022,IP1490,parsley,8210,H1490,8,11/9/2021,41,58,LOT1490_IP_2022-11-26_58,2/18/2022,SP1490,2022-12-04T02:32:15,,TRUE
12/29/2021,IP1491,cilantro,7439,H1491,8,8/16/2021,37,52,LOT1491_IP_2021-12-29_52,1/8/2022,SP1491,2022-08-22T07:45:21,,TRUE
12/19/2022,IP1492,chili peppers,5866,H1492,6,9/18/2021,30,41,LOT1492_IP_2022-12-19_41,1/23/2022,SP1492,2022-10-01T02:58:33,,FALSE
5/31/2022,IP1493,kale,1814,H1493,3,10/31/2021,9,13,LOT1493_IP_2022-05-31_13,2/14/2022,SP1493,2022-11-23T14:12:55,,FALSE
3/12/2022,IP1494,cilantro,7558,H1494,8,10/29/2021,38,53,LOT1494_IP_2022-03-12_53,2/13/2022,SP1494,2022-11-21T08:08:46,,FALSE
6/24/2022,IP1495,cilantro,7601,H1495,8,11/3/2021,38,53,LOT1495_IP_2022-06-24_53,2/15/2022,SP1495,2022-11-27T11:56:06,,FALSE
10/18/2021,IP1496,potato,8587,H1496,9,10/25/2021,43,60,LOT1496_IP_2021-10-18_60,2/11/2022,SP1496,2022-11-15T18:46:33,,TRUE
12/7/2021,IP1497,arugula,2901,H1497,4,11/25/2021,15,21,LOT1497_IP_2021-12-07_21,2/26/2022,SP1497,2022-12-23T18:44:27,,FALSE
11/25/2022,IP1498,basil,7010,H1498,7,11/14/2021,35,49,LOT1498_IP_2022-11-25_49,2/21/2022,SP1498,2022-12-10T20:44:41,,FALSE
1/8/2022,IP1499,basil,6824,H1499,7,11/24/2021,34,48,LOT1499_IP_2022-01-08_48,2/26/2022,SP1499,2022-12-22T21:06:47,,FALSE
3/14/2022,IP1500,basil,6559,H1500,7,9/7/2021,33,46,LOT1500_IP_2022-03-14_46,1/18/2022,SP1500,2022-09-18T01:22:31,,FALSE
12/30/2022,IP1501,spinach,1197,H1501,2,11/21/2021,6,9,LOT1501_IP_2022-12-30_9,2/24/2022,SP1501,2022-12-19T17:24:59,,FALSE
3/4/2022,IP1502,basil,6850,H1502,7,8/13/2021,34,48,LOT1502_IP_2022-03-04_48,1/6/2022,SP1502,2022-08-18T02:49:37,,FALSE
8/10/2021,IP1503,bell peppers,5673,H1503,6,10/2/2021,29,40,LOT1503_IP_2021-08-10_40,1/30/2022,SP1503,2022-10-18T09:30:20,,FALSE
7/9/2022,IP1504,melons,3038,H1504,4,11/5/2021,16,21,LOT1504_IP_2022-07-09_21,2/16/2022,SP1504,2022-11-29T10:47:41,,FALSE
1/7/2022,IP1505,potato,9101,H1505,9,8/18/2021,46,64,LOT1505_IP_2022-01-07_64,1/8/2022,SP1505,2022-08-23T19:48:06,,FALSE
8/19/2022,IP1506,Tomatoes,3682,H1506,4,11/15/2021,19,26,LOT1506_IP_2022-08-19_26,2/21/2022,SP1506,2022-12-12T01:34:54,,FALSE
12/12/2022,IP1507,kale,1767,H1507,3,8/10/2021,9,13,LOT1507_IP_2022-12-12_13,1/5/2022,SP1507,2022-08-14T15:55:15,,FALSE
3/8/2022,IP1508,potato,9224,H1508,9,11/1/2021,46,65,LOT1508_IP_2022-03-08_65,2/14/2022,SP1508,2022-11-24T22:39:24,,FALSE
11/17/2022,IP1509,spinach,821,H1509,2,11/16/2021,5,6,LOT1509_IP_2022-11-17_6,2/22/2022,SP1509,2022-12-12T23:12:33,,FALSE
2/11/2023,IP1510,Cucumbers,4429,H1510,5,9/15/2021,22,31,LOT1510_IP_2023-02-11_31,1/22/2022,SP1510,2022-09-27T08:51:39,,FALSE
1/14/2023,IP1511,spinach,923,H1511,2,10/19/2021,5,7,LOT1511_IP_2023-01-14_7,2/8/2022,SP1511,2022-11-08T10:09,,FALSE
2/5/2022,IP1512,melons,3100,H1512,4,11/10/2021,16,22,LOT1512_IP_2022-02-05_22,2/19/2022,SP1512,2022-12-05T14:35:01,,TRUE
10/5/2022,IP1513,basil,7048,H1513,7,10/21/2021,35,49,LOT1513_IP_2022-10-05_49,2/9/2022,SP1513,2022-11-10T16:13:09,,FALSE
7/12/2022,IP1514,sweet potato,9321,H1514,9,10/4/2021,47,65,LOT1514_IP_2022-07-12_65,2/1/2022,SP1514,2022-10-21T13:12:08,,FALSE
9/7/2021,IP1515,potato,9173,H1515,9,8/21/2021,46,64,LOT1515_IP_2021-09-07_64,1/10/2022,SP1515,2022-08-27T13:55:01,,FALSE
11/30/2021,IP1516,melons,3186,H1516,4,8/3/2021,16,23,LOT1516_IP_2021-11-30_23,1/1/2022,SP1516,2022-08-05T12:02:24,,FALSE
1/14/2022,IP1517,spinach,1205,H1517,2,9/22/2021,6,9,LOT1517_IP_2022-01-14_9,1/26/2022,SP1517,2022-10-06T09:08:14,,FALSE
8/14/2022,IP1518,parsley,8481,H1518,9,9/8/2021,42,59,LOT1518_IP_2022-08-14_59,1/19/2022,SP1518,2022-09-18T19:23:54,,FALSE
6/5/2022,IP1519,lettuce,435,H1519,1,10/26/2021,3,3,LOT1519_IP_2022-06-05_3,2/11/2022,SP1519,2022-11-16T23:36:45,,FALSE
2/25/2023,IP1520,chili peppers,6136,H1520,6,10/21/2021,31,43,LOT1520_IP_2023-02-25_43,2/9/2022,SP1520,2022-11-10T23:25:42,,FALSE
6/18/2022,IP1521,parsley,8082,H1521,8,8/30/2021,41,57,LOT1521_IP_2022-06-18_57,1/14/2022,SP1521,2022-09-07T16:39:27,,FALSE
11/16/2021,IP1522,Cucumbers,4448,H1522,5,8/14/2021,23,31,LOT1522_IP_2021-11-16_31,1/6/2022,SP1522,2022-08-19T14:52:22,,FALSE
11/16/2021,IP1523,Cucumbers,4346,H1523,5,11/28/2021,22,31,LOT1523_IP_2021-11-16_31,2/27/2022,SP1523,2022-12-27T12:51:21,,FALSE
8/28/2022,IP1524,bell peppers,5537,H1524,6,10/21/2021,28,39,LOT1524_IP_2022-08-28_39,2/9/2022,SP1524,2022-11-11T06:38:15,,FALSE
11/14/2021,IP1525,arugula,2610,H1525,3,10/12/2021,13,18,LOT1525_IP_2021-11-14_18,2/4/2022,SP1525,2022-10-30T13:28:42,,TRUE
3/28/2022,IP1526,bell peppers,5119,H1526,6,8/26/2021,26,36,LOT1526_IP_2022-03-28_36,1/12/2022,SP1526,2022-09-03T15:20,,FALSE
10/26/2022,IP1527,spinach,1148,H1527,2,11/8/2021,6,8,LOT1527_IP_2022-10-26_8,2/18/2022,SP1527,2022-12-03T04:54:36,,FALSE
5/17/2022,IP1528,Cucumbers,4569,H1528,5,9/4/2021,23,32,LOT1528_IP_2022-05-17_32,1/17/2022,SP1528,2022-09-14T10:51:53,,FALSE
2/13/2023,IP1529,parsley,7881,H1529,8,10/20/2021,40,55,LOT1529_IP_2023-02-13_55,2/8/2022,SP1529,2022-11-09T11:22:57,,FALSE
6/15/2022,IP1530,chili peppers,6334,H1530,7,10/7/2021,32,44,LOT1530_IP_2022-06-15_44,2/2/2022,SP1530,2022-10-24T09:41:23,,FALSE
8/14/2022,IP1531,cilantro,7848,H1531,8,8/12/2021,39,55,LOT1531_IP_2022-08-14_55,1/6/2022,SP1531,2022-08-17T05:11:57,,FALSE
10/31/2022,IP1532,chili peppers,5805,H1532,6,10/5/2021,29,41,LOT1532_IP_2022-10-31_41,2/1/2022,SP1532,2022-10-22T10:49:47,,FALSE
12/2/2022,IP1533,spinach,953,H1533,2,9/28/2021,5,7,LOT1533_IP_2022-12-02_7,1/29/2022,SP1533,2022-10-13T21:22:02,,FALSE
7/1/2022,IP1534,arugula,2742,H1534,3,8/18/2021,14,19,LOT1534_IP_2022-07-01_19,1/8/2022,SP1534,2022-08-23T19:48:06,,FALSE
4/27/2022,IP1535,parsley,8151,H1535,8,8/6/2021,41,57,LOT1535_IP_2022-04-27_57,1/2/2022,SP1535,2022-08-09T09:45:35,,FALSE
1/23/2022,IP1536,spinach,1349,H1536,2,10/15/2021,7,10,LOT1536_IP_2022-01-23_10,2/6/2022,SP1536,2022-11-04T01:37,,TRUE
10/5/2022,IP1537,lettuce,198,H1537,1,11/26/2021,1,2,LOT1537_IP_2022-10-05_2,2/27/2022,SP1537,2022-12-25T17:36:02,,FALSE
2/2/2023,IP1538,sweet potato,9770,H1538,10,8/9/2021,49,68,LOT1538_IP_2023-02-02_68,1/4/2022,SP1538,2022-08-12T20:39:56,,FALSE
5/31/2022,IP1539,sweet potato,9762,H1539,10,10/2/2021,49,68,LOT1539_IP_2022-05-31_68,1/30/2022,SP1539,2022-10-18T02:17:47,,FALSE
2/6/2023,IP1540,chili peppers,5775,H1540,6,10/25/2021,29,41,LOT1540_IP_2023-02-06_41,2/11/2022,SP1540,2022-11-15T22:22:49,,FALSE
2/26/2022,IP1541,sweet potato,9519,H1541,10,9/13/2021,48,67,LOT1541_IP_2022-02-26_67,1/21/2022,SP1541,2022-09-25T17:12:37,,FALSE
5/1/2022,IP1542,parsley,7945,H1542,8,8/31/2021,40,56,LOT1542_IP_2022-05-01_56,1/15/2022,SP1542,2022-09-09T01:05:57,,TRUE
7/19/2022,IP1543,kale,1867,H1543,3,10/16/2021,10,13,LOT1543_IP_2022-07-19_13,2/6/2022,SP1543,2022-11-04T16:02:06,,TRUE
6/7/2022,IP1544,Cucumbers,4503,H1544,5,10/30/2021,23,32,LOT1544_IP_2022-06-07_32,2/14/2022,SP1544,2022-11-22T16:35:15,,FALSE
2/10/2022,IP1545,bell peppers,5654,H1545,6,11/2/2021,28,40,LOT1545_IP_2022-02-10_40,2/15/2022,SP1545,2022-11-26T03:29:37,,FALSE
1/20/2022,IP1546,sweet potato,9693,H1546,10,10/6/2021,48,68,LOT1546_IP_2022-01-20_68,2/1/2022,SP1546,2022-10-23T01:14:54,,TRUE
1/2/2022,IP1547,kale,1958,H1547,3,9/10/2021,10,14,LOT1547_IP_2022-01-02_14,1/20/2022,SP1547,2022-09-21T23:05:42,,FALSE
2/20/2022,IP1548,Cucumbers,4634,H1548,5,9/10/2021,23,33,LOT1548_IP_2022-02-20_33,1/20/2022,SP1548,2022-09-22T02:41:59,,FALSE
12/9/2022,IP1549,Tomatoes,3936,H1549,4,9/3/2021,20,28,LOT1549_IP_2022-12-09_28,1/16/2022,SP1549,2022-09-13T13:14:14,,FALSE
2/8/2023,IP1550,potato,8974,H1550,9,10/17/2021,45,63,LOT1550_IP_2023-02-08_63,2/7/2022,SP1550,2022-11-06T00:28:35,,FALSE
9/10/2022,IP1551,kale,2191,H1551,3,10/30/2021,11,16,LOT1551_IP_2022-09-10_16,2/14/2022,SP1551,2022-11-22T16:35:15,,FALSE
3/13/2022,IP1552,bell peppers,5618,H1552,6,9/27/2021,28,39,LOT1552_IP_2022-03-13_39,1/28/2022,SP1552,2022-10-12T02:06:44,,FALSE
2/13/2022,IP1553,sweet potato,9375,H1553,9,9/8/2021,47,66,LOT1553_IP_2022-02-13_66,1/19/2022,SP1553,2022-09-19T17:01:34,,TRUE
3/8/2022,IP1554,sweet potato,9641,H1554,10,8/22/2021,48,67,LOT1554_IP_2022-03-08_67,1/10/2022,SP1554,2022-08-28T22:21:30,,FALSE
8/21/2022,IP1555,bell peppers,5318,H1555,6,9/21/2021,27,37,LOT1555_IP_2022-08-21_37,1/25/2022,SP1555,2022-10-05T11:30:34,,TRUE
10/8/2021,IP1556,sweet potato,9735,H1556,10,9/2/2021,49,68,LOT1556_IP_2021-10-08_68,1/15/2022,SP1556,2022-09-11T03:33:49,,FALSE
2/22/2022,IP1557,cilantro,7192,H1557,7,11/3/2021,36,50,LOT1557_IP_2022-02-22_50,2/15/2022,SP1557,2022-11-26T21:30:59,,TRUE
6/23/2022,IP1558,bell peppers,5596,H1558,6,11/6/2021,28,39,LOT1558_IP_2022-06-23_39,2/17/2022,SP1558,2022-11-30T19:14:10,,TRUE
2/24/2023,IP1559,Tomatoes,3937,H1559,4,8/31/2021,20,28,LOT1559_IP_2023-02-24_28,1/15/2022,SP1559,2022-09-09T15:31:03,,FALSE
8/23/2021,IP1560,potato,8952,H1560,9,8/18/2021,45,63,LOT1560_IP_2021-08-23_63,1/8/2022,SP1560,2022-08-24T03:00:40,,FALSE
9/30/2022,IP1561,lettuce,685,H1561,2,8/19/2021,4,5,LOT1561_IP_2022-09-30_5,1/9/2022,SP1561,2022-08-25T00:38:19,,FALSE
8/30/2021,IP1562,kale,1686,H1562,2,9/16/2021,9,12,LOT1562_IP_2021-08-30_12,1/23/2022,SP1562,2022-09-28T17:18:08,,FALSE
3/25/2022,IP1563,spinach,1164,H1563,2,8/5/2021,6,8,LOT1563_IP_2022-03-25_8,1/2/2022,SP1563,2022-08-08T01:19:06,,FALSE
3/9/2022,IP1564,cilantro,7305,H1564,8,9/23/2021,37,51,LOT1564_IP_2022-03-09_51,1/26/2022,SP1564,2022-10-07T17:34:43,,FALSE
8/10/2022,IP1565,potato,9198,H1565,9,8/4/2021,46,64,LOT1565_IP_2022-08-10_64,1/1/2022,SP1565,2022-08-06T13:16:20,,FALSE
3/4/2022,IP1566,parsley,7907,H1566,8,9/8/2021,40,55,LOT1566_IP_2022-03-04_55,1/19/2022,SP1566,2022-09-19T13:25:17,,FALSE
8/19/2021,IP1567,chili peppers,5920,H1567,6,9/29/2021,30,42,LOT1567_IP_2021-08-19_42,1/29/2022,SP1567,2022-10-14T18:59:42,,FALSE
5/24/2022,IP1568,kale,2163,H1568,3,10/10/2021,11,15,LOT1568_IP_2022-05-24_15,2/3/2022,SP1568,2022-10-28T14:37:07,,FALSE
7/28/2022,IP1569,Tomatoes,3697,H1569,4,10/18/2021,19,26,LOT1569_IP_2022-07-28_26,2/7/2022,SP1569,2022-11-07T08:55:04,,FALSE
11/25/2021,IP1570,Cucumbers,4986,H1570,5,11/8/2021,25,35,LOT1570_IP_2021-11-25_35,2/18/2022,SP1570,2022-12-02T21:42:02,,FALSE
12/18/2021,IP1571,bell peppers,5289,H1571,6,10/8/2021,27,37,LOT1571_IP_2021-12-18_37,2/2/2022,SP1571,2022-10-25T21:44:09,,FALSE
10/23/2022,IP1572,parsley,8043,H1572,8,10/24/2021,40,56,LOT1572_IP_2022-10-23_56,2/10/2022,SP1572,2022-11-14T13:56:20,,FALSE
4/14/2022,IP1573,kale,2028,H1573,3,9/20/2021,11,14,LOT1573_IP_2022-04-14_14,1/25/2022,SP1573,2022-10-04T10:16:38,,FALSE
6/12/2022,IP1574,parsley,8318,H1574,8,11/9/2021,42,58,LOT1574_IP_2022-06-12_58,2/18/2022,SP1574,2022-12-04T20:33:38,,FALSE
1/13/2023,IP1575,kale,2065,H1575,3,8/22/2021,11,15,LOT1575_IP_2023-01-13_15,1/11/2022,SP1575,2022-08-29T16:22:53,,FALSE
9/29/2021,IP1576,sweet potato,9624,H1576,10,11/27/2021,48,67,LOT1576_IP_2021-09-29_67,2/27/2022,SP1576,2022-12-26T15:13:42,,FALSE
3/3/2022,IP1577,sweet potato,9893,H1577,10,9/30/2021,49,69,LOT1577_IP_2022-03-03_69,1/30/2022,SP1577,2022-10-16T10:38:44,,FALSE
6/16/2022,IP1578,Cucumbers,5039,H1578,5,11/21/2021,25,35,LOT1578_IP_2022-06-16_35,2/24/2022,SP1578,2022-12-19T02:59:53,,FALSE
11/5/2021,IP1579,lettuce,791,H1579,2,8/12/2021,4,6,LOT1579_IP_2021-11-05_6,1/6/2022,SP1579,2022-08-17T05:11:57,,FALSE
9/6/2022,IP1580,cilantro,7866,H1580,8,11/13/2021,39,55,LOT1580_IP_2022-09-06_55,2/20/2022,SP1580,2022-12-09T15:54:28,,TRUE
8/28/2022,IP1581,parsley,8503,H1581,9,10/22/2021,43,60,LOT1581_IP_2022-08-28_60,2/10/2022,SP1581,2022-11-12T18:41:01,,FALSE
11/21/2022,IP1582,arugula,2685,H1582,3,11/19/2021,14,19,LOT1582_IP_2022-11-21_19,2/23/2022,SP1582,2022-12-16T20:55:44,,FALSE
12/5/2021,IP1583,melons,3427,H1583,4,11/28/2021,17,24,LOT1583_IP_2021-12-05_24,2/28/2022,SP1583,2022-12-28T03:16:27,,FALSE
2/3/2022,IP1584,bell peppers,5433,H1584,6,11/7/2021,27,38,LOT1584_IP_2022-02-03_38,2/17/2022,SP1584,2022-12-02T10:53:13,,FALSE
1/31/2022,IP1585,melons,3451,H1585,4,10/11/2021,18,24,LOT1585_IP_2022-01-31_24,2/4/2022,SP1585,2022-10-30T06:16:09,,TRUE
8/29/2022,IP1586,Cucumbers,4537,H1586,5,11/11/2021,23,32,LOT1586_IP_2022-08-29_32,2/19/2022,SP1586,2022-12-07T09:50:20,,FALSE
1/30/2022,IP1587,arugula,2766,H1587,3,12/1/2021,14,20,LOT1587_IP_2022-01-30_20,3/1/2022,SP1587,2022-12-30T23:45:42,,TRUE
5/31/2022,IP1588,melons,3534,H1588,4,9/2/2021,18,25,LOT1588_IP_2022-05-31_25,1/16/2022,SP1588,2022-09-12T04:47:45,,FALSE
11/30/2021,IP1589,Tomatoes,4069,H1589,5,11/7/2021,21,29,LOT1589_IP_2021-11-30_29,2/17/2022,SP1589,2022-12-01T16:51:50,,FALSE
2/28/2023,IP1590,lettuce,464,H1590,1,8/6/2021,3,4,LOT1590_IP_2023-02-28_4,1/2/2022,SP1590,2022-08-09T13:21:52,,FALSE
1/15/2022,IP1591,Tomatoes,4065,H1591,5,11/30/2021,21,29,LOT1591_IP_2022-01-15_29,3/1/2022,SP1591,2022-12-30T12:56:53,,FALSE
1/7/2022,IP1592,lettuce,362,H1592,1,9/25/2021,2,3,LOT1592_IP_2022-01-07_3,1/27/2022,SP1592,2022-10-10T14:03:58,,TRUE
3/30/2022,IP1593,bell peppers,5266,H1593,6,11/18/2021,27,37,LOT1593_IP_2022-03-30_37,2/22/2022,SP1593,2022-12-15T01:40:25,,FALSE
8/21/2022,IP1594,melons,3160,H1594,4,11/20/2021,16,22,LOT1594_IP_2022-08-21_22,2/24/2022,SP1594,2022-12-18T08:58:30,,FALSE
2/28/2022,IP1595,bell peppers,5696,H1595,6,11/16/2021,29,40,LOT1595_IP_2022-02-28_40,2/22/2022,SP1595,2022-12-13T10:01:23,,FALSE
6/16/2022,IP1596,cilantro,7326,H1596,8,8/8/2021,37,51,LOT1596_IP_2022-06-16_51,1/3/2022,SP1596,2022-08-11T12:13:27,,FALSE
10/23/2021,IP1597,lettuce,721,H1597,2,10/4/2021,4,5,LOT1597_IP_2021-10-23_5,2/1/2022,SP1597,2022-10-21T05:59:35,,FALSE
9/3/2021,IP1598,chili peppers,5831,H1598,6,11/27/2021,29,41,LOT1598_IP_2021-09-03_41,2/27/2022,SP1598,2022-12-26T04:24:52,,FALSE
2/19/2023,IP1599,Tomatoes,4201,H1599,5,8/7/2021,21,30,LOT1599_IP_2023-02-19_30,1/3/2022,SP1599,2022-08-10T10:59:31,,FALSE
10/7/2021,IP1600,bell peppers,5596,H1600,6,10/3/2021,28,39,LOT1600_IP_2021-10-07_39,1/31/2022,SP1600,2022-10-20T08:21:55,,FALSE
10/20/2021,IP1601,Cucumbers,4691,H1601,5,9/30/2021,24,33,LOT1601_IP_2021-10-20_33,1/30/2022,SP1601,2022-10-16T17:51:17,,FALSE
9/17/2021,IP1602,melons,3338,H1602,4,10/20/2021,17,24,LOT1602_IP_2021-09-17_24,2/8/2022,SP1602,2022-11-10T01:48:03,,FALSE
1/28/2022,IP1603,arugula,2446,H1603,3,8/21/2021,13,17,LOT1603_IP_2022-01-28_17,1/10/2022,SP1603,2022-08-28T11:32:40,,FALSE
5/9/2022,IP1604,cilantro,7461,H1604,8,11/4/2021,37,52,LOT1604_IP_2022-05-09_52,2/16/2022,SP1604,2022-11-28T13:10:02,,FALSE
7/29/2022,IP1605,sweet potato,9761,H1605,10,8/11/2021,49,68,LOT1605_IP_2022-07-29_68,1/5/2022,SP1605,2022-08-15T09:56:38,,TRUE
11/26/2022,IP1606,Tomatoes,3664,H1606,4,9/5/2021,19,26,LOT1606_IP_2022-11-26_26,1/17/2022,SP1606,2022-09-15T19:18:23,,FALSE
6/11/2022,IP1607,parsley,8549,H1607,9,11/13/2021,43,60,LOT1607_IP_2022-06-11_60,2/20/2022,SP1607,2022-12-09T12:18:12,,FALSE
2/9/2022,IP1608,Tomatoes,4338,H1608,5,8/18/2021,22,31,LOT1608_IP_2022-02-09_31,1/8/2022,SP1608,2022-08-23T23:24:23,,FALSE
7/10/2022,IP1609,basil,6883,H1609,7,9/11/2021,35,48,LOT1609_IP_2022-07-10_48,1/20/2022,SP1609,2022-09-22T09:54:32,,FALSE
10/24/2022,IP1610,arugula,2894,H1610,4,9/16/2021,15,20,LOT1610_IP_2022-10-24_20,1/23/2022,SP1610,2022-09-28T20:54:25,,FALSE
2/18/2023,IP1611,potato,8857,H1611,9,8/2/2021,44,62,LOT1611_IP_2023-02-18_62,12/31/2021,SP1611,2022-08-04T14:24:45,,FALSE
10/31/2021,IP1612,kale,1603,H1612,2,8/18/2021,8,11,LOT1612_IP_2021-10-31_11,1/8/2022,SP1612,2022-08-24T03:00:40,,FALSE
2/9/2023,IP1613,parsley,8569,H1613,9,9/28/2021,43,60,LOT1613_IP_2023-02-09_60,1/28/2022,SP1613,2022-10-13T10:33:13,,TRUE
11/14/2022,IP1614,basil,6609,H1614,7,8/16/2021,33,46,LOT1614_IP_2022-11-14_46,1/7/2022,SP1614,2022-08-21T17:20:14,,FALSE
10/21/2021,IP1615,sweet potato,9316,H1615,9,11/18/2021,47,65,LOT1615_IP_2021-10-21_65,2/23/2022,SP1615,2022-12-15T16:05:31,,FALSE
11/3/2022,IP1616,bell peppers,5418,H1616,6,11/30/2021,27,38,LOT1616_IP_2022-11-03_38,2/28/2022,SP1616,2022-12-30T02:08:03,,FALSE
10/25/2021,IP1617,lettuce,426,H1617,1,11/29/2021,3,3,LOT1617_IP_2021-10-25_3,2/28/2022,SP1617,2022-12-29T11:42:57,,FALSE
12/23/2022,IP1618,cilantro,7234,H1618,7,11/5/2021,36,51,LOT1618_IP_2022-12-23_51,2/16/2022,SP1618,2022-11-29T10:47:41,,TRUE
8/17/2021,IP1619,lettuce,700,H1619,2,11/13/2021,4,5,LOT1619_IP_2021-08-17_5,2/20/2022,SP1619,2022-12-08T18:16:49,,FALSE
8/7/2022,IP1620,bell peppers,5567,H1620,6,8/10/2021,28,39,LOT1620_IP_2022-08-07_39,1/4/2022,SP1620,2022-08-14T12:18:59,,FALSE
2/18/2022,IP1621,sweet potato,9363,H1621,9,8/30/2021,47,66,LOT1621_IP_2022-02-18_66,1/14/2022,SP1621,2022-09-07T16:39:27,,FALSE
9/13/2022,IP1622,Tomatoes,4061,H1622,5,8/10/2021,21,29,LOT1622_IP_2022-09-13_29,1/4/2022,SP1622,2022-08-14T05:06:26,,TRUE
8/26/2022,IP1623,bell peppers,5389,H1623,6,9/6/2021,27,38,LOT1623_IP_2022-08-26_38,1/18/2022,SP1623,2022-09-17T03:44:52,,FALSE
3/3/2022,IP1624,parsley,7999,H1624,8,11/10/2021,40,56,LOT1624_IP_2022-03-03_56,2/19/2022,SP1624,2022-12-05T10:58:44,,FALSE
10/6/2022,IP1625,potato,8773,H1625,9,8/21/2021,44,61,LOT1625_IP_2022-10-06_61,1/10/2022,SP1625,2022-08-27T13:55:01,,FALSE
12/5/2021,IP1626,basil,7137,H1626,7,9/18/2021,36,50,LOT1626_IP_2021-12-05_50,1/24/2022,SP1626,2022-10-01T17:23:40,,FALSE
3/31/2022,IP1627,potato,8821,H1627,9,9/22/2021,44,62,LOT1627_IP_2022-03-31_62,1/26/2022,SP1627,2022-10-06T19:57:03,,FALSE
1/10/2023,IP1628,spinach,1226,H1628,2,10/12/2021,7,9,LOT1628_IP_2023-01-10_9,2/4/2022,SP1628,2022-10-31T00:17:32,,FALSE
9/8/2021,IP1629,Tomatoes,3657,H1629,4,9/3/2021,19,26,LOT1629_IP_2021-09-08_26,1/16/2022,SP1629,2022-09-12T22:49:08,,FALSE
1/25/2022,IP1630,arugula,2927,H1630,4,9/21/2021,15,21,LOT1630_IP_2022-01-25_21,1/25/2022,SP1630,2022-10-04T13:52:55,,TRUE
10/16/2022,IP1631,arugula,2868,H1631,4,9/2/2021,15,20,LOT1631_IP_2022-10-16_20,1/16/2022,SP1631,2022-09-11T17:58:55,,FALSE
12/3/2022,IP1632,chili peppers,5978,H1632,6,8/2/2021,30,42,LOT1632_IP_2022-12-03_42,12/31/2021,SP1632,2022-08-04T07:12:11,,FALSE
10/12/2021,IP1633,bell peppers,5424,H1633,6,8/14/2021,27,38,LOT1633_IP_2021-10-12_38,1/6/2022,SP1633,2022-08-19T00:27:16,,FALSE
8/2/2022,IP1634,potato,9291,H1634,9,9/21/2021,46,65,LOT1634_IP_2022-08-02_65,1/25/2022,SP1634,2022-10-05T07:54:18,,FALSE
10/9/2021,IP1635,basil,6996,H1635,7,8/10/2021,35,49,LOT1635_IP_2021-10-09_49,1/4/2022,SP1635,2022-08-14T01:30:09,,FALSE
11/29/2021,IP1636,parsley,7895,H1636,8,8/22/2021,40,55,LOT1636_IP_2021-11-29_55,1/10/2022,SP1636,2022-08-28T15:08:57,,FALSE
6/14/2022,IP1637,Tomatoes,4132,H1637,5,8/13/2021,21,29,LOT1637_IP_2022-06-14_29,1/6/2022,SP1637,2022-08-18T02:49:37,,FALSE
11/8/2022,IP1638,chili peppers,5970,H1638,6,11/21/2021,30,42,LOT1638_IP_2022-11-08_42,2/24/2022,SP1638,2022-12-18T23:23:36,,FALSE
12/28/2021,IP1639,Tomatoes,3914,H1639,4,8/27/2021,20,28,LOT1639_IP_2021-12-28_28,1/13/2022,SP1639,2022-09-03T18:56:17,,FALSE
9/3/2022,IP1640,Cucumbers,4737,H1640,5,8/3/2021,24,33,LOT1640_IP_2022-09-03_33,1/1/2022,SP1640,2022-08-06T09:40:04,,FALSE
6/6/2022,IP1641,sweet potato,9838,H1641,10,11/13/2021,49,69,LOT1641_IP_2022-06-06_69,2/20/2022,SP1641,2022-12-08T18:16:49,,FALSE
6/8/2022,IP1642,spinach,1246,H1642,2,8/11/2021,7,9,LOT1642_IP_2022-06-08_9,1/5/2022,SP1642,2022-08-15T13:32:55,,FALSE
3/21/2022,IP1643,kale,1679,H1643,2,10/24/2021,9,12,LOT1643_IP_2022-03-21_12,2/11/2022,SP1643,2022-11-15T04:21:26,,FALSE
4/16/2022,IP1644,parsley,8528,H1644,9,10/13/2021,43,60,LOT1644_IP_2022-04-16_60,2/5/2022,SP1644,2022-10-31T14:42:38,,FALSE
9/9/2022,IP1645,kale,2205,H1645,3,11/25/2021,11,16,LOT1645_IP_2022-09-09_16,2/26/2022,SP1645,2022-12-23T22:20:43,,FALSE
10/26/2022,IP1646,Tomatoes,3733,H1646,4,8/2/2021,19,26,LOT1646_IP_2022-10-26_26,12/31/2021,SP1646,2022-08-04T14:24:45,,FALSE
7/22/2022,IP1647,melons,3311,H1647,4,9/9/2021,17,23,LOT1647_IP_2022-07-22_23,1/19/2022,SP1647,2022-09-20T11:02:57,,FALSE
9/15/2021,IP1648,bell peppers,5570,H1648,6,11/23/2021,28,39,LOT1648_IP_2021-09-15_39,2/25/2022,SP1648,2022-12-21T05:27:45,,FALSE
3/16/2022,IP1649,lettuce,445,H1649,1,11/20/2021,3,3,LOT1649_IP_2022-03-16_3,2/24/2022,SP1649,2022-12-18T05:22:13,,FALSE
12/31/2021,IP1650,arugula,2295,H1650,3,11/30/2021,12,16,LOT1650_IP_2021-12-31_16,3/1/2022,SP1650,2022-12-30T12:56:53,,FALSE
2/5/2022,IP1651,arugula,2704,H1651,3,11/24/2021,14,19,LOT1651_IP_2022-02-05_19,2/26/2022,SP1651,2022-12-22T21:06:47,,FALSE
3/11/2022,IP1652,potato,9062,H1652,9,10/25/2021,45,63,LOT1652_IP_2022-03-11_63,2/11/2022,SP1652,2022-11-15T11:34,,FALSE
7/18/2022,IP1653,parsley,8542,H1653,9,10/19/2021,43,60,LOT1653_IP_2022-07-18_60,2/8/2022,SP1653,2022-11-08T10:09,,FALSE
9/18/2022,IP1654,potato,9002,H1654,9,9/28/2021,45,63,LOT1654_IP_2022-09-18_63,1/29/2022,SP1654,2022-10-14T08:10:52,,TRUE
8/27/2021,IP1655,Cucumbers,4677,H1655,5,11/16/2021,24,33,LOT1655_IP_2021-08-27_33,2/22/2022,SP1655,2022-12-12T23:12:33,,FALSE
4/22/2022,IP1656,Cucumbers,4713,H1656,5,8/26/2021,24,33,LOT1656_IP_2022-04-22_33,1/12/2022,SP1656,2022-09-03T00:54:54,,FALSE
5/26/2022,IP1657,chili peppers,6298,H1657,7,8/19/2021,32,44,LOT1657_IP_2022-05-26_44,1/9/2022,SP1657,2022-08-25T18:39:42,,TRUE
10/5/2022,IP1658,cilantro,7712,H1658,8,8/3/2021,39,54,LOT1658_IP_2022-10-05_54,1/1/2022,SP1658,2022-08-05T22:51:14,,FALSE
2/1/2023,IP1659,kale,1990,H1659,3,10/24/2021,10,14,LOT1659_IP_2023-02-01_14,2/11/2022,SP1659,2022-11-15T04:21:26,,FALSE
6/8/2022,IP1660,basil,6792,H1660,7,8/1/2021,34,48,LOT1660_IP_2022-06-08_48,12/31/2021,SP1660,2022-08-03T23:59:38,,FALSE
7/13/2022,IP1661,sweet potato,9655,H1661,10,8/2/2021,48,68,LOT1661_IP_2022-07-13_68,12/31/2021,SP1661,2022-08-04T14:24:45,,FALSE
11/21/2022,IP1662,basil,6855,H1662,7,11/14/2021,34,48,LOT1662_IP_2022-11-21_48,2/20/2022,SP1662,2022-12-09T23:07:02,,FALSE
9/10/2022,IP1663,spinach,1451,H1663,2,11/7/2021,8,10,LOT1663_IP_2022-09-10_10,2/17/2022,SP1663,2022-12-01T13:15:33,,FALSE
7/24/2022,IP1664,basil,6839,H1664,7,11/19/2021,34,48,LOT1664_IP_2022-07-24_48,2/23/2022,SP1664,2022-12-16T06:30:38,,FALSE
11/12/2021,IP1665,potato,8788,H1665,9,8/26/2021,44,62,LOT1665_IP_2021-11-12_62,1/12/2022,SP1665,2022-09-03T15:20,,FALSE
10/14/2021,IP1666,arugula,2584,H1666,3,11/25/2021,13,18,LOT1666_IP_2021-10-14_18,2/26/2022,SP1666,2022-12-24T01:57,,FALSE
8/11/2021,IP1667,lettuce,639,H1667,1,11/18/2021,4,5,LOT1667_IP_2021-08-11_5,2/23/2022,SP1667,2022-12-15T23:18:05,,FALSE
4/24/2022,IP1668,arugula,2563,H1668,3,11/17/2021,13,18,LOT1668_IP_2022-04-24_18,2/22/2022,SP1668,2022-12-14T07:39:02,,FALSE
9/5/2021,IP1669,arugula,2887,H1669,4,11/12/2021,15,20,LOT1669_IP_2021-09-05_20,2/19/2022,SP1669,2022-12-07T13:26:36,,FALSE
1/9/2022,IP1670,arugula,2706,H1670,3,11/9/2021,14,19,LOT1670_IP_2022-01-09_19,2/18/2022,SP1670,2022-12-04T06:08:32,,FALSE
9/6/2021,IP1671,potato,8860,H1671,9,9/5/2021,44,62,LOT1671_IP_2021-09-06_62,1/17/2022,SP1671,2022-09-14T21:40:43,,FALSE
12/8/2021,IP1672,chili peppers,5896,H1672,6,9/11/2021,30,41,LOT1672_IP_2021-12-08_41,1/20/2022,SP1672,2022-09-22T06:18:15,,FALSE
12/1/2021,IP1673,lettuce,111,H1673,1,9/20/2021,1,1,LOT1673_IP_2021-12-01_1,1/25/2022,SP1673,2022-10-04T06:40:22,,TRUE
11/15/2021,IP1674,chili peppers,6141,H1674,6,11/7/2021,31,43,LOT1674_IP_2021-11-15_43,2/17/2022,SP1674,2022-12-02T03:40:40,,FALSE
8/28/2021,IP1675,parsley,8537,H1675,9,11/28/2021,43,60,LOT1675_IP_2021-08-28_60,2/27/2022,SP1675,2022-12-27T16:27:38,,FALSE
12/10/2021,IP1676,chili peppers,5903,H1676,6,11/15/2021,30,41,LOT1676_IP_2021-12-10_41,2/21/2022,SP1676,2022-12-11T07:33:31,,FALSE
9/7/2021,IP1677,cilantro,7253,H1677,8,11/14/2021,36,51,LOT1677_IP_2021-09-07_51,2/20/2022,SP1677,2022-12-10T02:43:18,,FALSE
1/28/2022,IP1678,basil,6736,H1678,7,9/30/2021,34,47,LOT1678_IP_2022-01-28_47,1/29/2022,SP1678,2022-10-15T20:13:38,,FALSE
11/20/2021,IP1679,cilantro,7837,H1679,8,10/17/2021,39,55,LOT1679_IP_2021-11-20_55,2/7/2022,SP1679,2022-11-06T04:04:52,,FALSE
11/14/2022,IP1680,cilantro,7410,H1680,8,11/29/2021,37,52,LOT1680_IP_2022-11-14_52,2/28/2022,SP1680,2022-12-28T17:41:34,,FALSE
8/1/2021,IP1681,melons,3165,H1681,4,11/2/2021,16,22,LOT1681_IP_2021-08-01_22,2/15/2022,SP1681,2022-11-26T07:05:53,,FALSE
8/16/2021,IP1682,spinach,1057,H1682,2,8/30/2021,6,8,LOT1682_IP_2021-08-16_8,1/14/2022,SP1682,2022-09-08T03:28:17,,FALSE
1/28/2023,IP1683,arugula,2402,H1683,3,11/23/2021,12,17,LOT1683_IP_2023-01-28_17,2/25/2022,SP1683,2022-12-21T09:04:01,,TRUE
12/11/2021,IP1684,Cucumbers,4549,H1684,5,11/4/2021,23,32,LOT1684_IP_2021-12-11_32,2/16/2022,SP1684,2022-11-27T19:08:39,,TRUE
9/29/2021,IP1685,sweet potato,9522,H1685,10,8/25/2021,48,67,LOT1685_IP_2021-09-29_67,1/12/2022,SP1685,2022-09-02T06:53:31,,TRUE
11/20/2021,IP1686,melons,3481,H1686,4,9/28/2021,18,25,LOT1686_IP_2021-11-20_25,1/29/2022,SP1686,2022-10-13T21:22:02,,FALSE
9/2/2021,IP1687,spinach,942,H1687,2,11/7/2021,5,7,LOT1687_IP_2021-09-02_7,2/17/2022,SP1687,2022-12-02T07:16:56,,FALSE
1/28/2023,IP1688,lettuce,565,H1688,1,10/4/2021,3,4,LOT1688_IP_2023-01-28_4,1/31/2022,SP1688,2022-10-20T15:34:28,,FALSE
12/4/2022,IP1689,parsley,8507,H1689,9,11/27/2021,43,60,LOT1689_IP_2022-12-04_60,2/27/2022,SP1689,2022-12-26T04:24:52,,TRUE
9/25/2021,IP1690,lettuce,680,H1690,2,9/4/2021,4,5,LOT1690_IP_2021-09-25_5,1/17/2022,SP1690,2022-09-14T18:04:27,,FALSE
6/7/2022,IP1691,potato,8932,H1691,9,11/6/2021,45,63,LOT1691_IP_2022-06-07_63,2/17/2022,SP1691,2022-11-30T15:37:54,,FALSE
5/21/2022,IP1692,spinach,936,H1692,2,9/4/2021,5,7,LOT1692_IP_2022-05-21_7,1/17/2022,SP1692,2022-09-14T10:51:53,,FALSE
6/18/2022,IP1693,bell peppers,5333,H1693,6,10/10/2021,27,37,LOT1693_IP_2022-06-18_37,2/3/2022,SP1693,2022-10-28T03:48:17,,FALSE
8/6/2022,IP1694,cilantro,7309,H1694,8,9/24/2021,37,51,LOT1694_IP_2022-08-06_51,1/27/2022,SP1694,2022-10-09T02:01:12,,FALSE
10/21/2022,IP1695,basil,6608,H1695,7,11/27/2021,33,46,LOT1695_IP_2022-10-21_46,2/27/2022,SP1695,2022-12-26T22:26:15,,FALSE
10/28/2021,IP1696,potato,8650,H1696,9,8/27/2021,43,61,LOT1696_IP_2021-10-28_61,1/13/2022,SP1696,2022-09-04T09:21:23,,TRUE
5/27/2022,IP1697,Tomatoes,4294,H1697,5,8/30/2021,22,30,LOT1697_IP_2022-05-27_30,1/14/2022,SP1697,2022-09-07T20:15:44,,FALSE
7/18/2022,IP1698,Cucumbers,4716,H1698,5,9/5/2021,24,33,LOT1698_IP_2022-07-18_33,1/17/2022,SP1698,2022-09-15T19:18:23,,FALSE
1/14/2023,IP1699,basil,6953,H1699,7,10/31/2021,35,49,LOT1699_IP_2023-01-14_49,2/14/2022,SP1699,2022-11-23T21:25:28,,FALSE
12/16/2021,IP1700,melons,2930,H1700,4,11/3/2021,15,21,LOT1700_IP_2021-12-16_21,2/15/2022,SP1700,2022-11-26T21:30:59,,FALSE
5/17/2022,IP1701,lettuce,686,H1701,2,10/23/2021,4,5,LOT1701_IP_2022-05-17_5,2/10/2022,SP1701,2022-11-13T19:54:57,,FALSE
10/6/2022,IP1702,lettuce,106,H1702,1,11/5/2021,1,1,LOT1702_IP_2022-10-06_1,2/16/2022,SP1702,2022-11-29T10:47:41,,FALSE
11/5/2021,IP1703,potato,8611,H1703,9,10/8/2021,43,60,LOT1703_IP_2021-11-05_60,2/2/2022,SP1703,2022-10-25T18:07:52,,FALSE
10/2/2022,IP1704,arugula,2421,H1704,3,11/17/2021,12,17,LOT1704_IP_2022-10-02_17,2/22/2022,SP1704,2022-12-13T20:50:13,,FALSE
12/4/2021,IP1705,lettuce,406,H1705,1,11/10/2021,3,3,LOT1705_IP_2021-12-04_3,2/19/2022,SP1705,2022-12-05T14:35:01,,FALSE
7/30/2022,IP1706,arugula,2265,H1706,3,8/25/2021,12,16,LOT1706_IP_2022-07-30_16,1/12/2022,SP1706,2022-09-02T06:53:31,,TRUE
1/14/2022,IP1707,parsley,8253,H1707,8,9/12/2021,41,58,LOT1707_IP_2022-01-14_58,1/20/2022,SP1707,2022-09-23T11:08:28,,FALSE
2/15/2022,IP1708,basil,7059,H1708,7,9/1/2021,35,50,LOT1708_IP_2022-02-15_50,1/15/2022,SP1708,2022-09-10T05:56:09,,FALSE
5/18/2022,IP1709,sweet potato,9863,H1709,10,8/3/2021,49,69,LOT1709_IP_2022-05-18_69,1/1/2022,SP1709,2022-08-05T19:14:57,,FALSE
5/16/2022,IP1710,bell peppers,5367,H1710,6,8/26/2021,27,38,LOT1710_IP_2022-05-16_38,1/12/2022,SP1710,2022-09-03T11:43:43,,FALSE
9/12/2021,IP1711,potato,8846,H1711,9,8/19/2021,44,62,LOT1711_IP_2021-09-12_62,1/9/2022,SP1711,2022-08-25T22:15:58,,TRUE
8/25/2021,IP1712,parsley,7919,H1712,8,8/8/2021,40,55,LOT1712_IP_2021-08-25_55,1/4/2022,SP1712,2022-08-12T09:51:07,,FALSE
11/15/2022,IP1713,sweet potato,9815,H1713,10,8/17/2021,49,69,LOT1713_IP_2022-11-15_69,1/8/2022,SP1713,2022-08-22T11:21:37,,FALSE
1/29/2023,IP1714,bell peppers,5395,H1714,6,10/29/2021,27,38,LOT1714_IP_2023-01-29_38,2/13/2022,SP1714,2022-11-20T21:19:56,,TRUE
11/25/2022,IP1715,chili peppers,6082,H1715,6,10/11/2021,31,43,LOT1715_IP_2022-11-25_43,2/4/2022,SP1715,2022-10-29T12:14:46,,FALSE
7/31/2022,IP1716,Cucumbers,5049,H1716,5,9/9/2021,25,35,LOT1716_IP_2022-07-31_35,1/19/2022,SP1716,2022-09-20T03:50:23,,FALSE
1/5/2022,IP1717,potato,9154,H1717,9,10/31/2021,46,64,LOT1717_IP_2022-01-05_64,2/14/2022,SP1717,2022-11-23T10:36:38,,FALSE
12/30/2022,IP1718,spinach,938,H1718,2,11/22/2021,5,7,LOT1718_IP_2022-12-30_7,2/25/2022,SP1718,2022-12-20T07:50:05,,TRUE
9/21/2021,IP1719,cilantro,7243,H1719,7,8/7/2021,36,51,LOT1719_IP_2021-09-21_51,1/3/2022,SP1719,2022-08-11T08:37:11,,FALSE
11/12/2022,IP1720,lettuce,259,H1720,1,8/12/2021,2,2,LOT1720_IP_2022-11-12_2,1/6/2022,SP1720,2022-08-17T12:24:30,,FALSE
6/13/2022,IP1721,arugula,2242,H1721,3,8/30/2021,12,16,LOT1721_IP_2022-06-13_16,1/14/2022,SP1721,2022-09-08T07:04:34,,FALSE
6/9/2022,IP1722,sweet potato,9807,H1722,10,11/18/2021,49,69,LOT1722_IP_2022-06-09_69,2/22/2022,SP1722,2022-12-15T01:40:25,,FALSE
12/15/2021,IP1723,cilantro,7431,H1723,8,9/10/2021,37,52,LOT1723_IP_2021-12-15_52,1/19/2022,SP1723,2022-09-21T01:28:03,,FALSE
1/2/2023,IP1724,cilantro,7374,H1724,8,11/30/2021,37,52,LOT1724_IP_2023-01-02_52,2/28/2022,SP1724,2022-12-29T18:55:30,,FALSE
9/6/2022,IP1725,chili peppers,6200,H1725,7,9/9/2021,31,44,LOT1725_IP_2022-09-06_44,1/19/2022,SP1725,2022-09-20T11:02:57,,FALSE
10/12/2021,IP1726,potato,8779,H1726,9,10/4/2021,44,61,LOT1726_IP_2021-10-12_61,2/1/2022,SP1726,2022-10-21T13:12:08,,FALSE
2/13/2023,IP1727,arugula,2472,H1727,3,11/8/2021,13,18,LOT1727_IP_2023-02-13_18,2/18/2022,SP1727,2022-12-03T15:43:25,,TRUE
12/1/2021,IP1728,potato,8956,H1728,9,10/21/2021,45,63,LOT1728_IP_2021-12-01_63,2/9/2022,SP1728,2022-11-10T16:13:09,,FALSE
10/31/2021,IP1729,chili peppers,6022,H1729,6,8/17/2021,30,42,LOT1729_IP_2021-10-31_42,1/8/2022,SP1729,2022-08-22T11:21:37,,FALSE
11/25/2022,IP1730,sweet potato,9307,H1730,9,10/23/2021,47,65,LOT1730_IP_2022-11-25_65,2/10/2022,SP1730,2022-11-13T09:06:07,,FALSE
5/5/2022,IP1731,spinach,1416,H1731,2,10/15/2021,8,10,LOT1731_IP_2022-05-05_10,2/6/2022,SP1731,2022-11-03T03:59:20,,FALSE
1/2/2022,IP1732,lettuce,786,H1732,2,10/22/2021,4,6,LOT1732_IP_2022-01-02_6,2/9/2022,SP1732,2022-11-12T04:15:55,,FALSE
4/23/2022,IP1733,spinach,1181,H1733,2,10/6/2021,6,9,LOT1733_IP_2022-04-23_9,2/1/2022,SP1733,2022-10-23T01:14:54,,FALSE
12/10/2021,IP1734,sweet potato,9529,H1734,10,9/20/2021,48,67,LOT1734_IP_2021-12-10_67,1/25/2022,SP1734,2022-10-04T10:16:38,,TRUE
3/5/2022,IP1735,lettuce,609,H1735,1,10/15/2021,4,5,LOT1735_IP_2022-03-05_5,2/6/2022,SP1735,2022-11-03T18:24:27,,FALSE
2/16/2022,IP1736,kale,1563,H1736,2,9/14/2021,8,11,LOT1736_IP_2022-02-16_11,1/22/2022,SP1736,2022-09-26T11:14,,FALSE
7/15/2022,IP1737,kale,1972,H1737,3,8/17/2021,10,14,LOT1737_IP_2022-07-15_14,1/8/2022,SP1737,2022-08-23T05:23,,TRUE
8/24/2022,IP1738,bell peppers,5200,H1738,6,8/30/2021,26,37,LOT1738_IP_2022-08-24_37,1/14/2022,SP1738,2022-09-08T14:17:07,,FALSE
4/8/2022,IP1739,bell peppers,5660,H1739,6,10/2/2021,29,40,LOT1739_IP_2022-04-08_40,1/30/2022,SP1739,2022-10-18T09:30:20,,FALSE
4/14/2022,IP1740,basil,6765,H1740,7,8/4/2021,34,47,LOT1740_IP_2022-04-14_47,1/1/2022,SP1740,2022-08-06T20:28:53,,FALSE
1/22/2022,IP1741,Cucumbers,4604,H1741,5,10/24/2021,23,32,LOT1741_IP_2022-01-22_32,2/10/2022,SP1741,2022-11-14T06:43:47,,FALSE
8/15/2021,IP1742,bell peppers,5395,H1742,6,9/2/2021,27,38,LOT1742_IP_2021-08-15_38,1/16/2022,SP1742,2022-09-12T01:11:28,,FALSE
10/4/2022,IP1743,kale,1657,H1743,2,9/16/2021,9,12,LOT1743_IP_2022-10-04_12,1/23/2022,SP1743,2022-09-28T17:18:08,,FALSE
9/4/2022,IP1744,chili peppers,5853,H1744,6,9/7/2021,29,41,LOT1744_IP_2022-09-04_41,1/18/2022,SP1744,2022-09-18T12:11:21,,FALSE
9/12/2022,IP1745,parsley,7929,H1745,8,11/25/2021,40,56,LOT1745_IP_2022-09-12_56,2/26/2022,SP1745,2022-12-24T12:45:49,,FALSE
11/26/2021,IP1746,Tomatoes,3681,H1746,4,8/30/2021,19,26,LOT1746_IP_2021-11-26_26,1/14/2022,SP1746,2022-09-08T03:28:17,,FALSE
2/7/2022,IP1747,parsley,8313,H1747,8,8/29/2021,42,58,LOT1747_IP_2022-02-07_58,1/14/2022,SP1747,2022-09-06T19:01:48,,TRUE
9/2/2021,IP1748,Cucumbers,4431,H1748,5,8/2/2021,22,31,LOT1748_IP_2021-09-02_31,1/1/2022,SP1748,2022-08-04T21:37:18,,TRUE
4/15/2022,IP1749,kale,1774,H1749,3,10/11/2021,9,13,LOT1749_IP_2022-04-15_13,2/4/2022,SP1749,2022-10-29T19:27:20,,FALSE
8/26/2022,IP1750,arugula,2908,H1750,4,10/24/2021,15,21,LOT1750_IP_2022-08-26_21,2/10/2022,SP1750,2022-11-14T13:56:20,,FALSE
10/30/2021,IP1751,bell peppers,5566,H1751,6,10/15/2021,28,39,LOT1751_IP_2021-10-30_39,2/6/2022,SP1751,2022-11-03T14:48:10,,FALSE
9/1/2022,IP1752,arugula,2646,H1752,3,10/2/2021,14,19,LOT1752_IP_2022-09-01_19,1/31/2022,SP1752,2022-10-18T16:42:53,,TRUE
6/5/2022,IP1753,arugula,2698,H1753,3,10/18/2021,14,19,LOT1753_IP_2022-06-05_19,2/7/2022,SP1753,2022-11-07T12:31:21,,FALSE
3/20/2022,IP1754,basil,6671,H1754,7,10/7/2021,34,47,LOT1754_IP_2022-03-20_47,2/2/2022,SP1754,2022-10-24T20:30:13,,FALSE
8/28/2022,IP1755,kale,2074,H1755,3,11/11/2021,11,15,LOT1755_IP_2022-08-28_15,2/19/2022,SP1755,2022-12-06T08:36:24,,FALSE
9/13/2021,IP1756,potato,8588,H1756,9,10/12/2021,43,60,LOT1756_IP_2021-09-13_60,2/4/2022,SP1756,2022-10-31T00:17:32,,TRUE
1/22/2022,IP1757,Tomatoes,3958,H1757,5,11/25/2021,20,28,LOT1757_IP_2022-01-22_28,2/26/2022,SP1757,2022-12-24T09:09:33,,FALSE
1/10/2023,IP1758,chili peppers,6396,H1758,7,8/21/2021,32,45,LOT1758_IP_2023-01-10_45,1/10/2022,SP1758,2022-08-28T04:20:07,,FALSE
8/30/2021,IP1759,arugula,2675,H1759,3,10/6/2021,14,19,LOT1759_IP_2021-08-30_19,2/1/2022,SP1759,2022-10-23T08:27:27,,FALSE
1/11/2022,IP1760,Cucumbers,4970,H1760,5,11/6/2021,25,35,LOT1760_IP_2022-01-11_35,2/17/2022,SP1760,2022-12-01T06:03,,FALSE
11/15/2021,IP1761,Tomatoes,3938,H1761,4,11/1/2021,20,28,LOT1761_IP_2021-11-15_28,2/14/2022,SP1761,2022-11-24T11:50:34,,FALSE
1/14/2023,IP1762,Tomatoes,4031,H1762,5,10/5/2021,20,28,LOT1762_IP_2023-01-14_28,2/1/2022,SP1762,2022-10-22T18:02:20,,FALSE
10/23/2021,IP1763,kale,2104,H1763,3,8/7/2021,11,15,LOT1763_IP_2021-10-23_15,1/3/2022,SP1763,2022-08-10T07:23:15,,TRUE
11/23/2021,IP1764,kale,2089,H1764,3,11/21/2021,11,15,LOT1764_IP_2021-11-23_15,2/24/2022,SP1764,2022-12-19T13:48:42,,FALSE
1/18/2022,IP1765,kale,2053,H1765,3,9/22/2021,11,15,LOT1765_IP_2022-01-18_15,1/25/2022,SP1765,2022-10-05T22:19:24,,FALSE
1/16/2022,IP1766,basil,6589,H1766,7,8/5/2021,33,46,LOT1766_IP_2022-01-16_46,1/2/2022,SP1766,2022-08-08T08:31:39,,TRUE
8/17/2022,IP1767,bell peppers,5073,H1767,6,11/11/2021,26,36,LOT1767_IP_2022-08-17_36,2/19/2022,SP1767,2022-12-06T08:36:24,,FALSE
5/27/2022,IP1768,potato,9118,H1768,9,10/15/2021,46,64,LOT1768_IP_2022-05-27_64,2/6/2022,SP1768,2022-11-03T14:48:10,,FALSE
3/7/2022,IP1769,melons,3166,H1769,4,10/22/2021,16,22,LOT1769_IP_2022-03-07_22,2/9/2022,SP1769,2022-11-12T04:15:55,,FALSE
10/21/2021,IP1770,cilantro,7251,H1770,8,10/10/2021,36,51,LOT1770_IP_2021-10-21_51,2/3/2022,SP1770,2022-10-28T11:00:50,,FALSE
8/13/2021,IP1771,kale,1634,H1771,2,11/1/2021,9,12,LOT1771_IP_2021-08-13_12,2/14/2022,SP1771,2022-11-24T15:26:51,,FALSE
6/29/2022,IP1772,parsley,8268,H1772,8,11/4/2021,41,58,LOT1772_IP_2022-06-29_58,2/16/2022,SP1772,2022-11-27T22:44:55,,FALSE
2/1/2022,IP1773,cilantro,7352,H1773,8,8/23/2021,37,52,LOT1773_IP_2022-02-01_52,1/11/2022,SP1773,2022-08-31T00:49:22,,FALSE
11/15/2022,IP1774,lettuce,740,H1774,2,10/22/2021,4,5,LOT1774_IP_2022-11-15_5,2/9/2022,SP1774,2022-11-12T11:28:28,,FALSE
8/6/2022,IP1775,sweet potato,9566,H1775,10,9/26/2021,48,67,LOT1775_IP_2022-08-06_67,1/27/2022,SP1775,2022-10-10T17:40:14,,FALSE
3/16/2022,IP1776,lettuce,630,H1776,1,10/2/2021,4,5,LOT1776_IP_2022-03-16_5,1/31/2022,SP1776,2022-10-18T23:55:26,,FALSE
9/1/2022,IP1777,parsley,8055,H1777,8,11/5/2021,40,56,LOT1777_IP_2022-09-01_56,2/16/2022,SP1777,2022-11-28T23:58:51,,FALSE
4/25/2022,IP1778,potato,8800,H1778,9,8/3/2021,44,62,LOT1778_IP_2022-04-25_62,1/1/2022,SP1778,2022-08-05T15:38:41,,FALSE
3/28/2022,IP1779,sweet potato,9620,H1779,10,9/4/2021,48,67,LOT1779_IP_2022-03-28_67,1/17/2022,SP1779,2022-09-13T20:26:47,,FALSE
8/21/2021,IP1780,cilantro,7550,H1780,8,9/5/2021,38,53,LOT1780_IP_2021-08-21_53,1/17/2022,SP1780,2022-09-15T12:05:49,,FALSE
2/10/2022,IP1781,lettuce,140,H1781,1,11/11/2021,1,1,LOT1781_IP_2022-02-10_1,2/19/2022,SP1781,2022-12-06T19:25:13,,FALSE
1/5/2023,IP1782,Tomatoes,3939,H1782,4,9/20/2021,20,28,LOT1782_IP_2023-01-05_28,1/25/2022,SP1782,2022-10-03T19:51:32,,FALSE
10/20/2022,IP1783,melons,3180,H1783,4,11/3/2021,16,22,LOT1783_IP_2022-10-20_22,2/15/2022,SP1783,2022-11-26T10:42:10,,FALSE
6/9/2022,IP1784,arugula,2708,H1784,3,8/5/2021,14,19,LOT1784_IP_2022-06-09_19,1/2/2022,SP1784,2022-08-07T21:42:49,,FALSE
3/6/2022,IP1785,potato,9079,H1785,9,11/6/2021,45,64,LOT1785_IP_2022-03-06_64,2/17/2022,SP1785,2022-11-30T22:50:27,,FALSE
3/23/2022,IP1786,spinach,1283,H1786,2,8/21/2021,7,9,LOT1786_IP_2022-03-23_9,1/10/2022,SP1786,2022-08-28T00:43:51,,FALSE
6/5/2022,IP1787,lettuce,483,H1787,1,11/15/2021,3,4,LOT1787_IP_2022-06-05_4,2/21/2022,SP1787,2022-12-11T03:57:14,,FALSE
2/23/2023,IP1788,potato,8744,H1788,9,8/17/2021,44,61,LOT1788_IP_2023-02-23_61,1/8/2022,SP1788,2022-08-22T11:21:37,,TRUE
10/30/2021,IP1789,bell peppers,5373,H1789,6,8/9/2021,27,38,LOT1789_IP_2021-10-30_38,1/4/2022,SP1789,2022-08-12T20:39:56,,FALSE
11/4/2021,IP1790,Tomatoes,3845,H1790,4,12/1/2021,20,27,LOT1790_IP_2021-11-04_27,3/1/2022,SP1790,2022-12-30T23:45:42,,FALSE
11/30/2021,IP1791,chili peppers,5847,H1791,6,9/20/2021,29,41,LOT1791_IP_2021-11-30_41,1/25/2022,SP1791,2022-10-03T16:15:15,,FALSE
10/24/2021,IP1792,parsley,8556,H1792,9,8/25/2021,43,60,LOT1792_IP_2021-10-24_60,1/12/2022,SP1792,2022-09-01T12:52:08,,FALSE
1/22/2022,IP1793,basil,6796,H1793,7,10/11/2021,34,48,LOT1793_IP_2022-01-22_48,2/4/2022,SP1793,2022-10-30T06:16:09,,FALSE
2/16/2023,IP1794,Cucumbers,4936,H1794,5,9/30/2021,25,35,LOT1794_IP_2023-02-16_35,1/29/2022,SP1794,2022-10-15T23:49:55,,FALSE
5/12/2022,IP1795,Cucumbers,4458,H1795,5,11/30/2021,23,31,LOT1795_IP_2022-05-12_31,2/28/2022,SP1795,2022-12-29T18:55:30,,TRUE
8/29/2021,IP1796,Tomatoes,3891,H1796,4,8/19/2021,20,27,LOT1796_IP_2021-08-29_27,1/9/2022,SP1796,2022-08-25T00:38:19,,FALSE
6/29/2022,IP1797,arugula,2336,H1797,3,11/16/2021,12,17,LOT1797_IP_2022-06-29_17,2/22/2022,SP1797,2022-12-13T02:48:50,,FALSE
1/6/2022,IP1798,kale,1668,H1798,2,9/11/2021,9,12,LOT1798_IP_2022-01-06_12,1/20/2022,SP1798,2022-09-23T03:55:55,,FALSE
11/9/2022,IP1799,potato,8752,H1799,9,11/19/2021,44,61,LOT1799_IP_2022-11-09_61,2/23/2022,SP1799,2022-12-16T02:54:21,,TRUE
7/15/2022,IP1800,parsley,7895,H1800,8,10/2/2021,40,55,LOT1800_IP_2022-07-15_55,1/31/2022,SP1800,2022-10-18T20:19:09,,FALSE
10/29/2021,IP1801,spinach,994,H1801,2,8/23/2021,5,7,LOT1801_IP_2021-10-29_7,1/11/2022,SP1801,2022-08-30T10:24:16,,FALSE
9/8/2022,IP1802,Cucumbers,4955,H1802,5,11/8/2021,25,35,LOT1802_IP_2022-09-08_35,2/18/2022,SP1802,2022-12-03T15:43:25,,FALSE
7/7/2022,IP1803,bell peppers,5216,H1803,6,9/24/2021,26,37,LOT1803_IP_2022-07-07_37,1/27/2022,SP1803,2022-10-09T05:37:29,,FALSE
12/6/2022,IP1804,melons,3308,H1804,4,10/21/2021,17,23,LOT1804_IP_2022-12-06_23,2/9/2022,SP1804,2022-11-10T19:49:26,,FALSE
1/13/2022,IP1805,spinach,1354,H1805,2,9/7/2021,7,10,LOT1805_IP_2022-01-13_10,1/18/2022,SP1805,2022-09-18T04:58:48,,FALSE
3/17/2022,IP1806,cilantro,7473,H1806,8,8/29/2021,37,52,LOT1806_IP_2022-03-17_52,1/14/2022,SP1806,2022-09-07T02:14:21,,FALSE
5/20/2022,IP1807,chili peppers,5931,H1807,6,8/31/2021,30,42,LOT1807_IP_2022-05-20_42,1/15/2022,SP1807,2022-09-09T15:31:03,,TRUE
3/30/2022,IP1808,melons,3593,H1808,4,9/12/2021,18,25,LOT1808_IP_2022-03-30_25,1/21/2022,SP1808,2022-09-24T01:33:34,,FALSE
10/9/2021,IP1809,Tomatoes,3745,H1809,4,11/26/2021,19,26,LOT1809_IP_2021-10-09_26,2/27/2022,SP1809,2022-12-25T13:59:46,,FALSE
7/4/2022,IP1810,sweet potato,9553,H1810,10,11/29/2021,48,67,LOT1810_IP_2022-07-04_67,2/28/2022,SP1810,2022-12-29T04:30:23,,FALSE
3/25/2022,IP1811,basil,6945,H1811,7,9/25/2021,35,49,LOT1811_IP_2022-03-25_49,1/27/2022,SP1811,2022-10-10T14:03:58,,FALSE
3/13/2022,IP1812,melons,3452,H1812,4,11/12/2021,18,24,LOT1812_IP_2022-03-13_24,2/20/2022,SP1812,2022-12-08T07:27:59,,FALSE
7/15/2022,IP1813,sweet potato,9333,H1813,9,10/19/2021,47,65,LOT1813_IP_2022-07-15_65,2/8/2022,SP1813,2022-11-07T23:20:11,,TRUE
9/19/2022,IP1814,potato,8889,H1814,9,8/19/2021,45,62,LOT1814_IP_2022-09-19_62,1/9/2022,SP1814,2022-08-25T00:38:19,,TRUE
2/4/2023,IP1815,arugula,2364,H1815,3,8/26/2021,12,17,LOT1815_IP_2023-02-04_17,1/12/2022,SP1815,2022-09-02T14:06:04,,FALSE
1/17/2023,IP1816,chili peppers,5914,H1816,6,8/4/2021,30,42,LOT1816_IP_2023-01-17_42,1/2/2022,SP1816,2022-08-07T03:41:26,,TRUE
8/14/2021,IP1817,arugula,2324,H1817,3,9/5/2021,12,17,LOT1817_IP_2021-08-14_17,1/17/2022,SP1817,2022-09-15T19:18:23,,FALSE
2/20/2022,IP1818,basil,6475,H1818,7,11/27/2021,33,45,LOT1818_IP_2022-02-20_45,2/27/2022,SP1818,2022-12-26T15:13:42,,FALSE
6/27/2022,IP1819,kale,1913,H1819,3,9/6/2021,10,14,LOT1819_IP_2022-06-27_14,1/18/2022,SP1819,2022-09-16T16:56:02,,FALSE
8/26/2022,IP1820,lettuce,103,H1820,1,9/1/2021,1,1,LOT1820_IP_2022-08-26_1,1/15/2022,SP1820,2022-09-10T02:19:53,,FALSE
3/13/2022,IP1821,Tomatoes,4332,H1821,5,10/1/2021,22,30,LOT1821_IP_2022-03-13_30,1/30/2022,SP1821,2022-10-17T04:40:07,,FALSE
1/31/2023,IP1822,Tomatoes,4052,H1822,5,10/19/2021,21,29,LOT1822_IP_2023-01-31_29,2/8/2022,SP1822,2022-11-08T02:56:27,,FALSE
11/19/2021,IP1823,melons,3090,H1823,4,11/11/2021,16,22,LOT1823_IP_2021-11-19_22,2/19/2022,SP1823,2022-12-06T19:25:13,,FALSE
12/4/2022,IP1824,Tomatoes,4272,H1824,5,11/19/2021,22,30,LOT1824_IP_2022-12-04_30,2/23/2022,SP1824,2022-12-16T17:19:27,,FALSE
11/21/2022,IP1825,parsley,8305,H1825,8,8/2/2021,42,58,LOT1825_IP_2022-11-21_58,12/31/2021,SP1825,2022-08-04T14:24:45,,FALSE
1/15/2023,IP1826,Tomatoes,4121,H1826,5,9/20/2021,21,29,LOT1826_IP_2023-01-15_29,1/25/2022,SP1826,2022-10-04T03:04:05,,FALSE
12/28/2021,IP1827,cilantro,7630,H1827,8,10/14/2021,38,53,LOT1827_IP_2021-12-28_53,2/5/2022,SP1827,2022-11-01T23:09:08,,FALSE
10/11/2021,IP1828,melons,3433,H1828,4,11/24/2021,17,24,LOT1828_IP_2021-10-11_24,2/26/2022,SP1828,2022-12-23T00:43:04,,FALSE
2/17/2022,IP1829,arugula,2306,H1829,3,8/30/2021,12,16,LOT1829_IP_2022-02-17_16,1/14/2022,SP1829,2022-09-08T07:04:34,,FALSE
7/6/2022,IP1830,Tomatoes,3995,H1830,5,10/8/2021,20,28,LOT1830_IP_2022-07-06_28,2/2/2022,SP1830,2022-10-26T01:20:25,,FALSE
12/3/2022,IP1831,lettuce,233,H1831,1,9/1/2021,2,2,LOT1831_IP_2022-12-03_2,1/15/2022,SP1831,2022-09-10T20:21:16,,FALSE
9/16/2022,IP1832,parsley,7957,H1832,8,11/23/2021,40,56,LOT1832_IP_2022-09-16_56,2/25/2022,SP1832,2022-12-21T23:29:08,,FALSE
11/29/2022,IP1833,Cucumbers,4928,H1833,5,10/10/2021,25,35,LOT1833_IP_2022-11-29_35,2/4/2022,SP1833,2022-10-29T01:25:57,,FALSE
12/23/2022,IP1834,potato,9260,H1834,9,11/10/2021,46,65,LOT1834_IP_2022-12-23_65,2/19/2022,SP1834,2022-12-06T05:00:07,,FALSE
2/1/2022,IP1835,potato,8593,H1835,9,8/10/2021,43,60,LOT1835_IP_2022-02-01_60,1/4/2022,SP1835,2022-08-14T01:30:09,,FALSE
11/19/2021,IP1836,Tomatoes,4111,H1836,5,11/11/2021,21,29,LOT1836_IP_2021-11-19_29,2/19/2022,SP1836,2022-12-07T06:14:03,,FALSE
9/28/2022,IP1837,Cucumbers,4565,H1837,5,8/6/2021,23,32,LOT1837_IP_2022-09-28_32,1/2/2022,SP1837,2022-08-09T06:09:18,,FALSE
8/7/2022,IP1838,spinach,1293,H1838,2,10/8/2021,7,9,LOT1838_IP_2022-08-07_9,2/2/2022,SP1838,2022-10-26T01:20:25,,FALSE
1/7/2023,IP1839,basil,7032,H1839,7,8/31/2021,35,49,LOT1839_IP_2023-01-07_49,1/15/2022,SP1839,2022-09-09T15:31:03,,TRUE
10/27/2022,IP1840,arugula,2251,H1840,3,11/18/2021,12,16,LOT1840_IP_2022-10-27_16,2/22/2022,SP1840,2022-12-14T22:04:09,,FALSE
2/27/2022,IP1841,melons,3303,H1841,4,9/3/2021,17,23,LOT1841_IP_2022-02-27_23,1/16/2022,SP1841,2022-09-13T13:14:14,,FALSE
9/27/2021,IP1842,Tomatoes,3732,H1842,4,11/24/2021,19,26,LOT1842_IP_2021-09-27_26,2/25/2022,SP1842,2022-12-22T10:17:57,,TRUE
1/2/2023,IP1843,chili peppers,6380,H1843,7,10/14/2021,32,45,LOT1843_IP_2023-01-02_45,2/6/2022,SP1843,2022-11-02T17:10:31,,FALSE
9/27/2022,IP1844,lettuce,466,H1844,1,8/25/2021,3,4,LOT1844_IP_2022-09-27_4,1/12/2022,SP1844,2022-09-02T06:53:31,,TRUE
2/13/2023,IP1845,melons,3141,H1845,4,10/24/2021,16,22,LOT1845_IP_2023-02-13_22,2/10/2022,SP1845,2022-11-14T21:08:53,,TRUE
11/21/2022,IP1846,melons,3201,H1846,4,11/14/2021,16,23,LOT1846_IP_2022-11-21_23,2/21/2022,SP1846,2022-12-10T06:19:35,,TRUE
2/17/2022,IP1847,arugula,2314,H1847,3,10/4/2021,12,16,LOT1847_IP_2022-02-17_16,1/31/2022,SP1847,2022-10-20T19:10:45,,TRUE
6/29/2022,IP1848,bell peppers,5453,H1848,6,10/24/2021,27,38,LOT1848_IP_2022-06-29_38,2/10/2022,SP1848,2022-11-14T13:56:20,,FALSE
1/15/2023,IP1849,Cucumbers,4709,H1849,5,8/29/2021,24,33,LOT1849_IP_2023-01-15_33,1/14/2022,SP1849,2022-09-07T05:50:38,,FALSE
9/17/2021,IP1850,Cucumbers,4774,H1850,5,9/28/2021,24,34,LOT1850_IP_2021-09-17_34,1/29/2022,SP1850,2022-10-13T17:45:46,,TRUE
9/16/2021,IP1851,parsley,8127,H1851,8,8/12/2021,41,57,LOT1851_IP_2021-09-16_57,1/6/2022,SP1851,2022-08-17T08:48:14,,FALSE
1/10/2023,IP1852,spinach,1198,H1852,2,10/27/2021,6,9,LOT1852_IP_2023-01-10_9,2/12/2022,SP1852,2022-11-18T00:50:41,,FALSE
7/23/2022,IP1853,chili peppers,5860,H1853,6,11/1/2021,30,41,LOT1853_IP_2022-07-23_41,2/14/2022,SP1853,2022-11-24T04:38:01,,FALSE
7/6/2022,IP1854,arugula,2351,H1854,3,8/8/2021,12,17,LOT1854_IP_2022-07-06_17,1/3/2022,SP1854,2022-08-11T15:49:44,,TRUE
6/11/2022,IP1855,cilantro,7723,H1855,8,11/17/2021,39,54,LOT1855_IP_2022-06-11_54,2/22/2022,SP1855,2022-12-14T14:51:35,,FALSE
10/16/2021,IP1856,potato,8902,H1856,9,10/26/2021,45,62,LOT1856_IP_2021-10-16_62,2/11/2022,SP1856,2022-11-17T14:01:52,,FALSE
8/24/2022,IP1857,bell peppers,5279,H1857,6,9/26/2021,27,37,LOT1857_IP_2022-08-24_37,1/27/2022,SP1857,2022-10-10T17:40:14,,FALSE
2/25/2023,IP1858,potato,9006,H1858,9,11/7/2021,45,63,LOT1858_IP_2023-02-25_63,2/17/2022,SP1858,2022-12-02T07:16:56,,FALSE
9/12/2022,IP1859,Tomatoes,3703,H1859,4,8/9/2021,19,26,LOT1859_IP_2022-09-12_26,1/4/2022,SP1859,2022-08-12T17:03:40,,FALSE
12/15/2021,IP1860,sweet potato,9718,H1860,10,8/10/2021,49,68,LOT1860_IP_2021-12-15_68,1/5/2022,SP1860,2022-08-14T23:07:48,,FALSE
2/4/2022,IP1861,chili peppers,5851,H1861,6,8/24/2021,29,41,LOT1861_IP_2022-02-04_41,1/11/2022,SP1861,2022-08-31T22:27:02,,FALSE
2/1/2023,IP1862,parsley,8008,H1862,8,8/16/2021,40,56,LOT1862_IP_2023-02-01_56,1/8/2022,SP1862,2022-08-22T04:09:04,,TRUE
6/8/2022,IP1863,cilantro,7738,H1863,8,11/25/2021,39,54,LOT1863_IP_2022-06-08_54,2/26/2022,SP1863,2022-12-23T22:20:43,,FALSE
4/16/2022,IP1864,lettuce,345,H1864,1,10/24/2021,2,3,LOT1864_IP_2022-04-16_3,2/10/2022,SP1864,2022-11-14T21:08:53,,FALSE
6/8/2022,IP1865,Tomatoes,3694,H1865,4,9/13/2021,19,26,LOT1865_IP_2022-06-08_26,1/21/2022,SP1865,2022-09-25T10:00:04,,FALSE
9/21/2022,IP1866,potato,8680,H1866,9,8/14/2021,43,61,LOT1866_IP_2022-09-21_61,1/6/2022,SP1866,2022-08-18T20:50:59,,FALSE
8/7/2022,IP1867,Tomatoes,4168,H1867,5,11/20/2021,21,29,LOT1867_IP_2022-08-07_29,2/23/2022,SP1867,2022-12-17T11:20:50,,FALSE
12/16/2021,IP1868,parsley,8554,H1868,9,10/27/2021,43,60,LOT1868_IP_2021-12-16_60,2/12/2022,SP1868,2022-11-18T00:50:41,,FALSE
1/7/2022,IP1869,spinach,858,H1869,2,10/26/2021,5,6,LOT1869_IP_2022-01-07_6,2/12/2022,SP1869,2022-11-17T17:38:08,,TRUE
11/3/2021,IP1870,chili peppers,5979,H1870,6,8/23/2021,30,42,LOT1870_IP_2021-11-03_42,1/11/2022,SP1870,2022-08-30T14:00:32,,FALSE
1/12/2022,IP1871,potato,9011,H1871,9,9/15/2021,45,63,LOT1871_IP_2022-01-12_63,1/22/2022,SP1871,2022-09-27T19:40:29,,FALSE
4/8/2022,IP1872,chili peppers,6186,H1872,7,10/8/2021,31,43,LOT1872_IP_2022-04-08_43,2/2/2022,SP1872,2022-10-25T10:55:19,,FALSE
6/1/2022,IP1873,Cucumbers,4632,H1873,5,10/2/2021,23,33,LOT1873_IP_2022-06-01_33,1/30/2022,SP1873,2022-10-18T13:06:36,,FALSE
8/3/2022,IP1874,Tomatoes,3967,H1874,5,10/6/2021,20,28,LOT1874_IP_2022-08-03_28,2/1/2022,SP1874,2022-10-23T08:27:27,,FALSE
10/9/2021,IP1875,potato,8674,H1875,9,11/6/2021,43,61,LOT1875_IP_2021-10-09_61,2/17/2022,SP1875,2022-11-30T12:01:37,,FALSE
7/23/2022,IP1876,Cucumbers,4358,H1876,5,10/6/2021,22,31,LOT1876_IP_2022-07-23_31,2/1/2022,SP1876,2022-10-23T08:27:27,,FALSE
9/7/2021,IP1877,kale,1917,H1877,3,11/20/2021,10,14,LOT1877_IP_2021-09-07_14,2/24/2022,SP1877,2022-12-18T05:22:13,,FALSE
11/7/2022,IP1878,Cucumbers,4840,H1878,5,10/15/2021,24,34,LOT1878_IP_2022-11-07_34,2/6/2022,SP1878,2022-11-03T07:35:37,,FALSE
1/5/2022,IP1879,melons,3519,H1879,4,11/13/2021,18,25,LOT1879_IP_2022-01-05_25,2/20/2022,SP1879,2022-12-09T19:30:45,,FALSE
5/27/2022,IP1880,kale,1541,H1880,2,10/14/2021,8,11,LOT1880_IP_2022-05-27_11,2/6/2022,SP1880,2022-11-03T00:23:04,,FALSE
2/12/2022,IP1881,melons,3328,H1881,4,9/25/2021,17,23,LOT1881_IP_2022-02-12_23,1/27/2022,SP1881,2022-10-10T10:27:41,,FALSE
8/11/2021,IP1882,basil,6839,H1882,7,11/1/2021,34,48,LOT1882_IP_2021-08-11_48,2/14/2022,SP1882,2022-11-24T15:26:51,,TRUE
2/12/2023,IP1883,basil,7051,H1883,7,9/3/2021,35,49,LOT1883_IP_2023-02-12_49,1/16/2022,SP1883,2022-09-13T13:14:14,,FALSE
10/21/2022,IP1884,parsley,8387,H1884,9,10/27/2021,42,59,LOT1884_IP_2022-10-21_59,2/12/2022,SP1884,2022-11-18T18:52:04,,FALSE
3/1/2023,IP1885,melons,3126,H1885,4,10/9/2021,16,22,LOT1885_IP_2023-03-01_22,2/3/2022,SP1885,2022-10-26T19:21:48,,TRUE
10/12/2022,IP1886,kale,1925,H1886,3,10/28/2021,10,14,LOT1886_IP_2022-10-12_14,2/12/2022,SP1886,2022-11-19T16:29:44,,TRUE
8/2/2022,IP1887,parsley,8310,H1887,8,8/24/2021,42,58,LOT1887_IP_2022-08-02_58,1/11/2022,SP1887,2022-08-31T18:50:45,,FALSE
11/4/2022,IP1888,Cucumbers,4755,H1888,5,11/2/2021,24,33,LOT1888_IP_2022-11-04_33,2/15/2022,SP1888,2022-11-25T23:53:20,,FALSE
2/10/2023,IP1889,parsley,8358,H1889,9,10/17/2021,42,59,LOT1889_IP_2023-02-10_59,2/7/2022,SP1889,2022-11-05T17:16:02,,FALSE
9/21/2022,IP1890,Cucumbers,4862,H1890,5,11/8/2021,25,34,LOT1890_IP_2022-09-21_34,2/18/2022,SP1890,2022-12-03T04:54:36,,TRUE
6/1/2022,IP1891,potato,8988,H1891,9,10/16/2021,45,63,LOT1891_IP_2022-06-01_63,2/6/2022,SP1891,2022-11-04T23:14:39,,TRUE
3/8/2022,IP1892,parsley,8059,H1892,8,10/13/2021,40,56,LOT1892_IP_2022-03-08_56,2/5/2022,SP1892,2022-11-01T01:31:28,,TRUE
10/15/2022,IP1893,bell peppers,5519,H1893,6,11/2/2021,28,39,LOT1893_IP_2022-10-15_39,2/15/2022,SP1893,2022-11-25T09:28:14,,FALSE
8/3/2021,IP1894,kale,1986,H1894,3,11/28/2021,10,14,LOT1894_IP_2021-08-03_14,2/27/2022,SP1894,2022-12-27T09:15:04,,FALSE
8/30/2021,IP1895,lettuce,790,H1895,2,10/26/2021,4,6,LOT1895_IP_2021-08-30_6,2/11/2022,SP1895,2022-11-17T06:49:18,,FALSE
11/18/2021,IP1896,arugula,2369,H1896,3,9/18/2021,12,17,LOT1896_IP_2021-11-18_17,1/24/2022,SP1896,2022-10-01T17:23:40,,FALSE
12/7/2021,IP1897,Tomatoes,3842,H1897,4,9/19/2021,20,27,LOT1897_IP_2021-12-07_27,1/24/2022,SP1897,2022-10-02T07:48:46,,FALSE
12/25/2021,IP1898,Tomatoes,4224,H1898,5,10/12/2021,21,30,LOT1898_IP_2021-12-25_30,2/4/2022,SP1898,2022-10-30T09:52:26,,TRUE
6/20/2022,IP1899,Tomatoes,4097,H1899,5,9/7/2021,21,29,LOT1899_IP_2022-06-20_29,1/18/2022,SP1899,2022-09-17T07:21:08,,FALSE
1/11/2023,IP1900,cilantro,7409,H1900,8,10/10/2021,37,52,LOT1900_IP_2023-01-11_52,2/4/2022,SP1900,2022-10-28T18:13:24,,FALSE
8/26/2022,IP1901,arugula,2414,H1901,3,9/12/2021,12,17,LOT1901_IP_2022-08-26_17,1/21/2022,SP1901,2022-09-23T21:57:18,,TRUE
6/4/2022,IP1902,chili peppers,6121,H1902,6,8/10/2021,31,43,LOT1902_IP_2022-06-04_43,1/5/2022,SP1902,2022-08-14T19:31:32,,FALSE
6/11/2022,IP1903,basil,6478,H1903,7,10/20/2021,33,45,LOT1903_IP_2022-06-11_45,2/8/2022,SP1903,2022-11-09T14:59:13,,FALSE
9/20/2021,IP1904,chili peppers,6351,H1904,7,11/23/2021,32,45,LOT1904_IP_2021-09-20_45,2/25/2022,SP1904,2022-12-21T01:51:28,,TRUE
12/4/2021,IP1905,arugula,2234,H1905,3,10/30/2021,12,16,LOT1905_IP_2021-12-04_16,2/13/2022,SP1905,2022-11-22T12:58:59,,FALSE
11/14/2022,IP1906,chili peppers,6451,H1906,7,11/14/2021,32,45,LOT1906_IP_2022-11-14_45,2/20/2022,SP1906,2022-12-10T02:43:18,,FALSE
2/16/2022,IP1907,basil,7116,H1907,7,8/1/2021,36,50,LOT1907_IP_2022-02-16_50,12/31/2021,SP1907,2022-08-03T23:59:38,,FALSE
10/28/2022,IP1908,potato,8869,H1908,9,9/24/2021,44,62,LOT1908_IP_2022-10-28_62,1/27/2022,SP1908,2022-10-09T02:01:12,,FALSE
12/12/2021,IP1909,Cucumbers,4404,H1909,5,9/1/2021,22,31,LOT1909_IP_2021-12-12_31,1/15/2022,SP1909,2022-09-10T16:44:59,,FALSE
8/11/2022,IP1910,sweet potato,9825,H1910,10,9/10/2021,49,69,LOT1910_IP_2022-08-11_69,1/20/2022,SP1910,2022-09-21T12:16:53,,FALSE
3/3/2022,IP1911,Cucumbers,4720,H1911,5,9/27/2021,24,33,LOT1911_IP_2022-03-03_33,1/28/2022,SP1911,2022-10-11T22:30:27,,FALSE
7/4/2022,IP1912,melons,3401,H1912,4,10/12/2021,17,24,LOT1912_IP_2022-07-04_24,2/4/2022,SP1912,2022-10-31T03:53:49,,FALSE
11/6/2022,IP1913,Cucumbers,4744,H1913,5,8/16/2021,24,33,LOT1913_IP_2022-11-06_33,1/7/2022,SP1913,2022-08-21T13:43:58,,FALSE
1/19/2022,IP1914,melons,3482,H1914,4,10/2/2021,18,25,LOT1914_IP_2022-01-19_25,1/31/2022,SP1914,2022-10-18T20:19:09,,FALSE
3/4/2022,IP1915,parsley,8398,H1915,9,11/3/2021,42,59,LOT1915_IP_2022-03-04_59,2/15/2022,SP1915,2022-11-27T01:07:16,,FALSE
1/28/2023,IP1916,potato,9281,H1916,9,8/23/2021,46,65,LOT1916_IP_2023-01-28_65,1/11/2022,SP1916,2022-08-30T21:13:06,,FALSE
7/28/2022,IP1917,chili peppers,6413,H1917,7,10/1/2021,32,45,LOT1917_IP_2022-07-28_45,1/30/2022,SP1917,2022-10-16T21:27:34,,FALSE
3/17/2022,IP1918,kale,2019,H1918,3,11/14/2021,10,14,LOT1918_IP_2022-03-17_14,2/21/2022,SP1918,2022-12-10T06:19:35,,FALSE
4/1/2022,IP1919,melons,3355,H1919,4,8/22/2021,17,24,LOT1919_IP_2022-04-01_24,1/10/2022,SP1919,2022-08-28T18:45:13,,FALSE
1/28/2022,IP1920,Tomatoes,4137,H1920,5,10/14/2021,21,29,LOT1920_IP_2022-01-28_29,2/6/2022,SP1920,2022-11-02T17:10:31,,FALSE
9/25/2021,IP1921,bell peppers,5703,H1921,6,9/20/2021,29,40,LOT1921_IP_2021-09-25_40,1/25/2022,SP1921,2022-10-03T16:15:15,,FALSE
3/20/2022,IP1922,potato,8929,H1922,9,9/12/2021,45,63,LOT1922_IP_2022-03-20_63,1/21/2022,SP1922,2022-09-23T21:57:18,,TRUE
1/16/2023,IP1923,potato,8691,H1923,9,9/23/2021,44,61,LOT1923_IP_2023-01-16_61,1/26/2022,SP1923,2022-10-07T03:09:37,,TRUE
12/23/2022,IP1924,chili peppers,6304,H1924,7,8/26/2021,32,44,LOT1924_IP_2022-12-23_44,1/12/2022,SP1924,2022-09-02T21:18:37,,FALSE
9/30/2022,IP1925,sweet potato,9629,H1925,10,8/29/2021,48,67,LOT1925_IP_2022-09-30_67,1/14/2022,SP1925,2022-09-06T19:01:48,,TRUE
8/7/2021,IP1926,potato,8857,H1926,9,10/13/2021,44,62,LOT1926_IP_2021-08-07_62,2/5/2022,SP1926,2022-11-01T15:56:35,,FALSE
2/28/2023,IP1927,arugula,2255,H1927,3,11/7/2021,12,16,LOT1927_IP_2023-02-28_16,2/17/2022,SP1927,2022-12-02T07:16:56,,FALSE
6/7/2022,IP1928,chili peppers,6381,H1928,7,8/21/2021,32,45,LOT1928_IP_2022-06-07_45,1/10/2022,SP1928,2022-08-27T17:31:17,,FALSE
7/11/2022,IP1929,spinach,1479,H1929,2,8/8/2021,8,11,LOT1929_IP_2022-07-11_11,1/3/2022,SP1929,2022-08-11T15:49:44,,FALSE
9/25/2021,IP1930,cilantro,7206,H1930,7,9/4/2021,36,51,LOT1930_IP_2021-09-25_51,1/17/2022,SP1930,2022-09-14T07:15:37,,FALSE
10/5/2021,IP1931,arugula,2901,H1931,4,11/1/2021,15,21,LOT1931_IP_2021-10-05_21,2/14/2022,SP1931,2022-11-24T11:50:34,,FALSE
10/20/2022,IP1932,Tomatoes,3954,H1932,5,8/7/2021,20,28,LOT1932_IP_2022-10-20_28,1/3/2022,SP1932,2022-08-11T05:00:54,,FALSE
2/26/2023,IP1933,bell peppers,5683,H1933,6,11/3/2021,29,40,LOT1933_IP_2023-02-26_40,2/15/2022,SP1933,2022-11-27T08:19:49,,FALSE
8/28/2021,IP1934,spinach,916,H1934,2,10/17/2021,5,7,LOT1934_IP_2021-08-28_7,2/7/2022,SP1934,2022-11-05T13:39:46,,FALSE
12/3/2021,IP1935,Tomatoes,3698,H1935,4,11/12/2021,19,26,LOT1935_IP_2021-12-03_26,2/20/2022,SP1935,2022-12-07T17:02:53,,FALSE
1/17/2023,IP1936,chili peppers,6121,H1936,6,11/15/2021,31,43,LOT1936_IP_2023-01-17_43,2/21/2022,SP1936,2022-12-12T05:11:10,,FALSE
8/11/2021,IP1937,basil,6598,H1937,7,10/22/2021,33,46,LOT1937_IP_2021-08-11_46,2/9/2022,SP1937,2022-11-12T11:28:28,,FALSE
7/7/2022,IP1938,kale,1737,H1938,2,8/18/2021,9,12,LOT1938_IP_2022-07-07_12,1/9/2022,SP1938,2022-08-24T21:02:02,,TRUE
10/5/2021,IP1939,cilantro,7692,H1939,8,8/1/2021,39,54,LOT1939_IP_2021-10-05_54,12/31/2021,SP1939,2022-08-03T09:34:32,,FALSE
8/14/2022,IP1940,parsley,8524,H1940,9,9/26/2021,43,60,LOT1940_IP_2022-08-14_60,1/28/2022,SP1940,2022-10-11T08:05:21,,FALSE
2/6/2023,IP1941,spinach,1247,H1941,2,10/17/2021,7,9,LOT1941_IP_2023-02-06_9,2/7/2022,SP1941,2022-11-05T17:16:02,,FALSE
2/25/2022,IP1942,sweet potato,9515,H1942,10,11/23/2021,48,67,LOT1942_IP_2022-02-25_67,2/25/2022,SP1942,2022-12-21T19:52:51,,FALSE
5/28/2022,IP1943,arugula,2338,H1943,3,8/25/2021,12,17,LOT1943_IP_2022-05-28_17,1/12/2022,SP1943,2022-09-01T20:04:41,,FALSE
1/3/2023,IP1944,Tomatoes,4023,H1944,5,10/14/2021,20,28,LOT1944_IP_2023-01-03_28,2/5/2022,SP1944,2022-11-01T19:32:51,,FALSE
4/15/2022,IP1945,melons,3015,H1945,4,10/10/2021,15,21,LOT1945_IP_2022-04-15_21,2/3/2022,SP1945,2022-10-28T03:48:17,,FALSE
11/4/2021,IP1946,potato,9262,H1946,9,10/3/2021,46,65,LOT1946_IP_2021-11-04_65,1/31/2022,SP1946,2022-10-20T01:09:22,,FALSE
5/30/2022,IP1947,arugula,2571,H1947,3,9/14/2021,13,18,LOT1947_IP_2022-05-30_18,1/22/2022,SP1947,2022-09-26T18:26:33,,FALSE
2/16/2023,IP1948,parsley,8552,H1948,9,8/11/2021,43,60,LOT1948_IP_2023-02-16_60,1/5/2022,SP1948,2022-08-15T02:44:05,,FALSE
3/1/2022,IP1949,bell peppers,5273,H1949,6,9/7/2021,27,37,LOT1949_IP_2022-03-01_37,1/18/2022,SP1949,2022-09-18T08:35:04,,FALSE
1/24/2022,IP1950,parsley,8428,H1950,9,10/16/2021,42,59,LOT1950_IP_2022-01-24_59,2/6/2022,SP1950,2022-11-04T16:02:06,,FALSE
9/2/2021,IP1951,potato,8775,H1951,9,8/26/2021,44,61,LOT1951_IP_2021-09-02_61,1/12/2022,SP1951,2022-09-03T11:43:43,,TRUE
9/22/2022,IP1952,cilantro,7407,H1952,8,9/3/2021,37,52,LOT1952_IP_2022-09-22_52,1/16/2022,SP1952,2022-09-12T15:36:35,,FALSE
9/17/2022,IP1953,parsley,8370,H1953,9,11/14/2021,42,59,LOT1953_IP_2022-09-17_59,2/21/2022,SP1953,2022-12-11T00:20:58,,FALSE
2/14/2022,IP1954,parsley,8195,H1954,8,10/4/2021,41,57,LOT1954_IP_2022-02-14_57,1/31/2022,SP1954,2022-10-20T11:58:12,,FALSE
9/10/2021,IP1955,melons,3062,H1955,4,10/24/2021,16,22,LOT1955_IP_2021-09-10_22,2/10/2022,SP1955,2022-11-14T17:32:37,,FALSE
5/26/2022,IP1956,Tomatoes,4327,H1956,5,9/25/2021,22,30,LOT1956_IP_2022-05-26_30,1/27/2022,SP1956,2022-10-09T16:26:18,,TRUE
9/23/2022,IP1957,arugula,2571,H1957,3,11/28/2021,13,18,LOT1957_IP_2022-09-23_18,2/28/2022,SP1957,2022-12-27T20:03:54,,FALSE
12/4/2021,IP1958,lettuce,782,H1958,2,8/13/2021,4,6,LOT1958_IP_2021-12-04_6,1/6/2022,SP1958,2022-08-18T17:14:43,,FALSE
7/19/2022,IP1959,Cucumbers,4858,H1959,5,8/28/2021,25,34,LOT1959_IP_2022-07-19_34,1/13/2022,SP1959,2022-09-05T14:11:35,,FALSE
7/26/2022,IP1960,lettuce,316,H1960,1,8/28/2021,2,3,LOT1960_IP_2022-07-26_3,1/13/2022,SP1960,2022-09-05T10:35:19,,TRUE
2/18/2022,IP1961,chili peppers,5993,H1961,6,8/4/2021,30,42,LOT1961_IP_2022-02-18_42,1/1/2022,SP1961,2022-08-06T16:52:37,,FALSE
8/7/2021,IP1962,sweet potato,9821,H1962,10,8/21/2021,49,69,LOT1962_IP_2021-08-07_69,1/10/2022,SP1962,2022-08-28T04:20:07,,FALSE
5/31/2022,IP1963,kale,1958,H1963,3,11/22/2021,10,14,LOT1963_IP_2022-05-31_14,2/25/2022,SP1963,2022-12-20T07:50:05,,FALSE
2/12/2023,IP1964,chili peppers,6370,H1964,7,10/2/2021,32,45,LOT1964_IP_2023-02-12_45,1/30/2022,SP1964,2022-10-18T02:17:47,,FALSE
5/2/2022,IP1965,potato,9222,H1965,9,8/23/2021,46,65,LOT1965_IP_2022-05-02_65,1/11/2022,SP1965,2022-08-30T21:13:06,,FALSE
6/12/2022,IP1966,spinach,1050,H1966,2,8/5/2021,6,8,LOT1966_IP_2022-06-12_8,1/2/2022,SP1966,2022-08-08T08:31:39,,FALSE
8/20/2022,IP1967,parsley,8455,H1967,9,10/31/2021,42,59,LOT1967_IP_2022-08-20_59,2/14/2022,SP1967,2022-11-23T07:00:22,,FALSE
11/25/2022,IP1968,bell peppers,5342,H1968,6,8/28/2021,27,38,LOT1968_IP_2022-11-25_38,1/14/2022,SP1968,2022-09-06T04:36:42,,FALSE
2/4/2022,IP1969,basil,6658,H1969,7,8/7/2021,33,47,LOT1969_IP_2022-02-04_47,1/3/2022,SP1969,2022-08-10T10:59:31,,FALSE
11/29/2021,IP1970,cilantro,7817,H1970,8,11/11/2021,39,55,LOT1970_IP_2021-11-29_55,2/19/2022,SP1970,2022-12-07T02:37:47,,FALSE
10/20/2021,IP1971,kale,2219,H1971,3,8/6/2021,11,16,LOT1971_IP_2021-10-20_16,1/3/2022,SP1971,2022-08-09T20:34:25,,FALSE
10/15/2021,IP1972,Tomatoes,4019,H1972,5,9/23/2021,20,28,LOT1972_IP_2021-10-15_28,1/26/2022,SP1972,2022-10-07T03:09:37,,FALSE
1/11/2022,IP1973,spinach,873,H1973,2,9/4/2021,5,6,LOT1973_IP_2022-01-11_6,1/17/2022,SP1973,2022-09-14T00:03:04,,FALSE
1/20/2023,IP1974,lettuce,488,H1974,1,8/8/2021,3,4,LOT1974_IP_2023-01-20_4,1/3/2022,SP1974,2022-08-11T23:02:17,,FALSE
9/1/2021,IP1975,arugula,2276,H1975,3,9/19/2021,12,16,LOT1975_IP_2021-09-01_16,1/24/2022,SP1975,2022-10-02T04:12:29,,FALSE
8/28/2021,IP1976,basil,6893,H1976,7,11/4/2021,35,48,LOT1976_IP_2021-08-28_48,2/16/2022,SP1976,2022-11-28T09:33:45,,FALSE
10/21/2021,IP1977,sweet potato,9604,H1977,10,10/7/2021,48,67,LOT1977_IP_2021-10-21_67,2/2/2022,SP1977,2022-10-24T16:53:56,,FALSE
2/27/2022,IP1978,sweet potato,9548,H1978,10,11/3/2021,48,67,LOT1978_IP_2022-02-27_67,2/15/2022,SP1978,2022-11-26T10:42:10,,FALSE
4/27/2022,IP1979,spinach,1239,H1979,2,11/8/2021,7,9,LOT1979_IP_2022-04-27_9,2/18/2022,SP1979,2022-12-02T18:05:46,,FALSE
12/28/2021,IP1980,basil,6707,H1980,7,11/9/2021,34,47,LOT1980_IP_2021-12-28_47,2/18/2022,SP1980,2022-12-04T02:32:15,,TRUE
8/20/2022,IP1981,arugula,2447,H1981,3,10/22/2021,13,17,LOT1981_IP_2022-08-20_17,2/9/2022,SP1981,2022-11-12T07:52:11,,FALSE
10/21/2021,IP1982,basil,6867,H1982,7,10/20/2021,34,48,LOT1982_IP_2021-10-21_48,2/8/2022,SP1982,2022-11-09T07:46:40,,FALSE
11/4/2021,IP1983,parsley,8453,H1983,9,8/22/2021,42,59,LOT1983_IP_2021-11-04_59,1/10/2022,SP1983,2022-08-28T15:08:57,,FALSE
1/23/2022,IP1984,melons,3098,H1984,4,9/2/2021,16,22,LOT1984_IP_2022-01-23_22,1/16/2022,SP1984,2022-09-12T08:24:01,,FALSE
7/28/2022,IP1985,potato,9057,H1985,9,11/16/2021,45,63,LOT1985_IP_2022-07-28_63,2/22/2022,SP1985,2022-12-12T23:12:33,,TRUE
9/13/2022,IP1986,parsley,8564,H1986,9,10/18/2021,43,60,LOT1986_IP_2022-09-13_60,2/7/2022,SP1986,2022-11-06T18:29:58,,FALSE
12/23/2021,IP1987,basil,6511,H1987,7,8/2/2021,33,46,LOT1987_IP_2021-12-23_46,12/31/2021,SP1987,2022-08-04T10:48:28,,FALSE
4/24/2022,IP1988,bell peppers,5609,H1988,6,8/15/2021,28,39,LOT1988_IP_2022-04-24_39,1/7/2022,SP1988,2022-08-20T12:30:02,,FALSE
6/18/2022,IP1989,basil,6571,H1989,7,11/23/2021,33,46,LOT1989_IP_2022-06-18_46,2/25/2022,SP1989,2022-12-21T16:16:35,,TRUE
6/12/2022,IP1990,Tomatoes,4315,H1990,5,8/25/2021,22,30,LOT1990_IP_2022-06-12_30,1/12/2022,SP1990,2022-09-01T12:52:08,,FALSE
7/7/2022,IP1991,potato,8977,H1991,9,10/13/2021,45,63,LOT1991_IP_2022-07-07_63,2/5/2022,SP1991,2022-11-01T01:31:28,,FALSE
4/17/2022,IP1992,lettuce,612,H1992,1,8/8/2021,4,5,LOT1992_IP_2022-04-17_5,1/4/2022,SP1992,2022-08-12T13:27:23,,FALSE
12/14/2022,IP1993,basil,6837,H1993,7,10/4/2021,34,48,LOT1993_IP_2022-12-14_48,2/1/2022,SP1993,2022-10-21T16:48:24,,FALSE
9/19/2022,IP1994,cilantro,7700,H1994,8,10/25/2021,39,54,LOT1994_IP_2022-09-19_54,2/11/2022,SP1994,2022-11-16T05:35:22,,FALSE
1/10/2023,IP1995,basil,6766,H1995,7,8/8/2021,34,47,LOT1995_IP_2023-01-10_47,1/4/2022,SP1995,2022-08-12T09:51:07,,FALSE
8/5/2021,IP1996,arugula,2806,H1996,3,9/7/2021,14,20,LOT1996_IP_2021-08-05_20,1/18/2022,SP1996,2022-09-17T21:46:15,,FALSE
8/21/2021,IP1997,Tomatoes,4308,H1997,5,10/8/2021,22,30,LOT1997_IP_2021-08-21_30,2/3/2022,SP1997,2022-10-26T12:09:15,,FALSE
2/15/2023,IP1998,parsley,8250,H1998,8,10/8/2021,41,58,LOT1998_IP_2023-02-15_58,2/2/2022,SP1998,2022-10-25T21:44:09,,TRUE
9/10/2022,IP1999,parsley,8582,H1999,9,8/29/2021,43,60,LOT1999_IP_2022-09-10_60,1/14/2022,SP1999,2022-09-07T02:14:21,,TRUE
11/19/2022,IP2000,basil,6638,H2000,7,10/15/2021,33,47,LOT2000_IP_2022-11-19_47,2/6/2022,SP2000,2022-11-04T01:37,,FALSE
10/21/2021,IP2001,Tomatoes,4030,H2001,5,9/9/2021,20,28,LOT2001_IP_2021-10-21_28,1/19/2022,SP2001,2022-09-20T07:26:40,,FALSE
12/29/2022,IP2002,basil,6667,H2002,7,8/25/2021,34,47,LOT2002_IP_2022-12-29_47,1/12/2022,SP2002,2022-09-02T03:17:14,,FALSE
9/13/2022,IP2003,melons,3352,H2003,4,9/21/2021,17,24,LOT2003_IP_2022-09-13_24,1/25/2022,SP2003,2022-10-04T13:52:55,,FALSE
5/21/2022,IP2004,lettuce,179,H2004,1,9/19/2021,1,2,LOT2004_IP_2022-05-21_2,1/24/2022,SP2004,2022-10-03T01:50:09,,TRUE
10/4/2021,IP2005,parsley,8344,H2005,8,11/17/2021,42,58,LOT2005_IP_2021-10-04_58,2/22/2022,SP2005,2022-12-14T14:51:35,,FALSE
10/5/2022,IP2006,basil,6780,H2006,7,11/11/2021,34,48,LOT2006_IP_2022-10-05_48,2/19/2022,SP2006,2022-12-06T19:25:13,,FALSE
3/23/2022,IP2007,Cucumbers,4503,H2007,5,8/6/2021,23,32,LOT2007_IP_2022-03-23_32,1/2/2022,SP2007,2022-08-08T22:56:45,,FALSE
7/22/2022,IP2008,bell peppers,5700,H2008,6,10/8/2021,29,40,LOT2008_IP_2022-07-22_40,2/3/2022,SP2008,2022-10-26T08:32:58,,FALSE
10/14/2021,IP2009,basil,6548,H2009,7,9/24/2021,33,46,LOT2009_IP_2021-10-14_46,1/26/2022,SP2009,2022-10-08T11:36:06,,FALSE
5/3/2022,IP2010,potato,9069,H2010,9,10/17/2021,45,64,LOT2010_IP_2022-05-03_64,2/7/2022,SP2010,2022-11-06T07:41:08,,FALSE
10/9/2022,IP2011,spinach,1187,H2011,2,9/1/2021,6,9,LOT2011_IP_2022-10-09_9,1/15/2022,SP2011,2022-09-09T22:43:36,,FALSE
2/17/2022,IP2012,spinach,1143,H2012,2,9/7/2021,6,8,LOT2012_IP_2022-02-17_8,1/18/2022,SP2012,2022-09-17T10:57:25,,FALSE
11/24/2022,IP2013,lettuce,768,H2013,2,8/4/2021,4,6,LOT2013_IP_2022-11-24_6,1/2/2022,SP2013,2022-08-07T07:17:43,,FALSE
10/4/2022,IP2014,parsley,8105,H2014,8,9/20/2021,41,57,LOT2014_IP_2022-10-04_57,1/25/2022,SP2014,2022-10-04T03:04:05,,FALSE
2/1/2022,IP2015,chili peppers,6253,H2015,7,9/7/2021,31,44,LOT2015_IP_2022-02-01_44,1/18/2022,SP2015,2022-09-17T10:57:25,,TRUE
1/23/2022,IP2016,lettuce,223,H2016,1,11/22/2021,2,2,LOT2016_IP_2022-01-23_2,2/24/2022,SP2016,2022-12-19T21:01:16,,FALSE
6/21/2022,IP2017,arugula,2723,H2017,3,12/1/2021,14,19,LOT2017_IP_2022-06-21_19,3/1/2022,SP2017,2022-12-30T23:45:42,,FALSE
10/3/2021,IP2018,cilantro,7290,H2018,8,9/21/2021,37,51,LOT2018_IP_2021-10-03_51,1/25/2022,SP2018,2022-10-04T17:29:11,,TRUE
2/26/2023,IP2019,sweet potato,9607,H2019,10,10/30/2021,48,67,LOT2019_IP_2023-02-26_67,2/13/2022,SP2019,2022-11-22T05:46:26,,FALSE
6/19/2022,IP2020,kale,1578,H2020,2,11/20/2021,8,11,LOT2020_IP_2022-06-19_11,2/23/2022,SP2020,2022-12-17T11:20:50,,TRUE
11/4/2021,IP2021,cilantro,7337,H2021,8,9/14/2021,37,51,LOT2021_IP_2021-11-04_51,1/22/2022,SP2021,2022-09-26T18:26:33,,FALSE
12/23/2022,IP2022,lettuce,132,H2022,1,8/10/2021,1,1,LOT2022_IP_2022-12-23_1,1/5/2022,SP2022,2022-08-14T23:07:48,,FALSE
2/11/2023,IP2023,melons,3510,H2023,4,9/23/2021,18,25,LOT2023_IP_2023-02-11_25,1/26/2022,SP2023,2022-10-07T10:22:10,,FALSE
9/28/2021,IP2024,parsley,8406,H2024,9,9/3/2021,42,59,LOT2024_IP_2021-09-28_59,1/16/2022,SP2024,2022-09-13T06:01:41,,FALSE
2/6/2022,IP2025,kale,2199,H2025,3,8/26/2021,11,16,LOT2025_IP_2022-02-06_16,1/12/2022,SP2025,2022-09-02T17:42:20,,TRUE
2/2/2023,IP2026,bell peppers,5145,H2026,6,10/17/2021,26,36,LOT2026_IP_2023-02-02_36,2/7/2022,SP2026,2022-11-06T14:53:42,,FALSE
12/18/2021,IP2027,basil,6880,H2027,7,10/11/2021,35,48,LOT2027_IP_2021-12-18_48,2/4/2022,SP2027,2022-10-29T23:03:36,,FALSE
12/11/2022,IP2028,parsley,8216,H2028,8,8/28/2021,41,58,LOT2028_IP_2022-12-11_58,1/13/2022,SP2028,2022-09-04T23:46:29,,FALSE
8/10/2021,IP2029,cilantro,7624,H2029,8,11/29/2021,38,53,LOT2029_IP_2021-08-10_53,2/28/2022,SP2029,2022-12-28T17:41:34,,FALSE
12/1/2022,IP2030,cilantro,7207,H2030,7,8/16/2021,36,51,LOT2030_IP_2022-12-01_51,1/7/2022,SP2030,2022-08-22T00:32:47,,FALSE
12/1/2021,IP2031,lettuce,479,H2031,1,11/6/2021,3,4,LOT2031_IP_2021-12-01_4,2/17/2022,SP2031,2022-11-30T22:50:27,,FALSE
7/28/2022,IP2032,Cucumbers,4402,H2032,5,8/22/2021,22,31,LOT2032_IP_2022-07-28_31,1/10/2022,SP2032,2022-08-28T18:45:13,,FALSE
2/9/2023,IP2033,lettuce,217,H2033,1,10/29/2021,2,2,LOT2033_IP_2023-02-09_2,2/13/2022,SP2033,2022-11-20T17:43:40,,FALSE
2/28/2023,IP2034,kale,2071,H2034,3,8/3/2021,11,15,LOT2034_IP_2023-02-28_15,1/1/2022,SP2034,2022-08-05T19:14:57,,FALSE
2/26/2023,IP2035,arugula,2865,H2035,4,9/24/2021,15,20,LOT2035_IP_2023-02-26_20,1/26/2022,SP2035,2022-10-08T15:12:22,,FALSE
9/17/2021,IP2036,chili peppers,6393,H2036,7,9/29/2021,32,45,LOT2036_IP_2021-09-17_45,1/29/2022,SP2036,2022-10-14T15:23:25,,FALSE
5/6/2022,IP2037,basil,6693,H2037,7,11/27/2021,34,47,LOT2037_IP_2022-05-06_47,2/27/2022,SP2037,2022-12-26T15:13:42,,TRUE
8/2/2021,IP2038,bell peppers,5613,H2038,6,11/4/2021,28,39,LOT2038_IP_2021-08-02_39,2/15/2022,SP2038,2022-11-27T15:32:22,,FALSE
9/1/2022,IP2039,sweet potato,9905,H2039,10,10/7/2021,50,69,LOT2039_IP_2022-09-01_69,2/2/2022,SP2039,2022-10-24T09:41:23,,FALSE
5/4/2022,IP2040,chili peppers,6121,H2040,6,10/3/2021,31,43,LOT2040_IP_2022-05-04_43,1/31/2022,SP2040,2022-10-19T14:20:32,,FALSE
9/15/2022,IP2041,spinach,1118,H2041,2,9/18/2021,6,8,LOT2041_IP_2022-09-15_8,1/24/2022,SP2041,2022-10-01T17:23:40,,TRUE
11/28/2021,IP2042,Tomatoes,3724,H2042,4,10/14/2021,19,26,LOT2042_IP_2021-11-28_26,2/6/2022,SP2042,2022-11-02T17:10:31,,FALSE
8/27/2022,IP2043,lettuce,146,H2043,1,8/16/2021,1,1,LOT2043_IP_2022-08-27_1,1/8/2022,SP2043,2022-08-22T07:45:21,,FALSE
1/9/2022,IP2044,sweet potato,9478,H2044,10,10/10/2021,47,66,LOT2044_IP_2022-01-09_66,2/3/2022,SP2044,2022-10-28T11:00:50,,FALSE
1/31/2023,IP2045,arugula,2435,H2045,3,9/6/2021,13,17,LOT2045_IP_2023-01-31_17,1/18/2022,SP2045,2022-09-16T06:07:12,,FALSE
2/26/2023,IP2046,basil,6483,H2046,7,8/31/2021,33,45,LOT2046_IP_2023-02-26_45,1/15/2022,SP2046,2022-09-09T11:54:46,,FALSE
8/28/2021,IP2047,spinach,1329,H2047,2,9/22/2021,7,10,LOT2047_IP_2021-08-28_10,1/26/2022,SP2047,2022-10-06T19:57:03,,FALSE
8/6/2021,IP2048,Tomatoes,3645,H2048,4,8/10/2021,19,26,LOT2048_IP_2021-08-06_26,1/4/2022,SP2048,2022-08-13T21:53:52,,FALSE
10/2/2021,IP2049,sweet potato,9688,H2049,10,11/9/2021,48,68,LOT2049_IP_2021-10-02_68,2/18/2022,SP2049,2022-12-04T20:33:38,,FALSE
4/8/2022,IP2050,cilantro,7490,H2050,8,9/20/2021,38,53,LOT2050_IP_2022-04-08_53,1/25/2022,SP2050,2022-10-03T16:15:15,,FALSE
2/23/2022,IP2051,melons,2947,H2051,4,10/10/2021,15,21,LOT2051_IP_2022-02-23_21,2/4/2022,SP2051,2022-10-28T18:13:24,,FALSE
4/2/2022,IP2052,parsley,7937,H2052,8,9/11/2021,40,56,LOT2052_IP_2022-04-02_56,1/20/2022,SP2052,2022-09-23T03:55:55,,FALSE
1/8/2022,IP2053,spinach,976,H2053,2,10/6/2021,5,7,LOT2053_IP_2022-01-08_7,2/1/2022,SP2053,2022-10-23T08:27:27,,FALSE
2/19/2023,IP2054,melons,3445,H2054,4,11/6/2021,18,24,LOT2054_IP_2023-02-19_24,2/17/2022,SP2054,2022-11-30T19:14:10,,FALSE
12/27/2022,IP2055,potato,8613,H2055,9,9/26/2021,43,60,LOT2055_IP_2022-12-27_60,1/27/2022,SP2055,2022-10-10T17:40:14,,FALSE
5/10/2022,IP2056,cilantro,7804,H2056,8,9/4/2021,39,55,LOT2056_IP_2022-05-10_55,1/17/2022,SP2056,2022-09-13T20:26:47,,FALSE
9/13/2022,IP2057,lettuce,438,H2057,1,9/23/2021,3,3,LOT2057_IP_2022-09-13_3,1/26/2022,SP2057,2022-10-06T23:33:20,,FALSE
8/25/2021,IP2058,melons,3030,H2058,4,8/7/2021,16,21,LOT2058_IP_2021-08-25_21,1/3/2022,SP2058,2022-08-10T14:35:48,,FALSE
4/22/2022,IP2059,cilantro,7828,H2059,8,8/12/2021,39,55,LOT2059_IP_2022-04-22_55,1/5/2022,SP2059,2022-08-16T18:23:07,,FALSE
9/6/2021,IP2060,Cucumbers,4781,H2060,5,9/8/2021,24,34,LOT2060_IP_2021-09-06_34,1/19/2022,SP2060,2022-09-19T06:12:44,,FALSE
12/26/2022,IP2061,cilantro,7322,H2061,8,10/7/2021,37,51,LOT2061_IP_2022-12-26_51,2/2/2022,SP2061,2022-10-24T20:30:13,,FALSE
12/18/2022,IP2062,sweet potato,9484,H2062,10,11/7/2021,47,66,LOT2062_IP_2022-12-18_66,2/17/2022,SP2062,2022-12-01T20:28:06,,TRUE
9/20/2021,IP2063,lettuce,293,H2063,1,11/29/2021,2,2,LOT2063_IP_2021-09-20_2,2/28/2022,SP2063,2022-12-29T00:54:07,,FALSE
9/23/2021,IP2064,chili peppers,5956,H2064,6,9/25/2021,30,42,LOT2064_IP_2021-09-23_42,1/27/2022,SP2064,2022-10-09T12:50:02,,FALSE
8/26/2021,IP2065,chili peppers,6098,H2065,6,10/28/2021,31,43,LOT2065_IP_2021-08-26_43,2/12/2022,SP2065,2022-11-19T02:04:37,,FALSE
6/25/2022,IP2066,lettuce,724,H2066,2,11/27/2021,4,5,LOT2066_IP_2022-06-25_5,2/27/2022,SP2066,2022-12-26T08:01:08,,FALSE
12/25/2021,IP2067,kale,1713,H2067,2,9/8/2021,9,12,LOT2067_IP_2021-12-25_12,1/19/2022,SP2067,2022-09-18T23:00:11,,TRUE
12/15/2021,IP2068,sweet potato,9825,H2068,10,10/31/2021,49,69,LOT2068_IP_2021-12-15_69,2/14/2022,SP2068,2022-11-23T21:25:28,,FALSE
8/17/2021,IP2069,lettuce,124,H2069,1,11/25/2021,1,1,LOT2069_IP_2021-08-17_1,2/26/2022,SP2069,2022-12-24T05:33:16,,FALSE
9/28/2022,IP2070,Tomatoes,4084,H2070,5,11/7/2021,21,29,LOT2070_IP_2022-09-28_29,2/17/2022,SP2070,2022-12-02T10:53:13,,FALSE
8/11/2021,IP2071,sweet potato,9817,H2071,10,10/5/2021,49,69,LOT2071_IP_2021-08-11_69,2/1/2022,SP2071,2022-10-22T18:02:20,,FALSE
7/28/2022,IP2072,lettuce,576,H2072,1,8/15/2021,3,4,LOT2072_IP_2022-07-28_4,1/7/2022,SP2072,2022-08-20T01:41:12,,TRUE
8/29/2021,IP2073,Tomatoes,3745,H2073,4,10/24/2021,19,26,LOT2073_IP_2021-08-29_26,2/11/2022,SP2073,2022-11-15T04:21:26,,TRUE
8/6/2022,IP2074,Cucumbers,4382,H2074,5,8/4/2021,22,31,LOT2074_IP_2022-08-06_31,1/2/2022,SP2074,2022-08-07T07:17:43,,FALSE
1/31/2022,IP2075,bell peppers,5189,H2075,6,9/5/2021,26,36,LOT2075_IP_2022-01-31_36,1/17/2022,SP2075,2022-09-15T22:54:39,,TRUE
11/18/2022,IP2076,chili peppers,6254,H2076,7,9/1/2021,31,44,LOT2076_IP_2022-11-18_44,1/15/2022,SP2076,2022-09-10T09:32:26,,FALSE
10/20/2022,IP2077,spinach,864,H2077,2,10/25/2021,5,6,LOT2077_IP_2022-10-20_6,2/11/2022,SP2077,2022-11-15T15:10:16,,FALSE
8/3/2021,IP2078,lettuce,304,H2078,1,8/2/2021,2,2,LOT2078_IP_2021-08-03_2,12/31/2021,SP2078,2022-08-04T03:35:55,,FALSE
5/21/2022,IP2079,bell peppers,5489,H2079,6,10/10/2021,28,39,LOT2079_IP_2022-05-21_39,2/4/2022,SP2079,2022-10-28T18:13:24,,FALSE
10/12/2022,IP2080,kale,1831,H2080,3,8/10/2021,10,13,LOT2080_IP_2022-10-12_13,1/5/2022,SP2080,2022-08-14T19:31:32,,FALSE
1/19/2022,IP2081,kale,2202,H2081,3,10/25/2021,11,16,LOT2081_IP_2022-01-19_16,2/11/2022,SP2081,2022-11-16T01:59:06,,FALSE
8/21/2021,IP2082,bell peppers,5429,H2082,6,10/3/2021,27,38,LOT2082_IP_2021-08-21_38,1/31/2022,SP2082,2022-10-19T17:56:49,,FALSE
6/19/2022,IP2083,melons,3500,H2083,4,10/14/2021,18,25,LOT2083_IP_2022-06-19_25,2/5/2022,SP2083,2022-11-02T02:45:24,,FALSE
3/21/2022,IP2084,Cucumbers,4458,H2084,5,10/14/2021,23,31,LOT2084_IP_2022-03-21_31,2/5/2022,SP2084,2022-11-02T09:57:57,,FALSE
2/5/2023,IP2085,Tomatoes,3788,H2085,4,11/9/2021,19,27,LOT2085_IP_2023-02-05_27,2/18/2022,SP2085,2022-12-04T16:57:21,,FALSE
10/12/2022,IP2086,parsley,8284,H2086,8,8/30/2021,42,58,LOT2086_IP_2022-10-12_58,1/14/2022,SP2086,2022-09-08T03:28:17,,FALSE
6/12/2022,IP2087,kale,2125,H2087,3,11/28/2021,11,15,LOT2087_IP_2022-06-12_15,2/27/2022,SP2087,2022-12-27T09:15:04,,FALSE
6/24/2022,IP2088,chili peppers,6222,H2088,7,11/23/2021,31,44,LOT2088_IP_2022-06-24_44,2/25/2022,SP2088,2022-12-21T05:27:45,,TRUE
4/10/2022,IP2089,Tomatoes,4206,H2089,5,11/4/2021,21,30,LOT2089_IP_2022-04-10_30,2/16/2022,SP2089,2022-11-27T22:44:55,,FALSE
12/28/2022,IP2090,potato,8983,H2090,9,9/30/2021,45,63,LOT2090_IP_2022-12-28_63,1/30/2022,SP2090,2022-10-16T14:15:01,,FALSE
12/6/2022,IP2091,chili peppers,6102,H2091,6,9/29/2021,31,43,LOT2091_IP_2022-12-06_43,1/29/2022,SP2091,2022-10-14T18:59:42,,TRUE
1/20/2023,IP2092,melons,3597,H2092,4,9/22/2021,18,25,LOT2092_IP_2023-01-20_25,1/26/2022,SP2092,2022-10-06T09:08:14,,FALSE
11/4/2021,IP2093,lettuce,662,H2093,2,10/9/2021,4,5,LOT2093_IP_2021-11-04_5,2/3/2022,SP2093,2022-10-27T13:23:11,,FALSE
10/24/2021,IP2094,spinach,889,H2094,2,11/20/2021,5,7,LOT2094_IP_2021-10-24_7,2/23/2022,SP2094,2022-12-17T14:57:07,,FALSE
9/20/2022,IP2095,parsley,8082,H2095,8,10/10/2021,41,57,LOT2095_IP_2022-09-20_57,2/4/2022,SP2095,2022-10-28T21:49:40,,TRUE
4/12/2022,IP2096,bell peppers,5694,H2096,6,11/19/2021,29,40,LOT2096_IP_2022-04-12_40,2/23/2022,SP2096,2022-12-16T10:06:54,,FALSE
9/1/2021,IP2097,Cucumbers,4384,H2097,5,8/9/2021,22,31,LOT2097_IP_2021-09-01_31,1/4/2022,SP2097,2022-08-12T17:03:40,,FALSE
1/26/2022,IP2098,bell peppers,5702,H2098,6,10/10/2021,29,40,LOT2098_IP_2022-01-26_40,2/4/2022,SP2098,2022-10-29T01:25:57,,FALSE
8/30/2022,IP2099,melons,2960,H2099,4,11/4/2021,15,21,LOT2099_IP_2022-08-30_21,2/16/2022,SP2099,2022-11-27T22:44:55,,FALSE
8/4/2022,IP2100,lettuce,599,H2100,1,10/23/2021,3,4,LOT2100_IP_2022-08-04_4,2/10/2022,SP2100,2022-11-13T16:18:41,,FALSE
2/21/2023,IP2101,lettuce,301,H2101,1,11/7/2021,2,2,LOT2101_IP_2023-02-21_2,2/17/2022,SP2101,2022-12-02T10:53:13,,FALSE
9/30/2022,IP2102,sweet potato,9442,H2102,9,8/24/2021,47,66,LOT2102_IP_2022-09-30_66,1/11/2022,SP2102,2022-09-01T02:03:18,,FALSE
5/24/2022,IP2103,cilantro,7724,H2103,8,9/20/2021,39,54,LOT2103_IP_2022-05-24_54,1/25/2022,SP2103,2022-10-04T06:40:22,,FALSE
11/4/2022,IP2104,Cucumbers,4858,H2104,5,9/20/2021,25,34,LOT2104_IP_2022-11-04_34,1/25/2022,SP2104,2022-10-03T19:51:32,,FALSE
3/6/2022,IP2105,parsley,8419,H2105,9,9/4/2021,42,59,LOT2105_IP_2022-03-06_59,1/17/2022,SP2105,2022-09-14T14:28:10,,FALSE
9/25/2021,IP2106,Tomatoes,3746,H2106,4,10/16/2021,19,26,LOT2106_IP_2021-09-25_26,2/6/2022,SP2106,2022-11-04T08:49:33,,TRUE
9/13/2021,IP2107,Tomatoes,4014,H2107,5,10/24/2021,20,28,LOT2107_IP_2021-09-13_28,2/10/2022,SP2107,2022-11-14T17:32:37,,FALSE
9/1/2022,IP2108,lettuce,712,H2108,2,10/19/2021,4,5,LOT2108_IP_2022-09-01_5,2/8/2022,SP2108,2022-11-08T02:56:27,,FALSE
5/10/2022,IP2109,Cucumbers,4709,H2109,5,9/10/2021,24,33,LOT2109_IP_2022-05-10_33,1/20/2022,SP2109,2022-09-21T23:05:42,,FALSE
11/25/2021,IP2110,Cucumbers,4795,H2110,5,10/16/2021,24,34,LOT2110_IP_2021-11-25_34,2/7/2022,SP2110,2022-11-05T06:27:12,,FALSE
12/11/2022,IP2111,Tomatoes,3648,H2111,4,11/1/2021,19,26,LOT2111_IP_2022-12-11_26,2/14/2022,SP2111,2022-11-24T15:26:51,,FALSE
1/8/2023,IP2112,basil,6578,H2112,7,10/30/2021,33,46,LOT2112_IP_2023-01-08_46,2/13/2022,SP2112,2022-11-21T11:45:03,,TRUE
4/3/2022,IP2113,kale,1796,H2113,3,8/11/2021,9,13,LOT2113_IP_2022-04-03_13,1/5/2022,SP2113,2022-08-15T13:32:55,,TRUE
11/9/2022,IP2114,sweet potato,9980,H2114,10,9/25/2021,50,70,LOT2114_IP_2022-11-09_70,1/27/2022,SP2114,2022-10-09T16:26:18,,FALSE
12/16/2021,IP2115,Tomatoes,4228,H2115,5,11/30/2021,21,30,LOT2115_IP_2021-12-16_30,3/1/2022,SP2115,2022-12-30T12:56:53,,TRUE
1/15/2023,IP2116,chili peppers,5957,H2116,6,8/23/2021,30,42,LOT2116_IP_2023-01-15_42,1/11/2022,SP2116,2022-08-30T17:36:49,,FALSE
8/21/2022,IP2117,bell peppers,5136,H2117,6,9/1/2021,26,36,LOT2117_IP_2022-08-21_36,1/15/2022,SP2117,2022-09-10T16:44:59,,FALSE
12/29/2022,IP2118,melons,3552,H2118,4,9/2/2021,18,25,LOT2118_IP_2022-12-29_25,1/16/2022,SP2118,2022-09-11T10:46:22,,TRUE
6/9/2022,IP2119,basil,6851,H2119,7,8/6/2021,34,48,LOT2119_IP_2022-06-09_48,1/2/2022,SP2119,2022-08-09T13:21:52,,FALSE
1/22/2023,IP2120,parsley,7908,H2120,8,10/5/2021,40,55,LOT2120_IP_2023-01-22_55,2/1/2022,SP2120,2022-10-22T10:49:47,,FALSE
8/3/2022,IP2121,basil,6930,H2121,7,11/18/2021,35,49,LOT2121_IP_2022-08-03_49,2/23/2022,SP2121,2022-12-15T12:29:15,,FALSE
10/19/2021,IP2122,lettuce,541,H2122,1,10/30/2021,3,4,LOT2122_IP_2021-10-19_4,2/13/2022,SP2122,2022-11-22T12:58:59,,TRUE
2/17/2023,IP2123,chili peppers,6216,H2123,7,11/1/2021,31,44,LOT2123_IP_2023-02-17_44,2/14/2022,SP2123,2022-11-25T02:15:40,,FALSE
2/16/2023,IP2124,sweet potato,9842,H2124,10,11/20/2021,49,69,LOT2124_IP_2023-02-16_69,2/23/2022,SP2124,2022-12-17T07:44:34,,FALSE
12/30/2021,IP2125,Cucumbers,4420,H2125,5,9/3/2021,22,31,LOT2125_IP_2021-12-30_31,1/16/2022,SP2125,2022-09-12T12:00:18,,FALSE
2/27/2022,IP2126,lettuce,231,H2126,1,8/27/2021,2,2,LOT2126_IP_2022-02-27_2,1/13/2022,SP2126,2022-09-03T22:32:33,,FALSE
8/26/2021,IP2127,Tomatoes,4148,H2127,5,8/5/2021,21,29,LOT2127_IP_2021-08-26_29,1/2/2022,SP2127,2022-08-07T18:06:33,,TRUE
4/15/2022,IP2128,spinach,1290,H2128,2,9/5/2021,7,9,LOT2128_IP_2022-04-15_9,1/17/2022,SP2128,2022-09-15T22:54:39,,FALSE
6/1/2022,IP2129,Tomatoes,3651,H2129,4,9/26/2021,19,26,LOT2129_IP_2022-06-01_26,1/27/2022,SP2129,2022-10-11T00:52:47,,FALSE
7/11/2022,IP2130,arugula,2513,H2130,3,9/24/2021,13,18,LOT2130_IP_2022-07-11_18,1/27/2022,SP2130,2022-10-09T02:01:12,,FALSE
10/21/2021,IP2131,cilantro,7190,H2131,7,10/17/2021,36,50,LOT2131_IP_2021-10-21_50,2/7/2022,SP2131,2022-11-06T14:53:42,,FALSE
2/25/2022,IP2132,sweet potato,9359,H2132,9,11/3/2021,47,66,LOT2132_IP_2022-02-25_66,2/15/2022,SP2132,2022-11-26T17:54:43,,FALSE
5/29/2022,IP2133,bell peppers,5196,H2133,6,11/15/2021,26,37,LOT2133_IP_2022-05-29_37,2/21/2022,SP2133,2022-12-11T11:09:47,,FALSE
11/24/2021,IP2134,kale,1831,H2134,3,8/17/2021,10,13,LOT2134_IP_2021-11-24_13,1/8/2022,SP2134,2022-08-22T14:57:54,,TRUE
2/15/2023,IP2135,Tomatoes,3847,H2135,4,11/11/2021,20,27,LOT2135_IP_2023-02-15_27,2/19/2022,SP2135,2022-12-06T23:01:30,,FALSE
1/29/2023,IP2136,parsley,8144,H2136,8,9/12/2021,41,57,LOT2136_IP_2023-01-29_57,1/21/2022,SP2136,2022-09-24T05:09:51,,TRUE
12/25/2022,IP2137,bell peppers,5274,H2137,6,10/15/2021,27,37,LOT2137_IP_2022-12-25_37,2/6/2022,SP2137,2022-11-03T11:11:53,,FALSE
1/3/2022,IP2138,bell peppers,5093,H2138,6,9/11/2021,26,36,LOT2138_IP_2022-01-03_36,1/20/2022,SP2138,2022-09-22T09:54:32,,TRUE
1/16/2023,IP2139,parsley,7989,H2139,8,9/29/2021,40,56,LOT2139_IP_2023-01-16_56,1/29/2022,SP2139,2022-10-14T11:47:09,,FALSE
2/27/2022,IP2140,parsley,8153,H2140,8,10/1/2021,41,57,LOT2140_IP_2022-02-27_57,1/30/2022,SP2140,2022-10-16T21:27:34,,FALSE
10/15/2022,IP2141,Cucumbers,4968,H2141,5,10/21/2021,25,35,LOT2141_IP_2022-10-15_35,2/9/2022,SP2141,2022-11-11T10:14:32,,FALSE
9/16/2021,IP2142,parsley,8151,H2142,8,11/23/2021,41,57,LOT2142_IP_2021-09-16_57,2/25/2022,SP2142,2022-12-21T12:40:18,,FALSE
1/4/2023,IP2143,chili peppers,5849,H2143,6,9/23/2021,29,41,LOT2143_IP_2023-01-04_41,1/26/2022,SP2143,2022-10-07T10:22:10,,FALSE
5/31/2022,IP2144,chili peppers,6112,H2144,6,9/24/2021,31,43,LOT2144_IP_2022-05-31_43,1/27/2022,SP2144,2022-10-08T22:24:55,,FALSE
7/13/2022,IP2145,spinach,897,H2145,2,8/2/2021,5,7,LOT2145_IP_2022-07-13_7,12/31/2021,SP2145,2022-08-04T03:35:55,,TRUE
9/10/2021,IP2146,bell peppers,5167,H2146,6,8/11/2021,26,36,LOT2146_IP_2021-09-10_36,1/5/2022,SP2146,2022-08-15T06:20:22,,TRUE
1/15/2023,IP2147,bell peppers,5382,H2147,6,11/11/2021,27,38,LOT2147_IP_2023-01-15_38,2/19/2022,SP2147,2022-12-06T15:48:57,,FALSE
1/15/2022,IP2148,basil,7039,H2148,7,9/1/2021,35,49,LOT2148_IP_2022-01-15_49,1/15/2022,SP2148,2022-09-10T16:44:59,,TRUE
6/24/2022,IP2149,kale,1987,H2149,3,9/28/2021,10,14,LOT2149_IP_2022-06-24_14,1/28/2022,SP2149,2022-10-13T14:09:29,,FALSE
11/26/2021,IP2150,spinach,1463,H2150,2,10/27/2021,8,10,LOT2150_IP_2021-11-26_10,2/12/2022,SP2150,2022-11-18T04:26:58,,FALSE
6/11/2022,IP2151,kale,2137,H2151,3,8/7/2021,11,15,LOT2151_IP_2022-06-11_15,1/3/2022,SP2151,2022-08-10T10:59:31,,FALSE
9/21/2021,IP2152,sweet potato,9737,H2152,10,11/13/2021,49,68,LOT2152_IP_2021-09-21_68,2/20/2022,SP2152,2022-12-09T01:29:22,,FALSE
1/20/2023,IP2153,kale,1687,H2153,2,10/14/2021,9,12,LOT2153_IP_2023-01-20_12,2/6/2022,SP2153,2022-11-02T17:10:31,,FALSE
5/16/2022,IP2154,sweet potato,9582,H2154,10,10/28/2021,48,67,LOT2154_IP_2022-05-16_67,2/12/2022,SP2154,2022-11-19T12:53:27,,FALSE
9/12/2022,IP2155,lettuce,651,H2155,2,10/30/2021,4,5,LOT2155_IP_2022-09-12_5,2/13/2022,SP2155,2022-11-22T12:58:59,,FALSE
1/14/2022,IP2156,lettuce,319,H2156,1,11/15/2021,2,3,LOT2156_IP_2022-01-14_3,2/21/2022,SP2156,2022-12-11T14:46:04,,TRUE
6/17/2022,IP2157,parsley,8382,H2157,9,9/16/2021,42,59,LOT2157_IP_2022-06-17_59,1/22/2022,SP2157,2022-09-28T10:05:35,,FALSE
9/9/2022,IP2158,kale,1741,H2158,2,11/10/2021,9,12,LOT2158_IP_2022-09-09_12,2/19/2022,SP2158,2022-12-06T05:00:07,,FALSE
10/23/2022,IP2159,cilantro,7252,H2159,8,10/12/2021,36,51,LOT2159_IP_2022-10-23_51,2/4/2022,SP2159,2022-10-31T03:53:49,,FALSE
4/29/2022,IP2160,arugula,2490,H2160,3,9/13/2021,13,18,LOT2160_IP_2022-04-29_18,1/21/2022,SP2160,2022-09-25T20:48:53,,FALSE
12/27/2022,IP2161,bell peppers,5754,H2161,6,11/7/2021,29,40,LOT2161_IP_2022-12-27_40,2/17/2022,SP2161,2022-12-02T07:16:56,,TRUE
2/28/2022,IP2162,basil,7019,H2162,7,9/23/2021,35,49,LOT2162_IP_2022-02-28_49,1/26/2022,SP2162,2022-10-07T13:58:26,,FALSE
1/27/2023,IP2163,lettuce,489,H2163,1,10/22/2021,3,4,LOT2163_IP_2023-01-27_4,2/9/2022,SP2163,2022-11-12T15:04:45,,FALSE
7/5/2022,IP2164,potato,8704,H2164,9,11/21/2021,44,61,LOT2164_IP_2022-07-05_61,2/24/2022,SP2164,2022-12-19T06:36:09,,TRUE
8/14/2021,IP2165,lettuce,226,H2165,1,9/7/2021,2,2,LOT2165_IP_2021-08-14_2,1/18/2022,SP2165,2022-09-17T14:33:42,,FALSE
2/1/2022,IP2166,parsley,8510,H2166,9,9/19/2021,43,60,LOT2166_IP_2022-02-01_60,1/24/2022,SP2166,2022-10-02T11:25:03,,FALSE
4/8/2022,IP2167,kale,1991,H2167,3,9/7/2021,10,14,LOT2167_IP_2022-04-08_14,1/18/2022,SP2167,2022-09-17T07:21:08,,TRUE
3/24/2022,IP2168,Cucumbers,4673,H2168,5,10/22/2021,24,33,LOT2168_IP_2022-03-24_33,2/10/2022,SP2168,2022-11-12T18:41:01,,FALSE
2/26/2023,IP2169,bell peppers,5538,H2169,6,9/23/2021,28,39,LOT2169_IP_2023-02-26_39,1/26/2022,SP2169,2022-10-07T03:09:37,,FALSE
12/11/2022,IP2170,Tomatoes,4002,H2170,5,10/27/2021,20,28,LOT2170_IP_2022-12-11_28,2/12/2022,SP2170,2022-11-18T00:50:41,,TRUE
12/2/2022,IP2171,parsley,8583,H2171,9,11/27/2021,43,60,LOT2171_IP_2022-12-02_60,2/27/2022,SP2171,2022-12-26T08:01:08,,FALSE
1/31/2022,IP2172,Tomatoes,3959,H2172,5,8/2/2021,20,28,LOT2172_IP_2022-01-31_28,12/31/2021,SP2172,2022-08-04T14:24:45,,FALSE
6/20/2022,IP2173,Tomatoes,3953,H2173,5,10/11/2021,20,28,LOT2173_IP_2022-06-20_28,2/4/2022,SP2173,2022-10-29T05:02:13,,FALSE
12/27/2021,IP2174,potato,9245,H2174,9,10/19/2021,46,65,LOT2174_IP_2021-12-27_65,2/8/2022,SP2174,2022-11-08T06:32:44,,TRUE
9/18/2022,IP2175,arugula,2766,H2175,3,9/15/2021,14,20,LOT2175_IP_2022-09-18_20,1/22/2022,SP2175,2022-09-27T08:51:39,,FALSE
2/16/2022,IP2176,sweet potato,9763,H2176,10,11/28/2021,49,68,LOT2176_IP_2022-02-16_68,2/27/2022,SP2176,2022-12-27T12:51:21,,FALSE
12/12/2021,IP2177,bell peppers,5732,H2177,6,10/12/2021,29,40,LOT2177_IP_2021-12-12_40,2/4/2022,SP2177,2022-10-30T13:28:42,,FALSE
11/12/2021,IP2178,Tomatoes,4269,H2178,5,10/20/2021,22,30,LOT2178_IP_2021-11-12_30,2/8/2022,SP2178,2022-11-09T04:10:23,,TRUE
8/2/2022,IP2179,potato,8672,H2179,9,8/14/2021,43,61,LOT2179_IP_2022-08-02_61,1/6/2022,SP2179,2022-08-19T11:16:06,,FALSE
12/2/2022,IP2180,parsley,8524,H2180,9,9/14/2021,43,60,LOT2180_IP_2022-12-02_60,1/22/2022,SP2180,2022-09-26T11:14,,FALSE
10/11/2021,IP2181,chili peppers,6234,H2181,7,9/26/2021,31,44,LOT2181_IP_2021-10-11_44,1/28/2022,SP2181,2022-10-11T04:29:04,,FALSE
2/20/2022,IP2182,potato,9046,H2182,9,9/18/2021,45,63,LOT2182_IP_2022-02-20_63,1/24/2022,SP2182,2022-10-01T20:59:56,,FALSE
11/13/2021,IP2183,chili peppers,6207,H2183,7,8/21/2021,31,44,LOT2183_IP_2021-11-13_44,1/10/2022,SP2183,2022-08-28T11:32:40,,FALSE
1/29/2022,IP2184,sweet potato,9378,H2184,9,10/21/2021,47,66,LOT2184_IP_2022-01-29_66,2/9/2022,SP2184,2022-11-11T03:01:59,,TRUE
4/10/2022,IP2185,arugula,2436,H2185,3,10/25/2021,13,17,LOT2185_IP_2022-04-10_17,2/11/2022,SP2185,2022-11-15T22:22:49,,FALSE
8/13/2021,IP2186,spinach,1327,H2186,2,8/4/2021,7,10,LOT2186_IP_2021-08-13_10,1/1/2022,SP2186,2022-08-07T00:05:10,,FALSE
11/12/2022,IP2187,kale,1764,H2187,3,10/15/2021,9,13,LOT2187_IP_2022-11-12_13,2/6/2022,SP2187,2022-11-04T01:37,,FALSE
6/9/2022,IP2188,arugula,2469,H2188,3,8/15/2021,13,18,LOT2188_IP_2022-06-09_18,1/7/2022,SP2188,2022-08-20T19:42:35,,FALSE
2/19/2022,IP2189,lettuce,599,H2189,1,8/29/2021,3,4,LOT2189_IP_2022-02-19_4,1/14/2022,SP2189,2022-09-07T05:50:38,,FALSE
8/20/2021,IP2190,potato,9083,H2190,9,10/22/2021,45,64,LOT2190_IP_2021-08-20_64,2/9/2022,SP2190,2022-11-12T11:28:28,,TRUE
4/13/2022,IP2191,basil,6596,H2191,7,8/29/2021,33,46,LOT2191_IP_2022-04-13_46,1/14/2022,SP2191,2022-09-06T08:12:58,,FALSE
11/1/2022,IP2192,arugula,2774,H2192,3,11/24/2021,14,20,LOT2192_IP_2022-11-01_20,2/25/2022,SP2192,2022-12-22T13:54:14,,FALSE
7/17/2022,IP2193,bell peppers,5408,H2193,6,8/25/2021,27,38,LOT2193_IP_2022-07-17_38,1/12/2022,SP2193,2022-09-01T16:28:24,,FALSE
11/14/2022,IP2194,basil,6941,H2194,7,10/5/2021,35,49,LOT2194_IP_2022-11-14_49,2/1/2022,SP2194,2022-10-22T18:02:20,,FALSE
12/25/2022,IP2195,Tomatoes,4300,H2195,5,11/14/2021,22,30,LOT2195_IP_2022-12-25_30,2/21/2022,SP2195,2022-12-10T13:32:08,,FALSE
12/10/2022,IP2196,bell peppers,5198,H2196,6,8/7/2021,26,37,LOT2196_IP_2022-12-10_37,1/3/2022,SP2196,2022-08-10T18:12:04,,TRUE
7/22/2022,IP2197,spinach,1458,H2197,2,9/27/2021,8,10,LOT2197_IP_2022-07-22_10,1/28/2022,SP2197,2022-10-12T05:43,,FALSE
10/31/2021,IP2198,arugula,2352,H2198,3,9/12/2021,12,17,LOT2198_IP_2021-10-31_17,1/21/2022,SP2198,2022-09-24T12:22:24,,FALSE
5/5/2022,IP2199,potato,8977,H2199,9,8/14/2021,45,63,LOT2199_IP_2022-05-05_63,1/6/2022,SP2199,2022-08-19T00:27:16,,TRUE
11/12/2021,IP2200,parsley,8106,H2200,8,9/19/2021,41,57,LOT2200_IP_2021-11-12_57,1/24/2022,SP2200,2022-10-02T22:13:52,,FALSE
12/20/2021,IP2201,sweet potato,9557,H2201,10,8/15/2021,48,67,LOT2201_IP_2021-12-20_67,1/7/2022,SP2201,2022-08-21T02:55:08,,FALSE
11/15/2021,IP2202,arugula,2234,H2202,3,11/13/2021,12,16,LOT2202_IP_2021-11-15_16,2/20/2022,SP2202,2022-12-09T01:29:22,,FALSE
9/20/2022,IP2203,bell peppers,5568,H2203,6,10/26/2021,28,39,LOT2203_IP_2022-09-20_39,2/11/2022,SP2203,2022-11-17T03:13:02,,FALSE
1/6/2022,IP2204,potato,8804,H2204,9,10/13/2021,44,62,LOT2204_IP_2022-01-06_62,2/5/2022,SP2204,2022-11-01T05:07:45,,FALSE
2/20/2023,IP2205,basil,7141,H2205,7,11/19/2021,36,50,LOT2205_IP_2023-02-20_50,2/23/2022,SP2205,2022-12-17T04:08:17,,FALSE
2/12/2023,IP2206,parsley,8320,H2206,8,9/17/2021,42,58,LOT2206_IP_2023-02-12_58,1/23/2022,SP2206,2022-09-29T18:32:04,,FALSE
12/10/2022,IP2207,arugula,2871,H2207,4,9/17/2021,15,20,LOT2207_IP_2022-12-10_20,1/23/2022,SP2207,2022-09-29T14:55:48,,FALSE
8/10/2021,IP2208,chili peppers,6020,H2208,6,9/12/2021,30,42,LOT2208_IP_2021-08-10_42,1/20/2022,SP2208,2022-09-23T11:08:28,,FALSE
11/25/2022,IP2209,arugula,2493,H2209,3,8/26/2021,13,18,LOT2209_IP_2022-11-25_18,1/12/2022,SP2209,2022-09-02T17:42:20,,FALSE
3/15/2022,IP2210,cilantro,7412,H2210,8,10/28/2021,37,52,LOT2210_IP_2022-03-15_52,2/12/2022,SP2210,2022-11-20T03:18:33,,FALSE
6/20/2022,IP2211,Tomatoes,4009,H2211,5,11/15/2021,20,28,LOT2211_IP_2022-06-20_28,2/21/2022,SP2211,2022-12-11T11:09:47,,FALSE
11/23/2022,IP2212,basil,6742,H2212,7,9/25/2021,34,47,LOT2212_IP_2022-11-23_47,1/27/2022,SP2212,2022-10-09T16:26:18,,FALSE
2/10/2022,IP2213,Cucumbers,4986,H2213,5,10/4/2021,25,35,LOT2213_IP_2022-02-10_35,1/31/2022,SP2213,2022-10-20T11:58:12,,FALSE
4/9/2022,IP2214,kale,2135,H2214,3,8/5/2021,11,15,LOT2214_IP_2022-04-09_15,1/2/2022,SP2214,2022-08-08T08:31:39,,FALSE
12/19/2022,IP2215,arugula,2581,H2215,3,10/9/2021,13,18,LOT2215_IP_2022-12-19_18,2/3/2022,SP2215,2022-10-27T02:34:21,,TRUE
2/19/2022,IP2216,chili peppers,6041,H2216,6,8/25/2021,30,42,LOT2216_IP_2022-02-19_42,1/12/2022,SP2216,2022-09-01T09:15:51,,FALSE
11/19/2021,IP2217,parsley,8339,H2217,8,9/11/2021,42,58,LOT2217_IP_2021-11-19_58,1/20/2022,SP2217,2022-09-23T07:32:11,,FALSE
2/15/2023,IP2218,melons,3324,H2218,4,11/5/2021,17,23,LOT2218_IP_2023-02-15_23,2/16/2022,SP2218,2022-11-28T23:58:51,,FALSE
11/26/2022,IP2219,basil,6883,H2219,7,11/10/2021,35,48,LOT2219_IP_2022-11-26_48,2/18/2022,SP2219,2022-12-05T03:46:11,,FALSE
1/3/2022,IP2220,cilantro,7565,H2220,8,8/16/2021,38,53,LOT2220_IP_2022-01-03_53,1/7/2022,SP2220,2022-08-22T00:32:47,,FALSE
2/4/2023,IP2221,Cucumbers,5031,H2221,5,10/28/2021,25,35,LOT2221_IP_2023-02-04_35,2/12/2022,SP2221,2022-11-20T03:18:33,,TRUE
8/29/2021,IP2222,arugula,2522,H2222,3,8/20/2021,13,18,LOT2222_IP_2021-08-29_18,1/9/2022,SP2222,2022-08-26T19:53:38,,FALSE
9/20/2021,IP2223,bell peppers,5185,H2223,6,8/16/2021,26,36,LOT2223_IP_2021-09-20_36,1/8/2022,SP2223,2022-08-22T04:09:04,,FALSE
12/23/2021,IP2224,melons,2993,H2224,4,8/31/2021,15,21,LOT2224_IP_2021-12-23_21,1/15/2022,SP2224,2022-09-08T21:29:40,,FALSE
9/14/2021,IP2225,kale,2148,H2225,3,10/18/2021,11,15,LOT2225_IP_2021-09-14_15,2/7/2022,SP2225,2022-11-07T16:07:38,,FALSE
10/17/2021,IP2226,Cucumbers,4825,H2226,5,8/4/2021,24,34,LOT2226_IP_2021-10-17_34,1/2/2022,SP2226,2022-08-07T14:30:16,,FALSE
10/17/2021,IP2227,potato,8961,H2227,9,11/29/2021,45,63,LOT2227_IP_2021-10-17_63,2/28/2022,SP2227,2022-12-29T11:42:57,,FALSE
1/31/2022,IP2228,bell peppers,5154,H2228,6,8/17/2021,26,36,LOT2228_IP_2022-01-31_36,1/8/2022,SP2228,2022-08-23T01:46:44,,FALSE
9/24/2022,IP2229,arugula,2286,H2229,3,8/21/2021,12,16,LOT2229_IP_2022-09-24_16,1/10/2022,SP2229,2022-08-28T11:32:40,,FALSE
9/25/2021,IP2230,spinach,813,H2230,2,9/5/2021,5,6,LOT2230_IP_2021-09-25_6,1/17/2022,SP2230,2022-09-15T08:29:33,,TRUE
4/2/2022,IP2231,basil,6849,H2231,7,8/13/2021,34,48,LOT2231_IP_2022-04-02_48,1/6/2022,SP2231,2022-08-18T06:25:53,,FALSE
9/19/2021,IP2232,potato,8957,H2232,9,8/2/2021,45,63,LOT2232_IP_2021-09-19_63,12/31/2021,SP2232,2022-08-04T03:35:55,,FALSE
4/25/2022,IP2233,basil,7004,H2233,7,9/3/2021,35,49,LOT2233_IP_2022-04-25_49,1/16/2022,SP2233,2022-09-13T02:25:24,,FALSE
1/13/2023,IP2234,Tomatoes,4310,H2234,5,8/30/2021,22,30,LOT2234_IP_2023-01-13_30,1/14/2022,SP2234,2022-09-08T14:17:07,,FALSE
10/2/2022,IP2235,parsley,7990,H2235,8,9/19/2021,40,56,LOT2235_IP_2022-10-02_56,1/24/2022,SP2235,2022-10-02T04:12:29,,FALSE
10/8/2021,IP2236,parsley,8027,H2236,8,11/13/2021,40,56,LOT2236_IP_2021-10-08_56,2/20/2022,SP2236,2022-12-09T08:41:55,,FALSE
12/19/2022,IP2237,cilantro,7600,H2237,8,9/6/2021,38,53,LOT2237_IP_2022-12-19_53,1/18/2022,SP2237,2022-09-17T03:44:52,,FALSE
1/15/2022,IP2238,lettuce,156,H2238,1,8/11/2021,1,1,LOT2238_IP_2022-01-15_1,1/5/2022,SP2238,2022-08-15T06:20:22,,FALSE
11/6/2022,IP2239,arugula,2786,H2239,3,11/16/2021,14,20,LOT2239_IP_2022-11-06_20,2/22/2022,SP2239,2022-12-13T10:01:23,,FALSE
10/21/2021,IP2240,arugula,2251,H2240,3,11/12/2021,12,16,LOT2240_IP_2021-10-21_16,2/20/2022,SP2240,2022-12-08T14:40:32,,FALSE
1/21/2023,IP2241,bell peppers,5192,H2241,6,8/21/2021,26,36,LOT2241_IP_2023-01-21_36,1/10/2022,SP2241,2022-08-28T04:20:07,,FALSE
7/26/2022,IP2242,spinach,1228,H2242,2,9/18/2021,7,9,LOT2242_IP_2022-07-26_9,1/23/2022,SP2242,2022-10-01T02:58:33,,FALSE
2/24/2022,IP2243,parsley,8232,H2243,8,9/27/2021,41,58,LOT2243_IP_2022-02-24_58,1/28/2022,SP2243,2022-10-12T02:06:44,,FALSE
9/4/2021,IP2244,bell peppers,5104,H2244,6,11/16/2021,26,36,LOT2244_IP_2021-09-04_36,2/22/2022,SP2244,2022-12-13T10:01:23,,FALSE
2/16/2023,IP2245,arugula,2539,H2245,3,9/3/2021,13,18,LOT2245_IP_2023-02-16_18,1/16/2022,SP2245,2022-09-12T19:12:51,,FALSE
5/1/2022,IP2246,spinach,820,H2246,2,8/18/2021,5,6,LOT2246_IP_2022-05-01_6,1/8/2022,SP2246,2022-08-24T03:00:40,,FALSE
1/5/2022,IP2247,cilantro,7569,H2247,8,11/16/2021,38,53,LOT2247_IP_2022-01-05_53,2/21/2022,SP2247,2022-12-12T12:23:43,,FALSE
3/3/2022,IP2248,Tomatoes,3695,H2248,4,10/14/2021,19,26,LOT2248_IP_2022-03-03_26,2/6/2022,SP2248,2022-11-03T00:23:04,,FALSE
9/17/2021,IP2249,lettuce,249,H2249,1,11/30/2021,2,2,LOT2249_IP_2021-09-17_2,2/28/2022,SP2249,2022-12-30T02:08:03,,FALSE
12/4/2022,IP2250,potato,9200,H2250,9,8/30/2021,46,64,LOT2250_IP_2022-12-04_64,1/14/2022,SP2250,2022-09-07T23:52:01,,FALSE
9/12/2022,IP2251,bell peppers,5463,H2251,6,8/1/2021,28,38,LOT2251_IP_2022-09-12_38,12/31/2021,SP2251,2022-08-03T23:59:38,,FALSE
2/13/2023,IP2252,bell peppers,5177,H2252,6,8/8/2021,26,36,LOT2252_IP_2023-02-13_36,1/3/2022,SP2252,2022-08-11T15:49:44,,FALSE
10/25/2022,IP2253,arugula,2855,H2253,4,11/25/2021,15,20,LOT2253_IP_2022-10-25_20,2/26/2022,SP2253,2022-12-24T05:33:16,,FALSE
2/4/2023,IP2254,cilantro,7584,H2254,8,10/17/2021,38,53,LOT2254_IP_2023-02-04_53,2/7/2022,SP2254,2022-11-05T20:52:19,,FALSE
6/17/2022,IP2255,chili peppers,6266,H2255,7,11/8/2021,32,44,LOT2255_IP_2022-06-17_44,2/18/2022,SP2255,2022-12-03T01:18:19,,FALSE
2/24/2022,IP2256,cilantro,7784,H2256,8,9/22/2021,39,55,LOT2256_IP_2022-02-24_55,1/26/2022,SP2256,2022-10-06T12:44:30,,FALSE
4/21/2022,IP2257,Cucumbers,4863,H2257,5,9/20/2021,25,34,LOT2257_IP_2022-04-21_34,1/25/2022,SP2257,2022-10-04T06:40:22,,FALSE
9/13/2022,IP2258,Tomatoes,4098,H2258,5,9/7/2021,21,29,LOT2258_IP_2022-09-13_29,1/18/2022,SP2258,2022-09-18T04:58:48,,FALSE
9/17/2021,IP2259,potato,8707,H2259,9,11/27/2021,44,61,LOT2259_IP_2021-09-17_61,2/27/2022,SP2259,2022-12-27T02:02:31,,FALSE
10/16/2021,IP2260,arugula,2696,H2260,3,10/2/2021,14,19,LOT2260_IP_2021-10-16_19,1/30/2022,SP2260,2022-10-18T13:06:36,,FALSE
7/16/2022,IP2261,kale,1795,H2261,3,11/4/2021,9,13,LOT2261_IP_2022-07-16_13,2/15/2022,SP2261,2022-11-27T15:32:22,,FALSE
4/27/2022,IP2262,potato,8978,H2262,9,11/15/2021,45,63,LOT2262_IP_2022-04-27_63,2/21/2022,SP2262,2022-12-12T08:47:27,,FALSE
4/19/2022,IP2263,basil,6750,H2263,7,10/28/2021,34,47,LOT2263_IP_2022-04-19_47,2/12/2022,SP2263,2022-11-19T02:04:37,,FALSE
7/11/2022,IP2264,Tomatoes,3798,H2264,4,10/23/2021,19,27,LOT2264_IP_2022-07-11_27,2/10/2022,SP2264,2022-11-12T22:17:18,,FALSE
12/11/2022,IP2265,potato,9255,H2265,9,8/5/2021,46,65,LOT2265_IP_2022-12-11_65,1/2/2022,SP2265,2022-08-08T12:07:56,,FALSE
1/9/2022,IP2266,basil,6648,H2266,7,11/23/2021,33,47,LOT2266_IP_2022-01-09_47,2/25/2022,SP2266,2022-12-21T19:52:51,,FALSE
7/12/2022,IP2267,parsley,7927,H2267,8,8/21/2021,40,56,LOT2267_IP_2022-07-12_56,1/10/2022,SP2267,2022-08-28T07:56:24,,FALSE
4/20/2022,IP2268,kale,2189,H2268,3,10/25/2021,11,16,LOT2268_IP_2022-04-20_16,2/11/2022,SP2268,2022-11-15T22:22:49,,FALSE
3/8/2022,IP2269,arugula,2590,H2269,3,8/7/2021,13,18,LOT2269_IP_2022-03-08_18,1/3/2022,SP2269,2022-08-10T07:23:15,,FALSE
2/2/2022,IP2270,sweet potato,9305,H2270,9,8/28/2021,47,65,LOT2270_IP_2022-02-02_65,1/13/2022,SP2270,2022-09-05T21:24:09,,TRUE
9/6/2022,IP2271,sweet potato,9607,H2271,10,9/28/2021,48,67,LOT2271_IP_2022-09-06_67,1/29/2022,SP2271,2022-10-14T00:58:19,,FALSE
7/18/2022,IP2272,cilantro,7508,H2272,8,9/12/2021,38,53,LOT2272_IP_2022-07-18_53,1/21/2022,SP2272,2022-09-23T18:21:01,,FALSE
11/12/2022,IP2273,basil,6973,H2273,7,11/19/2021,35,49,LOT2273_IP_2022-11-12_49,2/23/2022,SP2273,2022-12-17T00:32:01,,FALSE
8/28/2022,IP2274,lettuce,592,H2274,1,10/9/2021,3,4,LOT2274_IP_2022-08-28_4,2/3/2022,SP2274,2022-10-26T15:45:31,,FALSE
12/6/2021,IP2275,cilantro,7296,H2275,8,11/16/2021,37,51,LOT2275_IP_2021-12-06_51,2/22/2022,SP2275,2022-12-12T19:36:17,,FALSE
5/16/2022,IP2276,parsley,8356,H2276,9,10/7/2021,42,59,LOT2276_IP_2022-05-16_59,2/2/2022,SP2276,2022-10-25T00:06:29,,TRUE
12/31/2021,IP2277,bell peppers,5422,H2277,6,11/5/2021,27,38,LOT2277_IP_2021-12-31_38,2/16/2022,SP2277,2022-11-28T23:58:51,,TRUE
2/13/2022,IP2278,potato,8786,H2278,9,10/12/2021,44,62,LOT2278_IP_2022-02-13_62,2/5/2022,SP2278,2022-10-31T11:06:22,,FALSE
3/4/2022,IP2279,kale,1636,H2279,2,8/15/2021,9,12,LOT2279_IP_2022-03-04_12,1/7/2022,SP2279,2022-08-20T12:30:02,,FALSE
8/2/2022,IP2280,basil,6861,H2280,7,9/9/2021,34,48,LOT2280_IP_2022-08-02_48,1/19/2022,SP2280,2022-09-20T07:26:40,,FALSE
10/25/2021,IP2281,potato,8977,H2281,9,10/19/2021,45,63,LOT2281_IP_2021-10-25_63,2/8/2022,SP2281,2022-11-08T17:21:34,,TRUE
2/6/2022,IP2282,Tomatoes,3696,H2282,4,10/27/2021,19,26,LOT2282_IP_2022-02-06_26,2/12/2022,SP2282,2022-11-18T04:26:58,,FALSE
1/2/2022,IP2283,parsley,8534,H2283,9,11/25/2021,43,60,LOT2283_IP_2022-01-02_60,2/26/2022,SP2283,2022-12-23T11:31:53,,TRUE
12/19/2021,IP2284,lettuce,313,H2284,1,10/26/2021,2,2,LOT2284_IP_2021-12-19_2,2/11/2022,SP2284,2022-11-16T16:24:12,,FALSE
8/15/2022,IP2285,Cucumbers,4754,H2285,5,9/5/2021,24,33,LOT2285_IP_2022-08-15_33,1/17/2022,SP2285,2022-09-15T19:18:23,,FALSE
1/20/2022,IP2286,cilantro,7780,H2286,8,9/2/2021,39,55,LOT2286_IP_2022-01-20_55,1/16/2022,SP2286,2022-09-11T10:46:22,,FALSE
11/30/2021,IP2287,arugula,2232,H2287,3,10/28/2021,12,16,LOT2287_IP_2021-11-30_16,2/12/2022,SP2287,2022-11-19T05:40:54,,FALSE
7/19/2022,IP2288,Cucumbers,4657,H2288,5,8/23/2021,24,33,LOT2288_IP_2022-07-19_33,1/11/2022,SP2288,2022-08-30T10:24:16,,TRUE
9/10/2022,IP2289,potato,9105,H2289,9,8/14/2021,46,64,LOT2289_IP_2022-09-10_64,1/6/2022,SP2289,2022-08-19T11:16:06,,FALSE
2/13/2022,IP2290,cilantro,7487,H2290,8,11/25/2021,38,52,LOT2290_IP_2022-02-13_52,2/26/2022,SP2290,2022-12-23T11:31:53,,FALSE
1/6/2022,IP2291,sweet potato,9457,H2291,10,10/24/2021,47,66,LOT2291_IP_2022-01-06_66,2/10/2022,SP2291,2022-11-14T13:56:20,,FALSE
7/14/2022,IP2292,sweet potato,9894,H2292,10,8/12/2021,49,69,LOT2292_IP_2022-07-14_69,1/5/2022,SP2292,2022-08-17T01:35:40,,FALSE
6/16/2022,IP2293,chili peppers,5884,H2293,6,8/16/2021,30,41,LOT2293_IP_2022-06-16_41,1/7/2022,SP2293,2022-08-22T00:32:47,,FALSE
2/19/2022,IP2294,Cucumbers,4682,H2294,5,11/12/2021,24,33,LOT2294_IP_2022-02-19_33,2/20/2022,SP2294,2022-12-07T20:39:09,,TRUE
3/31/2022,IP2295,chili peppers,6278,H2295,7,9/6/2021,32,44,LOT2295_IP_2022-03-31_44,1/18/2022,SP2295,2022-09-16T13:19:46,,FALSE
1/24/2022,IP2296,basil,7143,H2296,7,11/29/2021,36,50,LOT2296_IP_2022-01-24_50,2/28/2022,SP2296,2022-12-29T04:30:23,,FALSE
9/15/2022,IP2297,Cucumbers,5042,H2297,5,8/11/2021,25,35,LOT2297_IP_2022-09-15_35,1/5/2022,SP2297,2022-08-15T06:20:22,,FALSE
12/23/2022,IP2298,potato,8985,H2298,9,10/11/2021,45,63,LOT2298_IP_2022-12-23_63,2/4/2022,SP2298,2022-10-29T05:02:13,,FALSE
11/19/2022,IP2299,chili peppers,6209,H2299,7,8/5/2021,31,44,LOT2299_IP_2022-11-19_44,1/2/2022,SP2299,2022-08-08T01:19:06,,FALSE
2/27/2022,IP2300,lettuce,701,H2300,2,8/1/2021,4,5,LOT2300_IP_2022-02-27_5,12/31/2021,SP2300,2022-08-03T23:59:38,,FALSE
12/11/2021,IP2301,arugula,2733,H2301,3,9/3/2021,14,19,LOT2301_IP_2021-12-11_19,1/16/2022,SP2301,2022-09-12T19:12:51,,FALSE
5/1/2022,IP2302,potato,9010,H2302,9,10/18/2021,45,63,LOT2302_IP_2022-05-01_63,2/7/2022,SP2302,2022-11-07T16:07:38,,FALSE
10/6/2022,IP2303,chili peppers,6300,H2303,7,10/16/2021,32,44,LOT2303_IP_2022-10-06_44,2/6/2022,SP2303,2022-11-04T12:25:49,,FALSE
10/19/2021,IP2304,parsley,7901,H2304,8,10/14/2021,40,55,LOT2304_IP_2021-10-19_55,2/5/2022,SP2304,2022-11-01T19:32:51,,FALSE
2/24/2023,IP2305,melons,3216,H2305,4,11/15/2021,16,23,LOT2305_IP_2023-02-24_23,2/21/2022,SP2305,2022-12-11T14:46:04,,FALSE
4/30/2022,IP2306,Tomatoes,3736,H2306,4,11/2/2021,19,26,LOT2306_IP_2022-04-30_26,2/15/2022,SP2306,2022-11-25T09:28:14,,FALSE
12/26/2022,IP2307,sweet potato,9847,H2307,10,11/25/2021,49,69,LOT2307_IP_2022-12-26_69,2/26/2022,SP2307,2022-12-23T22:20:43,,FALSE
9/16/2021,IP2308,sweet potato,9393,H2308,9,9/1/2021,47,66,LOT2308_IP_2021-09-16_66,1/15/2022,SP2308,2022-09-10T16:44:59,,FALSE
12/21/2021,IP2309,sweet potato,9907,H2309,10,10/7/2021,50,69,LOT2309_IP_2021-12-21_69,2/2/2022,SP2309,2022-10-24T13:17:39,,FALSE
10/3/2022,IP2310,Cucumbers,4618,H2310,5,9/18/2021,23,32,LOT2310_IP_2022-10-03_32,1/24/2022,SP2310,2022-10-01T10:11:07,,FALSE
10/26/2021,IP2311,kale,1847,H2311,3,10/14/2021,10,13,LOT2311_IP_2021-10-26_13,2/6/2022,SP2311,2022-11-02T17:10:31,,FALSE
2/1/2023,IP2312,potato,8986,H2312,9,10/12/2021,45,63,LOT2312_IP_2023-02-01_63,2/5/2022,SP2312,2022-10-31T07:30:05,,TRUE
8/24/2022,IP2313,cilantro,7831,H2313,8,8/3/2021,39,55,LOT2313_IP_2022-08-24_55,1/1/2022,SP2313,2022-08-05T15:38:41,,FALSE
7/27/2022,IP2314,sweet potato,9965,H2314,10,8/31/2021,50,70,LOT2314_IP_2022-07-27_70,1/15/2022,SP2314,2022-09-09T11:54:46,,FALSE
9/14/2022,IP2315,spinach,1405,H2315,2,10/3/2021,7,10,LOT2315_IP_2022-09-14_10,1/31/2022,SP2315,2022-10-20T01:09:22,,FALSE
1/31/2022,IP2316,melons,3339,H2316,4,8/7/2021,17,24,LOT2316_IP_2022-01-31_24,1/3/2022,SP2316,2022-08-10T07:23:15,,FALSE
2/15/2022,IP2317,basil,6881,H2317,7,10/10/2021,35,48,LOT2317_IP_2022-02-15_48,2/3/2022,SP2317,2022-10-28T14:37:07,,FALSE
8/8/2022,IP2318,parsley,8306,H2318,8,8/5/2021,42,58,LOT2318_IP_2022-08-08_58,1/2/2022,SP2318,2022-08-08T15:44:12,,FALSE
10/30/2021,IP2319,bell peppers,5614,H2319,6,11/17/2021,28,39,LOT2319_IP_2021-10-30_39,2/22/2022,SP2319,2022-12-14T04:02:46,,FALSE
2/9/2022,IP2320,Cucumbers,4959,H2320,5,9/25/2021,25,35,LOT2320_IP_2022-02-09_35,1/27/2022,SP2320,2022-10-10T03:15:08,,FALSE
8/26/2021,IP2321,basil,6576,H2321,7,9/19/2021,33,46,LOT2321_IP_2021-08-26_46,1/24/2022,SP2321,2022-10-02T04:12:29,,TRUE
2/22/2022,IP2322,parsley,8021,H2322,8,8/18/2021,40,56,LOT2322_IP_2022-02-22_56,1/8/2022,SP2322,2022-08-23T19:48:06,,FALSE
1/17/2023,IP2323,sweet potato,9371,H2323,9,10/1/2021,47,66,LOT2323_IP_2023-01-17_66,1/30/2022,SP2323,2022-10-17T19:05:13,,FALSE
8/9/2021,IP2324,lettuce,271,H2324,1,8/14/2021,2,2,LOT2324_IP_2021-08-09_2,1/6/2022,SP2324,2022-08-19T14:52:22,,FALSE
11/29/2022,IP2325,spinach,1177,H2325,2,10/13/2021,6,9,LOT2325_IP_2022-11-29_9,2/5/2022,SP2325,2022-11-01T08:44:01,,FALSE
11/15/2022,IP2326,bell peppers,5308,H2326,6,10/22/2021,27,37,LOT2326_IP_2022-11-15_37,2/9/2022,SP2326,2022-11-12T15:04:45,,FALSE
12/25/2022,IP2327,potato,8717,H2327,9,9/2/2021,44,61,LOT2327_IP_2022-12-25_61,1/16/2022,SP2327,2022-09-12T04:47:45,,FALSE
10/3/2022,IP2328,chili peppers,6405,H2328,7,10/27/2021,32,45,LOT2328_IP_2022-10-03_45,2/12/2022,SP2328,2022-11-18T18:52:04,,TRUE
1/9/2022,IP2329,cilantro,7678,H2329,8,11/25/2021,39,54,LOT2329_IP_2022-01-09_54,2/26/2022,SP2329,2022-12-24T12:45:49,,TRUE
9/10/2022,IP2330,parsley,8465,H2330,9,9/19/2021,42,59,LOT2330_IP_2022-09-10_59,1/24/2022,SP2330,2022-10-02T07:48:46,,FALSE
4/3/2022,IP2331,spinach,1026,H2331,2,11/13/2021,6,7,LOT2331_IP_2022-04-03_7,2/20/2022,SP2331,2022-12-09T05:05:39,,FALSE
2/4/2022,IP2332,parsley,8028,H2332,8,11/6/2021,40,56,LOT2332_IP_2022-02-04_56,2/17/2022,SP2332,2022-11-30T04:49:04,,FALSE
4/17/2022,IP2333,Tomatoes,4069,H2333,5,10/6/2021,21,29,LOT2333_IP_2022-04-17_29,2/1/2022,SP2333,2022-10-23T15:40,,FALSE
11/7/2022,IP2334,spinach,993,H2334,2,11/16/2021,5,7,LOT2334_IP_2022-11-07_7,2/22/2022,SP2334,2022-12-12T23:12:33,,FALSE
3/3/2022,IP2335,potato,8675,H2335,9,9/3/2021,43,61,LOT2335_IP_2022-03-03_61,1/16/2022,SP2335,2022-09-13T13:14:14,,FALSE
6/7/2022,IP2336,Tomatoes,3847,H2336,4,9/12/2021,20,27,LOT2336_IP_2022-06-07_27,1/21/2022,SP2336,2022-09-24T15:58:41,,TRUE
8/2/2022,IP2337,cilantro,7209,H2337,7,10/26/2021,36,51,LOT2337_IP_2022-08-02_51,2/11/2022,SP2337,2022-11-17T06:49:18,,TRUE
7/11/2022,IP2338,potato,9230,H2338,9,9/25/2021,46,65,LOT2338_IP_2022-07-11_65,1/27/2022,SP2338,2022-10-10T03:15:08,,FALSE
2/4/2023,IP2339,Tomatoes,4265,H2339,5,11/18/2021,22,30,LOT2339_IP_2023-02-04_30,2/23/2022,SP2339,2022-12-15T08:52:58,,FALSE
7/16/2022,IP2340,parsley,8264,H2340,8,11/21/2021,41,58,LOT2340_IP_2022-07-16_58,2/24/2022,SP2340,2022-12-19T06:36:09,,FALSE
7/16/2022,IP2341,kale,1915,H2341,3,8/14/2021,10,14,LOT2341_IP_2022-07-16_14,1/6/2022,SP2341,2022-08-18T20:50:59,,TRUE
5/31/2022,IP2342,Cucumbers,4888,H2342,5,11/17/2021,25,34,LOT2342_IP_2022-05-31_34,2/22/2022,SP2342,2022-12-13T17:13:56,,FALSE
12/23/2021,IP2343,parsley,8080,H2343,8,8/22/2021,40,57,LOT2343_IP_2021-12-23_57,1/11/2022,SP2343,2022-08-29T16:22:53,,FALSE
4/13/2022,IP2344,melons,3083,H2344,4,9/20/2021,16,22,LOT2344_IP_2022-04-13_22,1/25/2022,SP2344,2022-10-04T10:16:38,,FALSE
7/15/2022,IP2345,bell peppers,5634,H2345,6,10/11/2021,28,40,LOT2345_IP_2022-07-15_40,2/4/2022,SP2345,2022-10-29T19:27:20,,FALSE
5/15/2022,IP2346,lettuce,762,H2346,2,8/16/2021,4,6,LOT2346_IP_2022-05-15_6,1/7/2022,SP2346,2022-08-21T10:07:41,,FALSE
2/27/2023,IP2347,cilantro,7764,H2347,8,11/9/2021,39,54,LOT2347_IP_2023-02-27_54,2/18/2022,SP2347,2022-12-03T22:55:58,,FALSE
11/19/2022,IP2348,arugula,2564,H2348,3,8/5/2021,13,18,LOT2348_IP_2022-11-19_18,1/2/2022,SP2348,2022-08-08T01:19:06,,FALSE
5/25/2022,IP2349,potato,8692,H2349,9,11/24/2021,44,61,LOT2349_IP_2022-05-25_61,2/26/2022,SP2349,2022-12-22T17:30:31,,FALSE
9/17/2022,IP2350,melons,3223,H2350,4,10/1/2021,16,23,LOT2350_IP_2022-09-17_23,1/30/2022,SP2350,2022-10-17T19:05:13,,FALSE
9/1/2021,IP2351,melons,3340,H2351,4,11/18/2021,17,24,LOT2351_IP_2021-09-01_24,2/23/2022,SP2351,2022-12-15T16:05:31,,FALSE
9/20/2021,IP2352,parsley,8111,H2352,8,10/14/2021,41,57,LOT2352_IP_2021-09-20_57,2/5/2022,SP2352,2022-11-02T06:21:41,,FALSE
7/31/2022,IP2353,basil,6982,H2353,7,10/27/2021,35,49,LOT2353_IP_2022-07-31_49,2/12/2022,SP2353,2022-11-18T11:39:31,,FALSE
8/11/2021,IP2354,arugula,2307,H2354,3,8/18/2021,12,16,LOT2354_IP_2021-08-11_16,1/9/2022,SP2354,2022-08-24T17:25:46,,FALSE
12/12/2022,IP2355,kale,1679,H2355,2,9/1/2021,9,12,LOT2355_IP_2022-12-12_12,1/15/2022,SP2355,2022-09-10T16:44:59,,FALSE
9/8/2021,IP2356,melons,3291,H2356,4,8/19/2021,17,23,LOT2356_IP_2021-09-08_23,1/9/2022,SP2356,2022-08-25T11:27:09,,FALSE
2/15/2023,IP2357,lettuce,702,H2357,2,9/20/2021,4,5,LOT2357_IP_2023-02-15_5,1/24/2022,SP2357,2022-10-03T09:02:42,,FALSE
11/20/2021,IP2358,parsley,8355,H2358,9,11/8/2021,42,59,LOT2358_IP_2021-11-20_59,2/18/2022,SP2358,2022-12-02T18:05:46,,FALSE
11/23/2022,IP2359,bell peppers,5138,H2359,6,8/3/2021,26,36,LOT2359_IP_2022-11-23_36,1/1/2022,SP2359,2022-08-06T09:40:04,,FALSE
2/6/2022,IP2360,parsley,8428,H2360,9,9/23/2021,42,59,LOT2360_IP_2022-02-06_59,1/26/2022,SP2360,2022-10-07T10:22:10,,FALSE
1/25/2023,IP2361,chili peppers,5766,H2361,6,11/8/2021,29,40,LOT2361_IP_2023-01-25_40,2/18/2022,SP2361,2022-12-03T01:18:19,,FALSE
2/9/2023,IP2362,chili peppers,6112,H2362,6,10/15/2021,31,43,LOT2362_IP_2023-02-09_43,2/6/2022,SP2362,2022-11-03T14:48:10,,FALSE
6/26/2022,IP2363,potato,8701,H2363,9,11/19/2021,44,61,LOT2363_IP_2022-06-26_61,2/23/2022,SP2363,2022-12-16T06:30:38,,FALSE
12/7/2022,IP2364,arugula,2467,H2364,3,12/1/2021,13,17,LOT2364_IP_2022-12-07_17,3/1/2022,SP2364,2022-12-31T06:58:15,,FALSE
5/20/2022,IP2365,kale,2177,H2365,3,9/23/2021,11,15,LOT2365_IP_2022-05-20_15,1/26/2022,SP2365,2022-10-08T00:47:16,,FALSE
10/19/2021,IP2366,potato,8618,H2366,9,8/17/2021,43,60,LOT2366_IP_2021-10-19_60,1/8/2022,SP2366,2022-08-23T01:46:44,,FALSE
11/28/2022,IP2367,chili peppers,6035,H2367,6,11/14/2021,30,42,LOT2367_IP_2022-11-28_42,2/21/2022,SP2367,2022-12-11T00:20:58,,FALSE
4/17/2022,IP2368,lettuce,300,H2368,1,9/6/2021,2,2,LOT2368_IP_2022-04-17_2,1/18/2022,SP2368,2022-09-16T09:43:29,,FALSE
12/13/2022,IP2369,potato,8888,H2369,9,9/9/2021,44,62,LOT2369_IP_2022-12-13_62,1/19/2022,SP2369,2022-09-20T07:26:40,,TRUE
11/30/2022,IP2370,bell peppers,5750,H2370,6,10/28/2021,29,40,LOT2370_IP_2022-11-30_40,2/12/2022,SP2370,2022-11-19T05:40:54,,FALSE
10/18/2022,IP2371,cilantro,7285,H2371,8,8/1/2021,37,51,LOT2371_IP_2022-10-18_51,12/31/2021,SP2371,2022-08-03T09:34:32,,FALSE
2/28/2022,IP2372,Tomatoes,3939,H2372,4,8/5/2021,20,28,LOT2372_IP_2022-02-28_28,1/2/2022,SP2372,2022-08-08T08:31:39,,FALSE
10/27/2022,IP2373,potato,8873,H2373,9,10/19/2021,44,62,LOT2373_IP_2022-10-27_62,2/8/2022,SP2373,2022-11-07T23:20:11,,FALSE
2/19/2023,IP2374,spinach,1010,H2374,2,10/1/2021,6,7,LOT2374_IP_2023-02-19_7,1/30/2022,SP2374,2022-10-17T19:05:13,,FALSE
6/12/2022,IP2375,spinach,1220,H2375,2,11/14/2021,7,9,LOT2375_IP_2022-06-12_9,2/21/2022,SP2375,2022-12-10T13:32:08,,FALSE
9/16/2022,IP2376,Cucumbers,4751,H2376,5,8/10/2021,24,33,LOT2376_IP_2022-09-16_33,1/4/2022,SP2376,2022-08-14T01:30:09,,FALSE
10/28/2022,IP2377,melons,3612,H2377,4,10/10/2021,18,25,LOT2377_IP_2022-10-28_25,2/4/2022,SP2377,2022-10-28T21:49:40,,FALSE
4/21/2022,IP2378,lettuce,189,H2378,1,9/28/2021,1,2,LOT2378_IP_2022-04-21_2,1/28/2022,SP2378,2022-10-13T14:09:29,,FALSE
4/17/2022,IP2379,cilantro,7732,H2379,8,11/1/2021,39,54,LOT2379_IP_2022-04-17_54,2/14/2022,SP2379,2022-11-24T04:38:01,,FALSE
12/28/2022,IP2380,potato,8610,H2380,9,8/18/2021,43,60,LOT2380_IP_2022-12-28_60,1/8/2022,SP2380,2022-08-24T06:36:56,,FALSE
11/13/2022,IP2381,melons,3562,H2381,4,9/10/2021,18,25,LOT2381_IP_2022-11-13_25,1/20/2022,SP2381,2022-09-21T15:53:09,,TRUE
9/5/2021,IP2382,Cucumbers,4511,H2382,5,8/29/2021,23,32,LOT2382_IP_2021-09-05_32,1/14/2022,SP2382,2022-09-06T22:38:05,,FALSE
11/27/2021,IP2383,arugula,2569,H2383,3,9/1/2021,13,18,LOT2383_IP_2021-11-27_18,1/15/2022,SP2383,2022-09-10T16:44:59,,TRUE
12/29/2022,IP2384,parsley,7923,H2384,8,8/26/2021,40,56,LOT2384_IP_2022-12-29_56,1/12/2022,SP2384,2022-09-03T15:20,,FALSE
8/30/2021,IP2385,melons,2973,H2385,4,8/15/2021,15,21,LOT2385_IP_2021-08-30_21,1/7/2022,SP2385,2022-08-20T08:53:45,,FALSE
10/21/2021,IP2386,chili peppers,6274,H2386,7,10/13/2021,32,44,LOT2386_IP_2021-10-21_44,2/5/2022,SP2386,2022-10-31T18:18:55,,FALSE
9/5/2022,IP2387,sweet potato,9694,H2387,10,11/1/2021,48,68,LOT2387_IP_2022-09-05_68,2/14/2022,SP2387,2022-11-24T04:38:01,,TRUE
2/9/2023,IP2388,melons,3321,H2388,4,9/10/2021,17,23,LOT2388_IP_2023-02-09_23,1/20/2022,SP2388,2022-09-22T02:41:59,,FALSE
3/7/2022,IP2389,melons,2951,H2389,4,9/23/2021,15,21,LOT2389_IP_2022-03-07_21,1/26/2022,SP2389,2022-10-07T06:45:53,,FALSE
9/16/2022,IP2390,Tomatoes,3786,H2390,4,11/27/2021,19,27,LOT2390_IP_2022-09-16_27,2/27/2022,SP2390,2022-12-26T00:48:35,,FALSE
2/6/2022,IP2391,parsley,8482,H2391,9,11/21/2021,42,59,LOT2391_IP_2022-02-06_59,2/24/2022,SP2391,2022-12-19T17:24:59,,FALSE
5/6/2022,IP2392,potato,9292,H2392,9,8/31/2021,46,65,LOT2392_IP_2022-05-06_65,1/15/2022,SP2392,2022-09-08T17:53:24,,TRUE
2/3/2022,IP2393,bell peppers,5471,H2393,6,10/20/2021,28,38,LOT2393_IP_2022-02-03_38,2/8/2022,SP2393,2022-11-09T07:46:40,,FALSE
11/28/2021,IP2394,chili peppers,5870,H2394,6,11/16/2021,30,41,LOT2394_IP_2021-11-28_41,2/22/2022,SP2394,2022-12-12T23:12:33,,TRUE
8/18/2021,IP2395,cilantro,7741,H2395,8,8/25/2021,39,54,LOT2395_IP_2021-08-18_54,1/12/2022,SP2395,2022-09-01T16:28:24,,FALSE
9/3/2022,IP2396,basil,6501,H2396,7,8/9/2021,33,46,LOT2396_IP_2022-09-03_46,1/4/2022,SP2396,2022-08-13T07:28:46,,FALSE
1/13/2023,IP2397,potato,8775,H2397,9,8/30/2021,44,61,LOT2397_IP_2023-01-13_61,1/14/2022,SP2397,2022-09-07T13:03:11,,FALSE
10/31/2021,IP2398,melons,3234,H2398,4,8/22/2021,17,23,LOT2398_IP_2021-10-31_23,1/10/2022,SP2398,2022-08-28T18:45:13,,FALSE
8/27/2022,IP2399,melons,3301,H2399,4,11/7/2021,17,23,LOT2399_IP_2022-08-27_23,2/17/2022,SP2399,2022-12-01T13:15:33,,FALSE
1/20/2023,IP2400,sweet potato,9347,H2400,9,10/3/2021,47,65,LOT2400_IP_2023-01-20_65,1/31/2022,SP2400,2022-10-19T21:33:06,,TRUE
10/26/2022,IP2401,bell peppers,5365,H2401,6,8/25/2021,27,38,LOT2401_IP_2022-10-26_38,1/12/2022,SP2401,2022-09-02T10:29:47,,FALSE
11/23/2022,IP2402,Tomatoes,3912,H2402,4,10/6/2021,20,28,LOT2402_IP_2022-11-23_28,2/2/2022,SP2402,2022-10-23T22:52:33,,FALSE
11/25/2021,IP2403,chili peppers,6193,H2403,7,11/17/2021,31,43,LOT2403_IP_2021-11-25_43,2/22/2022,SP2403,2022-12-14T00:26:29,,FALSE
9/13/2022,IP2404,parsley,8361,H2404,9,10/11/2021,42,59,LOT2404_IP_2022-09-13_59,2/4/2022,SP2404,2022-10-30T02:39:53,,FALSE
7/5/2022,IP2405,bell peppers,5566,H2405,6,9/18/2021,28,39,LOT2405_IP_2022-07-05_39,1/23/2022,SP2405,2022-09-30T23:22:17,,FALSE
9/11/2022,IP2406,cilantro,7476,H2406,8,11/2/2021,38,52,LOT2406_IP_2022-09-11_52,2/15/2022,SP2406,2022-11-25T13:04:30,,FALSE
6/15/2022,IP2407,melons,3228,H2407,4,10/24/2021,16,23,LOT2407_IP_2022-06-15_23,2/10/2022,SP2407,2022-11-15T00:45:10,,FALSE
4/3/2022,IP2408,parsley,8372,H2408,9,10/27/2021,42,59,LOT2408_IP_2022-04-03_59,2/12/2022,SP2408,2022-11-17T21:14:25,,FALSE
3/4/2022,IP2409,Tomatoes,4258,H2409,5,8/8/2021,22,30,LOT2409_IP_2022-03-04_30,1/3/2022,SP2409,2022-08-11T12:13:27,,FALSE
12/27/2022,IP2410,sweet potato,9736,H2410,10,11/13/2021,49,68,LOT2410_IP_2022-12-27_68,2/20/2022,SP2410,2022-12-09T05:05:39,,FALSE
5/17/2022,IP2411,basil,6907,H2411,7,8/19/2021,35,48,LOT2411_IP_2022-05-17_48,1/9/2022,SP2411,2022-08-25T04:14:36,,FALSE
12/9/2022,IP2412,arugula,2256,H2412,3,9/16/2021,12,16,LOT2412_IP_2022-12-09_16,1/23/2022,SP2412,2022-09-28T17:18:08,,FALSE
1/3/2022,IP2413,kale,1574,H2413,2,10/1/2021,8,11,LOT2413_IP_2022-01-03_11,1/30/2022,SP2413,2022-10-17T19:05:13,,FALSE
5/25/2022,IP2414,Tomatoes,4292,H2414,5,8/3/2021,22,30,LOT2414_IP_2022-05-25_30,1/1/2022,SP2414,2022-08-06T06:03:47,,FALSE
4/23/2022,IP2415,sweet potato,9706,H2415,10,10/21/2021,49,68,LOT2415_IP_2022-04-23_68,2/9/2022,SP2415,2022-11-11T10:14:32,,FALSE
12/22/2022,IP2416,spinach,1380,H2416,2,8/8/2021,7,10,LOT2416_IP_2022-12-22_10,1/4/2022,SP2416,2022-08-12T09:51:07,,FALSE
8/5/2021,IP2417,basil,6847,H2417,7,10/2/2021,34,48,LOT2417_IP_2021-08-05_48,1/31/2022,SP2417,2022-10-18T23:55:26,,FALSE
10/23/2022,IP2418,Tomatoes,4099,H2418,5,11/15/2021,21,29,LOT2418_IP_2022-10-23_29,2/21/2022,SP2418,2022-12-11T21:58:37,,FALSE
12/12/2021,IP2419,bell peppers,5491,H2419,6,10/28/2021,28,39,LOT2419_IP_2021-12-12_39,2/12/2022,SP2419,2022-11-19T05:40:54,,FALSE
6/11/2022,IP2420,sweet potato,9359,H2420,9,11/13/2021,47,66,LOT2420_IP_2022-06-11_66,2/20/2022,SP2420,2022-12-08T18:16:49,,TRUE
8/28/2022,IP2421,arugula,2905,H2421,4,9/8/2021,15,21,LOT2421_IP_2022-08-28_21,1/19/2022,SP2421,2022-09-19T17:01:34,,FALSE
3/3/2022,IP2422,potato,8648,H2422,9,8/24/2021,43,61,LOT2422_IP_2022-03-03_61,1/11/2022,SP2422,2022-08-31T22:27:02,,FALSE
3/22/2022,IP2423,spinach,1014,H2423,2,11/12/2021,6,7,LOT2423_IP_2022-03-22_7,2/20/2022,SP2423,2022-12-08T11:04:16,,FALSE
8/4/2021,IP2424,chili peppers,6197,H2424,7,8/26/2021,31,43,LOT2424_IP_2021-08-04_43,1/12/2022,SP2424,2022-09-03T08:07:27,,TRUE
7/30/2022,IP2425,chili peppers,5979,H2425,6,11/22/2021,30,42,LOT2425_IP_2022-07-30_42,2/24/2022,SP2425,2022-12-20T04:13:49,,FALSE
6/11/2022,IP2426,chili peppers,6221,H2426,7,10/7/2021,31,44,LOT2426_IP_2022-06-11_44,2/2/2022,SP2426,2022-10-25T03:42:46,,FALSE
10/24/2022,IP2427,Tomatoes,4164,H2427,5,9/4/2021,21,29,LOT2427_IP_2022-10-24_29,1/17/2022,SP2427,2022-09-14T03:39:20,,TRUE
9/23/2021,IP2428,spinach,1231,H2428,2,12/1/2021,7,9,LOT2428_IP_2021-09-23_9,3/1/2022,SP2428,2022-12-30T20:09:26,,FALSE
12/15/2022,IP2429,spinach,1498,H2429,2,9/1/2021,8,11,LOT2429_IP_2022-12-15_11,1/15/2022,SP2429,2022-09-10T16:44:59,,FALSE
2/11/2023,IP2430,spinach,1287,H2430,2,8/31/2021,7,9,LOT2430_IP_2023-02-11_9,1/15/2022,SP2430,2022-09-08T17:53:24,,FALSE
1/24/2022,IP2431,chili peppers,6205,H2431,7,10/8/2021,31,44,LOT2431_IP_2022-01-24_44,2/2/2022,SP2431,2022-10-25T18:07:52,,FALSE
6/4/2022,IP2432,chili peppers,5788,H2432,6,8/30/2021,29,41,LOT2432_IP_2022-06-04_41,1/14/2022,SP2432,2022-09-08T10:40:50,,FALSE
5/12/2022,IP2433,Tomatoes,4224,H2433,5,9/11/2021,21,30,LOT2433_IP_2022-05-12_30,1/20/2022,SP2433,2022-09-23T03:55:55,,FALSE
3/8/2022,IP2434,spinach,1282,H2434,2,8/25/2021,7,9,LOT2434_IP_2022-03-08_9,1/12/2022,SP2434,2022-09-02T03:17:14,,FALSE
6/24/2022,IP2435,arugula,2492,H2435,3,11/2/2021,13,18,LOT2435_IP_2022-06-24_18,2/15/2022,SP2435,2022-11-26T07:05:53,,TRUE
9/1/2022,IP2436,melons,3566,H2436,4,10/4/2021,18,25,LOT2436_IP_2022-09-01_25,2/1/2022,SP2436,2022-10-21T09:35:51,,FALSE
9/5/2021,IP2437,lettuce,650,H2437,2,10/4/2021,4,5,LOT2437_IP_2021-09-05_5,1/31/2022,SP2437,2022-10-21T02:23:18,,FALSE
1/13/2022,IP2438,Tomatoes,3663,H2438,4,10/23/2021,19,26,LOT2438_IP_2022-01-13_26,2/10/2022,SP2438,2022-11-12T22:17:18,,TRUE
1/27/2022,IP2439,spinach,1080,H2439,2,11/14/2021,6,8,LOT2439_IP_2022-01-27_8,2/20/2022,SP2439,2022-12-09T23:07:02,,FALSE
7/28/2022,IP2440,bell peppers,5179,H2440,6,11/25/2021,26,36,LOT2440_IP_2022-07-28_36,2/26/2022,SP2440,2022-12-23T15:08:10,,FALSE
2/17/2023,IP2441,arugula,2879,H2441,4,11/30/2021,15,20,LOT2441_IP_2023-02-17_20,3/1/2022,SP2441,2022-12-30T05:44:19,,FALSE
8/29/2021,IP2442,chili peppers,6076,H2442,6,9/4/2021,31,43,LOT2442_IP_2021-08-29_43,1/17/2022,SP2442,2022-09-13T16:50:31,,FALSE
9/3/2021,IP2443,potato,8879,H2443,9,10/11/2021,44,62,LOT2443_IP_2021-09-03_62,2/4/2022,SP2443,2022-10-30T02:39:53,,FALSE
1/31/2023,IP2444,melons,3548,H2444,4,9/2/2021,18,25,LOT2444_IP_2023-01-31_25,1/16/2022,SP2444,2022-09-12T08:24:01,,FALSE
10/3/2022,IP2445,bell peppers,5276,H2445,6,9/16/2021,27,37,LOT2445_IP_2022-10-03_37,1/23/2022,SP2445,2022-09-28T17:18:08,,TRUE
9/2/2022,IP2446,potato,8834,H2446,9,11/10/2021,44,62,LOT2446_IP_2022-09-02_62,2/18/2022,SP2446,2022-12-05T00:09:55,,FALSE
7/20/2022,IP2447,kale,1983,H2447,3,11/5/2021,10,14,LOT2447_IP_2022-07-20_14,2/16/2022,SP2447,2022-11-29T18:00:14,,FALSE
10/10/2021,IP2448,sweet potato,9807,H2448,10,11/30/2021,49,69,LOT2448_IP_2021-10-10_69,3/1/2022,SP2448,2022-12-30T12:56:53,,FALSE
2/20/2023,IP2449,lettuce,640,H2449,1,10/2/2021,4,5,LOT2449_IP_2023-02-20_5,1/30/2022,SP2449,2022-10-18T13:06:36,,FALSE
1/28/2022,IP2450,parsley,8510,H2450,9,9/2/2021,43,60,LOT2450_IP_2022-01-28_60,1/16/2022,SP2450,2022-09-12T01:11:28,,FALSE
12/23/2021,IP2451,potato,9267,H2451,9,8/6/2021,46,65,LOT2451_IP_2021-12-23_65,1/2/2022,SP2451,2022-08-09T13:21:52,,FALSE
2/21/2022,IP2452,parsley,8452,H2452,9,11/30/2021,42,59,LOT2452_IP_2022-02-21_59,3/1/2022,SP2452,2022-12-30T12:56:53,,FALSE
4/15/2022,IP2453,bell peppers,5545,H2453,6,10/1/2021,28,39,LOT2453_IP_2022-04-15_39,1/30/2022,SP2453,2022-10-17T04:40:07,,FALSE
7/16/2022,IP2454,bell peppers,5169,H2454,6,9/30/2021,26,36,LOT2454_IP_2022-07-16_36,1/29/2022,SP2454,2022-10-15T20:13:38,,FALSE
2/24/2023,IP2455,melons,3053,H2455,4,10/12/2021,16,22,LOT2455_IP_2023-02-24_22,2/4/2022,SP2455,2022-10-31T03:53:49,,TRUE
2/2/2022,IP2456,kale,1918,H2456,3,8/18/2021,10,14,LOT2456_IP_2022-02-02_14,1/9/2022,SP2456,2022-08-24T21:02:02,,FALSE
4/23/2022,IP2457,basil,7118,H2457,7,10/2/2021,36,50,LOT2457_IP_2022-04-23_50,1/31/2022,SP2457,2022-10-18T16:42:53,,TRUE
1/11/2023,IP2458,Tomatoes,4178,H2458,5,10/30/2021,21,29,LOT2458_IP_2023-01-11_29,2/13/2022,SP2458,2022-11-21T18:57:36,,TRUE
10/24/2021,IP2459,lettuce,301,H2459,1,9/18/2021,2,2,LOT2459_IP_2021-10-24_2,1/24/2022,SP2459,2022-10-01T17:23:40,,FALSE
9/3/2022,IP2460,kale,1674,H2460,2,8/21/2021,9,12,LOT2460_IP_2022-09-03_12,1/10/2022,SP2460,2022-08-28T11:32:40,,FALSE
4/13/2022,IP2461,Cucumbers,4843,H2461,5,11/6/2021,24,34,LOT2461_IP_2022-04-13_34,2/17/2022,SP2461,2022-12-01T02:26:44,,TRUE
9/15/2022,IP2462,bell peppers,5513,H2462,6,10/4/2021,28,39,LOT2462_IP_2022-09-15_39,2/1/2022,SP2462,2022-10-21T09:35:51,,FALSE
6/19/2022,IP2463,potato,8969,H2463,9,9/12/2021,45,63,LOT2463_IP_2022-06-19_63,1/21/2022,SP2463,2022-09-24T01:33:34,,FALSE
12/7/2022,IP2464,Tomatoes,3983,H2464,5,11/25/2021,20,28,LOT2464_IP_2022-12-07_28,2/26/2022,SP2464,2022-12-23T15:08:10,,TRUE
11/3/2022,IP2465,sweet potato,9491,H2465,10,11/5/2021,47,66,LOT2465_IP_2022-11-03_66,2/16/2022,SP2465,2022-11-29T03:35:08,,FALSE
3/2/2022,IP2466,potato,9264,H2466,9,8/22/2021,46,65,LOT2466_IP_2022-03-02_65,1/10/2022,SP2466,2022-08-29T09:10:20,,TRUE
10/22/2022,IP2467,parsley,8555,H2467,9,10/16/2021,43,60,LOT2467_IP_2022-10-22_60,2/6/2022,SP2467,2022-11-04T08:49:33,,FALSE
5/14/2022,IP2468,lettuce,281,H2468,1,9/24/2021,2,2,LOT2468_IP_2022-05-14_2,1/27/2022,SP2468,2022-10-09T02:01:12,,FALSE
6/30/2022,IP2469,basil,6850,H2469,7,11/11/2021,34,48,LOT2469_IP_2022-06-30_48,2/19/2022,SP2469,2022-12-06T19:25:13,,FALSE
2/26/2023,IP2470,basil,6816,H2470,7,8/12/2021,34,48,LOT2470_IP_2023-02-26_48,1/5/2022,SP2470,2022-08-16T11:10:34,,FALSE
8/20/2022,IP2471,kale,1886,H2471,3,9/28/2021,10,13,LOT2471_IP_2022-08-20_13,1/28/2022,SP2471,2022-10-13T10:33:13,,FALSE
11/19/2021,IP2472,Tomatoes,3798,H2472,4,10/20/2021,19,27,LOT2472_IP_2021-11-19_27,2/8/2022,SP2472,2022-11-09T04:10:23,,FALSE
11/21/2021,IP2473,spinach,1405,H2473,2,8/10/2021,7,10,LOT2473_IP_2021-11-21_10,1/4/2022,SP2473,2022-08-14T05:06:26,,FALSE
10/27/2022,IP2474,lettuce,754,H2474,2,11/21/2021,4,6,LOT2474_IP_2022-10-27_6,2/24/2022,SP2474,2022-12-18T16:11:03,,TRUE
8/12/2021,IP2475,lettuce,115,H2475,1,10/5/2021,1,1,LOT2475_IP_2021-08-12_1,2/1/2022,SP2475,2022-10-22T00:00:58,,TRUE
9/13/2021,IP2476,Cucumbers,4795,H2476,5,11/18/2021,24,34,LOT2476_IP_2021-09-13_34,2/22/2022,SP2476,2022-12-15T01:40:25,,FALSE
8/19/2021,IP2477,cilantro,7721,H2477,8,11/19/2021,39,54,LOT2477_IP_2021-08-19_54,2/23/2022,SP2477,2022-12-16T13:43:11,,FALSE
9/26/2022,IP2478,bell peppers,5729,H2478,6,10/23/2021,29,40,LOT2478_IP_2022-09-26_40,2/10/2022,SP2478,2022-11-13T01:53:34,,FALSE
8/24/2022,IP2479,lettuce,521,H2479,1,8/6/2021,3,4,LOT2479_IP_2022-08-24_4,1/2/2022,SP2479,2022-08-09T13:21:52,,TRUE
8/5/2022,IP2480,melons,3506,H2480,4,8/25/2021,18,25,LOT2480_IP_2022-08-05_25,1/12/2022,SP2480,2022-09-01T23:40:58,,FALSE
9/27/2022,IP2481,cilantro,7481,H2481,8,11/29/2021,38,52,LOT2481_IP_2022-09-27_52,2/28/2022,SP2481,2022-12-29T08:06:40,,FALSE
7/31/2022,IP2482,Cucumbers,4754,H2482,5,9/3/2021,24,33,LOT2482_IP_2022-07-31_33,1/16/2022,SP2482,2022-09-12T12:00:18,,FALSE
9/22/2022,IP2483,melons,3071,H2483,4,9/6/2021,16,22,LOT2483_IP_2022-09-22_22,1/18/2022,SP2483,2022-09-16T06:07:12,,FALSE
10/21/2021,IP2484,lettuce,775,H2484,2,9/24/2021,4,6,LOT2484_IP_2021-10-21_6,1/27/2022,SP2484,2022-10-09T05:37:29,,TRUE
11/17/2021,IP2485,arugula,2231,H2485,3,10/28/2021,12,16,LOT2485_IP_2021-11-17_16,2/12/2022,SP2485,2022-11-19T16:29:44,,TRUE
9/6/2022,IP2486,lettuce,129,H2486,1,8/20/2021,1,1,LOT2486_IP_2022-09-06_1,1/10/2022,SP2486,2022-08-27T06:42:28,,FALSE
1/6/2023,IP2487,bell peppers,5571,H2487,6,8/9/2021,28,39,LOT2487_IP_2023-01-06_39,1/4/2022,SP2487,2022-08-12T20:39:56,,FALSE
10/31/2021,IP2488,kale,1840,H2488,3,8/17/2021,10,13,LOT2488_IP_2021-10-31_13,1/8/2022,SP2488,2022-08-22T11:21:37,,FALSE
6/11/2022,IP2489,sweet potato,9568,H2489,10,8/28/2021,48,67,LOT2489_IP_2022-06-11_67,1/13/2022,SP2489,2022-09-05T14:11:35,,FALSE
9/25/2022,IP2490,kale,1754,H2490,3,10/7/2021,9,13,LOT2490_IP_2022-09-25_13,2/2/2022,SP2490,2022-10-24T20:30:13,,FALSE
1/22/2022,IP2491,bell peppers,5672,H2491,6,10/10/2021,29,40,LOT2491_IP_2022-01-22_40,2/4/2022,SP2491,2022-10-28T18:13:24,,FALSE
7/2/2022,IP2492,chili peppers,5846,H2492,6,9/24/2021,29,41,LOT2492_IP_2022-07-02_41,1/27/2022,SP2492,2022-10-09T02:01:12,,FALSE
9/22/2022,IP2493,bell peppers,5300,H2493,6,8/7/2021,27,37,LOT2493_IP_2022-09-22_37,1/3/2022,SP2493,2022-08-10T10:59:31,,FALSE
12/19/2021,IP2494,parsley,8000,H2494,8,9/30/2021,40,56,LOT2494_IP_2021-12-19_56,1/30/2022,SP2494,2022-10-16T14:15:01,,FALSE
3/24/2022,IP2495,Tomatoes,4252,H2495,5,8/27/2021,22,30,LOT2495_IP_2022-03-24_30,1/13/2022,SP2495,2022-09-03T22:32:33,,FALSE
12/25/2021,IP2496,parsley,8479,H2496,9,8/26/2021,42,59,LOT2496_IP_2021-12-25_59,1/12/2022,SP2496,2022-09-02T17:42:20,,FALSE
1/18/2023,IP2497,lettuce,180,H2497,1,9/26/2021,1,2,LOT2497_IP_2023-01-18_2,1/27/2022,SP2497,2022-10-10T17:40:14,,FALSE
11/5/2022,IP2498,melons,3262,H2498,4,8/25/2021,17,23,LOT2498_IP_2022-11-05_23,1/12/2022,SP2498,2022-09-02T06:53:31,,TRUE
9/19/2021,IP2499,basil,7138,H2499,7,10/6/2021,36,50,LOT2499_IP_2021-09-19_50,2/2/2022,SP2499,2022-10-23T19:16:17,,FALSE
2/6/2023,IP2500,sweet potato,9895,H2500,10,11/15/2021,49,69,LOT2500_IP_2023-02-06_69,2/21/2022,SP2500,2022-12-11T07:33:31,,FALSE
9/16/2021,IP2501,Tomatoes,3726,H2501,4,11/7/2021,19,26,LOT2501_IP_2021-09-16_26,2/17/2022,SP2501,2022-12-01T09:39:17,,FALSE
4/5/2022,IP2502,potato,8910,H2502,9,11/28/2021,45,62,LOT2502_IP_2022-04-05_62,2/27/2022,SP2502,2022-12-27T16:27:38,,FALSE
1/29/2022,IP2503,spinach,1381,H2503,2,8/14/2021,7,10,LOT2503_IP_2022-01-29_10,1/6/2022,SP2503,2022-08-19T14:52:22,,FALSE
9/4/2022,IP2504,Tomatoes,3773,H2504,4,10/2/2021,19,27,LOT2504_IP_2022-09-04_27,1/30/2022,SP2504,2022-10-18T05:54:03,,FALSE
5/12/2022,IP2505,Cucumbers,4883,H2505,5,9/28/2021,25,34,LOT2505_IP_2022-05-12_34,1/29/2022,SP2505,2022-10-14T08:10:52,,FALSE
2/11/2023,IP2506,melons,3336,H2506,4,12/1/2021,17,24,LOT2506_IP_2023-02-11_24,3/1/2022,SP2506,2022-12-31T10:34:32,,FALSE
12/12/2022,IP2507,basil,6626,H2507,7,10/9/2021,33,46,LOT2507_IP_2022-12-12_46,2/3/2022,SP2507,2022-10-27T02:34:21,,FALSE
7/5/2022,IP2508,Cucumbers,5034,H2508,5,10/30/2021,25,35,LOT2508_IP_2022-07-05_35,2/13/2022,SP2508,2022-11-21T15:21:19,,FALSE
11/1/2022,IP2509,arugula,2883,H2509,4,10/22/2021,15,20,LOT2509_IP_2022-11-01_20,2/10/2022,SP2509,2022-11-12T18:41:01,,FALSE
8/3/2021,IP2510,arugula,2847,H2510,3,10/18/2021,15,20,LOT2510_IP_2021-08-03_20,2/7/2022,SP2510,2022-11-07T08:55:04,,FALSE
4/14/2022,IP2511,cilantro,7270,H2511,8,10/30/2021,36,51,LOT2511_IP_2022-04-14_51,2/13/2022,SP2511,2022-11-21T18:57:36,,FALSE
2/13/2023,IP2512,basil,7071,H2512,7,10/28/2021,36,50,LOT2512_IP_2023-02-13_50,2/12/2022,SP2512,2022-11-19T02:04:37,,FALSE
9/6/2021,IP2513,basil,7025,H2513,7,10/21/2021,35,49,LOT2513_IP_2021-09-06_49,2/9/2022,SP2513,2022-11-10T19:49:26,,FALSE
11/23/2022,IP2514,chili peppers,5952,H2514,6,10/5/2021,30,42,LOT2514_IP_2022-11-23_42,2/1/2022,SP2514,2022-10-22T00:00:58,,FALSE
6/29/2022,IP2515,bell peppers,5416,H2515,6,9/4/2021,27,38,LOT2515_IP_2022-06-29_38,1/17/2022,SP2515,2022-09-14T14:28:10,,FALSE
8/25/2021,IP2516,cilantro,7495,H2516,8,11/2/2021,38,53,LOT2516_IP_2021-08-25_53,2/15/2022,SP2516,2022-11-25T20:17:03,,FALSE
9/7/2021,IP2517,potato,8958,H2517,9,11/21/2021,45,63,LOT2517_IP_2021-09-07_63,2/24/2022,SP2517,2022-12-19T06:36:09,,FALSE
10/27/2022,IP2518,cilantro,7503,H2518,8,10/31/2021,38,53,LOT2518_IP_2022-10-27_53,2/14/2022,SP2518,2022-11-23T21:25:28,,TRUE
3/25/2022,IP2519,Tomatoes,4283,H2519,5,9/18/2021,22,30,LOT2519_IP_2022-03-25_30,1/24/2022,SP2519,2022-10-02T00:36:13,,FALSE
12/14/2021,IP2520,melons,3562,H2520,4,10/19/2021,18,25,LOT2520_IP_2021-12-14_25,2/8/2022,SP2520,2022-11-08T06:32:44,,FALSE
5/26/2022,IP2521,cilantro,7634,H2521,8,10/13/2021,38,54,LOT2521_IP_2022-05-26_54,2/5/2022,SP2521,2022-11-01T01:31:28,,TRUE
6/14/2022,IP2522,Cucumbers,5002,H2522,5,10/21/2021,25,35,LOT2522_IP_2022-06-14_35,2/9/2022,SP2522,2022-11-11T10:14:32,,FALSE
2/28/2023,IP2523,spinach,840,H2523,2,8/11/2021,5,6,LOT2523_IP_2023-02-28_6,1/5/2022,SP2523,2022-08-16T00:21:44,,FALSE
3/1/2022,IP2524,bell peppers,5715,H2524,6,10/16/2021,29,40,LOT2524_IP_2022-03-01_40,2/7/2022,SP2524,2022-11-05T10:03:29,,FALSE
9/5/2022,IP2525,cilantro,7545,H2525,8,8/24/2021,38,53,LOT2525_IP_2022-09-05_53,1/11/2022,SP2525,2022-08-31T11:38:12,,FALSE
5/6/2022,IP2526,bell peppers,5627,H2526,6,8/23/2021,28,40,LOT2526_IP_2022-05-06_40,1/11/2022,SP2526,2022-08-31T00:49:22,,TRUE
1/26/2022,IP2527,bell peppers,5469,H2527,6,10/21/2021,28,38,LOT2527_IP_2022-01-26_38,2/9/2022,SP2527,2022-11-10T16:13:09,,FALSE
12/21/2022,IP2528,basil,6712,H2528,7,8/15/2021,34,47,LOT2528_IP_2022-12-21_47,1/7/2022,SP2528,2022-08-20T08:53:45,,FALSE
2/16/2023,IP2529,lettuce,417,H2529,1,8/13/2021,3,3,LOT2529_IP_2023-02-16_3,1/6/2022,SP2529,2022-08-18T06:25:53,,FALSE
9/9/2022,IP2530,Tomatoes,4019,H2530,5,11/9/2021,20,28,LOT2530_IP_2022-09-09_28,2/18/2022,SP2530,2022-12-04T16:57:21,,FALSE
10/18/2021,IP2531,arugula,2477,H2531,3,8/30/2021,13,18,LOT2531_IP_2021-10-18_18,1/14/2022,SP2531,2022-09-08T14:17:07,,FALSE
7/8/2022,IP2532,potato,9010,H2532,9,9/4/2021,45,63,LOT2532_IP_2022-07-08_63,1/17/2022,SP2532,2022-09-14T14:28:10,,FALSE
3/6/2022,IP2533,kale,1917,H2533,3,11/10/2021,10,14,LOT2533_IP_2022-03-06_14,2/19/2022,SP2533,2022-12-06T05:00:07,,FALSE
10/4/2022,IP2534,bell peppers,5078,H2534,6,11/7/2021,26,36,LOT2534_IP_2022-10-04_36,2/17/2022,SP2534,2022-12-02T07:16:56,,FALSE
1/3/2023,IP2535,Cucumbers,4393,H2535,5,10/15/2021,22,31,LOT2535_IP_2023-01-03_31,2/6/2022,SP2535,2022-11-03T07:35:37,,FALSE
9/17/2021,IP2536,spinach,1254,H2536,2,10/17/2021,7,9,LOT2536_IP_2021-09-17_9,2/7/2022,SP2536,2022-11-06T11:17:25,,FALSE
2/1/2023,IP2537,lettuce,640,H2537,1,9/30/2021,4,5,LOT2537_IP_2023-02-01_5,1/30/2022,SP2537,2022-10-16T07:02:28,,FALSE
2/13/2022,IP2538,basil,6844,H2538,7,8/30/2021,34,48,LOT2538_IP_2022-02-13_48,1/14/2022,SP2538,2022-09-08T10:40:50,,FALSE
10/5/2021,IP2539,Cucumbers,4606,H2539,5,10/3/2021,23,32,LOT2539_IP_2021-10-05_32,1/31/2022,SP2539,2022-10-20T01:09:22,,FALSE
1/15/2023,IP2540,cilantro,7370,H2540,8,11/27/2021,37,52,LOT2540_IP_2023-01-15_52,2/27/2022,SP2540,2022-12-26T11:37:25,,FALSE
5/6/2022,IP2541,parsley,8439,H2541,9,9/19/2021,42,59,LOT2541_IP_2022-05-06_59,1/24/2022,SP2541,2022-10-02T18:37:36,,FALSE
12/8/2022,IP2542,lettuce,457,H2542,1,11/14/2021,3,3,LOT2542_IP_2022-12-08_3,2/21/2022,SP2542,2022-12-10T17:08:24,,FALSE
1/23/2022,IP2543,Tomatoes,3816,H2543,4,10/10/2021,19,27,LOT2543_IP_2022-01-23_27,2/4/2022,SP2543,2022-10-28T21:49:40,,FALSE
10/24/2021,IP2544,potato,9172,H2544,9,9/15/2021,46,64,LOT2544_IP_2021-10-24_64,1/22/2022,SP2544,2022-09-27T12:27:56,,FALSE
6/14/2022,IP2545,kale,1868,H2545,3,9/28/2021,10,13,LOT2545_IP_2022-06-14_13,1/29/2022,SP2545,2022-10-13T21:22:02,,FALSE
2/2/2023,IP2546,kale,2017,H2546,3,10/28/2021,10,14,LOT2546_IP_2023-02-02_14,2/12/2022,SP2546,2022-11-19T02:04:37,,FALSE
8/14/2021,IP2547,sweet potato,9758,H2547,10,8/5/2021,49,68,LOT2547_IP_2021-08-14_68,1/2/2022,SP2547,2022-08-08T08:31:39,,TRUE
8/10/2022,IP2548,kale,1905,H2548,3,8/7/2021,10,14,LOT2548_IP_2022-08-10_14,1/3/2022,SP2548,2022-08-11T05:00:54,,TRUE
2/26/2022,IP2549,parsley,8090,H2549,8,11/2/2021,41,57,LOT2549_IP_2022-02-26_57,2/15/2022,SP2549,2022-11-25T09:28:14,,FALSE
8/7/2021,IP2550,Tomatoes,3886,H2550,4,9/3/2021,20,27,LOT2550_IP_2021-08-07_27,1/16/2022,SP2550,2022-09-12T19:12:51,,FALSE
11/30/2021,IP2551,basil,6492,H2551,7,8/28/2021,33,46,LOT2551_IP_2021-11-30_46,1/13/2022,SP2551,2022-09-05T10:35:19,,FALSE
9/25/2021,IP2552,potato,8780,H2552,9,9/25/2021,44,61,LOT2552_IP_2021-09-25_61,1/27/2022,SP2552,2022-10-09T20:02:35,,FALSE
12/22/2021,IP2553,Tomatoes,4303,H2553,5,8/3/2021,22,30,LOT2553_IP_2021-12-22_30,1/1/2022,SP2553,2022-08-05T12:02:24,,FALSE
11/25/2021,IP2554,bell peppers,5738,H2554,6,8/4/2021,29,40,LOT2554_IP_2021-11-25_40,1/1/2022,SP2554,2022-08-06T16:52:37,,FALSE
5/17/2022,IP2555,arugula,2732,H2555,3,10/6/2021,14,19,LOT2555_IP_2022-05-17_19,2/2/2022,SP2555,2022-10-24T02:28:50,,FALSE
10/12/2021,IP2556,lettuce,629,H2556,1,10/20/2021,4,5,LOT2556_IP_2021-10-12_5,2/9/2022,SP2556,2022-11-10T05:24:19,,TRUE
2/2/2023,IP2557,Tomatoes,4022,H2557,5,11/3/2021,20,28,LOT2557_IP_2023-02-02_28,2/15/2022,SP2557,2022-11-26T10:42:10,,FALSE
11/5/2021,IP2558,parsley,8081,H2558,8,9/27/2021,41,57,LOT2558_IP_2021-11-05_57,1/28/2022,SP2558,2022-10-12T09:19:17,,FALSE
11/20/2021,IP2559,arugula,2296,H2559,3,10/12/2021,12,16,LOT2559_IP_2021-11-20_16,2/4/2022,SP2559,2022-10-31T00:17:32,,FALSE
8/22/2022,IP2560,Tomatoes,3780,H2560,4,8/21/2021,19,27,LOT2560_IP_2022-08-22_27,1/10/2022,SP2560,2022-08-28T04:20:07,,FALSE
2/28/2023,IP2561,melons,3538,H2561,4,11/28/2021,18,25,LOT2561_IP_2023-02-28_25,2/28/2022,SP2561,2022-12-28T03:16:27,,FALSE
8/24/2021,IP2562,melons,3021,H2562,4,11/14/2021,15,21,LOT2562_IP_2021-08-24_21,2/20/2022,SP2562,2022-12-10T02:43:18,,FALSE
10/5/2021,IP2563,Cucumbers,4562,H2563,5,11/20/2021,23,32,LOT2563_IP_2021-10-05_32,2/24/2022,SP2563,2022-12-18T01:45:57,,FALSE
9/28/2021,IP2564,bell peppers,5462,H2564,6,10/14/2021,28,38,LOT2564_IP_2021-09-28_38,2/5/2022,SP2564,2022-11-02T02:45:24,,FALSE
10/29/2022,IP2565,spinach,961,H2565,2,9/1/2021,5,7,LOT2565_IP_2022-10-29_7,1/15/2022,SP2565,2022-09-10T02:19:53,,FALSE
2/26/2022,IP2566,Cucumbers,4726,H2566,5,11/12/2021,24,33,LOT2566_IP_2022-02-26_33,2/20/2022,SP2566,2022-12-08T14:40:32,,TRUE
8/14/2021,IP2567,parsley,8184,H2567,8,8/18/2021,41,57,LOT2567_IP_2021-08-14_57,1/8/2022,SP2567,2022-08-23T19:48:06,,FALSE
1/20/2022,IP2568,basil,7072,H2568,7,8/11/2021,36,50,LOT2568_IP_2022-01-20_50,1/5/2022,SP2568,2022-08-15T20:45:28,,FALSE
8/19/2021,IP2569,potato,9228,H2569,9,9/10/2021,46,65,LOT2569_IP_2021-08-19_65,1/20/2022,SP2569,2022-09-21T23:05:42,,TRUE
11/21/2022,IP2570,bell peppers,5358,H2570,6,9/10/2021,27,38,LOT2570_IP_2022-11-21_38,1/20/2022,SP2570,2022-09-21T23:05:42,,TRUE
12/8/2022,IP2571,kale,1842,H2571,3,10/23/2021,10,13,LOT2571_IP_2022-12-08_13,2/10/2022,SP2571,2022-11-12T22:17:18,,FALSE
2/12/2022,IP2572,potato,8895,H2572,9,9/6/2021,45,62,LOT2572_IP_2022-02-12_62,1/18/2022,SP2572,2022-09-16T13:19:46,,FALSE
2/21/2022,IP2573,kale,1933,H2573,3,10/30/2021,10,14,LOT2573_IP_2022-02-21_14,2/13/2022,SP2573,2022-11-22T05:46:26,,FALSE
9/19/2021,IP2574,bell peppers,5435,H2574,6,9/27/2021,27,38,LOT2574_IP_2021-09-19_38,1/28/2022,SP2574,2022-10-12T12:55:33,,FALSE
1/4/2022,IP2575,kale,2164,H2575,3,8/24/2021,11,15,LOT2575_IP_2022-01-04_15,1/11/2022,SP2575,2022-08-31T18:50:45,,FALSE
7/5/2022,IP2576,melons,3525,H2576,4,11/29/2021,18,25,LOT2576_IP_2022-07-05_25,2/28/2022,SP2576,2022-12-29T11:42:57,,FALSE
10/27/2022,IP2577,cilantro,7227,H2577,7,9/29/2021,36,51,LOT2577_IP_2022-10-27_51,1/29/2022,SP2577,2022-10-15T02:12:15,,TRUE
5/19/2022,IP2578,lettuce,160,H2578,1,9/30/2021,1,1,LOT2578_IP_2022-05-19_1,1/29/2022,SP2578,2022-10-15T16:37:21,,FALSE
11/4/2022,IP2579,Cucumbers,4653,H2579,5,8/3/2021,24,33,LOT2579_IP_2022-11-04_33,1/1/2022,SP2579,2022-08-06T06:03:47,,TRUE
5/29/2022,IP2580,spinach,1433,H2580,2,9/1/2021,8,10,LOT2580_IP_2022-05-29_10,1/15/2022,SP2580,2022-09-10T16:44:59,,TRUE
3/9/2022,IP2581,spinach,1462,H2581,2,11/12/2021,8,10,LOT2581_IP_2022-03-09_10,2/20/2022,SP2581,2022-12-08T00:15:26,,TRUE
10/17/2021,IP2582,bell peppers,5187,H2582,6,10/27/2021,26,36,LOT2582_IP_2021-10-17_36,2/12/2022,SP2582,2022-11-18T00:50:41,,FALSE
1/6/2023,IP2583,spinach,824,H2583,2,9/5/2021,5,6,LOT2583_IP_2023-01-06_6,1/17/2022,SP2583,2022-09-15T08:29:33,,FALSE
9/1/2022,IP2584,parsley,7944,H2584,8,9/11/2021,40,56,LOT2584_IP_2022-09-01_56,1/20/2022,SP2584,2022-09-23T03:55:55,,FALSE
8/11/2022,IP2585,potato,8967,H2585,9,8/22/2021,45,63,LOT2585_IP_2022-08-11_63,1/10/2022,SP2585,2022-08-28T15:08:57,,FALSE
10/31/2022,IP2586,bell peppers,5329,H2586,6,8/14/2021,27,37,LOT2586_IP_2022-10-31_37,1/6/2022,SP2586,2022-08-19T11:16:06,,TRUE
11/1/2021,IP2587,Tomatoes,3745,H2587,4,10/25/2021,19,26,LOT2587_IP_2021-11-01_26,2/11/2022,SP2587,2022-11-15T15:10:16,,FALSE
2/6/2023,IP2588,melons,3320,H2588,4,11/26/2021,17,23,LOT2588_IP_2023-02-06_23,2/26/2022,SP2588,2022-12-25T03:10:56,,TRUE
4/12/2022,IP2589,chili peppers,6386,H2589,7,11/6/2021,32,45,LOT2589_IP_2022-04-12_45,2/17/2022,SP2589,2022-11-30T19:14:10,,TRUE
9/17/2022,IP2590,potato,8748,H2590,9,10/11/2021,44,61,LOT2590_IP_2022-09-17_61,2/4/2022,SP2590,2022-10-29T23:03:36,,FALSE
8/13/2021,IP2591,cilantro,7739,H2591,8,9/6/2021,39,54,LOT2591_IP_2021-08-13_54,1/18/2022,SP2591,2022-09-16T06:07:12,,FALSE
3/13/2022,IP2592,lettuce,298,H2592,1,11/10/2021,2,2,LOT2592_IP_2022-03-13_2,2/19/2022,SP2592,2022-12-05T07:22:28,,FALSE
9/2/2021,IP2593,cilantro,7557,H2593,8,11/13/2021,38,53,LOT2593_IP_2021-09-02_53,2/20/2022,SP2593,2022-12-09T08:41:55,,FALSE
10/26/2022,IP2594,potato,9192,H2594,9,10/16/2021,46,64,LOT2594_IP_2022-10-26_64,2/6/2022,SP2594,2022-11-04T12:25:49,,FALSE
1/10/2022,IP2595,chili peppers,5978,H2595,6,11/22/2021,30,42,LOT2595_IP_2022-01-10_42,2/24/2022,SP2595,2022-12-19T21:01:16,,FALSE
12/3/2022,IP2596,cilantro,7818,H2596,8,11/9/2021,39,55,LOT2596_IP_2022-12-03_55,2/18/2022,SP2596,2022-12-04T16:57:21,,FALSE
7/3/2022,IP2597,potato,8987,H2597,9,9/4/2021,45,63,LOT2597_IP_2022-07-03_63,1/17/2022,SP2597,2022-09-13T16:50:31,,FALSE
8/4/2022,IP2598,bell peppers,5509,H2598,6,10/11/2021,28,39,LOT2598_IP_2022-08-04_39,2/4/2022,SP2598,2022-10-30T02:39:53,,FALSE
9/21/2021,IP2599,parsley,8070,H2599,8,9/18/2021,40,57,LOT2599_IP_2021-09-21_57,1/24/2022,SP2599,2022-10-01T10:11:07,,FALSE
2/16/2022,IP2600,parsley,7880,H2600,8,9/4/2021,40,55,LOT2600_IP_2022-02-16_55,1/17/2022,SP2600,2022-09-14T18:04:27,,FALSE
9/24/2022,IP2601,potato,9133,H2601,9,11/16/2021,46,64,LOT2601_IP_2022-09-24_64,2/22/2022,SP2601,2022-12-13T06:25:06,,FALSE
12/27/2022,IP2602,Tomatoes,4199,H2602,5,11/4/2021,21,30,LOT2602_IP_2022-12-27_30,2/16/2022,SP2602,2022-11-28T02:21:12,,TRUE
9/6/2021,IP2603,arugula,2810,H2603,3,8/6/2021,14,20,LOT2603_IP_2021-09-06_20,1/3/2022,SP2603,2022-08-09T20:34:25,,FALSE
8/10/2021,IP2604,melons,2977,H2604,4,9/17/2021,15,21,LOT2604_IP_2021-08-10_21,1/23/2022,SP2604,2022-09-30T05:20:54,,TRUE
11/14/2021,IP2605,parsley,7915,H2605,8,9/7/2021,40,55,LOT2605_IP_2021-11-14_55,1/18/2022,SP2605,2022-09-17T18:09:58,,FALSE
12/19/2021,IP2606,parsley,8341,H2606,8,11/17/2021,42,58,LOT2606_IP_2021-12-19_58,2/22/2022,SP2606,2022-12-13T17:13:56,,TRUE
10/27/2021,IP2607,potato,8908,H2607,9,9/27/2021,45,62,LOT2607_IP_2021-10-27_62,1/28/2022,SP2607,2022-10-12T05:43,,TRUE
12/19/2022,IP2608,arugula,2622,H2608,3,8/30/2021,13,19,LOT2608_IP_2022-12-19_19,1/14/2022,SP2608,2022-09-07T23:52:01,,FALSE
6/26/2022,IP2609,melons,3501,H2609,4,10/12/2021,18,25,LOT2609_IP_2022-06-26_25,2/4/2022,SP2609,2022-10-31T03:53:49,,FALSE
10/6/2021,IP2610,parsley,8457,H2610,9,11/24/2021,42,59,LOT2610_IP_2021-10-06_59,2/25/2022,SP2610,2022-12-22T10:17:57,,FALSE
12/10/2021,IP2611,chili peppers,6294,H2611,7,10/28/2021,32,44,LOT2611_IP_2021-12-10_44,2/12/2022,SP2611,2022-11-19T16:29:44,,FALSE
10/16/2022,IP2612,Tomatoes,3726,H2612,4,8/29/2021,19,26,LOT2612_IP_2022-10-16_26,1/14/2022,SP2612,2022-09-06T08:12:58,,TRUE
10/8/2021,IP2613,basil,6563,H2613,7,10/24/2021,33,46,LOT2613_IP_2021-10-08_46,2/10/2022,SP2613,2022-11-14T06:43:47,,FALSE
3/26/2022,IP2614,cilantro,7202,H2614,7,11/1/2021,36,51,LOT2614_IP_2022-03-26_51,2/14/2022,SP2614,2022-11-24T08:14:18,,FALSE
10/31/2021,IP2615,potato,8629,H2615,9,10/21/2021,43,60,LOT2615_IP_2021-10-31_60,2/9/2022,SP2615,2022-11-11T13:50:49,,FALSE
12/31/2022,IP2616,basil,6989,H2616,7,9/19/2021,35,49,LOT2616_IP_2022-12-31_49,1/24/2022,SP2616,2022-10-03T05:26:26,,FALSE
3/6/2022,IP2617,parsley,7931,H2617,8,9/21/2021,40,56,LOT2617_IP_2022-03-06_56,1/25/2022,SP2617,2022-10-05T15:06:51,,FALSE
7/14/2022,IP2618,spinach,1362,H2618,2,8/12/2021,7,10,LOT2618_IP_2022-07-14_10,1/5/2022,SP2618,2022-08-16T21:59:24,,FALSE
1/15/2022,IP2619,arugula,2421,H2619,3,10/17/2021,12,17,LOT2619_IP_2022-01-15_17,2/7/2022,SP2619,2022-11-06T07:41:08,,FALSE
10/9/2021,IP2620,potato,8784,H2620,9,10/1/2021,44,62,LOT2620_IP_2021-10-09_62,1/30/2022,SP2620,2022-10-17T01:03:51,,FALSE
2/28/2022,IP2621,lettuce,234,H2621,1,11/22/2021,2,2,LOT2621_IP_2022-02-28_2,2/25/2022,SP2621,2022-12-20T11:26:22,,FALSE
12/3/2022,IP2622,cilantro,7572,H2622,8,9/20/2021,38,53,LOT2622_IP_2022-12-03_53,1/25/2022,SP2622,2022-10-04T03:04:05,,FALSE
1/29/2023,IP2623,potato,8683,H2623,9,9/15/2021,43,61,LOT2623_IP_2023-01-29_61,1/22/2022,SP2623,2022-09-27T16:04:12,,FALSE
10/31/2021,IP2624,arugula,2418,H2624,3,8/19/2021,12,17,LOT2624_IP_2021-10-31_17,1/9/2022,SP2624,2022-08-25T18:39:42,,FALSE
5/21/2022,IP2625,melons,3613,H2625,4,8/19/2021,18,25,LOT2625_IP_2022-05-21_25,1/9/2022,SP2625,2022-08-25T18:39:42,,FALSE
11/18/2021,IP2626,potato,8952,H2626,9,8/12/2021,45,63,LOT2626_IP_2021-11-18_63,1/6/2022,SP2626,2022-08-17T05:11:57,,FALSE
1/11/2023,IP2627,spinach,825,H2627,2,9/30/2021,5,6,LOT2627_IP_2023-01-11_6,1/30/2022,SP2627,2022-10-16T17:51:17,,FALSE
6/24/2022,IP2628,cilantro,7249,H2628,7,9/19/2021,36,51,LOT2628_IP_2022-06-24_51,1/24/2022,SP2628,2022-10-03T05:26:26,,FALSE
4/4/2022,IP2629,bell peppers,5485,H2629,6,9/21/2021,28,39,LOT2629_IP_2022-04-04_39,1/25/2022,SP2629,2022-10-04T17:29:11,,FALSE
11/24/2022,IP2630,sweet potato,9397,H2630,9,9/17/2021,47,66,LOT2630_IP_2022-11-24_66,1/23/2022,SP2630,2022-09-29T18:32:04,,FALSE
5/17/2022,IP2631,bell peppers,5509,H2631,6,10/8/2021,28,39,LOT2631_IP_2022-05-17_39,2/2/2022,SP2631,2022-10-25T10:55:19,,FALSE
5/17/2022,IP2632,potato,8973,H2632,9,8/22/2021,45,63,LOT2632_IP_2022-05-17_63,1/11/2022,SP2632,2022-08-29T16:22:53,,TRUE
9/8/2022,IP2633,arugula,2571,H2633,3,9/22/2021,13,18,LOT2633_IP_2022-09-08_18,1/26/2022,SP2633,2022-10-06T05:31:57,,FALSE
10/6/2021,IP2634,arugula,2883,H2634,4,11/7/2021,15,20,LOT2634_IP_2021-10-06_20,2/17/2022,SP2634,2022-12-01T16:51:50,,TRUE
9/20/2021,IP2635,chili peppers,5932,H2635,6,10/11/2021,30,42,LOT2635_IP_2021-09-20_42,2/4/2022,SP2635,2022-10-29T12:14:46,,FALSE
10/16/2022,IP2636,Tomatoes,3827,H2636,4,10/24/2021,19,27,LOT2636_IP_2022-10-16_27,2/10/2022,SP2636,2022-11-14T03:07:30,,FALSE
12/16/2022,IP2637,sweet potato,9352,H2637,9,9/1/2021,47,65,LOT2637_IP_2022-12-16_65,1/15/2022,SP2637,2022-09-10T16:44:59,,TRUE
6/20/2022,IP2638,arugula,2567,H2638,3,9/7/2021,13,18,LOT2638_IP_2022-06-20_18,1/18/2022,SP2638,2022-09-18T01:22:31,,TRUE
12/20/2021,IP2639,kale,1757,H2639,3,9/8/2021,9,13,LOT2639_IP_2021-12-20_13,1/19/2022,SP2639,2022-09-19T06:12:44,,TRUE
11/25/2022,IP2640,Cucumbers,4452,H2640,5,8/2/2021,23,31,LOT2640_IP_2022-11-25_31,12/31/2021,SP2640,2022-08-04T10:48:28,,FALSE
8/22/2022,IP2641,lettuce,202,H2641,1,10/12/2021,2,2,LOT2641_IP_2022-08-22_2,2/4/2022,SP2641,2022-10-30T17:04:59,,FALSE
2/23/2023,IP2642,kale,2103,H2642,3,8/29/2021,11,15,LOT2642_IP_2023-02-23_15,1/14/2022,SP2642,2022-09-06T22:38:05,,FALSE
10/31/2021,IP2643,Cucumbers,4415,H2643,5,10/3/2021,22,31,LOT2643_IP_2021-10-31_31,1/31/2022,SP2643,2022-10-19T14:20:32,,FALSE
1/7/2023,IP2644,Cucumbers,4416,H2644,5,9/25/2021,22,31,LOT2644_IP_2023-01-07_31,1/27/2022,SP2644,2022-10-09T20:02:35,,FALSE
2/3/2023,IP2645,bell peppers,5695,H2645,6,9/18/2021,29,40,LOT2645_IP_2023-02-03_40,1/24/2022,SP2645,2022-10-01T06:34:50,,FALSE
11/16/2022,IP2646,cilantro,7856,H2646,8,9/13/2021,39,55,LOT2646_IP_2022-11-16_55,1/21/2022,SP2646,2022-09-25T13:36:20,,FALSE
8/9/2022,IP2647,potato,9165,H2647,9,10/14/2021,46,64,LOT2647_IP_2022-08-09_64,2/5/2022,SP2647,2022-11-01T23:09:08,,FALSE
5/23/2022,IP2648,basil,7046,H2648,7,9/22/2021,35,49,LOT2648_IP_2022-05-23_49,1/26/2022,SP2648,2022-10-06T16:20:47,,FALSE
11/19/2022,IP2649,basil,6689,H2649,7,10/31/2021,34,47,LOT2649_IP_2022-11-19_47,2/14/2022,SP2649,2022-11-23T14:12:55,,FALSE
7/18/2022,IP2650,basil,6488,H2650,7,10/28/2021,33,46,LOT2650_IP_2022-07-18_46,2/12/2022,SP2650,2022-11-20T03:18:33,,FALSE
7/25/2022,IP2651,basil,6899,H2651,7,9/27/2021,35,48,LOT2651_IP_2022-07-25_48,1/28/2022,SP2651,2022-10-12T23:44:23,,FALSE
8/14/2022,IP2652,bell peppers,5233,H2652,6,10/24/2021,26,37,LOT2652_IP_2022-08-14_37,2/10/2022,SP2652,2022-11-14T06:43:47,,FALSE
1/3/2022,IP2653,spinach,1300,H2653,2,10/23/2021,7,9,LOT2653_IP_2022-01-03_9,2/10/2022,SP2653,2022-11-13T19:54:57,,FALSE
10/6/2021,IP2654,basil,6701,H2654,7,8/9/2021,34,47,LOT2654_IP_2021-10-06_47,1/4/2022,SP2654,2022-08-13T07:28:46,,FALSE
3/15/2022,IP2655,parsley,8016,H2655,8,11/13/2021,40,56,LOT2655_IP_2022-03-15_56,2/20/2022,SP2655,2022-12-09T15:54:28,,FALSE
2/3/2023,IP2656,Cucumbers,4633,H2656,5,8/28/2021,23,33,LOT2656_IP_2023-02-03_33,1/13/2022,SP2656,2022-09-05T17:47:52,,FALSE
8/27/2021,IP2657,basil,6497,H2657,7,11/24/2021,33,46,LOT2657_IP_2021-08-27_46,2/25/2022,SP2657,2022-12-22T06:41:41,,FALSE
11/11/2021,IP2658,parsley,7952,H2658,8,10/26/2021,40,56,LOT2658_IP_2021-11-11_56,2/11/2022,SP2658,2022-11-17T10:25:35,,TRUE
1/25/2022,IP2659,chili peppers,6117,H2659,6,9/24/2021,31,43,LOT2659_IP_2022-01-25_43,1/27/2022,SP2659,2022-10-09T09:13:45,,FALSE
8/29/2021,IP2660,spinach,1475,H2660,2,10/4/2021,8,11,LOT2660_IP_2021-08-29_11,1/31/2022,SP2660,2022-10-21T02:23:18,,FALSE
6/15/2022,IP2661,bell peppers,5547,H2661,6,11/1/2021,28,39,LOT2661_IP_2022-06-15_39,2/14/2022,SP2661,2022-11-24T11:50:34,,FALSE
11/18/2021,IP2662,kale,1604,H2662,2,10/17/2021,8,11,LOT2662_IP_2021-11-18_11,2/7/2022,SP2662,2022-11-06T00:28:35,,FALSE
10/25/2022,IP2663,potato,8769,H2663,9,8/23/2021,44,61,LOT2663_IP_2022-10-25_61,1/11/2022,SP2663,2022-08-30T10:24:16,,FALSE
1/5/2023,IP2664,lettuce,383,H2664,1,11/2/2021,2,3,LOT2664_IP_2023-01-05_3,2/15/2022,SP2664,2022-11-25T23:53:20,,FALSE
7/3/2022,IP2665,Cucumbers,4552,H2665,5,11/29/2021,23,32,LOT2665_IP_2022-07-03_32,2/28/2022,SP2665,2022-12-28T10:29,,FALSE
9/19/2022,IP2666,lettuce,350,H2666,1,10/25/2021,2,3,LOT2666_IP_2022-09-19_3,2/11/2022,SP2666,2022-11-16T05:35:22,,FALSE
12/18/2021,IP2667,melons,3319,H2667,4,9/28/2021,17,23,LOT2667_IP_2021-12-18_23,1/29/2022,SP2667,2022-10-13T21:22:02,,TRUE
5/20/2022,IP2668,Tomatoes,4241,H2668,5,8/10/2021,21,30,LOT2668_IP_2022-05-20_30,1/5/2022,SP2668,2022-08-14T19:31:32,,FALSE
1/24/2022,IP2669,lettuce,115,H2669,1,10/1/2021,1,1,LOT2669_IP_2022-01-24_1,1/30/2022,SP2669,2022-10-17T19:05:13,,FALSE
9/10/2022,IP2670,chili peppers,5969,H2670,6,11/14/2021,30,42,LOT2670_IP_2022-09-10_42,2/21/2022,SP2670,2022-12-10T09:55:51,,TRUE
12/2/2022,IP2671,cilantro,7552,H2671,8,8/10/2021,38,53,LOT2671_IP_2022-12-02_53,1/5/2022,SP2671,2022-08-14T23:07:48,,FALSE
1/9/2023,IP2672,spinach,1284,H2672,2,8/9/2021,7,9,LOT2672_IP_2023-01-09_9,1/4/2022,SP2672,2022-08-13T18:17:36,,FALSE
8/17/2022,IP2673,melons,3369,H2673,4,9/17/2021,17,24,LOT2673_IP_2022-08-17_24,1/23/2022,SP2673,2022-09-30T01:44:37,,FALSE
4/21/2022,IP2674,spinach,1036,H2674,2,8/8/2021,6,8,LOT2674_IP_2022-04-21_8,1/4/2022,SP2674,2022-08-12T09:51:07,,FALSE
1/20/2022,IP2675,sweet potato,9676,H2675,10,11/4/2021,48,68,LOT2675_IP_2022-01-20_68,2/16/2022,SP2675,2022-11-27T22:44:55,,FALSE
8/22/2022,IP2676,cilantro,7446,H2676,8,10/15/2021,37,52,LOT2676_IP_2022-08-22_52,2/6/2022,SP2676,2022-11-03T14:48:10,,FALSE
8/19/2022,IP2677,basil,6498,H2677,7,9/16/2021,33,46,LOT2677_IP_2022-08-19_46,1/23/2022,SP2677,2022-09-29T07:43:15,,FALSE
12/23/2021,IP2678,arugula,2227,H2678,3,10/21/2021,12,16,LOT2678_IP_2021-12-23_16,2/9/2022,SP2678,2022-11-11T06:38:15,,TRUE
4/1/2022,IP2679,chili peppers,5850,H2679,6,11/17/2021,29,41,LOT2679_IP_2022-04-01_41,2/22/2022,SP2679,2022-12-14T07:39:02,,FALSE
6/9/2022,IP2680,chili peppers,6417,H2680,7,10/30/2021,32,45,LOT2680_IP_2022-06-09_45,2/13/2022,SP2680,2022-11-22T12:58:59,,FALSE
2/14/2022,IP2681,bell peppers,5376,H2681,6,9/21/2021,27,38,LOT2681_IP_2022-02-14_38,1/25/2022,SP2681,2022-10-04T13:52:55,,FALSE
9/9/2022,IP2682,lettuce,440,H2682,1,11/17/2021,3,3,LOT2682_IP_2022-09-09_3,2/22/2022,SP2682,2022-12-13T17:13:56,,FALSE
2/3/2022,IP2683,spinach,1240,H2683,2,11/29/2021,7,9,LOT2683_IP_2022-02-03_9,2/28/2022,SP2683,2022-12-28T21:17:50,,FALSE
4/2/2022,IP2684,cilantro,7325,H2684,8,8/10/2021,37,51,LOT2684_IP_2022-04-02_51,1/5/2022,SP2684,2022-08-14T19:31:32,,FALSE
7/12/2022,IP2685,bell peppers,5234,H2685,6,8/22/2021,26,37,LOT2685_IP_2022-07-12_37,1/10/2022,SP2685,2022-08-28T15:08:57,,FALSE
5/29/2022,IP2686,potato,8599,H2686,9,10/24/2021,43,60,LOT2686_IP_2022-05-29_60,2/10/2022,SP2686,2022-11-14T21:08:53,,FALSE
11/14/2021,IP2687,sweet potato,9828,H2687,10,8/5/2021,49,69,LOT2687_IP_2021-11-14_69,1/2/2022,SP2687,2022-08-08T01:19:06,,FALSE
10/10/2021,IP2688,Cucumbers,4755,H2688,5,9/23/2021,24,33,LOT2688_IP_2021-10-10_33,1/26/2022,SP2688,2022-10-07T13:58:26,,TRUE
11/15/2021,IP2689,parsley,8442,H2689,9,9/6/2021,42,59,LOT2689_IP_2021-11-15_59,1/18/2022,SP2689,2022-09-16T06:07:12,,FALSE
10/26/2021,IP2690,chili peppers,5990,H2690,6,10/20/2021,30,42,LOT2690_IP_2021-10-26_42,2/8/2022,SP2690,2022-11-10T01:48:03,,FALSE
10/7/2022,IP2691,chili peppers,6450,H2691,7,11/18/2021,32,45,LOT2691_IP_2022-10-07_45,2/23/2022,SP2691,2022-12-15T16:05:31,,FALSE
2/12/2022,IP2692,spinach,1395,H2692,2,10/4/2021,7,10,LOT2692_IP_2022-02-12_10,2/1/2022,SP2692,2022-10-21T13:12:08,,TRUE
12/14/2021,IP2693,cilantro,7789,H2693,8,11/19/2021,39,55,LOT2693_IP_2021-12-14_55,2/23/2022,SP2693,2022-12-16T17:19:27,,FALSE
9/25/2021,IP2694,spinach,1296,H2694,2,8/2/2021,7,9,LOT2694_IP_2021-09-25_9,1/1/2022,SP2694,2022-08-05T04:49:51,,FALSE
2/15/2022,IP2695,chili peppers,6373,H2695,7,8/24/2021,32,45,LOT2695_IP_2022-02-15_45,1/11/2022,SP2695,2022-08-31T22:27:02,,FALSE
2/27/2022,IP2696,Cucumbers,4650,H2696,5,10/28/2021,24,33,LOT2696_IP_2022-02-27_33,2/12/2022,SP2696,2022-11-19T20:06,,FALSE
8/4/2021,IP2697,Cucumbers,4720,H2697,5,10/12/2021,24,33,LOT2697_IP_2021-08-04_33,2/5/2022,SP2697,2022-10-31T11:06:22,,FALSE
12/5/2022,IP2698,arugula,2674,H2698,3,8/17/2021,14,19,LOT2698_IP_2022-12-05_19,1/8/2022,SP2698,2022-08-23T12:35:33,,FALSE
9/17/2021,IP2699,arugula,2784,H2699,3,9/8/2021,14,20,LOT2699_IP_2021-09-17_20,1/19/2022,SP2699,2022-09-19T02:36:27,,FALSE
5/30/2022,IP2700,bell peppers,5116,H2700,6,9/19/2021,26,36,LOT2700_IP_2022-05-30_36,1/24/2022,SP2700,2022-10-03T05:26:26,,FALSE
1/1/2023,IP2701,lettuce,345,H2701,1,10/10/2021,2,3,LOT2701_IP_2023-01-01_3,2/3/2022,SP2701,2022-10-28T00:12:01,,FALSE
1/8/2022,IP2702,chili peppers,5766,H2702,6,11/17/2021,29,40,LOT2702_IP_2022-01-08_40,2/22/2022,SP2702,2022-12-14T18:27:52,,FALSE
3/21/2022,IP2703,Cucumbers,4549,H2703,5,9/22/2021,23,32,LOT2703_IP_2022-03-21_32,1/26/2022,SP2703,2022-10-06T05:31:57,,FALSE
7/30/2022,IP2704,spinach,830,H2704,2,11/4/2021,5,6,LOT2704_IP_2022-07-30_6,2/16/2022,SP2704,2022-11-28T05:57:29,,FALSE
11/12/2022,IP2705,bell peppers,5251,H2705,6,9/10/2021,26,37,LOT2705_IP_2022-11-12_37,1/20/2022,SP2705,2022-09-21T12:16:53,,FALSE
11/6/2022,IP2706,kale,1534,H2706,2,11/6/2021,8,11,LOT2706_IP_2022-11-06_11,2/17/2022,SP2706,2022-11-30T15:37:54,,FALSE
4/4/2022,IP2707,Cucumbers,4519,H2707,5,9/22/2021,23,32,LOT2707_IP_2022-04-04_32,1/26/2022,SP2707,2022-10-06T16:20:47,,TRUE
5/29/2022,IP2708,parsley,8189,H2708,8,11/21/2021,41,57,LOT2708_IP_2022-05-29_57,2/24/2022,SP2708,2022-12-19T06:36:09,,FALSE
12/31/2021,IP2709,chili peppers,5961,H2709,6,10/4/2021,30,42,LOT2709_IP_2021-12-31_42,1/31/2022,SP2709,2022-10-20T15:34:28,,FALSE
11/29/2021,IP2710,sweet potato,9743,H2710,10,11/30/2021,49,68,LOT2710_IP_2021-11-29_68,2/28/2022,SP2710,2022-12-29T15:19:13,,TRUE
12/29/2022,IP2711,chili peppers,5890,H2711,6,8/15/2021,30,41,LOT2711_IP_2022-12-29_41,1/7/2022,SP2711,2022-08-20T05:17:29,,FALSE
11/27/2021,IP2712,Cucumbers,5036,H2712,5,11/9/2021,25,35,LOT2712_IP_2021-11-27_35,2/18/2022,SP2712,2022-12-04T06:08:32,,FALSE
12/21/2021,IP2713,chili peppers,6398,H2713,7,11/26/2021,32,45,LOT2713_IP_2021-12-21_45,2/26/2022,SP2713,2022-12-24T16:22:06,,TRUE
11/30/2021,IP2714,melons,3325,H2714,4,9/19/2021,17,23,LOT2714_IP_2021-11-30_23,1/24/2022,SP2714,2022-10-03T05:26:26,,TRUE
8/23/2022,IP2715,melons,3331,H2715,4,8/17/2021,17,24,LOT2715_IP_2022-08-23_24,1/8/2022,SP2715,2022-08-23T12:35:33,,FALSE
11/23/2021,IP2716,arugula,2769,H2716,3,10/22/2021,14,20,LOT2716_IP_2021-11-23_20,2/10/2022,SP2716,2022-11-12T18:41:01,,FALSE
10/31/2021,IP2717,potato,9149,H2717,9,9/27/2021,46,64,LOT2717_IP_2021-10-31_64,1/28/2022,SP2717,2022-10-12T16:31:50,,FALSE
8/28/2022,IP2718,basil,6736,H2718,7,11/7/2021,34,47,LOT2718_IP_2022-08-28_47,2/17/2022,SP2718,2022-12-02T03:40:40,,FALSE
8/26/2022,IP2719,basil,7082,H2719,7,10/4/2021,36,50,LOT2719_IP_2022-08-26_50,2/1/2022,SP2719,2022-10-21T13:12:08,,TRUE
9/8/2021,IP2720,kale,1560,H2720,2,8/25/2021,8,11,LOT2720_IP_2021-09-08_11,1/12/2022,SP2720,2022-09-02T06:53:31,,FALSE
1/20/2022,IP2721,Cucumbers,4700,H2721,5,11/23/2021,24,33,LOT2721_IP_2022-01-20_33,2/25/2022,SP2721,2022-12-21T23:29:08,,FALSE
1/20/2022,IP2722,Tomatoes,4092,H2722,5,11/18/2021,21,29,LOT2722_IP_2022-01-20_29,2/23/2022,SP2722,2022-12-15T16:05:31,,FALSE
3/5/2022,IP2723,lettuce,144,H2723,1,10/24/2021,1,1,LOT2723_IP_2022-03-05_1,2/10/2022,SP2723,2022-11-14T03:07:30,,FALSE
5/16/2022,IP2724,lettuce,574,H2724,1,8/16/2021,3,4,LOT2724_IP_2022-05-16_4,1/7/2022,SP2724,2022-08-21T13:43:58,,FALSE
2/15/2023,IP2725,Tomatoes,4146,H2725,5,8/26/2021,21,29,LOT2725_IP_2023-02-15_29,1/12/2022,SP2725,2022-09-03T11:43:43,,FALSE
11/22/2022,IP2726,chili peppers,5877,H2726,6,10/3/2021,30,41,LOT2726_IP_2022-11-22_41,1/31/2022,SP2726,2022-10-19T10:44:16,,FALSE
8/15/2022,IP2727,arugula,2414,H2727,3,8/16/2021,12,17,LOT2727_IP_2022-08-15_17,1/7/2022,SP2727,2022-08-22T00:32:47,,FALSE
10/2/2022,IP2728,parsley,8263,H2728,8,8/4/2021,41,58,LOT2728_IP_2022-10-02_58,1/1/2022,SP2728,2022-08-06T13:16:20,,FALSE
3/10/2022,IP2729,spinach,967,H2729,2,10/20/2021,5,7,LOT2729_IP_2022-03-10_7,2/8/2022,SP2729,2022-11-09T07:46:40,,FALSE
5/17/2022,IP2730,melons,3537,H2730,4,10/23/2021,18,25,LOT2730_IP_2022-05-17_25,2/10/2022,SP2730,2022-11-13T01:53:34,,FALSE
8/17/2021,IP2731,arugula,2829,H2731,3,11/3/2021,15,20,LOT2731_IP_2021-08-17_20,2/15/2022,SP2731,2022-11-26T14:18:26,,TRUE
10/20/2021,IP2732,cilantro,7839,H2732,8,9/3/2021,39,55,LOT2732_IP_2021-10-20_55,1/16/2022,SP2732,2022-09-12T15:36:35,,FALSE
7/22/2022,IP2733,Cucumbers,4983,H2733,5,9/2/2021,25,35,LOT2733_IP_2022-07-22_35,1/16/2022,SP2733,2022-09-12T01:11:28,,FALSE
9/2/2021,IP2734,Cucumbers,4919,H2734,5,11/26/2021,25,35,LOT2734_IP_2021-09-02_35,2/26/2022,SP2734,2022-12-25T03:10:56,,FALSE
11/30/2021,IP2735,bell peppers,5381,H2735,6,10/27/2021,27,38,LOT2735_IP_2021-11-30_38,2/12/2022,SP2735,2022-11-18T00:50:41,,FALSE
10/7/2021,IP2736,lettuce,389,H2736,1,8/28/2021,2,3,LOT2736_IP_2021-10-07_3,1/13/2022,SP2736,2022-09-05T17:47:52,,FALSE
10/20/2021,IP2737,chili peppers,6163,H2737,7,8/3/2021,31,43,LOT2737_IP_2021-10-20_43,1/1/2022,SP2737,2022-08-05T22:51:14,,FALSE
2/2/2023,IP2738,potato,9288,H2738,9,11/11/2021,46,65,LOT2738_IP_2023-02-02_65,2/19/2022,SP2738,2022-12-06T08:36:24,,FALSE
9/3/2021,IP2739,bell peppers,5402,H2739,6,9/11/2021,27,38,LOT2739_IP_2021-09-03_38,1/20/2022,SP2739,2022-09-22T20:43:22,,FALSE
1/3/2022,IP2740,potato,8726,H2740,9,8/13/2021,44,61,LOT2740_IP_2022-01-03_61,1/6/2022,SP2740,2022-08-18T17:14:43,,FALSE
10/19/2022,IP2741,chili peppers,6403,H2741,7,9/29/2021,32,45,LOT2741_IP_2022-10-19_45,1/29/2022,SP2741,2022-10-14T18:59:42,,FALSE
10/5/2021,IP2742,Cucumbers,4849,H2742,5,10/3/2021,25,34,LOT2742_IP_2021-10-05_34,1/31/2022,SP2742,2022-10-20T04:45:39,,FALSE
12/19/2021,IP2743,arugula,2385,H2743,3,11/4/2021,12,17,LOT2743_IP_2021-12-19_17,2/16/2022,SP2743,2022-11-28T02:21:12,,FALSE
5/14/2022,IP2744,spinach,1504,H2744,2,9/3/2021,8,11,LOT2744_IP_2022-05-14_11,1/16/2022,SP2744,2022-09-12T15:36:35,,FALSE
4/27/2022,IP2745,Cucumbers,4733,H2745,5,10/18/2021,24,33,LOT2745_IP_2022-04-27_33,2/7/2022,SP2745,2022-11-07T08:55:04,,FALSE
10/16/2021,IP2746,arugula,2892,H2746,4,11/12/2021,15,20,LOT2746_IP_2021-10-16_20,2/19/2022,SP2746,2022-12-07T13:26:36,,FALSE
10/5/2021,IP2747,chili peppers,6458,H2747,7,8/25/2021,32,45,LOT2747_IP_2021-10-05_45,1/12/2022,SP2747,2022-09-01T20:04:41,,TRUE
3/2/2022,IP2748,lettuce,399,H2748,1,10/4/2021,2,3,LOT2748_IP_2022-03-02_3,2/1/2022,SP2748,2022-10-21T16:48:24,,FALSE
4/8/2022,IP2749,chili peppers,5947,H2749,6,10/23/2021,30,42,LOT2749_IP_2022-04-08_42,2/10/2022,SP2749,2022-11-13T12:42:24,,FALSE
11/7/2022,IP2750,parsley,8451,H2750,9,11/28/2021,42,59,LOT2750_IP_2022-11-07_59,2/28/2022,SP2750,2022-12-27T20:03:54,,FALSE
10/24/2021,IP2751,spinach,1465,H2751,2,9/5/2021,8,11,LOT2751_IP_2021-10-24_11,1/17/2022,SP2751,2022-09-15T12:05:49,,FALSE
6/18/2022,IP2752,Cucumbers,4818,H2752,5,10/29/2021,24,34,LOT2752_IP_2022-06-18_34,2/13/2022,SP2752,2022-11-20T21:19:56,,FALSE
3/21/2022,IP2753,kale,1785,H2753,3,10/15/2021,9,13,LOT2753_IP_2022-03-21_13,2/6/2022,SP2753,2022-11-03T03:59:20,,FALSE
10/30/2022,IP2754,Tomatoes,4178,H2754,5,8/9/2021,21,29,LOT2754_IP_2022-10-30_29,1/4/2022,SP2754,2022-08-13T07:28:46,,FALSE
7/14/2022,IP2755,parsley,8271,H2755,8,11/25/2021,41,58,LOT2755_IP_2022-07-14_58,2/26/2022,SP2755,2022-12-24T01:57,,FALSE
9/10/2021,IP2756,basil,6625,H2756,7,10/8/2021,33,46,LOT2756_IP_2021-09-10_46,2/2/2022,SP2756,2022-10-25T14:31:35,,FALSE
12/15/2022,IP2757,kale,2032,H2757,3,11/19/2021,11,14,LOT2757_IP_2022-12-15_14,2/23/2022,SP2757,2022-12-16T06:30:38,,FALSE
1/5/2023,IP2758,basil,7047,H2758,7,8/3/2021,35,49,LOT2758_IP_2023-01-05_49,1/1/2022,SP2758,2022-08-05T22:51:14,,FALSE
7/5/2022,IP2759,Cucumbers,4847,H2759,5,8/3/2021,24,34,LOT2759_IP_2022-07-05_34,1/1/2022,SP2759,2022-08-05T19:14:57,,FALSE
7/26/2022,IP2760,Cucumbers,4481,H2760,5,11/20/2021,23,32,LOT2760_IP_2022-07-26_32,2/24/2022,SP2760,2022-12-18T08:58:30,,FALSE
12/16/2021,IP2761,chili peppers,5828,H2761,6,9/18/2021,29,41,LOT2761_IP_2021-12-16_41,1/24/2022,SP2761,2022-10-01T10:11:07,,FALSE
8/13/2021,IP2762,basil,6789,H2762,7,10/23/2021,34,48,LOT2762_IP_2021-08-13_48,2/10/2022,SP2762,2022-11-13T12:42:24,,FALSE
5/5/2022,IP2763,sweet potato,9715,H2763,10,10/19/2021,49,68,LOT2763_IP_2022-05-05_68,2/8/2022,SP2763,2022-11-08T10:09,,FALSE
12/16/2021,IP2764,potato,9158,H2764,9,11/15/2021,46,64,LOT2764_IP_2021-12-16_64,2/21/2022,SP2764,2022-12-11T11:09:47,,TRUE
2/15/2023,IP2765,Tomatoes,4091,H2765,5,8/16/2021,21,29,LOT2765_IP_2023-02-15_29,1/7/2022,SP2765,2022-08-22T00:32:47,,FALSE
12/20/2022,IP2766,kale,1683,H2766,2,10/16/2021,9,12,LOT2766_IP_2022-12-20_12,2/7/2022,SP2766,2022-11-05T10:03:29,,FALSE
1/14/2023,IP2767,Tomatoes,3895,H2767,4,10/15/2021,20,27,LOT2767_IP_2023-01-14_27,2/6/2022,SP2767,2022-11-04T05:13:16,,FALSE
9/27/2022,IP2768,melons,3053,H2768,4,8/16/2021,16,22,LOT2768_IP_2022-09-27_22,1/7/2022,SP2768,2022-08-21T06:31:25,,FALSE
10/4/2022,IP2769,potato,9124,H2769,9,10/31/2021,46,64,LOT2769_IP_2022-10-04_64,2/14/2022,SP2769,2022-11-23T03:24:05,,FALSE
12/5/2021,IP2770,bell peppers,5657,H2770,6,9/6/2021,29,40,LOT2770_IP_2021-12-05_40,1/18/2022,SP2770,2022-09-17T03:44:52,,FALSE
10/24/2022,IP2771,potato,8704,H2771,9,10/13/2021,44,61,LOT2771_IP_2022-10-24_61,2/5/2022,SP2771,2022-11-01T12:20:18,,FALSE
10/19/2021,IP2772,chili peppers,5910,H2772,6,10/25/2021,30,41,LOT2772_IP_2021-10-19_41,2/11/2022,SP2772,2022-11-15T18:46:33,,FALSE
2/25/2022,IP2773,Tomatoes,4225,H2773,5,10/25/2021,21,30,LOT2773_IP_2022-02-25_30,2/11/2022,SP2773,2022-11-16T05:35:22,,FALSE
12/12/2022,IP2774,parsley,8556,H2774,9,11/9/2021,43,60,LOT2774_IP_2022-12-12_60,2/18/2022,SP2774,2022-12-03T19:19:42,,FALSE
12/30/2021,IP2775,parsley,8412,H2775,9,8/15/2021,42,59,LOT2775_IP_2021-12-30_59,1/7/2022,SP2775,2022-08-20T08:53:45,,FALSE
12/16/2021,IP2776,arugula,2488,H2776,3,8/29/2021,13,18,LOT2776_IP_2021-12-16_18,1/14/2022,SP2776,2022-09-06T15:25:31,,FALSE
1/18/2023,IP2777,lettuce,511,H2777,1,10/11/2021,3,4,LOT2777_IP_2023-01-18_4,2/4/2022,SP2777,2022-10-29T12:14:46,,TRUE
9/4/2021,IP2778,melons,3074,H2778,4,8/20/2021,16,22,LOT2778_IP_2021-09-04_22,1/9/2022,SP2778,2022-08-26T12:41:05,,FALSE
10/12/2022,IP2779,arugula,2562,H2779,3,11/24/2021,13,18,LOT2779_IP_2022-10-12_18,2/26/2022,SP2779,2022-12-23T07:55:37,,FALSE
8/5/2021,IP2780,kale,1533,H2780,2,9/22/2021,8,11,LOT2780_IP_2021-08-05_11,1/26/2022,SP2780,2022-10-06T12:44:30,,FALSE
3/11/2022,IP2781,spinach,918,H2781,2,10/22/2021,5,7,LOT2781_IP_2022-03-11_7,2/10/2022,SP2781,2022-11-12T18:41:01,,FALSE
6/20/2022,IP2782,spinach,897,H2782,2,10/9/2021,5,7,LOT2782_IP_2022-06-20_7,2/3/2022,SP2782,2022-10-27T06:10:38,,FALSE
12/27/2021,IP2783,chili peppers,5910,H2783,6,10/9/2021,30,41,LOT2783_IP_2021-12-27_41,2/3/2022,SP2783,2022-10-27T16:59:27,,TRUE
6/13/2022,IP2784,parsley,8192,H2784,8,11/4/2021,41,57,LOT2784_IP_2022-06-13_57,2/16/2022,SP2784,2022-11-28T02:21:12,,FALSE
9/23/2021,IP2785,parsley,8397,H2785,9,10/4/2021,42,59,LOT2785_IP_2021-09-23_59,1/31/2022,SP2785,2022-10-21T02:23:18,,FALSE
11/9/2021,IP2786,spinach,1299,H2786,2,10/18/2021,7,9,LOT2786_IP_2021-11-09_9,2/7/2022,SP2786,2022-11-07T01:42:31,,FALSE
12/28/2021,IP2787,basil,6942,H2787,7,9/27/2021,35,49,LOT2787_IP_2021-12-28_49,1/28/2022,SP2787,2022-10-12T23:44:23,,FALSE
8/17/2022,IP2788,bell peppers,5752,H2788,6,8/19/2021,29,40,LOT2788_IP_2022-08-17_40,1/9/2022,SP2788,2022-08-26T01:52:15,,FALSE
2/9/2022,IP2789,sweet potato,9396,H2789,9,11/20/2021,47,66,LOT2789_IP_2022-02-09_66,2/24/2022,SP2789,2022-12-18T08:58:30,,FALSE
8/9/2021,IP2790,sweet potato,9334,H2790,9,9/8/2021,47,65,LOT2790_IP_2021-08-09_65,1/19/2022,SP2790,2022-09-18T19:23:54,,TRUE
2/21/2022,IP2791,chili peppers,6354,H2791,7,10/13/2021,32,45,LOT2791_IP_2022-02-21_45,2/5/2022,SP2791,2022-10-31T14:42:38,,FALSE
1/31/2022,IP2792,potato,8929,H2792,9,8/18/2021,45,63,LOT2792_IP_2022-01-31_63,1/8/2022,SP2792,2022-08-23T23:24:23,,FALSE
2/16/2023,IP2793,chili peppers,5841,H2793,6,9/20/2021,29,41,LOT2793_IP_2023-02-16_41,1/25/2022,SP2793,2022-10-03T19:51:32,,FALSE
2/28/2022,IP2794,kale,1978,H2794,3,11/12/2021,10,14,LOT2794_IP_2022-02-28_14,2/20/2022,SP2794,2022-12-07T20:39:09,,FALSE
4/8/2022,IP2795,cilantro,7492,H2795,8,8/15/2021,38,53,LOT2795_IP_2022-04-08_53,1/7/2022,SP2795,2022-08-20T19:42:35,,FALSE
10/29/2022,IP2796,parsley,8419,H2796,9,9/27/2021,42,59,LOT2796_IP_2022-10-29_59,1/28/2022,SP2796,2022-10-12T16:31:50,,TRUE
2/12/2022,IP2797,bell peppers,5634,H2797,6,11/12/2021,28,40,LOT2797_IP_2022-02-12_40,2/20/2022,SP2797,2022-12-08T07:27:59,,FALSE
2/10/2022,IP2798,spinach,1333,H2798,2,8/28/2021,7,10,LOT2798_IP_2022-02-10_10,1/14/2022,SP2798,2022-09-06T04:36:42,,FALSE
6/19/2022,IP2799,Tomatoes,3659,H2799,4,8/8/2021,19,26,LOT2799_IP_2022-06-19_26,1/3/2022,SP2799,2022-08-11T12:13:27,,FALSE
8/24/2022,IP2800,basil,6699,H2800,7,9/2/2021,34,47,LOT2800_IP_2022-08-24_47,1/16/2022,SP2800,2022-09-11T10:46:22,,FALSE
5/8/2022,IP2801,basil,7065,H2801,7,9/2/2021,35,50,LOT2801_IP_2022-05-08_50,1/16/2022,SP2801,2022-09-11T10:46:22,,FALSE
9/26/2022,IP2802,bell peppers,5484,H2802,6,11/23/2021,28,39,LOT2802_IP_2022-09-26_39,2/25/2022,SP2802,2022-12-21T19:52:51,,FALSE
1/31/2023,IP2803,parsley,8413,H2803,9,9/30/2021,42,59,LOT2803_IP_2023-01-31_59,1/30/2022,SP2803,2022-10-16T07:02:28,,FALSE
8/12/2021,IP2804,kale,1702,H2804,2,10/7/2021,9,12,LOT2804_IP_2021-08-12_12,2/2/2022,SP2804,2022-10-25T00:06:29,,FALSE
10/13/2022,IP2805,spinach,948,H2805,2,11/1/2021,5,7,LOT2805_IP_2022-10-13_7,2/14/2022,SP2805,2022-11-24T11:50:34,,FALSE
8/21/2021,IP2806,Tomatoes,4262,H2806,5,10/5/2021,22,30,LOT2806_IP_2021-08-21_30,2/1/2022,SP2806,2022-10-22T00:00:58,,FALSE
10/8/2022,IP2807,Cucumbers,4473,H2807,5,9/3/2021,23,31,LOT2807_IP_2022-10-08_31,1/16/2022,SP2807,2022-09-12T12:00:18,,FALSE
3/25/2022,IP2808,Cucumbers,4911,H2808,5,10/7/2021,25,35,LOT2808_IP_2022-03-25_35,2/2/2022,SP2808,2022-10-24T16:53:56,,TRUE
11/1/2021,IP2809,Tomatoes,4166,H2809,5,8/7/2021,21,29,LOT2809_IP_2021-11-01_29,1/3/2022,SP2809,2022-08-10T10:59:31,,FALSE
9/19/2022,IP2810,bell peppers,5709,H2810,6,11/19/2021,29,40,LOT2810_IP_2022-09-19_40,2/23/2022,SP2810,2022-12-16T20:55:44,,FALSE
4/28/2022,IP2811,parsley,7959,H2811,8,8/26/2021,40,56,LOT2811_IP_2022-04-28_56,1/12/2022,SP2811,2022-09-03T00:54:54,,FALSE
7/26/2022,IP2812,melons,3502,H2812,4,8/10/2021,18,25,LOT2812_IP_2022-07-26_25,1/5/2022,SP2812,2022-08-14T15:55:15,,FALSE
12/7/2021,IP2813,spinach,1117,H2813,2,9/7/2021,6,8,LOT2813_IP_2021-12-07_8,1/18/2022,SP2813,2022-09-17T21:46:15,,FALSE
7/21/2022,IP2814,parsley,8547,H2814,9,9/16/2021,43,60,LOT2814_IP_2022-07-21_60,1/23/2022,SP2814,2022-09-29T04:06:58,,FALSE
7/30/2022,IP2815,sweet potato,9993,H2815,10,9/23/2021,50,70,LOT2815_IP_2022-07-30_70,1/26/2022,SP2815,2022-10-07T17:34:43,,FALSE
1/17/2022,IP2816,Tomatoes,4214,H2816,5,8/11/2021,21,30,LOT2816_IP_2022-01-17_30,1/5/2022,SP2816,2022-08-15T17:09:11,,TRUE
1/15/2022,IP2817,potato,9020,H2817,9,8/6/2021,45,63,LOT2817_IP_2022-01-15_63,1/2/2022,SP2817,2022-08-09T02:33:02,,FALSE
9/30/2022,IP2818,parsley,8045,H2818,8,11/3/2021,40,56,LOT2818_IP_2022-09-30_56,2/15/2022,SP2818,2022-11-27T01:07:16,,FALSE
8/7/2022,IP2819,lettuce,683,H2819,2,9/24/2021,4,5,LOT2819_IP_2022-08-07_5,1/26/2022,SP2819,2022-10-08T15:12:22,,FALSE
11/11/2021,IP2820,potato,8972,H2820,9,11/4/2021,45,63,LOT2820_IP_2021-11-11_63,2/16/2022,SP2820,2022-11-28T02:21:12,,FALSE
4/29/2022,IP2821,arugula,2429,H2821,3,9/21/2021,13,17,LOT2821_IP_2022-04-29_17,1/25/2022,SP2821,2022-10-05T00:41:44,,FALSE
12/22/2022,IP2822,kale,1605,H2822,2,8/30/2021,8,11,LOT2822_IP_2022-12-22_11,1/14/2022,SP2822,2022-09-08T14:17:07,,FALSE
2/21/2023,IP2823,cilantro,7293,H2823,8,9/18/2021,37,51,LOT2823_IP_2023-02-21_51,1/24/2022,SP2823,2022-10-01T20:59:56,,FALSE
5/30/2022,IP2824,parsley,8364,H2824,9,8/28/2021,42,59,LOT2824_IP_2022-05-30_59,1/13/2022,SP2824,2022-09-04T23:46:29,,TRUE
6/26/2022,IP2825,arugula,2592,H2825,3,9/24/2021,13,18,LOT2825_IP_2022-06-26_18,1/26/2022,SP2825,2022-10-08T15:12:22,,FALSE
7/7/2022,IP2826,kale,1753,H2826,3,8/28/2021,9,13,LOT2826_IP_2022-07-07_13,1/14/2022,SP2826,2022-09-06T04:36:42,,TRUE
10/23/2021,IP2827,sweet potato,9721,H2827,10,9/14/2021,49,68,LOT2827_IP_2021-10-23_68,1/22/2022,SP2827,2022-09-26T11:14,,FALSE
12/31/2021,IP2828,cilantro,7385,H2828,8,8/13/2021,37,52,LOT2828_IP_2021-12-31_52,1/6/2022,SP2828,2022-08-18T10:02:10,,FALSE
11/20/2021,IP2829,spinach,1342,H2829,2,9/3/2021,7,10,LOT2829_IP_2021-11-20_10,1/16/2022,SP2829,2022-09-13T02:25:24,,FALSE
11/1/2022,IP2830,lettuce,668,H2830,2,8/20/2021,4,5,LOT2830_IP_2022-11-01_5,1/9/2022,SP2830,2022-08-26T16:17:21,,FALSE
2/17/2022,IP2831,sweet potato,9352,H2831,9,9/1/2021,47,65,LOT2831_IP_2022-02-17_65,1/15/2022,SP2831,2022-09-10T05:56:09,,TRUE
8/28/2022,IP2832,bell peppers,5352,H2832,6,11/23/2021,27,38,LOT2832_IP_2022-08-28_38,2/25/2022,SP2832,2022-12-21T12:40:18,,FALSE
2/28/2023,IP2833,kale,2214,H2833,3,10/12/2021,11,16,LOT2833_IP_2023-02-28_16,2/4/2022,SP2833,2022-10-30T17:04:59,,TRUE
11/30/2022,IP2834,parsley,8503,H2834,9,9/7/2021,43,60,LOT2834_IP_2022-11-30_60,1/18/2022,SP2834,2022-09-18T08:35:04,,FALSE
3/6/2022,IP2835,chili peppers,6380,H2835,7,11/15/2021,32,45,LOT2835_IP_2022-03-06_45,2/21/2022,SP2835,2022-12-11T14:46:04,,FALSE
9/19/2022,IP2836,chili peppers,6077,H2836,6,11/28/2021,31,43,LOT2836_IP_2022-09-19_43,2/27/2022,SP2836,2022-12-27T05:38:48,,FALSE
9/25/2021,IP2837,basil,6812,H2837,7,11/10/2021,34,48,LOT2837_IP_2021-09-25_48,2/18/2022,SP2837,2022-12-05T03:46:11,,FALSE
1/14/2023,IP2838,Cucumbers,4548,H2838,5,10/16/2021,23,32,LOT2838_IP_2023-01-14_32,2/6/2022,SP2838,2022-11-04T12:25:49,,FALSE
2/22/2022,IP2839,cilantro,7231,H2839,7,9/4/2021,36,51,LOT2839_IP_2022-02-22_51,1/17/2022,SP2839,2022-09-13T16:50:31,,FALSE
1/1/2023,IP2840,lettuce,404,H2840,1,9/13/2021,3,3,LOT2840_IP_2023-01-01_3,1/21/2022,SP2840,2022-09-24T23:11:14,,FALSE
11/15/2022,IP2841,Cucumbers,4465,H2841,5,9/16/2021,23,31,LOT2841_IP_2022-11-15_31,1/23/2022,SP2841,2022-09-28T20:54:25,,FALSE
10/4/2022,IP2842,Cucumbers,4629,H2842,5,11/4/2021,23,33,LOT2842_IP_2022-10-04_33,2/16/2022,SP2842,2022-11-28T05:57:29,,FALSE
9/2/2021,IP2843,arugula,2450,H2843,3,10/10/2021,13,17,LOT2843_IP_2021-09-02_17,2/3/2022,SP2843,2022-10-28T14:37:07,,FALSE
10/17/2021,IP2844,bell peppers,5649,H2844,6,10/28/2021,28,40,LOT2844_IP_2021-10-17_40,2/12/2022,SP2844,2022-11-19T05:40:54,,FALSE
6/6/2022,IP2845,cilantro,7213,H2845,7,9/15/2021,36,51,LOT2845_IP_2022-06-06_51,1/22/2022,SP2845,2022-09-27T23:16:45,,TRUE
9/22/2022,IP2846,Cucumbers,4694,H2846,5,10/16/2021,24,33,LOT2846_IP_2022-09-22_33,2/6/2022,SP2846,2022-11-04T19:38:23,,FALSE
3/14/2022,IP2847,cilantro,7211,H2847,7,8/11/2021,36,51,LOT2847_IP_2022-03-14_51,1/5/2022,SP2847,2022-08-15T09:56:38,,FALSE
11/25/2022,IP2848,kale,1737,H2848,2,9/17/2021,9,12,LOT2848_IP_2022-11-25_12,1/23/2022,SP2848,2022-09-30T05:20:54,,FALSE
10/15/2022,IP2849,potato,9289,H2849,9,10/7/2021,46,65,LOT2849_IP_2022-10-15_65,2/2/2022,SP2849,2022-10-25T03:42:46,,FALSE
4/2/2022,IP2850,arugula,2233,H2850,3,8/31/2021,12,16,LOT2850_IP_2022-04-02_16,1/15/2022,SP2850,2022-09-09T04:42:13,,FALSE
6/15/2022,IP2851,potato,9176,H2851,9,11/10/2021,46,64,LOT2851_IP_2022-06-15_64,2/19/2022,SP2851,2022-12-05T10:58:44,,TRUE
11/16/2021,IP2852,kale,1814,H2852,3,9/26/2021,9,13,LOT2852_IP_2021-11-16_13,1/28/2022,SP2852,2022-10-11T18:54:10,,FALSE
12/25/2021,IP2853,Cucumbers,4666,H2853,5,8/10/2021,24,33,LOT2853_IP_2021-12-25_33,1/4/2022,SP2853,2022-08-14T12:18:59,,FALSE
10/9/2022,IP2854,lettuce,347,H2854,1,8/16/2021,2,3,LOT2854_IP_2022-10-09_3,1/7/2022,SP2854,2022-08-21T20:56:31,,FALSE
9/24/2021,IP2855,spinach,1506,H2855,2,10/25/2021,8,11,LOT2855_IP_2021-09-24_11,2/11/2022,SP2855,2022-11-15T22:22:49,,FALSE
9/14/2022,IP2856,spinach,1025,H2856,2,8/30/2021,6,7,LOT2856_IP_2022-09-14_7,1/14/2022,SP2856,2022-09-07T16:39:27,,TRUE
6/27/2022,IP2857,basil,6729,H2857,7,10/9/2021,34,47,LOT2857_IP_2022-06-27_47,2/3/2022,SP2857,2022-10-27T13:23:11,,TRUE
12/3/2021,IP2858,arugula,2547,H2858,3,10/9/2021,13,18,LOT2858_IP_2021-12-03_18,2/3/2022,SP2858,2022-10-26T19:21:48,,FALSE
1/26/2022,IP2859,Cucumbers,4758,H2859,5,8/3/2021,24,33,LOT2859_IP_2022-01-26_33,1/1/2022,SP2859,2022-08-05T15:38:41,,FALSE
4/27/2022,IP2860,arugula,2625,H2860,3,9/3/2021,13,19,LOT2860_IP_2022-04-27_19,1/16/2022,SP2860,2022-09-12T12:00:18,,FALSE
10/8/2021,IP2861,Cucumbers,4353,H2861,5,8/23/2021,22,31,LOT2861_IP_2021-10-08_31,1/11/2022,SP2861,2022-08-30T06:47:59,,FALSE
6/20/2022,IP2862,Cucumbers,4688,H2862,5,8/27/2021,24,33,LOT2862_IP_2022-06-20_33,1/13/2022,SP2862,2022-09-04T12:57:39,,FALSE
3/3/2022,IP2863,spinach,824,H2863,2,10/2/2021,5,6,LOT2863_IP_2022-03-03_6,1/30/2022,SP2863,2022-10-18T09:30:20,,TRUE
8/2/2022,IP2864,arugula,2923,H2864,4,10/7/2021,15,21,LOT2864_IP_2022-08-02_21,2/2/2022,SP2864,2022-10-24T09:41:23,,FALSE
1/5/2022,IP2865,parsley,8151,H2865,8,9/26/2021,41,57,LOT2865_IP_2022-01-05_57,1/28/2022,SP2865,2022-10-11T08:05:21,,FALSE
3/4/2022,IP2866,arugula,2708,H2866,3,11/21/2021,14,19,LOT2866_IP_2022-03-04_19,2/24/2022,SP2866,2022-12-19T13:48:42,,FALSE
1/31/2022,IP2867,bell peppers,5249,H2867,6,11/2/2021,26,37,LOT2867_IP_2022-01-31_37,2/15/2022,SP2867,2022-11-25T13:04:30,,FALSE
8/6/2022,IP2868,arugula,2810,H2868,3,11/26/2021,14,20,LOT2868_IP_2022-08-06_20,2/26/2022,SP2868,2022-12-24T16:22:06,,FALSE
6/15/2022,IP2869,cilantro,7261,H2869,8,10/14/2021,36,51,LOT2869_IP_2022-06-15_51,2/5/2022,SP2869,2022-11-02T06:21:41,,FALSE
10/6/2022,IP2870,kale,1647,H2870,2,10/1/2021,9,12,LOT2870_IP_2022-10-06_12,1/30/2022,SP2870,2022-10-17T04:40:07,,FALSE
12/26/2021,IP2871,kale,2110,H2871,3,8/6/2021,11,15,LOT2871_IP_2021-12-26_15,1/2/2022,SP2871,2022-08-09T09:45:35,,FALSE
11/18/2022,IP2872,kale,2039,H2872,3,8/21/2021,11,15,LOT2872_IP_2022-11-18_15,1/10/2022,SP2872,2022-08-27T21:07:34,,FALSE
4/11/2022,IP2873,parsley,8307,H2873,8,10/9/2021,42,58,LOT2873_IP_2022-04-11_58,2/3/2022,SP2873,2022-10-27T13:23:11,,FALSE
8/3/2021,IP2874,kale,2029,H2874,3,9/21/2021,11,14,LOT2874_IP_2021-08-03_14,1/25/2022,SP2874,2022-10-05T04:18:01,,FALSE
11/22/2022,IP2875,sweet potato,9489,H2875,10,10/4/2021,47,66,LOT2875_IP_2022-11-22_66,2/1/2022,SP2875,2022-10-21T09:35:51,,FALSE
4/13/2022,IP2876,parsley,7910,H2876,8,8/14/2021,40,55,LOT2876_IP_2022-04-13_55,1/7/2022,SP2876,2022-08-19T18:28:39,,FALSE
6/10/2022,IP2877,cilantro,7811,H2877,8,10/23/2021,39,55,LOT2877_IP_2022-06-10_55,2/10/2022,SP2877,2022-11-13T23:31:14,,FALSE
10/20/2021,IP2878,melons,3608,H2878,4,11/4/2021,18,25,LOT2878_IP_2021-10-20_25,2/16/2022,SP2878,2022-11-27T19:08:39,,FALSE
8/18/2021,IP2879,Cucumbers,4924,H2879,5,9/29/2021,25,35,LOT2879_IP_2021-08-18_35,1/29/2022,SP2879,2022-10-15T13:01:05,,FALSE
12/25/2022,IP2880,chili peppers,6256,H2880,7,10/9/2021,31,44,LOT2880_IP_2022-12-25_44,2/3/2022,SP2880,2022-10-26T22:58:05,,FALSE
11/4/2021,IP2881,Cucumbers,4642,H2881,5,9/15/2021,23,33,LOT2881_IP_2021-11-04_33,1/22/2022,SP2881,2022-09-27T23:16:45,,FALSE
9/21/2022,IP2882,chili peppers,5772,H2882,6,10/5/2021,29,41,LOT2882_IP_2022-09-21_41,2/1/2022,SP2882,2022-10-22T10:49:47,,TRUE
5/12/2022,IP2883,basil,6984,H2883,7,9/15/2021,35,49,LOT2883_IP_2022-05-12_49,1/22/2022,SP2883,2022-09-27T12:27:56,,FALSE
1/9/2022,IP2884,bell peppers,5393,H2884,6,8/31/2021,27,38,LOT2884_IP_2022-01-09_38,1/15/2022,SP2884,2022-09-09T15:31:03,,TRUE
9/2/2022,IP2885,lettuce,251,H2885,1,8/9/2021,2,2,LOT2885_IP_2022-09-02_2,1/4/2022,SP2885,2022-08-12T20:39:56,,FALSE
8/21/2021,IP2886,chili peppers,6325,H2886,7,9/19/2021,32,44,LOT2886_IP_2021-08-21_44,1/24/2022,SP2886,2022-10-02T11:25:03,,FALSE
12/3/2021,IP2887,Tomatoes,4219,H2887,5,10/8/2021,21,30,LOT2887_IP_2021-12-03_30,2/2/2022,SP2887,2022-10-26T01:20:25,,FALSE
8/6/2021,IP2888,sweet potato,9744,H2888,10,11/2/2021,49,68,LOT2888_IP_2021-08-06_68,2/15/2022,SP2888,2022-11-25T20:17:03,,FALSE
12/3/2021,IP2889,Cucumbers,4751,H2889,5,11/6/2021,24,33,LOT2889_IP_2021-12-03_33,2/17/2022,SP2889,2022-12-01T06:03,,FALSE
9/23/2022,IP2890,basil,7129,H2890,7,8/10/2021,36,50,LOT2890_IP_2022-09-23_50,1/5/2022,SP2890,2022-08-14T23:07:48,,FALSE
9/2/2022,IP2891,arugula,2520,H2891,3,8/11/2021,13,18,LOT2891_IP_2022-09-02_18,1/5/2022,SP2891,2022-08-16T00:21:44,,FALSE
10/10/2022,IP2892,lettuce,183,H2892,1,10/15/2021,1,2,LOT2892_IP_2022-10-10_2,2/6/2022,SP2892,2022-11-03T22:00:43,,FALSE
7/16/2022,IP2893,lettuce,217,H2893,1,11/5/2021,2,2,LOT2893_IP_2022-07-16_2,2/16/2022,SP2893,2022-11-28T23:58:51,,FALSE
2/28/2023,IP2894,chili peppers,6144,H2894,6,9/25/2021,31,43,LOT2894_IP_2023-02-28_43,1/27/2022,SP2894,2022-10-10T14:03:58,,FALSE
11/1/2022,IP2895,potato,8627,H2895,9,8/23/2021,43,60,LOT2895_IP_2022-11-01_60,1/11/2022,SP2895,2022-08-31T00:49:22,,FALSE
12/5/2021,IP2896,sweet potato,9620,H2896,10,11/24/2021,48,67,LOT2896_IP_2021-12-05_67,2/25/2022,SP2896,2022-12-22T06:41:41,,FALSE
9/27/2021,IP2897,Cucumbers,4851,H2897,5,11/19/2021,25,34,LOT2897_IP_2021-09-27_34,2/23/2022,SP2897,2022-12-17T04:08:17,,FALSE
1/24/2022,IP2898,sweet potato,9802,H2898,10,11/4/2021,49,69,LOT2898_IP_2022-01-24_69,2/16/2022,SP2898,2022-11-27T19:08:39,,FALSE
10/12/2021,IP2899,Tomatoes,3872,H2899,4,9/11/2021,20,27,LOT2899_IP_2021-10-12_27,1/20/2022,SP2899,2022-09-22T13:30:49,,FALSE
3/3/2022,IP2900,basil,6841,H2900,7,11/3/2021,34,48,LOT2900_IP_2022-03-03_48,2/15/2022,SP2900,2022-11-26T17:54:43,,FALSE
6/9/2022,IP2901,spinach,1199,H2901,2,11/12/2021,6,9,LOT2901_IP_2022-06-09_9,2/20/2022,SP2901,2022-12-07T17:02:53,,TRUE
10/1/2022,IP2902,sweet potato,9492,H2902,10,9/1/2021,47,66,LOT2902_IP_2022-10-01_66,1/15/2022,SP2902,2022-09-10T05:56:09,,FALSE
8/20/2022,IP2903,basil,7076,H2903,7,11/30/2021,36,50,LOT2903_IP_2022-08-20_50,3/1/2022,SP2903,2022-12-30T16:33:09,,FALSE
6/17/2022,IP2904,Tomatoes,4237,H2904,5,9/14/2021,21,30,LOT2904_IP_2022-06-17_30,1/22/2022,SP2904,2022-09-27T01:39:06,,FALSE
3/12/2022,IP2905,Tomatoes,3809,H2905,4,9/20/2021,19,27,LOT2905_IP_2022-03-12_27,1/24/2022,SP2905,2022-10-03T09:02:42,,FALSE
6/30/2022,IP2906,cilantro,7512,H2906,8,9/19/2021,38,53,LOT2906_IP_2022-06-30_53,1/24/2022,SP2906,2022-10-02T18:37:36,,FALSE
8/9/2022,IP2907,lettuce,640,H2907,1,9/28/2021,4,5,LOT2907_IP_2022-08-09_5,1/28/2022,SP2907,2022-10-13T10:33:13,,TRUE
10/23/2022,IP2908,kale,1972,H2908,3,8/10/2021,10,14,LOT2908_IP_2022-10-23_14,1/4/2022,SP2908,2022-08-14T01:30:09,,FALSE
10/24/2021,IP2909,chili peppers,5956,H2909,6,11/3/2021,30,42,LOT2909_IP_2021-10-24_42,2/15/2022,SP2909,2022-11-26T21:30:59,,FALSE
7/27/2022,IP2910,basil,6679,H2910,7,11/26/2021,34,47,LOT2910_IP_2022-07-27_47,2/26/2022,SP2910,2022-12-24T19:58:23,,FALSE
11/18/2022,IP2911,basil,7083,H2911,7,8/6/2021,36,50,LOT2911_IP_2022-11-18_50,1/2/2022,SP2911,2022-08-09T13:21:52,,TRUE
10/4/2021,IP2912,arugula,2716,H2912,3,8/30/2021,14,19,LOT2912_IP_2021-10-04_19,1/14/2022,SP2912,2022-09-08T14:17:07,,FALSE
2/2/2022,IP2913,spinach,938,H2913,2,10/30/2021,5,7,LOT2913_IP_2022-02-02_7,2/13/2022,SP2913,2022-11-22T09:22:42,,FALSE
8/19/2022,IP2914,cilantro,7592,H2914,8,10/12/2021,38,53,LOT2914_IP_2022-08-19_53,2/5/2022,SP2914,2022-10-31T11:06:22,,FALSE
12/30/2022,IP2915,Tomatoes,4341,H2915,5,8/16/2021,22,31,LOT2915_IP_2022-12-30_31,1/7/2022,SP2915,2022-08-22T00:32:47,,FALSE
8/14/2022,IP2916,spinach,1354,H2916,2,8/30/2021,7,10,LOT2916_IP_2022-08-14_10,1/14/2022,SP2916,2022-09-08T10:40:50,,FALSE
6/7/2022,IP2917,parsley,8081,H2917,8,10/6/2021,40,57,LOT2917_IP_2022-06-07_57,2/1/2022,SP2917,2022-10-23T01:14:54,,FALSE
2/1/2023,IP2918,melons,3320,H2918,4,11/18/2021,17,23,LOT2918_IP_2023-02-01_23,2/23/2022,SP2918,2022-12-15T12:29:15,,FALSE
9/12/2022,IP2919,melons,3204,H2919,4,9/3/2021,16,23,LOT2919_IP_2022-09-12_23,1/16/2022,SP2919,2022-09-12T15:36:35,,FALSE
9/23/2022,IP2920,parsley,8451,H2920,9,11/1/2021,42,59,LOT2920_IP_2022-09-23_59,2/14/2022,SP2920,2022-11-25T02:15:40,,FALSE
11/5/2022,IP2921,cilantro,7475,H2921,8,11/16/2021,38,52,LOT2921_IP_2022-11-05_52,2/22/2022,SP2921,2022-12-12T23:12:33,,TRUE
7/8/2022,IP2922,lettuce,139,H2922,1,9/4/2021,1,1,LOT2922_IP_2022-07-08_1,1/17/2022,SP2922,2022-09-14T14:28:10,,TRUE
7/11/2022,IP2923,Cucumbers,4525,H2923,5,8/19/2021,23,32,LOT2923_IP_2022-07-11_32,1/9/2022,SP2923,2022-08-25T00:38:19,,FALSE
9/20/2022,IP2924,melons,3018,H2924,4,10/19/2021,15,21,LOT2924_IP_2022-09-20_21,2/8/2022,SP2924,2022-11-08T20:57:50,,FALSE
9/12/2022,IP2925,potato,9292,H2925,9,9/26/2021,46,65,LOT2925_IP_2022-09-12_65,1/27/2022,SP2925,2022-10-11T00:52:47,,FALSE
5/6/2022,IP2926,basil,7167,H2926,7,10/12/2021,36,50,LOT2926_IP_2022-05-06_50,2/4/2022,SP2926,2022-10-31T00:17:32,,TRUE
1/21/2022,IP2927,Tomatoes,3934,H2927,4,11/26/2021,20,28,LOT2927_IP_2022-01-21_28,2/27/2022,SP2927,2022-12-25T13:59:46,,TRUE
1/19/2022,IP2928,spinach,1240,H2928,2,8/11/2021,7,9,LOT2928_IP_2022-01-19_9,1/5/2022,SP2928,2022-08-15T13:32:55,,FALSE
2/15/2022,IP2929,bell peppers,5084,H2929,6,8/12/2021,26,36,LOT2929_IP_2022-02-15_36,1/5/2022,SP2929,2022-08-16T21:59:24,,TRUE
8/3/2021,IP2930,Cucumbers,4425,H2930,5,11/5/2021,22,31,LOT2930_IP_2021-08-03_31,2/16/2022,SP2930,2022-11-30T01:12:47,,FALSE
10/11/2021,IP2931,bell peppers,5085,H2931,6,10/9/2021,26,36,LOT2931_IP_2021-10-11_36,2/3/2022,SP2931,2022-10-27T02:34:21,,TRUE
6/26/2022,IP2932,bell peppers,5303,H2932,6,11/23/2021,27,37,LOT2932_IP_2022-06-26_37,2/25/2022,SP2932,2022-12-21T23:29:08,,FALSE
11/9/2022,IP2933,kale,2121,H2933,3,10/26/2021,11,15,LOT2933_IP_2022-11-09_15,2/12/2022,SP2933,2022-11-17T17:38:08,,FALSE
9/29/2021,IP2934,potato,9235,H2934,9,11/14/2021,46,65,LOT2934_IP_2021-09-29_65,2/21/2022,SP2934,2022-12-10T20:44:41,,FALSE
9/23/2021,IP2935,lettuce,293,H2935,1,8/19/2021,2,2,LOT2935_IP_2021-09-23_2,1/9/2022,SP2935,2022-08-26T01:52:15,,FALSE
9/14/2021,IP2936,Cucumbers,4549,H2936,5,9/13/2021,23,32,LOT2936_IP_2021-09-14_32,1/21/2022,SP2936,2022-09-25T02:47:30,,TRUE
12/4/2021,IP2937,Cucumbers,5049,H2937,5,10/26/2021,25,35,LOT2937_IP_2021-12-04_35,2/11/2022,SP2937,2022-11-17T10:25:35,,FALSE
3/6/2022,IP2938,sweet potato,9906,H2938,10,10/22/2021,50,69,LOT2938_IP_2022-03-06_69,2/9/2022,SP2938,2022-11-12T15:04:45,,FALSE
9/3/2022,IP2939,lettuce,501,H2939,1,11/22/2021,3,4,LOT2939_IP_2022-09-03_4,2/25/2022,SP2939,2022-12-20T18:38:55,,FALSE
1/11/2022,IP2940,Cucumbers,4494,H2940,5,10/11/2021,23,32,LOT2940_IP_2022-01-11_32,2/4/2022,SP2940,2022-10-29T23:03:36,,FALSE
2/20/2023,IP2941,parsley,8508,H2941,9,8/9/2021,43,60,LOT2941_IP_2023-02-20_60,1/4/2022,SP2941,2022-08-13T03:52:29,,FALSE
5/5/2022,IP2942,lettuce,532,H2942,1,11/5/2021,3,4,LOT2942_IP_2022-05-05_4,2/16/2022,SP2942,2022-11-29T03:35:08,,TRUE
11/28/2021,IP2943,sweet potato,9326,H2943,9,10/10/2021,47,65,LOT2943_IP_2021-11-28_65,2/3/2022,SP2943,2022-10-28T11:00:50,,FALSE
12/23/2022,IP2944,lettuce,182,H2944,1,10/25/2021,1,2,LOT2944_IP_2022-12-23_2,2/11/2022,SP2944,2022-11-15T15:10:16,,FALSE
10/15/2021,IP2945,cilantro,7857,H2945,8,9/28/2021,39,55,LOT2945_IP_2021-10-15_55,1/28/2022,SP2945,2022-10-13T14:09:29,,FALSE
9/23/2022,IP2946,cilantro,7866,H2946,8,9/9/2021,39,55,LOT2946_IP_2022-09-23_55,1/19/2022,SP2946,2022-09-20T07:26:40,,FALSE
1/15/2023,IP2947,kale,1726,H2947,2,11/28/2021,9,12,LOT2947_IP_2023-01-15_12,2/28/2022,SP2947,2022-12-28T06:52:44,,FALSE
11/12/2021,IP2948,cilantro,7798,H2948,8,10/6/2021,39,55,LOT2948_IP_2021-11-12_55,2/1/2022,SP2948,2022-10-23T12:03:43,,FALSE
8/4/2021,IP2949,sweet potato,9923,H2949,10,8/11/2021,50,69,LOT2949_IP_2021-08-04_69,1/5/2022,SP2949,2022-08-15T20:45:28,,FALSE
4/10/2022,IP2950,potato,8831,H2950,9,11/2/2021,44,62,LOT2950_IP_2022-04-10_62,2/15/2022,SP2950,2022-11-25T13:04:30,,FALSE
4/3/2022,IP2951,kale,1522,H2951,2,8/7/2021,8,11,LOT2951_IP_2022-04-03_11,1/3/2022,SP2951,2022-08-11T01:24:37,,FALSE
8/22/2021,IP2952,sweet potato,9532,H2952,10,8/4/2021,48,67,LOT2952_IP_2021-08-22_67,1/2/2022,SP2952,2022-08-07T14:30:16,,FALSE
11/5/2021,IP2953,kale,1977,H2953,3,9/10/2021,10,14,LOT2953_IP_2021-11-05_14,1/20/2022,SP2953,2022-09-21T12:16:53,,FALSE
9/5/2022,IP2954,bell peppers,5290,H2954,6,9/27/2021,27,37,LOT2954_IP_2022-09-05_37,1/28/2022,SP2954,2022-10-12T02:06:44,,FALSE
2/27/2023,IP2955,chili peppers,6103,H2955,6,9/20/2021,31,43,LOT2955_IP_2023-02-27_43,1/25/2022,SP2955,2022-10-03T16:15:15,,FALSE
10/15/2022,IP2956,spinach,917,H2956,2,8/28/2021,5,7,LOT2956_IP_2022-10-15_7,1/13/2022,SP2956,2022-09-05T03:22:46,,FALSE
1/22/2022,IP2957,melons,3100,H2957,4,10/3/2021,16,22,LOT2957_IP_2022-01-22_22,1/31/2022,SP2957,2022-10-19T10:44:16,,FALSE
3/23/2022,IP2958,Tomatoes,3773,H2958,4,8/31/2021,19,27,LOT2958_IP_2022-03-23_27,1/15/2022,SP2958,2022-09-09T19:07:20,,FALSE
5/19/2022,IP2959,potato,8720,H2959,9,9/27/2021,44,61,LOT2959_IP_2022-05-19_61,1/28/2022,SP2959,2022-10-11T22:30:27,,FALSE
11/25/2022,IP2960,sweet potato,9629,H2960,10,10/19/2021,48,67,LOT2960_IP_2022-11-25_67,2/8/2022,SP2960,2022-11-08T10:09,,FALSE
10/27/2021,IP2961,Cucumbers,4506,H2961,5,8/9/2021,23,32,LOT2961_IP_2021-10-27_32,1/4/2022,SP2961,2022-08-13T11:05:03,,FALSE
7/26/2022,IP2962,Tomatoes,4150,H2962,5,8/20/2021,21,29,LOT2962_IP_2022-07-26_29,1/9/2022,SP2962,2022-08-26T16:17:21,,FALSE
8/24/2022,IP2963,chili peppers,6171,H2963,7,11/25/2021,31,43,LOT2963_IP_2022-08-24_43,2/26/2022,SP2963,2022-12-23T15:08:10,,FALSE
1/23/2023,IP2964,sweet potato,9937,H2964,10,8/6/2021,50,70,LOT2964_IP_2023-01-23_70,1/3/2022,SP2964,2022-08-10T03:46:58,,FALSE
1/5/2022,IP2965,kale,2119,H2965,3,8/26/2021,11,15,LOT2965_IP_2022-01-05_15,1/12/2022,SP2965,2022-09-02T17:42:20,,FALSE
5/31/2022,IP2966,chili peppers,6147,H2966,6,10/19/2021,31,43,LOT2966_IP_2022-05-31_43,2/8/2022,SP2966,2022-11-08T10:09,,FALSE
1/4/2022,IP2967,potato,8651,H2967,9,9/20/2021,43,61,LOT2967_IP_2022-01-04_61,1/24/2022,SP2967,2022-10-03T12:38:59,,FALSE
1/1/2022,IP2968,parsley,8112,H2968,8,9/2/2021,41,57,LOT2968_IP_2022-01-01_57,1/16/2022,SP2968,2022-09-12T04:47:45,,TRUE
2/20/2022,IP2969,lettuce,304,H2969,1,10/22/2021,2,2,LOT2969_IP_2022-02-20_2,2/9/2022,SP2969,2022-11-12T00:39:38,,FALSE
2/15/2023,IP2970,spinach,1054,H2970,2,9/5/2021,6,8,LOT2970_IP_2023-02-15_8,1/17/2022,SP2970,2022-09-15T04:53:16,,TRUE
3/5/2022,IP2971,chili peppers,6008,H2971,6,10/10/2021,30,42,LOT2971_IP_2022-03-05_42,2/3/2022,SP2971,2022-10-28T14:37:07,,FALSE
4/25/2022,IP2972,Tomatoes,3717,H2972,4,11/11/2021,19,26,LOT2972_IP_2022-04-25_26,2/19/2022,SP2972,2022-12-07T02:37:47,,FALSE
9/28/2022,IP2973,parsley,8086,H2973,8,11/17/2021,41,57,LOT2973_IP_2022-09-28_57,2/22/2022,SP2973,2022-12-14T00:26:29,,TRUE
1/20/2022,IP2974,basil,7113,H2974,7,8/2/2021,36,50,LOT2974_IP_2022-01-20_50,1/1/2022,SP2974,2022-08-05T01:13:34,,FALSE
11/1/2021,IP2975,chili peppers,6454,H2975,7,8/4/2021,32,45,LOT2975_IP_2021-11-01_45,1/2/2022,SP2975,2022-08-07T14:30:16,,FALSE
6/12/2022,IP2976,sweet potato,9692,H2976,10,10/8/2021,48,68,LOT2976_IP_2022-06-12_68,2/2/2022,SP2976,2022-10-25T10:55:19,,FALSE
1/24/2022,IP2977,bell peppers,5069,H2977,6,9/14/2021,26,36,LOT2977_IP_2022-01-24_36,1/22/2022,SP2977,2022-09-26T07:37:43,,TRUE
12/6/2021,IP2978,bell peppers,5287,H2978,6,9/8/2021,27,37,LOT2978_IP_2021-12-06_37,1/18/2022,SP2978,2022-09-18T15:47:38,,FALSE
9/10/2022,IP2979,chili peppers,6307,H2979,7,8/18/2021,32,44,LOT2979_IP_2022-09-10_44,1/9/2022,SP2979,2022-08-24T17:25:46,,FALSE
6/15/2022,IP2980,potato,9176,H2980,9,9/22/2021,46,64,LOT2980_IP_2022-06-15_64,1/26/2022,SP2980,2022-10-06T19:57:03,,FALSE
6/4/2022,IP2981,sweet potato,9714,H2981,10,11/22/2021,49,68,LOT2981_IP_2022-06-04_68,2/25/2022,SP2981,2022-12-20T18:38:55,,FALSE
6/2/2022,IP2982,parsley,8466,H2982,9,9/28/2021,42,59,LOT2982_IP_2022-06-02_59,1/28/2022,SP2982,2022-10-13T03:20:40,,FALSE
10/29/2021,IP2983,melons,3344,H2983,4,9/24/2021,17,24,LOT2983_IP_2021-10-29_24,1/27/2022,SP2983,2022-10-08T22:24:55,,FALSE
11/26/2022,IP2984,bell peppers,5184,H2984,6,9/19/2021,26,36,LOT2984_IP_2022-11-26_36,1/24/2022,SP2984,2022-10-02T11:25:03,,TRUE
8/9/2021,IP2985,Cucumbers,5008,H2985,5,11/11/2021,25,35,LOT2985_IP_2021-08-09_35,2/19/2022,SP2985,2022-12-07T02:37:47,,FALSE
12/16/2022,IP2986,chili peppers,6449,H2986,7,8/22/2021,32,45,LOT2986_IP_2022-12-16_45,1/10/2022,SP2986,2022-08-28T22:21:30,,FALSE
6/3/2022,IP2987,spinach,1086,H2987,2,10/26/2021,6,8,LOT2987_IP_2022-06-03_8,2/11/2022,SP2987,2022-11-17T03:13:02,,FALSE
11/28/2021,IP2988,arugula,2495,H2988,3,11/7/2021,13,18,LOT2988_IP_2021-11-28_18,2/17/2022,SP2988,2022-12-02T10:53:13,,FALSE
6/4/2022,IP2989,spinach,1368,H2989,2,11/22/2021,7,10,LOT2989_IP_2022-06-04_10,2/25/2022,SP2989,2022-12-20T15:02:38,,FALSE
10/30/2021,IP2990,arugula,2534,H2990,3,8/22/2021,13,18,LOT2990_IP_2021-10-30_18,1/10/2022,SP2990,2022-08-29T12:46:36,,FALSE
7/8/2022,IP2991,lettuce,520,H2991,1,11/15/2021,3,4,LOT2991_IP_2022-07-08_4,2/21/2022,SP2991,2022-12-12T01:34:54,,TRUE
3/13/2022,IP2992,cilantro,7724,H2992,8,10/16/2021,39,54,LOT2992_IP_2022-03-13_54,2/6/2022,SP2992,2022-11-04T08:49:33,,FALSE
11/26/2021,IP2993,melons,3513,H2993,4,10/17/2021,18,25,LOT2993_IP_2021-11-26_25,2/7/2022,SP2993,2022-11-05T17:16:02,,FALSE
12/7/2022,IP2994,melons,3558,H2994,4,11/19/2021,18,25,LOT2994_IP_2022-12-07_25,2/23/2022,SP2994,2022-12-16T13:43:11,,FALSE
1/7/2023,IP2995,kale,1688,H2995,2,8/22/2021,9,12,LOT2995_IP_2023-01-07_12,1/10/2022,SP2995,2022-08-28T22:21:30,,FALSE
11/17/2021,IP2996,melons,3075,H2996,4,10/24/2021,16,22,LOT2996_IP_2021-11-17_22,2/10/2022,SP2996,2022-11-14T06:43:47,,FALSE
10/21/2021,IP2997,cilantro,7661,H2997,8,9/1/2021,38,54,LOT2997_IP_2021-10-21_54,1/15/2022,SP2997,2022-09-10T23:57:32,,TRUE
9/24/2021,IP2998,sweet potato,9784,H2998,10,9/1/2021,49,68,LOT2998_IP_2021-09-24_68,1/15/2022,SP2998,2022-09-09T22:43:36,,FALSE
5/25/2022,IP2999,lettuce,771,H2999,2,11/26/2021,4,6,LOT2999_IP_2022-05-25_6,2/27/2022,SP2999,2022-12-25T17:36:02,,TRUE
6/20/2022,IP3000,Cucumbers,4883,H3000,5,9/17/2021,25,34,LOT3000_IP_2022-06-20_34,1/23/2022,SP3000,2022-09-29T22:08:21,,FALSE
